"No.","Time","Source","Destination","Protocol","Length","Info"
"1","0.000000","::1","::1","TLSv1.2","89","Application Data"
"2","0.000086","::1","::1","TCP","64","64964  >  8900 [ACK] Seq=1 Ack=26 Win=222 Len=0"
"3","0.001190","::1","::1","TLSv1.2","93","Application Data"
"4","0.001267","::1","::1","TCP","64","8900  >  64964 [ACK] Seq=26 Ack=30 Win=190 Len=0"
"5","1.970669","127.0.0.1","127.0.0.1","TCP","56","58661  >  53530 [SYN] Seq=0 Win=65535 Len=0 MSS=65495 WS=256 SACK_PERM"
"6","1.971049","127.0.0.1","127.0.0.1","TCP","56","53530  >  58661 [SYN, ACK] Seq=0 Ack=1 Win=65535 Len=0 MSS=65495 WS=256 SACK_PERM"
"7","1.971162","127.0.0.1","127.0.0.1","TCP","44","58661  >  53530 [ACK] Seq=1 Ack=1 Win=65280 Len=0"
"8","1.971708","127.0.0.1","127.0.0.1","OpcUa","128","Hello message"
"9","1.971764","127.0.0.1","127.0.0.1","TCP","44","53530  >  58661 [ACK] Seq=1 Ack=85 Win=65280 Len=0"
"10","1.974612","127.0.0.1","127.0.0.1","OpcUa","72","Acknowledge message"
"11","1.974698","127.0.0.1","127.0.0.1","TCP","44","58661  >  53530 [ACK] Seq=85 Ack=29 Win=65280 Len=0"
"12","1.975403","127.0.0.1","127.0.0.1","OpcUa","177","OpenSecureChannel message"
"13","1.975482","127.0.0.1","127.0.0.1","TCP","44","53530  >  58661 [ACK] Seq=29 Ack=218 Win=65280 Len=0"
"14","1.976197","127.0.0.1","127.0.0.1","OpcUa","179","OpenSecureChannel message"
"15","1.976248","127.0.0.1","127.0.0.1","TCP","44","58661  >  53530 [ACK] Seq=218 Ack=164 Win=65280 Len=0"
"16","1.976662","127.0.0.1","127.0.0.1","OpcUa","165","UA Secure Conversation Message: GetEndpointsRequest"
"17","1.976722","127.0.0.1","127.0.0.1","TCP","44","53530  >  58661 [ACK] Seq=164 Ack=339 Win=65024 Len=0"
"18","1.978260","127.0.0.1","127.0.0.1","OpcUa","20188","UA Secure Conversation Message: GetEndpointsResponse"
"19","1.978426","127.0.0.1","127.0.0.1","TCP","44","58661  >  53530 [ACK] Seq=339 Ack=20308 Win=45056 Len=0"
"20","1.978960","127.0.0.1","127.0.0.1","OpcUa","101","CloseSecureChannel message: CloseSecureChannelRequest"
"21","1.979019","127.0.0.1","127.0.0.1","TCP","44","53530  >  58661 [ACK] Seq=20308 Ack=396 Win=65024 Len=0"
"22","1.979121","127.0.0.1","127.0.0.1","TCP","44","58661  >  53530 [FIN, ACK] Seq=396 Ack=20308 Win=45056 Len=0"
"23","1.979173","127.0.0.1","127.0.0.1","TCP","44","53530  >  58661 [ACK] Seq=20308 Ack=397 Win=65024 Len=0"
"24","1.981005","127.0.0.1","127.0.0.1","TCP","44","53530  >  58661 [FIN, ACK] Seq=20308 Ack=397 Win=65024 Len=0"
"25","1.981098","127.0.0.1","127.0.0.1","TCP","44","58661  >  53530 [ACK] Seq=397 Ack=20309 Win=45056 Len=0"
"26","2.138363","127.0.0.1","127.0.0.1","TCP","56","58662  >  53530 [SYN] Seq=0 Win=65535 Len=0 MSS=65495 WS=256 SACK_PERM"
"27","2.138505","127.0.0.1","127.0.0.1","TCP","56","53530  >  58662 [SYN, ACK] Seq=0 Ack=1 Win=65535 Len=0 MSS=65495 WS=256 SACK_PERM"
"28","2.138588","127.0.0.1","127.0.0.1","TCP","44","58662  >  53530 [ACK] Seq=1 Ack=1 Win=65280 Len=0"
"29","2.139184","127.0.0.1","127.0.0.1","OpcUa","128","Hello message"
"30","2.139258","127.0.0.1","127.0.0.1","TCP","44","53530  >  58662 [ACK] Seq=1 Ack=85 Win=65280 Len=0"
"31","2.140861","127.0.0.1","127.0.0.1","OpcUa","72","Acknowledge message"
"32","2.140971","127.0.0.1","127.0.0.1","TCP","44","58662  >  53530 [ACK] Seq=85 Ack=29 Win=65280 Len=0"
"33","2.141106","127.0.0.1","127.0.0.1","OpcUa","177","OpenSecureChannel message"
"34","2.141162","127.0.0.1","127.0.0.1","TCP","44","53530  >  58662 [ACK] Seq=29 Ack=218 Win=65280 Len=0"
"35","2.141987","127.0.0.1","127.0.0.1","OpcUa","179","OpenSecureChannel message"
"36","2.142083","127.0.0.1","127.0.0.1","TCP","44","58662  >  53530 [ACK] Seq=218 Ack=164 Win=65280 Len=0"
"37","2.142532","127.0.0.1","127.0.0.1","OpcUa","423","UA Secure Conversation Message: CreateSessionRequest"
"38","2.142626","127.0.0.1","127.0.0.1","TCP","44","53530  >  58662 [ACK] Seq=164 Ack=597 Win=64768 Len=0"
"39","2.150884","127.0.0.1","127.0.0.1","OpcUa","21331","UA Secure Conversation Message: CreateSessionResponse"
"40","2.151042","127.0.0.1","127.0.0.1","TCP","44","58662  >  53530 [ACK] Seq=597 Ack=21451 Win=44032 Len=0"
"41","2.153475","127.0.0.1","127.0.0.1","OpcUa","193","UA Secure Conversation Message: ActivateSessionRequest"
"42","2.153571","127.0.0.1","127.0.0.1","TCP","44","53530  >  58662 [ACK] Seq=21451 Ack=746 Win=64768 Len=0"
"43","2.155575","127.0.0.1","127.0.0.1","OpcUa","140","UA Secure Conversation Message: ActivateSessionResponse"
"44","2.155658","127.0.0.1","127.0.0.1","TCP","44","58662  >  53530 [ACK] Seq=746 Ack=21547 Win=43776 Len=0"
"45","2.155959","127.0.0.1","127.0.0.1","OpcUa","190","UA Secure Conversation Message: ReadRequest"
"46","2.156025","127.0.0.1","127.0.0.1","TCP","44","53530  >  58662 [ACK] Seq=21547 Ack=892 Win=64512 Len=0"
"47","2.158978","127.0.0.1","127.0.0.1","OpcUa","116","UA Secure Conversation Message: ReadResponse"
"48","2.159072","127.0.0.1","127.0.0.1","TCP","44","58662  >  53530 [ACK] Seq=892 Ack=21619 Win=43776 Len=0"
"49","2.159464","127.0.0.1","127.0.0.1","OpcUa","496","UA Secure Conversation Message: ReadRequest"
"50","2.159530","127.0.0.1","127.0.0.1","TCP","44","53530  >  58662 [ACK] Seq=21619 Ack=1344 Win=64000 Len=0"
"51","2.162165","127.0.0.1","127.0.0.1","OpcUa","565","UA Secure Conversation Message: ReadResponse"
"52","2.162255","127.0.0.1","127.0.0.1","TCP","44","58662  >  53530 [ACK] Seq=1344 Ack=22140 Win=43264 Len=0"
"53","2.176872","127.0.0.1","127.0.0.1","OpcUa","172","UA Secure Conversation Message: ReadRequest"
"54","2.176957","127.0.0.1","127.0.0.1","TCP","44","53530  >  58662 [ACK] Seq=22140 Ack=1472 Win=64000 Len=0"
"55","2.178759","127.0.0.1","127.0.0.1","OpcUa","107","UA Secure Conversation Message: ReadResponse"
"56","2.178891","127.0.0.1","127.0.0.1","TCP","44","58662  >  53530 [ACK] Seq=1472 Ack=22203 Win=43264 Len=0"
"57","2.179230","127.0.0.1","127.0.0.1","OpcUa","160","UA Secure Conversation Message: CreateSubscriptionRequest"
"58","2.179272","127.0.0.1","127.0.0.1","TCP","44","53530  >  58662 [ACK] Seq=22203 Ack=1588 Win=63744 Len=0"
"59","2.184913","127.0.0.1","127.0.0.1","OpcUa","116","UA Secure Conversation Message: CreateSubscriptionResponse"
"60","2.184988","127.0.0.1","127.0.0.1","TCP","44","58662  >  53530 [ACK] Seq=1588 Ack=22275 Win=43008 Len=0"
"61","2.185347","127.0.0.1","127.0.0.1","OpcUa","320","UA Secure Conversation Message: CreateMonitoredItemsRequest"
"62","2.185389","127.0.0.1","127.0.0.1","TCP","44","53530  >  58662 [ACK] Seq=22275 Ack=1864 Win=63488 Len=0"
"63","2.187752","127.0.0.1","127.0.0.1","OpcUa","182","UA Secure Conversation Message: CreateMonitoredItemsResponse"
"64","2.187817","127.0.0.1","127.0.0.1","TCP","44","58662  >  53530 [ACK] Seq=1864 Ack=22413 Win=43008 Len=0"
"65","2.190717","127.0.0.1","127.0.0.1","OpcUa","177","UA Secure Conversation Message: BrowseRequest"
"66","2.190882","127.0.0.1","127.0.0.1","TCP","44","53530  >  58662 [ACK] Seq=22413 Ack=1997 Win=63488 Len=0"
"67","2.192992","127.0.0.1","127.0.0.1","OpcUa","240","UA Secure Conversation Message: BrowseResponse"
"68","2.193072","127.0.0.1","127.0.0.1","TCP","44","58662  >  53530 [ACK] Seq=1997 Ack=22609 Win=42752 Len=0"
"69","2.194267","127.0.0.1","127.0.0.1","OpcUa","314","UA Secure Conversation Message: ReadRequest"
"70","2.194338","127.0.0.1","127.0.0.1","TCP","44","53530  >  58662 [ACK] Seq=22609 Ack=2267 Win=63232 Len=0"
"71","2.196691","127.0.0.1","127.0.0.1","OpcUa","194","UA Secure Conversation Message: ReadResponse"
"72","2.196785","127.0.0.1","127.0.0.1","TCP","44","58662  >  53530 [ACK] Seq=2267 Ack=22759 Win=42752 Len=0"
"73","2.197235","127.0.0.1","127.0.0.1","OpcUa","177","UA Secure Conversation Message: BrowseRequest"
"74","2.197379","127.0.0.1","127.0.0.1","TCP","44","53530  >  58662 [ACK] Seq=22759 Ack=2400 Win=62976 Len=0"
"75","2.199050","127.0.0.1","127.0.0.1","OpcUa","142","UA Secure Conversation Message: BrowseResponse"
"76","2.199129","127.0.0.1","127.0.0.1","TCP","44","58662  >  53530 [ACK] Seq=2400 Ack=22857 Win=42496 Len=0"
"77","2.199487","127.0.0.1","127.0.0.1","OpcUa","314","UA Secure Conversation Message: ReadRequest"
"78","2.199535","127.0.0.1","127.0.0.1","TCP","44","53530  >  58662 [ACK] Seq=22857 Ack=2670 Win=62720 Len=0"
"79","2.201867","127.0.0.1","127.0.0.1","OpcUa","238","UA Secure Conversation Message: ReadResponse"
"80","2.201951","127.0.0.1","127.0.0.1","TCP","44","58662  >  53530 [ACK] Seq=2670 Ack=23051 Win=42240 Len=0"
"81","2.202249","127.0.0.1","127.0.0.1","OpcUa","177","UA Secure Conversation Message: BrowseRequest"
"82","2.202301","127.0.0.1","127.0.0.1","TCP","44","53530  >  58662 [ACK] Seq=23051 Ack=2803 Win=62720 Len=0"
"83","2.204462","127.0.0.1","127.0.0.1","OpcUa","142","UA Secure Conversation Message: BrowseResponse"
"84","2.204528","127.0.0.1","127.0.0.1","TCP","44","58662  >  53530 [ACK] Seq=2803 Ack=23149 Win=42240 Len=0"
"85","2.204861","127.0.0.1","127.0.0.1","OpcUa","314","UA Secure Conversation Message: ReadRequest"
"86","2.204908","127.0.0.1","127.0.0.1","TCP","44","53530  >  58662 [ACK] Seq=23149 Ack=3073 Win=62208 Len=0"
"87","2.213379","127.0.0.1","127.0.0.1","OpcUa","181","UA Secure Conversation Message: ReadResponse"
"88","2.213495","127.0.0.1","127.0.0.1","TCP","44","58662  >  53530 [ACK] Seq=3073 Ack=23286 Win=42240 Len=0"
"89","2.213863","127.0.0.1","127.0.0.1","OpcUa","177","UA Secure Conversation Message: BrowseRequest"
"90","2.213934","127.0.0.1","127.0.0.1","TCP","44","53530  >  58662 [ACK] Seq=23286 Ack=3206 Win=62208 Len=0"
"91","2.216052","127.0.0.1","127.0.0.1","OpcUa","116","UA Secure Conversation Message: BrowseResponse"
"92","2.216130","127.0.0.1","127.0.0.1","TCP","44","58662  >  53530 [ACK] Seq=3206 Ack=23358 Win=41984 Len=0"
"93","2.224802","127.0.0.1","127.0.0.1","OpcUa","177","UA Secure Conversation Message: BrowseRequest"
"94","2.224883","127.0.0.1","127.0.0.1","TCP","44","53530  >  58662 [ACK] Seq=23358 Ack=3339 Win=61952 Len=0"
"95","2.227304","127.0.0.1","127.0.0.1","OpcUa","463","UA Secure Conversation Message: BrowseResponse"
"96","2.227401","127.0.0.1","127.0.0.1","TCP","44","58662  >  53530 [ACK] Seq=3339 Ack=23777 Win=41728 Len=0"
"97","2.281031","127.0.0.1","127.0.0.1","OpcUa","334","UA Secure Conversation Message: ReadRequest"
"98","2.281107","127.0.0.1","127.0.0.1","TCP","44","53530  >  58662 [ACK] Seq=23777 Ack=3629 Win=61696 Len=0"
"99","2.283270","127.0.0.1","127.0.0.1","OpcUa","184","UA Secure Conversation Message: ReadResponse"
"100","2.283350","127.0.0.1","127.0.0.1","TCP","44","58662  >  53530 [ACK] Seq=3629 Ack=23917 Win=41472 Len=0"
"101","2.283607","127.0.0.1","127.0.0.1","OpcUa","179","UA Secure Conversation Message: BrowseRequest"
"102","2.283650","127.0.0.1","127.0.0.1","TCP","44","53530  >  58662 [ACK] Seq=23917 Ack=3764 Win=61696 Len=0"
"103","2.285573","127.0.0.1","127.0.0.1","OpcUa","142","UA Secure Conversation Message: BrowseResponse"
"104","2.285642","127.0.0.1","127.0.0.1","TCP","44","58662  >  53530 [ACK] Seq=3764 Ack=24015 Win=41472 Len=0"
"105","2.285997","127.0.0.1","127.0.0.1","OpcUa","314","UA Secure Conversation Message: ReadRequest"
"106","2.286043","127.0.0.1","127.0.0.1","TCP","44","53530  >  58662 [ACK] Seq=24015 Ack=4034 Win=61440 Len=0"
"107","2.288406","127.0.0.1","127.0.0.1","OpcUa","192","UA Secure Conversation Message: ReadResponse"
"108","2.288471","127.0.0.1","127.0.0.1","TCP","44","58662  >  53530 [ACK] Seq=4034 Ack=24163 Win=41216 Len=0"
"109","2.288968","127.0.0.1","127.0.0.1","OpcUa","177","UA Secure Conversation Message: BrowseRequest"
"110","2.289012","127.0.0.1","127.0.0.1","TCP","44","53530  >  58662 [ACK] Seq=24163 Ack=4167 Win=61184 Len=0"
"111","2.291869","127.0.0.1","127.0.0.1","OpcUa","116","UA Secure Conversation Message: BrowseResponse"
"112","2.291959","127.0.0.1","127.0.0.1","TCP","44","58662  >  53530 [ACK] Seq=4167 Ack=24235 Win=41216 Len=0"
"113","2.292692","127.0.0.1","127.0.0.1","OpcUa","334","UA Secure Conversation Message: ReadRequest"
"114","2.292756","127.0.0.1","127.0.0.1","TCP","44","53530  >  58662 [ACK] Seq=24235 Ack=4457 Win=60928 Len=0"
"115","2.294857","127.0.0.1","127.0.0.1","OpcUa","206","UA Secure Conversation Message: ReadResponse"
"116","2.294937","127.0.0.1","127.0.0.1","TCP","44","58662  >  53530 [ACK] Seq=4457 Ack=24397 Win=40960 Len=0"
"117","2.295235","127.0.0.1","127.0.0.1","OpcUa","179","UA Secure Conversation Message: BrowseRequest"
"118","2.295342","127.0.0.1","127.0.0.1","TCP","44","53530  >  58662 [ACK] Seq=24397 Ack=4592 Win=60928 Len=0"
"119","2.297270","127.0.0.1","127.0.0.1","OpcUa","142","UA Secure Conversation Message: BrowseResponse"
"120","2.297326","127.0.0.1","127.0.0.1","TCP","44","58662  >  53530 [ACK] Seq=4592 Ack=24495 Win=40960 Len=0"
"121","2.305499","127.0.0.1","127.0.0.1","OpcUa","160","UA Secure Conversation Message: CreateSubscriptionRequest"
"122","2.305570","127.0.0.1","127.0.0.1","TCP","44","53530  >  58662 [ACK] Seq=24495 Ack=4708 Win=60672 Len=0"
"123","2.311198","127.0.0.1","127.0.0.1","OpcUa","116","UA Secure Conversation Message: CreateSubscriptionResponse"
"124","2.311272","127.0.0.1","127.0.0.1","TCP","44","58662  >  53530 [ACK] Seq=4708 Ack=24567 Win=40960 Len=0"
"125","2.311941","127.0.0.1","127.0.0.1","OpcUa","1524","UA Secure Conversation Message: ReadRequest"
"126","2.312005","127.0.0.1","127.0.0.1","TCP","44","53530  >  58662 [ACK] Seq=24567 Ack=6188 Win=59136 Len=0"
"127","2.314091","127.0.0.1","127.0.0.1","OpcUa","537","UA Secure Conversation Message: ReadResponse"
"128","2.314172","127.0.0.1","127.0.0.1","TCP","44","58662  >  53530 [ACK] Seq=6188 Ack=25060 Win=40448 Len=0"
"129","2.314519","127.0.0.1","127.0.0.1","OpcUa","431","UA Secure Conversation Message: CreateMonitoredItemsRequest"
"130","2.314564","127.0.0.1","127.0.0.1","TCP","44","53530  >  58662 [ACK] Seq=25060 Ack=6575 Win=58880 Len=0"
"131","2.319249","127.0.0.1","127.0.0.1","OpcUa","242","UA Secure Conversation Message: CreateMonitoredItemsResponse"
"132","2.319314","127.0.0.1","127.0.0.1","TCP","44","58662  >  53530 [ACK] Seq=6575 Ack=25258 Win=40192 Len=0"
"133","2.319871","127.0.0.1","127.0.0.1","OpcUa","314","UA Secure Conversation Message: ReadRequest"
"134","2.319921","127.0.0.1","127.0.0.1","TCP","44","53530  >  58662 [ACK] Seq=25258 Ack=6845 Win=58624 Len=0"
"135","2.323538","127.0.0.1","127.0.0.1","OpcUa","184","UA Secure Conversation Message: ReadResponse"
"136","2.323629","127.0.0.1","127.0.0.1","TCP","44","58662  >  53530 [ACK] Seq=6845 Ack=25398 Win=39936 Len=0"
"137","2.324166","127.0.0.1","127.0.0.1","OpcUa","314","UA Secure Conversation Message: ReadRequest"
"138","2.324261","127.0.0.1","127.0.0.1","TCP","44","53530  >  58662 [ACK] Seq=25398 Ack=7115 Win=58368 Len=0"
"139","2.327255","127.0.0.1","127.0.0.1","OpcUa","174","UA Secure Conversation Message: ReadResponse"
"140","2.327394","127.0.0.1","127.0.0.1","TCP","44","58662  >  53530 [ACK] Seq=7115 Ack=25528 Win=39936 Len=0"
"141","2.327916","127.0.0.1","127.0.0.1","OpcUa","314","UA Secure Conversation Message: ReadRequest"
"142","2.327967","127.0.0.1","127.0.0.1","TCP","44","53530  >  58662 [ACK] Seq=25528 Ack=7385 Win=58112 Len=0"
"143","2.329937","127.0.0.1","127.0.0.1","OpcUa","176","UA Secure Conversation Message: ReadResponse"
"144","2.330014","127.0.0.1","127.0.0.1","TCP","44","58662  >  53530 [ACK] Seq=7385 Ack=25660 Win=39680 Len=0"
"145","2.330493","127.0.0.1","127.0.0.1","OpcUa","375","UA Secure Conversation Message: TranslateBrowsePathsToNodeIdsRequest"
"146","2.330542","127.0.0.1","127.0.0.1","TCP","44","53530  >  58662 [ACK] Seq=25660 Ack=7716 Win=57600 Len=0"
"147","2.332946","127.0.0.1","127.0.0.1","OpcUa","152","UA Secure Conversation Message: TranslateBrowsePathsToNodeIdsResponse"
"148","2.333030","127.0.0.1","127.0.0.1","TCP","44","58662  >  53530 [ACK] Seq=7716 Ack=25768 Win=39680 Len=0"
"149","2.333421","127.0.0.1","127.0.0.1","OpcUa","363","UA Secure Conversation Message: TranslateBrowsePathsToNodeIdsRequest"
"150","2.333465","127.0.0.1","127.0.0.1","TCP","44","53530  >  58662 [ACK] Seq=25768 Ack=8035 Win=57344 Len=0"
"151","2.335539","127.0.0.1","127.0.0.1","OpcUa","152","UA Secure Conversation Message: TranslateBrowsePathsToNodeIdsResponse"
"152","2.335600","127.0.0.1","127.0.0.1","TCP","44","58662  >  53530 [ACK] Seq=8035 Ack=25876 Win=39424 Len=0"
"153","2.354264","127.0.0.1","127.0.0.1","OpcUa","142","UA Secure Conversation Message: PublishRequest"
"154","2.354354","127.0.0.1","127.0.0.1","TCP","44","53530  >  58662 [ACK] Seq=25876 Ack=8133 Win=57344 Len=0"
"155","2.354419","127.0.0.1","127.0.0.1","OpcUa","142","UA Secure Conversation Message: PublishRequest"
"156","2.354445","127.0.0.1","127.0.0.1","TCP","44","53530  >  58662 [ACK] Seq=25876 Ack=8231 Win=57088 Len=0"
"157","2.354487","127.0.0.1","127.0.0.1","OpcUa","142","UA Secure Conversation Message: PublishRequest"
"158","2.354512","127.0.0.1","127.0.0.1","TCP","44","53530  >  58662 [ACK] Seq=25876 Ack=8329 Win=57088 Len=0"
"159","2.358838","127.0.0.1","127.0.0.1","OpcUa","129","UA Secure Conversation Message: PublishResponse"
"160","2.358940","127.0.0.1","127.0.0.1","TCP","44","58662  >  53530 [ACK] Seq=8329 Ack=25961 Win=39424 Len=0"
"161","2.370104","127.0.0.1","127.0.0.1","OpcUa","142","UA Secure Conversation Message: PublishRequest"
"162","2.370189","127.0.0.1","127.0.0.1","TCP","44","53530  >  58662 [ACK] Seq=25961 Ack=8427 Win=57088 Len=0"
"163","2.825005","127.0.0.1","127.0.0.1","OpcUa","315","UA Secure Conversation Message: PublishResponse"
"164","2.825095","127.0.0.1","127.0.0.1","TCP","44","58662  >  53530 [ACK] Seq=8427 Ack=26232 Win=39168 Len=0"
"165","2.838016","127.0.0.1","127.0.0.1","OpcUa","150","UA Secure Conversation Message: PublishRequest"
"166","2.838138","127.0.0.1","127.0.0.1","TCP","44","53530  >  58662 [ACK] Seq=26232 Ack=8533 Win=56832 Len=0"
"167","3.263762","127.0.0.1","127.0.0.1","UDP","1464","54217  >  5093 Len=1432"
"168","3.307333","127.0.0.1","127.0.0.1","UDP","1464","5093  >  54217 Len=1432"
"169","3.311052","127.0.0.1","127.0.0.1","UDP","1464","54217  >  5093 Len=1432"
"170","3.311360","127.0.0.1","127.0.0.1","UDP","1464","5093  >  54217 Len=1432"
"171","3.312509","127.0.0.1","127.0.0.1","UDP","1464","54217  >  5093 Len=1432"
"172","3.312791","127.0.0.1","127.0.0.1","UDP","1464","5093  >  54217 Len=1432"
"173","3.313764","127.0.0.1","127.0.0.1","UDP","1464","54217  >  5093 Len=1432"
"174","3.313990","127.0.0.1","127.0.0.1","UDP","1464","5093  >  54217 Len=1432"
"175","3.821421","127.0.0.1","127.0.0.1","OpcUa","232","UA Secure Conversation Message: PublishResponse"
"176","3.821519","127.0.0.1","127.0.0.1","TCP","44","58662  >  53530 [ACK] Seq=8533 Ack=26420 Win=38912 Len=0"
"177","3.835509","127.0.0.1","127.0.0.1","OpcUa","150","UA Secure Conversation Message: PublishRequest"
"178","3.835599","127.0.0.1","127.0.0.1","TCP","44","53530  >  58662 [ACK] Seq=26420 Ack=8639 Win=56832 Len=0"
"179","4.821354","127.0.0.1","127.0.0.1","OpcUa","232","UA Secure Conversation Message: PublishResponse"
"180","4.821461","127.0.0.1","127.0.0.1","TCP","44","58662  >  53530 [ACK] Seq=8639 Ack=26608 Win=38912 Len=0"
"181","4.834385","127.0.0.1","127.0.0.1","OpcUa","150","UA Secure Conversation Message: PublishRequest"
"182","4.834477","127.0.0.1","127.0.0.1","TCP","44","53530  >  58662 [ACK] Seq=26608 Ack=8745 Win=56576 Len=0"
"183","5.810439","127.0.0.1","127.0.0.1","OpcUa","236","UA Secure Conversation Message: PublishResponse"
"184","5.810521","127.0.0.1","127.0.0.1","TCP","44","58662  >  53530 [ACK] Seq=8745 Ack=26800 Win=38656 Len=0"
"185","5.823827","127.0.0.1","127.0.0.1","OpcUa","150","UA Secure Conversation Message: PublishRequest"
"186","5.823921","127.0.0.1","127.0.0.1","TCP","44","53530  >  58662 [ACK] Seq=26800 Ack=8851 Win=56576 Len=0"
"187","6.823117","127.0.0.1","127.0.0.1","OpcUa","236","UA Secure Conversation Message: PublishResponse"
"188","6.823197","127.0.0.1","127.0.0.1","TCP","44","58662  >  53530 [ACK] Seq=8851 Ack=26992 Win=38400 Len=0"
"189","6.836760","127.0.0.1","127.0.0.1","OpcUa","150","UA Secure Conversation Message: PublishRequest"
"190","6.836853","127.0.0.1","127.0.0.1","TCP","44","53530  >  58662 [ACK] Seq=26992 Ack=8957 Win=56576 Len=0"
"191","7.288651","127.0.0.1","127.0.0.1","OpcUa","133","UA Secure Conversation Message: PublishResponse"
"192","7.288734","127.0.0.1","127.0.0.1","TCP","44","58662  >  53530 [ACK] Seq=8957 Ack=27081 Win=38400 Len=0"
"193","7.302600","127.0.0.1","127.0.0.1","OpcUa","142","UA Secure Conversation Message: PublishRequest"
"194","7.302686","127.0.0.1","127.0.0.1","TCP","44","53530  >  58662 [ACK] Seq=27081 Ack=9055 Win=56320 Len=0"
"195","7.349078","127.0.0.1","127.0.0.1","OpcUa","208","UA Secure Conversation Message: ReadRequest"
"196","7.349174","127.0.0.1","127.0.0.1","TCP","44","53530  >  58662 [ACK] Seq=27081 Ack=9219 Win=56064 Len=0"
"197","7.357956","127.0.0.1","127.0.0.1","OpcUa","143","UA Secure Conversation Message: ReadResponse"
"198","7.358056","127.0.0.1","127.0.0.1","TCP","44","58662  >  53530 [ACK] Seq=9219 Ack=27180 Win=38144 Len=0"
"199","7.817765","127.0.0.1","127.0.0.1","OpcUa","236","UA Secure Conversation Message: PublishResponse"
"200","7.817864","127.0.0.1","127.0.0.1","TCP","44","58662  >  53530 [ACK] Seq=9219 Ack=27372 Win=38144 Len=0"
"201","7.832210","127.0.0.1","127.0.0.1","OpcUa","150","UA Secure Conversation Message: PublishRequest"
"202","7.832406","127.0.0.1","127.0.0.1","TCP","44","53530  >  58662 [ACK] Seq=27372 Ack=9325 Win=56064 Len=0"
"203","8.818132","127.0.0.1","127.0.0.1","OpcUa","236","UA Secure Conversation Message: PublishResponse"
"204","8.818218","127.0.0.1","127.0.0.1","TCP","44","58662  >  53530 [ACK] Seq=9325 Ack=27564 Win=37888 Len=0"
"205","8.832586","127.0.0.1","127.0.0.1","OpcUa","150","UA Secure Conversation Message: PublishRequest"
"206","8.832677","127.0.0.1","127.0.0.1","TCP","44","53530  >  58662 [ACK] Seq=27564 Ack=9431 Win=56064 Len=0"
"207","9.809671","127.0.0.1","127.0.0.1","OpcUa","232","UA Secure Conversation Message: PublishResponse"
"208","9.809758","127.0.0.1","127.0.0.1","TCP","44","58662  >  53530 [ACK] Seq=9431 Ack=27752 Win=37632 Len=0"
"209","9.823156","127.0.0.1","127.0.0.1","OpcUa","150","UA Secure Conversation Message: PublishRequest"
"210","9.823246","127.0.0.1","127.0.0.1","TCP","44","53530  >  58662 [ACK] Seq=27752 Ack=9537 Win=55808 Len=0"
"211","10.821946","127.0.0.1","127.0.0.1","OpcUa","236","UA Secure Conversation Message: PublishResponse"
"212","10.822013","127.0.0.1","127.0.0.1","TCP","44","58662  >  53530 [ACK] Seq=9537 Ack=27944 Win=37376 Len=0"
"213","10.836053","127.0.0.1","127.0.0.1","OpcUa","150","UA Secure Conversation Message: PublishRequest"
"214","10.836217","127.0.0.1","127.0.0.1","TCP","44","53530  >  58662 [ACK] Seq=27944 Ack=9643 Win=55808 Len=0"
"215","11.424246","127.0.0.1","127.0.0.1","OpcUa","160","UA Secure Conversation Message: WriteRequest"
"216","11.424399","127.0.0.1","127.0.0.1","TCP","44","53530  >  58662 [ACK] Seq=27944 Ack=9759 Win=55552 Len=0"
"217","11.432949","127.0.0.1","127.0.0.1","OpcUa","108","UA Secure Conversation Message: WriteResponse"
"218","11.433126","127.0.0.1","127.0.0.1","TCP","44","58662  >  53530 [ACK] Seq=9759 Ack=28008 Win=37376 Len=0"
"219","11.819664","127.0.0.1","127.0.0.1","OpcUa","236","UA Secure Conversation Message: PublishResponse"
"220","11.819753","127.0.0.1","127.0.0.1","TCP","44","58662  >  53530 [ACK] Seq=9759 Ack=28200 Win=37120 Len=0"
"221","11.833277","127.0.0.1","127.0.0.1","OpcUa","150","UA Secure Conversation Message: PublishRequest"
"222","11.833385","127.0.0.1","127.0.0.1","TCP","44","53530  >  58662 [ACK] Seq=28200 Ack=9865 Win=55552 Len=0"
"223","12.288483","127.0.0.1","127.0.0.1","OpcUa","133","UA Secure Conversation Message: PublishResponse"
"224","12.288555","127.0.0.1","127.0.0.1","TCP","44","58662  >  53530 [ACK] Seq=9865 Ack=28289 Win=37120 Len=0"
"225","12.302658","127.0.0.1","127.0.0.1","OpcUa","142","UA Secure Conversation Message: PublishRequest"
"226","12.302757","127.0.0.1","127.0.0.1","TCP","44","53530  >  58662 [ACK] Seq=28289 Ack=9963 Win=55552 Len=0"
"227","12.364244","127.0.0.1","127.0.0.1","OpcUa","208","UA Secure Conversation Message: ReadRequest"
"228","12.364415","127.0.0.1","127.0.0.1","TCP","44","53530  >  58662 [ACK] Seq=28289 Ack=10127 Win=55296 Len=0"
"229","12.366007","127.0.0.1","127.0.0.1","OpcUa","143","UA Secure Conversation Message: ReadResponse"
"230","12.366090","127.0.0.1","127.0.0.1","TCP","44","58662  >  53530 [ACK] Seq=10127 Ack=28388 Win=37120 Len=0"
"231","12.818394","127.0.0.1","127.0.0.1","OpcUa","236","UA Secure Conversation Message: PublishResponse"
"232","12.818481","127.0.0.1","127.0.0.1","TCP","44","58662  >  53530 [ACK] Seq=10127 Ack=28580 Win=36864 Len=0"
"233","12.831442","127.0.0.1","127.0.0.1","OpcUa","150","UA Secure Conversation Message: PublishRequest"
"234","12.831538","127.0.0.1","127.0.0.1","TCP","44","53530  >  58662 [ACK] Seq=28580 Ack=10233 Win=55296 Len=0"
"235","13.787044","127.0.0.1","127.0.0.1","OpcUa","160","UA Secure Conversation Message: WriteRequest"
"236","13.787119","127.0.0.1","127.0.0.1","TCP","44","53530  >  58662 [ACK] Seq=28580 Ack=10349 Win=55040 Len=0"
"237","13.789822","127.0.0.1","127.0.0.1","OpcUa","108","UA Secure Conversation Message: WriteResponse"
"238","13.789908","127.0.0.1","127.0.0.1","TCP","44","58662  >  53530 [ACK] Seq=10349 Ack=28644 Win=36864 Len=0"
"239","13.814530","127.0.0.1","127.0.0.1","OpcUa","236","UA Secure Conversation Message: PublishResponse"
"240","13.814650","127.0.0.1","127.0.0.1","TCP","44","58662  >  53530 [ACK] Seq=10349 Ack=28836 Win=36608 Len=0"
"241","13.827692","127.0.0.1","127.0.0.1","OpcUa","150","UA Secure Conversation Message: PublishRequest"
"242","13.827783","127.0.0.1","127.0.0.1","TCP","44","53530  >  58662 [ACK] Seq=28836 Ack=10455 Win=55040 Len=0"
"243","14.814767","127.0.0.1","127.0.0.1","OpcUa","232","UA Secure Conversation Message: PublishResponse"
"244","14.814882","127.0.0.1","127.0.0.1","TCP","44","58662  >  53530 [ACK] Seq=10455 Ack=29024 Win=36352 Len=0"
"245","14.829036","127.0.0.1","127.0.0.1","OpcUa","150","UA Secure Conversation Message: PublishRequest"
"246","14.829146","127.0.0.1","127.0.0.1","TCP","44","53530  >  58662 [ACK] Seq=29024 Ack=10561 Win=54784 Len=0"
"247","15.810784","127.0.0.1","127.0.0.1","OpcUa","236","UA Secure Conversation Message: PublishResponse"
"248","15.810871","127.0.0.1","127.0.0.1","TCP","44","58662  >  53530 [ACK] Seq=10561 Ack=29216 Win=36096 Len=0"
"249","15.824338","127.0.0.1","127.0.0.1","OpcUa","150","UA Secure Conversation Message: PublishRequest"
"250","15.824455","127.0.0.1","127.0.0.1","TCP","44","53530  >  58662 [ACK] Seq=29216 Ack=10667 Win=54784 Len=0"
"251","16.822218","127.0.0.1","127.0.0.1","OpcUa","236","UA Secure Conversation Message: PublishResponse"
"252","16.822300","127.0.0.1","127.0.0.1","TCP","44","58662  >  53530 [ACK] Seq=10667 Ack=29408 Win=36096 Len=0"
"253","16.836521","127.0.0.1","127.0.0.1","OpcUa","150","UA Secure Conversation Message: PublishRequest"
"254","16.836600","127.0.0.1","127.0.0.1","TCP","44","53530  >  58662 [ACK] Seq=29408 Ack=10773 Win=54528 Len=0"
"255","17.289950","127.0.0.1","127.0.0.1","OpcUa","133","UA Secure Conversation Message: PublishResponse"
"256","17.290049","127.0.0.1","127.0.0.1","TCP","44","58662  >  53530 [ACK] Seq=10773 Ack=29497 Win=35840 Len=0"
"257","17.303934","127.0.0.1","127.0.0.1","OpcUa","142","UA Secure Conversation Message: PublishRequest"
"258","17.304044","127.0.0.1","127.0.0.1","TCP","44","53530  >  58662 [ACK] Seq=29497 Ack=10871 Win=54528 Len=0"
"259","17.381642","127.0.0.1","127.0.0.1","OpcUa","208","UA Secure Conversation Message: ReadRequest"
"260","17.381752","127.0.0.1","127.0.0.1","TCP","44","53530  >  58662 [ACK] Seq=29497 Ack=11035 Win=54272 Len=0"
"261","17.383897","127.0.0.1","127.0.0.1","OpcUa","143","UA Secure Conversation Message: ReadResponse"
"262","17.383969","127.0.0.1","127.0.0.1","TCP","44","58662  >  53530 [ACK] Seq=11035 Ack=29596 Win=35840 Len=0"
"263","17.819229","127.0.0.1","127.0.0.1","OpcUa","236","UA Secure Conversation Message: PublishResponse"
"264","17.819395","127.0.0.1","127.0.0.1","TCP","44","58662  >  53530 [ACK] Seq=11035 Ack=29788 Win=35584 Len=0"
"265","17.832712","127.0.0.1","127.0.0.1","OpcUa","150","UA Secure Conversation Message: PublishRequest"
"266","17.832823","127.0.0.1","127.0.0.1","TCP","44","53530  >  58662 [ACK] Seq=29788 Ack=11141 Win=54272 Len=0"
"267","18.273816","127.0.0.1","127.0.0.1","UDP","1464","54217  >  5093 Len=1432"
"268","18.316954","127.0.0.1","127.0.0.1","UDP","1464","5093  >  54217 Len=1432"
"269","18.321035","127.0.0.1","127.0.0.1","UDP","1464","54217  >  5093 Len=1432"
"270","18.321347","127.0.0.1","127.0.0.1","UDP","1464","5093  >  54217 Len=1432"
"271","18.322650","127.0.0.1","127.0.0.1","UDP","1464","54217  >  5093 Len=1432"
"272","18.323026","127.0.0.1","127.0.0.1","UDP","1464","5093  >  54217 Len=1432"
"273","18.324060","127.0.0.1","127.0.0.1","UDP","1464","54217  >  5093 Len=1432"
"274","18.324297","127.0.0.1","127.0.0.1","UDP","1464","5093  >  54217 Len=1432"
"275","18.818404","127.0.0.1","127.0.0.1","OpcUa","236","UA Secure Conversation Message: PublishResponse"
"276","18.818498","127.0.0.1","127.0.0.1","TCP","44","58662  >  53530 [ACK] Seq=11141 Ack=29980 Win=35328 Len=0"
"277","18.831033","127.0.0.1","127.0.0.1","OpcUa","150","UA Secure Conversation Message: PublishRequest"
"278","18.831137","127.0.0.1","127.0.0.1","TCP","44","53530  >  58662 [ACK] Seq=29980 Ack=11247 Win=54272 Len=0"
"279","19.822846","127.0.0.1","127.0.0.1","OpcUa","232","UA Secure Conversation Message: PublishResponse"
"280","19.822934","127.0.0.1","127.0.0.1","TCP","44","58662  >  53530 [ACK] Seq=11247 Ack=30168 Win=35328 Len=0"
"281","19.836015","127.0.0.1","127.0.0.1","OpcUa","150","UA Secure Conversation Message: PublishRequest"
"282","19.836115","127.0.0.1","127.0.0.1","TCP","44","53530  >  58662 [ACK] Seq=30168 Ack=11353 Win=54016 Len=0"
"283","19.999388","127.0.0.1","127.0.0.1","OpcUa","160","UA Secure Conversation Message: WriteRequest"
"284","19.999464","127.0.0.1","127.0.0.1","TCP","44","53530  >  58662 [ACK] Seq=30168 Ack=11469 Win=54016 Len=0"
"285","20.001113","127.0.0.1","127.0.0.1","OpcUa","108","UA Secure Conversation Message: WriteResponse"
"286","20.001179","127.0.0.1","127.0.0.1","TCP","44","58662  >  53530 [ACK] Seq=11469 Ack=30232 Win=35072 Len=0"
"287","20.819064","127.0.0.1","127.0.0.1","OpcUa","236","UA Secure Conversation Message: PublishResponse"
"288","20.819147","127.0.0.1","127.0.0.1","TCP","44","58662  >  53530 [ACK] Seq=11469 Ack=30424 Win=35072 Len=0"
"289","20.833748","127.0.0.1","127.0.0.1","OpcUa","150","UA Secure Conversation Message: PublishRequest"
"290","20.833832","127.0.0.1","127.0.0.1","TCP","44","53530  >  58662 [ACK] Seq=30424 Ack=11575 Win=53760 Len=0"
"291","21.818229","127.0.0.1","127.0.0.1","OpcUa","236","UA Secure Conversation Message: PublishResponse"
"292","21.818323","127.0.0.1","127.0.0.1","TCP","44","58662  >  53530 [ACK] Seq=11575 Ack=30616 Win=34816 Len=0"
"293","21.832043","127.0.0.1","127.0.0.1","OpcUa","150","UA Secure Conversation Message: PublishRequest"
"294","21.832209","127.0.0.1","127.0.0.1","TCP","44","53530  >  58662 [ACK] Seq=30616 Ack=11681 Win=53760 Len=0"
"295","22.284598","127.0.0.1","127.0.0.1","OpcUa","133","UA Secure Conversation Message: PublishResponse"
"296","22.284676","127.0.0.1","127.0.0.1","TCP","44","58662  >  53530 [ACK] Seq=11681 Ack=30705 Win=34816 Len=0"
"297","22.298745","127.0.0.1","127.0.0.1","OpcUa","142","UA Secure Conversation Message: PublishRequest"
"298","22.298846","127.0.0.1","127.0.0.1","TCP","44","53530  >  58662 [ACK] Seq=30705 Ack=11779 Win=53504 Len=0"
"299","22.392573","127.0.0.1","127.0.0.1","OpcUa","208","UA Secure Conversation Message: ReadRequest"
"300","22.392662","127.0.0.1","127.0.0.1","TCP","44","53530  >  58662 [ACK] Seq=30705 Ack=11943 Win=53504 Len=0"
"301","22.395346","127.0.0.1","127.0.0.1","OpcUa","143","UA Secure Conversation Message: ReadResponse"
"302","22.395456","127.0.0.1","127.0.0.1","TCP","44","58662  >  53530 [ACK] Seq=11943 Ack=30804 Win=34560 Len=0"
"303","22.819201","127.0.0.1","127.0.0.1","OpcUa","236","UA Secure Conversation Message: PublishResponse"
"304","22.819288","127.0.0.1","127.0.0.1","TCP","44","58662  >  53530 [ACK] Seq=11943 Ack=30996 Win=34304 Len=0"
"305","22.826815","127.0.0.1","127.0.0.1","OpcUa","150","UA Secure Conversation Message: PublishRequest"
"306","22.826892","127.0.0.1","127.0.0.1","TCP","44","53530  >  58662 [ACK] Seq=30996 Ack=12049 Win=53248 Len=0"
"307","23.824454","127.0.0.1","127.0.0.1","OpcUa","236","UA Secure Conversation Message: PublishResponse"
"308","23.824542","127.0.0.1","127.0.0.1","TCP","44","58662  >  53530 [ACK] Seq=12049 Ack=31188 Win=34304 Len=0"
"309","23.838307","127.0.0.1","127.0.0.1","OpcUa","150","UA Secure Conversation Message: PublishRequest"
"310","23.838387","127.0.0.1","127.0.0.1","TCP","44","53530  >  58662 [ACK] Seq=31188 Ack=12155 Win=53248 Len=0"
"311","24.825052","127.0.0.1","127.0.0.1","OpcUa","232","UA Secure Conversation Message: PublishResponse"
"312","24.825122","127.0.0.1","127.0.0.1","TCP","44","58662  >  53530 [ACK] Seq=12155 Ack=31376 Win=34048 Len=0"
"313","24.830712","127.0.0.1","127.0.0.1","OpcUa","150","UA Secure Conversation Message: PublishRequest"
"314","24.830800","127.0.0.1","127.0.0.1","TCP","44","53530  >  58662 [ACK] Seq=31376 Ack=12261 Win=53248 Len=0"
"315","25.011536","::1","::1","TLSv1.2","89","Application Data"
"316","25.011608","::1","::1","TCP","64","64964  >  8900 [ACK] Seq=30 Ack=51 Win=222 Len=0"
"317","25.013025","::1","::1","TLSv1.2","93","Application Data"
"318","25.013191","::1","::1","TCP","64","8900  >  64964 [ACK] Seq=51 Ack=59 Win=190 Len=0"
"319","25.822448","127.0.0.1","127.0.0.1","OpcUa","210","UA Secure Conversation Message: PublishResponse"
"320","25.822542","127.0.0.1","127.0.0.1","TCP","44","58662  >  53530 [ACK] Seq=12261 Ack=31542 Win=33792 Len=0"
"321","25.836368","127.0.0.1","127.0.0.1","OpcUa","150","UA Secure Conversation Message: PublishRequest"
"322","25.836486","127.0.0.1","127.0.0.1","TCP","44","53530  >  58662 [ACK] Seq=31542 Ack=12367 Win=52992 Len=0"
"323","26.821162","127.0.0.1","127.0.0.1","OpcUa","236","UA Secure Conversation Message: PublishResponse"
"324","26.821249","127.0.0.1","127.0.0.1","TCP","44","58662  >  53530 [ACK] Seq=12367 Ack=31734 Win=33792 Len=0"
"325","26.833780","127.0.0.1","127.0.0.1","OpcUa","150","UA Secure Conversation Message: PublishRequest"
"326","26.833890","127.0.0.1","127.0.0.1","TCP","44","53530  >  58662 [ACK] Seq=31734 Ack=12473 Win=52992 Len=0"
"327","27.295923","127.0.0.1","127.0.0.1","OpcUa","133","UA Secure Conversation Message: PublishResponse"
"328","27.296000","127.0.0.1","127.0.0.1","TCP","44","58662  >  53530 [ACK] Seq=12473 Ack=31823 Win=33536 Len=0"
"329","27.310032","127.0.0.1","127.0.0.1","OpcUa","142","UA Secure Conversation Message: PublishRequest"
"330","27.310117","127.0.0.1","127.0.0.1","TCP","44","53530  >  58662 [ACK] Seq=31823 Ack=12571 Win=52736 Len=0"
"331","27.402632","127.0.0.1","127.0.0.1","OpcUa","208","UA Secure Conversation Message: ReadRequest"
"332","27.402724","127.0.0.1","127.0.0.1","TCP","44","53530  >  58662 [ACK] Seq=31823 Ack=12735 Win=52736 Len=0"
"333","27.405489","127.0.0.1","127.0.0.1","OpcUa","143","UA Secure Conversation Message: ReadResponse"
"334","27.405574","127.0.0.1","127.0.0.1","TCP","44","58662  >  53530 [ACK] Seq=12735 Ack=31922 Win=33536 Len=0"
"335","27.824181","127.0.0.1","127.0.0.1","OpcUa","236","UA Secure Conversation Message: PublishResponse"
"336","27.824279","127.0.0.1","127.0.0.1","TCP","44","58662  >  53530 [ACK] Seq=12735 Ack=32114 Win=33280 Len=0"
"337","27.838035","127.0.0.1","127.0.0.1","OpcUa","150","UA Secure Conversation Message: PublishRequest"
"338","27.838136","127.0.0.1","127.0.0.1","TCP","44","53530  >  58662 [ACK] Seq=32114 Ack=12841 Win=52480 Len=0"
"339","28.822240","127.0.0.1","127.0.0.1","OpcUa","236","UA Secure Conversation Message: PublishResponse"
"340","28.822364","127.0.0.1","127.0.0.1","TCP","44","58662  >  53530 [ACK] Seq=12841 Ack=32306 Win=33024 Len=0"
"341","28.836638","127.0.0.1","127.0.0.1","OpcUa","150","UA Secure Conversation Message: PublishRequest"
"342","28.836761","127.0.0.1","127.0.0.1","TCP","44","53530  >  58662 [ACK] Seq=32306 Ack=12947 Win=52480 Len=0"
"343","29.820299","127.0.0.1","127.0.0.1","OpcUa","232","UA Secure Conversation Message: PublishResponse"
"344","29.820388","127.0.0.1","127.0.0.1","TCP","44","58662  >  53530 [ACK] Seq=12947 Ack=32494 Win=33024 Len=0"
"345","29.834088","127.0.0.1","127.0.0.1","OpcUa","150","UA Secure Conversation Message: PublishRequest"
"346","29.834208","127.0.0.1","127.0.0.1","TCP","44","53530  >  58662 [ACK] Seq=32494 Ack=13053 Win=52480 Len=0"
"347","30.817297","127.0.0.1","127.0.0.1","OpcUa","236","UA Secure Conversation Message: PublishResponse"
"348","30.817386","127.0.0.1","127.0.0.1","TCP","44","58662  >  53530 [ACK] Seq=13053 Ack=32686 Win=32768 Len=0"
"349","30.830608","127.0.0.1","127.0.0.1","OpcUa","150","UA Secure Conversation Message: PublishRequest"
"350","30.830740","127.0.0.1","127.0.0.1","TCP","44","53530  >  58662 [ACK] Seq=32686 Ack=13159 Win=52224 Len=0"
"351","31.816745","127.0.0.1","127.0.0.1","OpcUa","236","UA Secure Conversation Message: PublishResponse"
"352","31.816942","127.0.0.1","127.0.0.1","TCP","44","58662  >  53530 [ACK] Seq=13159 Ack=32878 Win=65280 Len=0"
"353","31.830199","127.0.0.1","127.0.0.1","OpcUa","150","UA Secure Conversation Message: PublishRequest"
"354","31.830353","127.0.0.1","127.0.0.1","TCP","44","53530  >  58662 [ACK] Seq=32878 Ack=13265 Win=52224 Len=0"
"355","32.297035","127.0.0.1","127.0.0.1","OpcUa","133","UA Secure Conversation Message: PublishResponse"
"356","32.297118","127.0.0.1","127.0.0.1","TCP","44","58662  >  53530 [ACK] Seq=13265 Ack=32967 Win=65280 Len=0"
"357","32.310377","127.0.0.1","127.0.0.1","OpcUa","142","UA Secure Conversation Message: PublishRequest"
"358","32.310495","127.0.0.1","127.0.0.1","TCP","44","53530  >  58662 [ACK] Seq=32967 Ack=13363 Win=51968 Len=0"
"359","32.419506","127.0.0.1","127.0.0.1","OpcUa","208","UA Secure Conversation Message: ReadRequest"
"360","32.419614","127.0.0.1","127.0.0.1","TCP","44","53530  >  58662 [ACK] Seq=32967 Ack=13527 Win=51968 Len=0"
"361","32.421792","127.0.0.1","127.0.0.1","OpcUa","143","UA Secure Conversation Message: ReadResponse"
"362","32.421855","127.0.0.1","127.0.0.1","TCP","44","58662  >  53530 [ACK] Seq=13527 Ack=33066 Win=65280 Len=0"
"363","32.811059","127.0.0.1","127.0.0.1","OpcUa","236","UA Secure Conversation Message: PublishResponse"
"364","32.811150","127.0.0.1","127.0.0.1","TCP","44","58662  >  53530 [ACK] Seq=13527 Ack=33258 Win=65024 Len=0"
"365","32.825132","127.0.0.1","127.0.0.1","OpcUa","150","UA Secure Conversation Message: PublishRequest"
"366","32.825234","127.0.0.1","127.0.0.1","TCP","44","53530  >  58662 [ACK] Seq=33258 Ack=13633 Win=51712 Len=0"
"367","33.035459","127.0.0.1","127.0.0.1","OpcUa","168","UA Secure Conversation Message: WriteRequest"
"368","33.035557","127.0.0.1","127.0.0.1","TCP","44","53530  >  58662 [ACK] Seq=33258 Ack=13757 Win=51712 Len=0"
"369","33.037912","127.0.0.1","127.0.0.1","OpcUa","108","UA Secure Conversation Message: WriteResponse"
"370","33.037982","127.0.0.1","127.0.0.1","TCP","44","58662  >  53530 [ACK] Seq=13757 Ack=33322 Win=65024 Len=0"
"371","33.300450","127.0.0.1","127.0.0.1","UDP","1464","54217  >  5093 Len=1432"
"372","33.310912","127.0.0.1","127.0.0.1","OpcUa","180","UA Secure Conversation Message: PublishResponse"
"373","33.310995","127.0.0.1","127.0.0.1","TCP","44","58662  >  53530 [ACK] Seq=13757 Ack=33458 Win=64768 Len=0"
