"No.","Time","Source","Destination","Protocol","Length","Info"
"1","0.000000","127.0.0.1","127.0.0.1","UDP","1464","54217  >  5093 Len=1432"
"2","0.042177","127.0.0.1","127.0.0.1","UDP","1464","5093  >  54217 Len=1432"
"3","0.046233","127.0.0.1","127.0.0.1","UDP","1464","54217  >  5093 Len=1432"
"4","0.046636","127.0.0.1","127.0.0.1","UDP","1464","5093  >  54217 Len=1432"
"5","0.047718","127.0.0.1","127.0.0.1","UDP","1464","54217  >  5093 Len=1432"
"6","0.047962","127.0.0.1","127.0.0.1","UDP","1464","5093  >  54217 Len=1432"
"7","0.048950","127.0.0.1","127.0.0.1","UDP","1464","54217  >  5093 Len=1432"
"8","0.049202","127.0.0.1","127.0.0.1","UDP","1464","5093  >  54217 Len=1432"
"9","2.050503","::1","::1","TLSv1.2","89","Application Data"
"10","2.050606","::1","::1","TCP","64","64964  >  8900 [ACK] Seq=1 Ack=26 Win=227 Len=0"
"11","2.051790","::1","::1","TLSv1.2","93","Application Data"
"12","2.051867","::1","::1","TCP","64","8900  >  64964 [ACK] Seq=26 Ack=30 Win=195 Len=0"
"13","15.007359","127.0.0.1","127.0.0.1","UDP","1464","54217  >  5093 Len=1432"
"14","15.051638","127.0.0.1","127.0.0.1","UDP","1464","5093  >  54217 Len=1432"
"15","15.055054","127.0.0.1","127.0.0.1","UDP","1464","54217  >  5093 Len=1432"
"16","15.055415","127.0.0.1","127.0.0.1","UDP","1464","5093  >  54217 Len=1432"
"17","15.056781","127.0.0.1","127.0.0.1","UDP","1464","54217  >  5093 Len=1432"
"18","15.057089","127.0.0.1","127.0.0.1","UDP","1464","5093  >  54217 Len=1432"
"19","15.058472","127.0.0.1","127.0.0.1","UDP","1464","54217  >  5093 Len=1432"
"20","15.058756","127.0.0.1","127.0.0.1","UDP","1464","5093  >  54217 Len=1432"
"21","27.067690","::1","::1","TLSv1.2","89","Application Data"
"22","27.067771","::1","::1","TCP","64","64964  >  8900 [ACK] Seq=30 Ack=51 Win=227 Len=0"
"23","27.068588","::1","::1","TLSv1.2","93","Application Data"
"24","27.068669","::1","::1","TCP","64","8900  >  64964 [ACK] Seq=51 Ack=59 Win=195 Len=0"
"25","29.620215","127.0.0.1","127.0.0.1","TCP","56","52662  >  52661 [SYN] Seq=0 Win=65535 Len=0 MSS=65495 WS=256 SACK_PERM"
"26","29.620449","127.0.0.1","127.0.0.1","TCP","56","52661  >  52662 [SYN, ACK] Seq=0 Ack=1 Win=65535 Len=0 MSS=65495 WS=256 SACK_PERM"
"27","29.620529","127.0.0.1","127.0.0.1","TCP","44","52662  >  52661 [ACK] Seq=1 Ack=1 Win=65280 Len=0"
"28","29.621081","127.0.0.1","127.0.0.1","TCP","53","52662  >  52661 [PSH, ACK] Seq=1 Ack=1 Win=65280 Len=9"
"29","29.621116","127.0.0.1","127.0.0.1","TCP","44","52661  >  52662 [ACK] Seq=1 Ack=10 Win=65280 Len=0"
"30","29.714420","127.0.0.1","127.0.0.1","TCP","45","52661  >  52662 [PSH, ACK] Seq=1 Ack=10 Win=65280 Len=1"
"31","29.714493","127.0.0.1","127.0.0.1","TCP","44","52662  >  52661 [ACK] Seq=10 Ack=2 Win=65280 Len=0"
"32","29.714634","127.0.0.1","127.0.0.1","TCP","44","52661  >  52662 [FIN, ACK] Seq=2 Ack=10 Win=65280 Len=0"
"33","29.714698","127.0.0.1","127.0.0.1","TCP","44","52662  >  52661 [ACK] Seq=10 Ack=3 Win=65280 Len=0"
"34","29.714745","127.0.0.1","127.0.0.1","TCP","44","52662  >  52661 [RST, ACK] Seq=10 Ack=3 Win=0 Len=0"
"35","30.019903","127.0.0.1","127.0.0.1","UDP","1464","54217  >  5093 Len=1432"
"36","30.081440","127.0.0.1","127.0.0.1","UDP","1464","5093  >  54217 Len=1432"
"37","30.085901","127.0.0.1","127.0.0.1","UDP","1464","54217  >  5093 Len=1432"
"38","30.086279","127.0.0.1","127.0.0.1","UDP","1464","5093  >  54217 Len=1432"
"39","30.088066","127.0.0.1","127.0.0.1","UDP","1464","54217  >  5093 Len=1432"
"40","30.091471","127.0.0.1","127.0.0.1","UDP","1464","5093  >  54217 Len=1432"
"41","30.093284","127.0.0.1","127.0.0.1","UDP","1464","54217  >  5093 Len=1432"
"42","30.093867","127.0.0.1","127.0.0.1","UDP","1464","5093  >  54217 Len=1432"
"43","35.160341","127.0.0.1","127.0.0.1","TCP","56","52664  >  4840 [SYN] Seq=0 Win=65535 Len=0 MSS=65495 WS=256 SACK_PERM"
"44","35.160516","127.0.0.1","127.0.0.1","TCP","56","4840  >  52664 [SYN, ACK] Seq=0 Ack=1 Win=65535 Len=0 MSS=65495 WS=2 SACK_PERM"
"45","35.160606","127.0.0.1","127.0.0.1","TCP","44","52664  >  4840 [ACK] Seq=1 Ack=1 Win=65280 Len=0"
"46","35.161201","127.0.0.1","127.0.0.1","OpcUa","100","Hello message"
"47","35.161267","127.0.0.1","127.0.0.1","TCP","44","4840  >  52664 [ACK] Seq=1 Ack=57 Win=65480 Len=0"
"48","35.165972","127.0.0.1","127.0.0.1","OpcUa","72","Acknowledge message"
"49","35.166040","127.0.0.1","127.0.0.1","TCP","44","52664  >  4840 [ACK] Seq=57 Ack=29 Win=65280 Len=0"
"50","35.166472","127.0.0.1","127.0.0.1","OpcUa","177","OpenSecureChannel message"
"51","35.166534","127.0.0.1","127.0.0.1","TCP","44","4840  >  52664 [ACK] Seq=29 Ack=190 Win=65346 Len=0"
"52","35.168400","127.0.0.1","127.0.0.1","OpcUa","179","OpenSecureChannel message"
"53","35.168459","127.0.0.1","127.0.0.1","TCP","44","52664  >  4840 [ACK] Seq=190 Ack=164 Win=65280 Len=0"
"54","35.168805","127.0.0.1","127.0.0.1","OpcUa","137","UA Secure Conversation Message: FindServersRequest"
"55","35.168843","127.0.0.1","127.0.0.1","TCP","44","4840  >  52664 [ACK] Seq=164 Ack=283 Win=65254 Len=0"
"56","35.171633","127.0.0.1","127.0.0.1","OpcUa","278","UA Secure Conversation Message: FindServersResponse"
"57","35.171783","127.0.0.1","127.0.0.1","TCP","44","52664  >  4840 [ACK] Seq=283 Ack=398 Win=65024 Len=0"
"58","35.172035","127.0.0.1","127.0.0.1","OpcUa","101","CloseSecureChannel message: CloseSecureChannelRequest"
"59","35.172084","127.0.0.1","127.0.0.1","TCP","44","4840  >  52664 [ACK] Seq=398 Ack=340 Win=65196 Len=0"
"60","35.172163","127.0.0.1","127.0.0.1","TCP","44","52664  >  4840 [FIN, ACK] Seq=340 Ack=398 Win=65024 Len=0"
"61","35.172184","127.0.0.1","127.0.0.1","TCP","44","4840  >  52664 [ACK] Seq=398 Ack=341 Win=65196 Len=0"
"62","35.172347","127.0.0.1","127.0.0.1","TCP","44","4840  >  52664 [FIN, ACK] Seq=398 Ack=341 Win=65196 Len=0"
"63","35.172424","127.0.0.1","127.0.0.1","TCP","44","52664  >  4840 [ACK] Seq=341 Ack=399 Win=65024 Len=0"
"64","45.027741","127.0.0.1","127.0.0.1","UDP","1464","54217  >  5093 Len=1432"
"65","45.064330","127.0.0.1","127.0.0.1","UDP","1464","5093  >  54217 Len=1432"
"66","45.067827","127.0.0.1","127.0.0.1","UDP","1464","54217  >  5093 Len=1432"
"67","45.068161","127.0.0.1","127.0.0.1","UDP","1464","5093  >  54217 Len=1432"
"68","45.069093","127.0.0.1","127.0.0.1","UDP","1464","54217  >  5093 Len=1432"
"69","45.069361","127.0.0.1","127.0.0.1","UDP","1464","5093  >  54217 Len=1432"
"70","45.070209","127.0.0.1","127.0.0.1","UDP","1464","54217  >  5093 Len=1432"
"71","45.070493","127.0.0.1","127.0.0.1","UDP","1464","5093  >  54217 Len=1432"
"72","45.598582","127.0.0.1","127.0.0.1","TCP","56","54670  >  4840 [SYN] Seq=0 Win=65535 Len=0 MSS=65495 WS=256 SACK_PERM"
"73","45.598701","127.0.0.1","127.0.0.1","TCP","56","4840  >  54670 [SYN, ACK] Seq=0 Ack=1 Win=65535 Len=0 MSS=65495 WS=2 SACK_PERM"
"74","45.598770","127.0.0.1","127.0.0.1","TCP","44","54670  >  4840 [ACK] Seq=1 Ack=1 Win=65280 Len=0"
"75","45.599266","127.0.0.1","127.0.0.1","OpcUa","100","Hello message"
"76","45.599334","127.0.0.1","127.0.0.1","TCP","44","4840  >  54670 [ACK] Seq=1 Ack=57 Win=65480 Len=0"
"77","45.599468","127.0.0.1","127.0.0.1","OpcUa","72","Acknowledge message"
"78","45.599523","127.0.0.1","127.0.0.1","TCP","44","54670  >  4840 [ACK] Seq=57 Ack=29 Win=65280 Len=0"
"79","45.599636","127.0.0.1","127.0.0.1","OpcUa","177","OpenSecureChannel message"
"80","45.599687","127.0.0.1","127.0.0.1","TCP","44","4840  >  54670 [ACK] Seq=29 Ack=190 Win=65346 Len=0"
"81","45.599850","127.0.0.1","127.0.0.1","OpcUa","179","OpenSecureChannel message"
"82","45.599896","127.0.0.1","127.0.0.1","TCP","44","54670  >  4840 [ACK] Seq=190 Ack=164 Win=65280 Len=0"
"83","45.600215","127.0.0.1","127.0.0.1","OpcUa","137","UA Secure Conversation Message: FindServersRequest"
"84","45.600280","127.0.0.1","127.0.0.1","TCP","44","4840  >  54670 [ACK] Seq=164 Ack=283 Win=65254 Len=0"
"85","45.602019","127.0.0.1","127.0.0.1","OpcUa","278","UA Secure Conversation Message: FindServersResponse"
"86","45.602085","127.0.0.1","127.0.0.1","TCP","44","54670  >  4840 [ACK] Seq=283 Ack=398 Win=65024 Len=0"
"87","45.602319","127.0.0.1","127.0.0.1","OpcUa","101","CloseSecureChannel message: CloseSecureChannelRequest"
"88","45.602369","127.0.0.1","127.0.0.1","TCP","44","4840  >  54670 [ACK] Seq=398 Ack=340 Win=65196 Len=0"
"89","45.602425","127.0.0.1","127.0.0.1","TCP","44","54670  >  4840 [FIN, ACK] Seq=340 Ack=398 Win=65024 Len=0"
"90","45.602458","127.0.0.1","127.0.0.1","TCP","44","4840  >  54670 [ACK] Seq=398 Ack=341 Win=65196 Len=0"
"91","45.602553","127.0.0.1","127.0.0.1","TCP","44","4840  >  54670 [FIN, ACK] Seq=398 Ack=341 Win=65196 Len=0"
"92","45.602648","127.0.0.1","127.0.0.1","TCP","44","54670  >  4840 [ACK] Seq=341 Ack=399 Win=65024 Len=0"
"93","48.646918","127.0.0.1","127.0.0.1","TCP","56","54671  >  53530 [SYN] Seq=0 Win=65535 Len=0 MSS=65495 WS=256 SACK_PERM"
"94","48.647114","127.0.0.1","127.0.0.1","TCP","56","53530  >  54671 [SYN, ACK] Seq=0 Ack=1 Win=65535 Len=0 MSS=65495 WS=256 SACK_PERM"
"95","48.647205","127.0.0.1","127.0.0.1","TCP","44","54671  >  53530 [ACK] Seq=1 Ack=1 Win=65280 Len=0"
"96","48.647723","127.0.0.1","127.0.0.1","OpcUa","124","Hello message"
"97","48.647769","127.0.0.1","127.0.0.1","TCP","44","53530  >  54671 [ACK] Seq=1 Ack=81 Win=65280 Len=0"
"98","48.650790","127.0.0.1","127.0.0.1","OpcUa","72","Acknowledge message"
"99","48.650851","127.0.0.1","127.0.0.1","TCP","44","54671  >  53530 [ACK] Seq=81 Ack=29 Win=65280 Len=0"
"100","48.651007","127.0.0.1","127.0.0.1","OpcUa","177","OpenSecureChannel message"
"101","48.651052","127.0.0.1","127.0.0.1","TCP","44","53530  >  54671 [ACK] Seq=29 Ack=214 Win=65280 Len=0"
"102","48.651553","127.0.0.1","127.0.0.1","OpcUa","179","OpenSecureChannel message"
"103","48.651602","127.0.0.1","127.0.0.1","TCP","44","54671  >  53530 [ACK] Seq=214 Ack=164 Win=65280 Len=0"
"104","48.651846","127.0.0.1","127.0.0.1","OpcUa","161","UA Secure Conversation Message: FindServersRequest"
"105","48.651895","127.0.0.1","127.0.0.1","TCP","44","53530  >  54671 [ACK] Seq=164 Ack=331 Win=65024 Len=0"
"106","48.653692","127.0.0.1","127.0.0.1","OpcUa","295","UA Secure Conversation Message: FindServersResponse"
"107","48.653771","127.0.0.1","127.0.0.1","TCP","44","54671  >  53530 [ACK] Seq=331 Ack=415 Win=65024 Len=0"
"108","48.654074","127.0.0.1","127.0.0.1","OpcUa","101","CloseSecureChannel message: CloseSecureChannelRequest"
"109","48.654120","127.0.0.1","127.0.0.1","TCP","44","53530  >  54671 [ACK] Seq=415 Ack=388 Win=65024 Len=0"
"110","48.654212","127.0.0.1","127.0.0.1","TCP","44","54671  >  53530 [FIN, ACK] Seq=388 Ack=415 Win=65024 Len=0"
"111","48.654240","127.0.0.1","127.0.0.1","TCP","44","53530  >  54671 [ACK] Seq=415 Ack=389 Win=65024 Len=0"
"112","48.655617","127.0.0.1","127.0.0.1","TCP","44","53530  >  54671 [FIN, ACK] Seq=415 Ack=389 Win=65024 Len=0"
"113","48.655730","127.0.0.1","127.0.0.1","TCP","44","54671  >  53530 [ACK] Seq=389 Ack=416 Win=65024 Len=0"
"114","49.291897","127.0.0.1","127.0.0.1","TCP","56","54672  >  53530 [SYN] Seq=0 Win=65535 Len=0 MSS=65495 WS=256 SACK_PERM"
"115","49.292015","127.0.0.1","127.0.0.1","TCP","56","53530  >  54672 [SYN, ACK] Seq=0 Ack=1 Win=65535 Len=0 MSS=65495 WS=256 SACK_PERM"
"116","49.292158","127.0.0.1","127.0.0.1","TCP","44","54672  >  53530 [ACK] Seq=1 Ack=1 Win=65280 Len=0"
"117","49.292587","127.0.0.1","127.0.0.1","OpcUa","128","Hello message"
"118","49.292630","127.0.0.1","127.0.0.1","TCP","44","53530  >  54672 [ACK] Seq=1 Ack=85 Win=65280 Len=0"
"119","49.293631","127.0.0.1","127.0.0.1","OpcUa","72","Acknowledge message"
"120","49.293696","127.0.0.1","127.0.0.1","TCP","44","54672  >  53530 [ACK] Seq=85 Ack=29 Win=65280 Len=0"
"121","49.293897","127.0.0.1","127.0.0.1","OpcUa","177","OpenSecureChannel message"
"122","49.294042","127.0.0.1","127.0.0.1","TCP","44","53530  >  54672 [ACK] Seq=29 Ack=218 Win=65280 Len=0"
"123","49.294593","127.0.0.1","127.0.0.1","OpcUa","179","OpenSecureChannel message"
"124","49.294651","127.0.0.1","127.0.0.1","TCP","44","54672  >  53530 [ACK] Seq=218 Ack=164 Win=65280 Len=0"
"125","49.295038","127.0.0.1","127.0.0.1","OpcUa","165","UA Secure Conversation Message: GetEndpointsRequest"
"126","49.295086","127.0.0.1","127.0.0.1","TCP","44","53530  >  54672 [ACK] Seq=164 Ack=339 Win=65024 Len=0"
"127","49.296474","127.0.0.1","127.0.0.1","OpcUa","20188","UA Secure Conversation Message: GetEndpointsResponse"
"128","49.296594","127.0.0.1","127.0.0.1","TCP","44","54672  >  53530 [ACK] Seq=339 Ack=20308 Win=45056 Len=0"
"129","49.297007","127.0.0.1","127.0.0.1","OpcUa","101","CloseSecureChannel message: CloseSecureChannelRequest"
"130","49.297063","127.0.0.1","127.0.0.1","TCP","44","53530  >  54672 [ACK] Seq=20308 Ack=396 Win=65024 Len=0"
"131","49.297114","127.0.0.1","127.0.0.1","TCP","44","54672  >  53530 [FIN, ACK] Seq=396 Ack=20308 Win=45056 Len=0"
"132","49.297141","127.0.0.1","127.0.0.1","TCP","44","53530  >  54672 [ACK] Seq=20308 Ack=397 Win=65024 Len=0"
"133","49.298114","127.0.0.1","127.0.0.1","TCP","44","53530  >  54672 [FIN, ACK] Seq=20308 Ack=397 Win=65024 Len=0"
"134","49.298207","127.0.0.1","127.0.0.1","TCP","44","54672  >  53530 [ACK] Seq=397 Ack=20309 Win=45056 Len=0"
"135","52.074392","::1","::1","TLSv1.2","89","Application Data"
"136","52.074447","::1","::1","TCP","64","64964  >  8900 [ACK] Seq=59 Ack=76 Win=226 Len=0"
"137","52.075385","::1","::1","TLSv1.2","93","Application Data"
"138","52.075438","::1","::1","TCP","64","8900  >  64964 [ACK] Seq=76 Ack=88 Win=195 Len=0"
"139","56.606833","127.0.0.1","127.0.0.1","TCP","56","54673  >  53530 [SYN] Seq=0 Win=65535 Len=0 MSS=65495 WS=256 SACK_PERM"
"140","56.606987","127.0.0.1","127.0.0.1","TCP","56","53530  >  54673 [SYN, ACK] Seq=0 Ack=1 Win=65535 Len=0 MSS=65495 WS=256 SACK_PERM"
"141","56.607064","127.0.0.1","127.0.0.1","TCP","44","54673  >  53530 [ACK] Seq=1 Ack=1 Win=65280 Len=0"
"142","56.607664","127.0.0.1","127.0.0.1","OpcUa","128","Hello message"
"143","56.607730","127.0.0.1","127.0.0.1","TCP","44","53530  >  54673 [ACK] Seq=1 Ack=85 Win=65280 Len=0"
"144","56.612307","127.0.0.1","127.0.0.1","OpcUa","72","Acknowledge message"
"145","56.612370","127.0.0.1","127.0.0.1","TCP","44","54673  >  53530 [ACK] Seq=85 Ack=29 Win=65280 Len=0"
"146","56.612561","127.0.0.1","127.0.0.1","OpcUa","177","OpenSecureChannel message"
"147","56.612612","127.0.0.1","127.0.0.1","TCP","44","53530  >  54673 [ACK] Seq=29 Ack=218 Win=65280 Len=0"
"148","56.613114","127.0.0.1","127.0.0.1","OpcUa","179","OpenSecureChannel message"
"149","56.613166","127.0.0.1","127.0.0.1","TCP","44","54673  >  53530 [ACK] Seq=218 Ack=164 Win=65280 Len=0"
"150","56.613681","127.0.0.1","127.0.0.1","OpcUa","165","UA Secure Conversation Message: GetEndpointsRequest"
"151","56.613745","127.0.0.1","127.0.0.1","TCP","44","53530  >  54673 [ACK] Seq=164 Ack=339 Win=65024 Len=0"
"152","56.614830","127.0.0.1","127.0.0.1","OpcUa","20188","UA Secure Conversation Message: GetEndpointsResponse"
"153","56.614955","127.0.0.1","127.0.0.1","TCP","44","54673  >  53530 [ACK] Seq=339 Ack=20308 Win=45056 Len=0"
"154","56.615394","127.0.0.1","127.0.0.1","OpcUa","101","CloseSecureChannel message: CloseSecureChannelRequest"
"155","56.615547","127.0.0.1","127.0.0.1","TCP","44","53530  >  54673 [ACK] Seq=20308 Ack=396 Win=65024 Len=0"
"156","56.615664","127.0.0.1","127.0.0.1","TCP","44","54673  >  53530 [FIN, ACK] Seq=396 Ack=20308 Win=45056 Len=0"
"157","56.615712","127.0.0.1","127.0.0.1","TCP","44","53530  >  54673 [ACK] Seq=20308 Ack=397 Win=65024 Len=0"
"158","56.616671","127.0.0.1","127.0.0.1","TCP","44","53530  >  54673 [FIN, ACK] Seq=20308 Ack=397 Win=65024 Len=0"
"159","56.616753","127.0.0.1","127.0.0.1","TCP","44","54673  >  53530 [ACK] Seq=397 Ack=20309 Win=45056 Len=0"
"160","56.790403","127.0.0.1","127.0.0.1","TCP","56","54674  >  53530 [SYN] Seq=0 Win=65535 Len=0 MSS=65495 WS=256 SACK_PERM"
"161","56.790675","127.0.0.1","127.0.0.1","TCP","56","53530  >  54674 [SYN, ACK] Seq=0 Ack=1 Win=65535 Len=0 MSS=65495 WS=256 SACK_PERM"
"162","56.790786","127.0.0.1","127.0.0.1","TCP","44","54674  >  53530 [ACK] Seq=1 Ack=1 Win=65280 Len=0"
"163","56.791335","127.0.0.1","127.0.0.1","OpcUa","128","Hello message"
"164","56.791402","127.0.0.1","127.0.0.1","TCP","44","53530  >  54674 [ACK] Seq=1 Ack=85 Win=65280 Len=0"
"165","56.793279","127.0.0.1","127.0.0.1","OpcUa","72","Acknowledge message"
"166","56.793345","127.0.0.1","127.0.0.1","TCP","44","54674  >  53530 [ACK] Seq=85 Ack=29 Win=65280 Len=0"
"167","56.793499","127.0.0.1","127.0.0.1","OpcUa","177","OpenSecureChannel message"
"168","56.793625","127.0.0.1","127.0.0.1","TCP","44","53530  >  54674 [ACK] Seq=29 Ack=218 Win=65280 Len=0"
"169","56.794108","127.0.0.1","127.0.0.1","OpcUa","179","OpenSecureChannel message"
"170","56.794187","127.0.0.1","127.0.0.1","TCP","44","54674  >  53530 [ACK] Seq=218 Ack=164 Win=65280 Len=0"
"171","56.794520","127.0.0.1","127.0.0.1","OpcUa","386","UA Secure Conversation Message: CreateSessionRequest"
"172","56.794566","127.0.0.1","127.0.0.1","TCP","44","53530  >  54674 [ACK] Seq=164 Ack=560 Win=64768 Len=0"
"173","56.801108","127.0.0.1","127.0.0.1","OpcUa","21331","UA Secure Conversation Message: CreateSessionResponse"
"174","56.801223","127.0.0.1","127.0.0.1","TCP","44","54674  >  53530 [ACK] Seq=560 Ack=21451 Win=44032 Len=0"
"175","56.802911","127.0.0.1","127.0.0.1","OpcUa","193","UA Secure Conversation Message: ActivateSessionRequest"
"176","56.802981","127.0.0.1","127.0.0.1","TCP","44","53530  >  54674 [ACK] Seq=21451 Ack=709 Win=64768 Len=0"
"177","56.805309","127.0.0.1","127.0.0.1","OpcUa","140","UA Secure Conversation Message: ActivateSessionResponse"
"178","56.805379","127.0.0.1","127.0.0.1","TCP","44","54674  >  53530 [ACK] Seq=709 Ack=21547 Win=43776 Len=0"
"179","56.805746","127.0.0.1","127.0.0.1","OpcUa","190","UA Secure Conversation Message: ReadRequest"
"180","56.805827","127.0.0.1","127.0.0.1","TCP","44","53530  >  54674 [ACK] Seq=21547 Ack=855 Win=64512 Len=0"
"181","56.808088","127.0.0.1","127.0.0.1","OpcUa","116","UA Secure Conversation Message: ReadResponse"
"182","56.808171","127.0.0.1","127.0.0.1","TCP","44","54674  >  53530 [ACK] Seq=855 Ack=21619 Win=43776 Len=0"
"183","56.808598","127.0.0.1","127.0.0.1","OpcUa","496","UA Secure Conversation Message: ReadRequest"
"184","56.808678","127.0.0.1","127.0.0.1","TCP","44","53530  >  54674 [ACK] Seq=21619 Ack=1307 Win=64000 Len=0"
"185","56.810768","127.0.0.1","127.0.0.1","OpcUa","565","UA Secure Conversation Message: ReadResponse"
"186","56.810845","127.0.0.1","127.0.0.1","TCP","44","54674  >  53530 [ACK] Seq=1307 Ack=22140 Win=43264 Len=0"
"187","56.812934","127.0.0.1","127.0.0.1","OpcUa","172","UA Secure Conversation Message: ReadRequest"
"188","56.812992","127.0.0.1","127.0.0.1","TCP","44","53530  >  54674 [ACK] Seq=22140 Ack=1435 Win=64000 Len=0"
"189","56.814846","127.0.0.1","127.0.0.1","OpcUa","107","UA Secure Conversation Message: ReadResponse"
"190","56.814921","127.0.0.1","127.0.0.1","TCP","44","54674  >  53530 [ACK] Seq=1435 Ack=22203 Win=43264 Len=0"
"191","56.815358","127.0.0.1","127.0.0.1","OpcUa","160","UA Secure Conversation Message: CreateSubscriptionRequest"
"192","56.815423","127.0.0.1","127.0.0.1","TCP","44","53530  >  54674 [ACK] Seq=22203 Ack=1551 Win=63744 Len=0"
"193","56.821150","127.0.0.1","127.0.0.1","OpcUa","116","UA Secure Conversation Message: CreateSubscriptionResponse"
"194","56.821226","127.0.0.1","127.0.0.1","TCP","44","54674  >  53530 [ACK] Seq=1551 Ack=22275 Win=43008 Len=0"
"195","56.821605","127.0.0.1","127.0.0.1","OpcUa","320","UA Secure Conversation Message: CreateMonitoredItemsRequest"
"196","56.821669","127.0.0.1","127.0.0.1","TCP","44","53530  >  54674 [ACK] Seq=22275 Ack=1827 Win=63488 Len=0"
"197","56.824996","127.0.0.1","127.0.0.1","OpcUa","182","UA Secure Conversation Message: CreateMonitoredItemsResponse"
"198","56.825093","127.0.0.1","127.0.0.1","TCP","44","54674  >  53530 [ACK] Seq=1827 Ack=22413 Win=43008 Len=0"
"199","56.829268","127.0.0.1","127.0.0.1","OpcUa","177","UA Secure Conversation Message: BrowseRequest"
"200","56.829326","127.0.0.1","127.0.0.1","TCP","44","53530  >  54674 [ACK] Seq=22413 Ack=1960 Win=63488 Len=0"
"201","56.831816","127.0.0.1","127.0.0.1","OpcUa","240","UA Secure Conversation Message: BrowseResponse"
"202","56.831959","127.0.0.1","127.0.0.1","TCP","44","54674  >  53530 [ACK] Seq=1960 Ack=22609 Win=42752 Len=0"
"203","56.832790","127.0.0.1","127.0.0.1","OpcUa","314","UA Secure Conversation Message: ReadRequest"
"204","56.832856","127.0.0.1","127.0.0.1","TCP","44","53530  >  54674 [ACK] Seq=22609 Ack=2230 Win=63232 Len=0"
"205","56.835366","127.0.0.1","127.0.0.1","OpcUa","194","UA Secure Conversation Message: ReadResponse"
"206","56.835445","127.0.0.1","127.0.0.1","TCP","44","54674  >  53530 [ACK] Seq=2230 Ack=22759 Win=42752 Len=0"
"207","56.835718","127.0.0.1","127.0.0.1","OpcUa","177","UA Secure Conversation Message: BrowseRequest"
"208","56.835756","127.0.0.1","127.0.0.1","TCP","44","53530  >  54674 [ACK] Seq=22759 Ack=2363 Win=62976 Len=0"
"209","56.838174","127.0.0.1","127.0.0.1","OpcUa","142","UA Secure Conversation Message: BrowseResponse"
"210","56.838250","127.0.0.1","127.0.0.1","TCP","44","54674  >  53530 [ACK] Seq=2363 Ack=22857 Win=42496 Len=0"
"211","56.838576","127.0.0.1","127.0.0.1","OpcUa","314","UA Secure Conversation Message: ReadRequest"
"212","56.838634","127.0.0.1","127.0.0.1","TCP","44","53530  >  54674 [ACK] Seq=22857 Ack=2633 Win=62720 Len=0"
"213","56.841033","127.0.0.1","127.0.0.1","OpcUa","238","UA Secure Conversation Message: ReadResponse"
"214","56.841108","127.0.0.1","127.0.0.1","TCP","44","54674  >  53530 [ACK] Seq=2633 Ack=23051 Win=42240 Len=0"
"215","56.842137","127.0.0.1","127.0.0.1","OpcUa","177","UA Secure Conversation Message: BrowseRequest"
"216","56.842200","127.0.0.1","127.0.0.1","TCP","44","53530  >  54674 [ACK] Seq=23051 Ack=2766 Win=62720 Len=0"
"217","56.844835","127.0.0.1","127.0.0.1","OpcUa","142","UA Secure Conversation Message: BrowseResponse"
"218","56.844919","127.0.0.1","127.0.0.1","TCP","44","54674  >  53530 [ACK] Seq=2766 Ack=23149 Win=42240 Len=0"
"219","56.845200","127.0.0.1","127.0.0.1","OpcUa","314","UA Secure Conversation Message: ReadRequest"
"220","56.845247","127.0.0.1","127.0.0.1","TCP","44","53530  >  54674 [ACK] Seq=23149 Ack=3036 Win=62464 Len=0"
"221","56.847717","127.0.0.1","127.0.0.1","OpcUa","181","UA Secure Conversation Message: ReadResponse"
"222","56.847788","127.0.0.1","127.0.0.1","TCP","44","54674  >  53530 [ACK] Seq=3036 Ack=23286 Win=42240 Len=0"
"223","56.848175","127.0.0.1","127.0.0.1","OpcUa","177","UA Secure Conversation Message: BrowseRequest"
"224","56.848230","127.0.0.1","127.0.0.1","TCP","44","53530  >  54674 [ACK] Seq=23286 Ack=3169 Win=62208 Len=0"
"225","56.850815","127.0.0.1","127.0.0.1","OpcUa","116","UA Secure Conversation Message: BrowseResponse"
"226","56.850887","127.0.0.1","127.0.0.1","TCP","44","54674  >  53530 [ACK] Seq=3169 Ack=23358 Win=41984 Len=0"
"227","56.857692","127.0.0.1","127.0.0.1","OpcUa","177","UA Secure Conversation Message: BrowseRequest"
"228","56.857763","127.0.0.1","127.0.0.1","TCP","44","53530  >  54674 [ACK] Seq=23358 Ack=3302 Win=62208 Len=0"
"229","56.860398","127.0.0.1","127.0.0.1","OpcUa","463","UA Secure Conversation Message: BrowseResponse"
"230","56.860454","127.0.0.1","127.0.0.1","TCP","44","54674  >  53530 [ACK] Seq=3302 Ack=23777 Win=41728 Len=0"
"231","56.942278","127.0.0.1","127.0.0.1","OpcUa","334","UA Secure Conversation Message: ReadRequest"
"232","56.942349","127.0.0.1","127.0.0.1","TCP","44","53530  >  54674 [ACK] Seq=23777 Ack=3592 Win=61696 Len=0"
"233","56.944644","127.0.0.1","127.0.0.1","OpcUa","184","UA Secure Conversation Message: ReadResponse"
"234","56.944711","127.0.0.1","127.0.0.1","TCP","44","54674  >  53530 [ACK] Seq=3592 Ack=23917 Win=41472 Len=0"
"235","56.945020","127.0.0.1","127.0.0.1","OpcUa","179","UA Secure Conversation Message: BrowseRequest"
"236","56.945062","127.0.0.1","127.0.0.1","TCP","44","53530  >  54674 [ACK] Seq=23917 Ack=3727 Win=61696 Len=0"
"237","56.947538","127.0.0.1","127.0.0.1","OpcUa","142","UA Secure Conversation Message: BrowseResponse"
"238","56.947605","127.0.0.1","127.0.0.1","TCP","44","54674  >  53530 [ACK] Seq=3727 Ack=24015 Win=41472 Len=0"
"239","56.948006","127.0.0.1","127.0.0.1","OpcUa","314","UA Secure Conversation Message: ReadRequest"
"240","56.948047","127.0.0.1","127.0.0.1","TCP","44","53530  >  54674 [ACK] Seq=24015 Ack=3997 Win=61440 Len=0"
"241","56.949902","127.0.0.1","127.0.0.1","OpcUa","192","UA Secure Conversation Message: ReadResponse"
"242","56.949959","127.0.0.1","127.0.0.1","TCP","44","54674  >  53530 [ACK] Seq=3997 Ack=24163 Win=41216 Len=0"
"243","56.950210","127.0.0.1","127.0.0.1","OpcUa","177","UA Secure Conversation Message: BrowseRequest"
"244","56.950241","127.0.0.1","127.0.0.1","TCP","44","53530  >  54674 [ACK] Seq=24163 Ack=4130 Win=61184 Len=0"
"245","56.952026","127.0.0.1","127.0.0.1","OpcUa","116","UA Secure Conversation Message: BrowseResponse"
"246","56.952094","127.0.0.1","127.0.0.1","TCP","44","54674  >  53530 [ACK] Seq=4130 Ack=24235 Win=41216 Len=0"
"247","56.952782","127.0.0.1","127.0.0.1","OpcUa","334","UA Secure Conversation Message: ReadRequest"
"248","56.952833","127.0.0.1","127.0.0.1","TCP","44","53530  >  54674 [ACK] Seq=24235 Ack=4420 Win=60928 Len=0"
"249","56.960033","127.0.0.1","127.0.0.1","OpcUa","206","UA Secure Conversation Message: ReadResponse"
"250","56.960093","127.0.0.1","127.0.0.1","TCP","44","54674  >  53530 [ACK] Seq=4420 Ack=24397 Win=40960 Len=0"
"251","56.960374","127.0.0.1","127.0.0.1","OpcUa","179","UA Secure Conversation Message: BrowseRequest"
"252","56.960413","127.0.0.1","127.0.0.1","TCP","44","53530  >  54674 [ACK] Seq=24397 Ack=4555 Win=60928 Len=0"
"253","56.962416","127.0.0.1","127.0.0.1","OpcUa","142","UA Secure Conversation Message: BrowseResponse"
"254","56.962479","127.0.0.1","127.0.0.1","TCP","44","54674  >  53530 [ACK] Seq=4555 Ack=24495 Win=40960 Len=0"
"255","56.976855","127.0.0.1","127.0.0.1","OpcUa","142","UA Secure Conversation Message: PublishRequest"
"256","56.976927","127.0.0.1","127.0.0.1","TCP","44","53530  >  54674 [ACK] Seq=24495 Ack=4653 Win=60672 Len=0"
"257","56.977001","127.0.0.1","127.0.0.1","OpcUa","142","UA Secure Conversation Message: PublishRequest"
"258","56.977016","127.0.0.1","127.0.0.1","TCP","44","53530  >  54674 [ACK] Seq=24495 Ack=4751 Win=60672 Len=0"
"259","56.979715","127.0.0.1","127.0.0.1","OpcUa","129","UA Secure Conversation Message: PublishResponse"
"260","56.979875","127.0.0.1","127.0.0.1","TCP","44","54674  >  53530 [ACK] Seq=4751 Ack=24580 Win=40704 Len=0"
"261","56.992867","127.0.0.1","127.0.0.1","OpcUa","142","UA Secure Conversation Message: PublishRequest"
"262","56.993028","127.0.0.1","127.0.0.1","TCP","44","53530  >  54674 [ACK] Seq=24580 Ack=4849 Win=60672 Len=0"
"263","60.036787","127.0.0.1","127.0.0.1","UDP","1464","54217  >  5093 Len=1432"
"264","60.087647","127.0.0.1","127.0.0.1","UDP","1464","5093  >  54217 Len=1432"
"265","60.094752","127.0.0.1","127.0.0.1","UDP","1464","54217  >  5093 Len=1432"
"266","60.095085","127.0.0.1","127.0.0.1","UDP","1464","5093  >  54217 Len=1432"
"267","60.097149","127.0.0.1","127.0.0.1","UDP","1464","54217  >  5093 Len=1432"
"268","60.097597","127.0.0.1","127.0.0.1","UDP","1464","5093  >  54217 Len=1432"
"269","60.099075","127.0.0.1","127.0.0.1","UDP","1464","54217  >  5093 Len=1432"
"270","60.099552","127.0.0.1","127.0.0.1","UDP","1464","5093  >  54217 Len=1432"
"271","61.923075","127.0.0.1","127.0.0.1","OpcUa","129","UA Secure Conversation Message: PublishResponse"
"272","61.923140","127.0.0.1","127.0.0.1","TCP","44","54674  >  53530 [ACK] Seq=4849 Ack=24665 Win=40704 Len=0"
"273","61.937823","127.0.0.1","127.0.0.1","OpcUa","142","UA Secure Conversation Message: PublishRequest"
"274","61.937927","127.0.0.1","127.0.0.1","TCP","44","53530  >  54674 [ACK] Seq=24665 Ack=4947 Win=60416 Len=0"
"275","61.969209","127.0.0.1","127.0.0.1","OpcUa","208","UA Secure Conversation Message: ReadRequest"
"276","61.969293","127.0.0.1","127.0.0.1","TCP","44","53530  >  54674 [ACK] Seq=24665 Ack=5111 Win=60416 Len=0"
"277","61.970812","127.0.0.1","127.0.0.1","OpcUa","143","UA Secure Conversation Message: ReadResponse"
"278","61.970892","127.0.0.1","127.0.0.1","TCP","44","54674  >  53530 [ACK] Seq=5111 Ack=24764 Win=40704 Len=0"
"279","66.930874","127.0.0.1","127.0.0.1","OpcUa","129","UA Secure Conversation Message: PublishResponse"
"280","66.931033","127.0.0.1","127.0.0.1","TCP","44","54674  >  53530 [ACK] Seq=5111 Ack=24849 Win=40448 Len=0"
"281","66.944916","127.0.0.1","127.0.0.1","OpcUa","142","UA Secure Conversation Message: PublishRequest"
"282","66.945007","127.0.0.1","127.0.0.1","TCP","44","53530  >  54674 [ACK] Seq=24849 Ack=5209 Win=60160 Len=0"
"283","66.977056","127.0.0.1","127.0.0.1","OpcUa","208","UA Secure Conversation Message: ReadRequest"
"284","66.977131","127.0.0.1","127.0.0.1","TCP","44","53530  >  54674 [ACK] Seq=24849 Ack=5373 Win=60160 Len=0"
"285","66.979412","127.0.0.1","127.0.0.1","OpcUa","143","UA Secure Conversation Message: ReadResponse"
"286","66.979494","127.0.0.1","127.0.0.1","TCP","44","54674  >  53530 [ACK] Seq=5373 Ack=24948 Win=40448 Len=0"
"287","71.931179","127.0.0.1","127.0.0.1","OpcUa","129","UA Secure Conversation Message: PublishResponse"
"288","71.931242","127.0.0.1","127.0.0.1","TCP","44","54674  >  53530 [ACK] Seq=5373 Ack=25033 Win=40448 Len=0"
"289","71.945224","127.0.0.1","127.0.0.1","OpcUa","142","UA Secure Conversation Message: PublishRequest"
"290","71.945412","127.0.0.1","127.0.0.1","TCP","44","53530  >  54674 [ACK] Seq=25033 Ack=5471 Win=59904 Len=0"
"291","71.991923","127.0.0.1","127.0.0.1","OpcUa","208","UA Secure Conversation Message: ReadRequest"
"292","71.992035","127.0.0.1","127.0.0.1","TCP","44","53530  >  54674 [ACK] Seq=25033 Ack=5635 Win=59648 Len=0"
"293","71.994811","127.0.0.1","127.0.0.1","OpcUa","143","UA Secure Conversation Message: ReadResponse"
"294","71.994964","127.0.0.1","127.0.0.1","TCP","44","54674  >  53530 [ACK] Seq=5635 Ack=25132 Win=40192 Len=0"
"295","75.050368","127.0.0.1","127.0.0.1","UDP","1464","54217  >  5093 Len=1432"
"296","75.094494","127.0.0.1","127.0.0.1","UDP","1464","5093  >  54217 Len=1432"
"297","75.098145","127.0.0.1","127.0.0.1","UDP","1464","54217  >  5093 Len=1432"
"298","75.098521","127.0.0.1","127.0.0.1","UDP","1464","5093  >  54217 Len=1432"
"299","75.099573","127.0.0.1","127.0.0.1","UDP","1464","54217  >  5093 Len=1432"
"300","75.099832","127.0.0.1","127.0.0.1","UDP","1464","5093  >  54217 Len=1432"
"301","75.100800","127.0.0.1","127.0.0.1","UDP","1464","54217  >  5093 Len=1432"
"302","75.101043","127.0.0.1","127.0.0.1","UDP","1464","5093  >  54217 Len=1432"
"303","76.931808","127.0.0.1","127.0.0.1","OpcUa","129","UA Secure Conversation Message: PublishResponse"
"304","76.931905","127.0.0.1","127.0.0.1","TCP","44","54674  >  53530 [ACK] Seq=5635 Ack=25217 Win=40192 Len=0"
"305","76.946246","127.0.0.1","127.0.0.1","OpcUa","142","UA Secure Conversation Message: PublishRequest"
"306","76.946341","127.0.0.1","127.0.0.1","TCP","44","53530  >  54674 [ACK] Seq=25217 Ack=5733 Win=59648 Len=0"
"307","77.007908","127.0.0.1","127.0.0.1","OpcUa","208","UA Secure Conversation Message: ReadRequest"
"308","77.008026","127.0.0.1","127.0.0.1","TCP","44","53530  >  54674 [ACK] Seq=25217 Ack=5897 Win=59392 Len=0"
"309","77.010643","127.0.0.1","127.0.0.1","OpcUa","143","UA Secure Conversation Message: ReadResponse"
"310","77.010709","127.0.0.1","127.0.0.1","TCP","44","54674  >  53530 [ACK] Seq=5897 Ack=25316 Win=40192 Len=0"
"311","77.086584","::1","::1","TLSv1.2","89","Application Data"
"312","77.086727","::1","::1","TCP","64","64964  >  8900 [ACK] Seq=88 Ack=101 Win=226 Len=0"
"313","77.087944","::1","::1","TLSv1.2","93","Application Data"
"314","77.088049","::1","::1","TCP","64","8900  >  64964 [ACK] Seq=101 Ack=117 Win=195 Len=0"
"315","81.469685","127.0.0.1","127.0.0.1","OpcUa","197","UA Secure Conversation Message: BrowseRequest"
"316","81.469789","127.0.0.1","127.0.0.1","TCP","44","53530  >  54674 [ACK] Seq=25316 Ack=6050 Win=59392 Len=0"
"317","81.473102","127.0.0.1","127.0.0.1","OpcUa","246","UA Secure Conversation Message: BrowseResponse"
"318","81.473173","127.0.0.1","127.0.0.1","TCP","44","54674  >  53530 [ACK] Seq=6050 Ack=25518 Win=39936 Len=0"
"319","81.932581","127.0.0.1","127.0.0.1","OpcUa","129","UA Secure Conversation Message: PublishResponse"
"320","81.932691","127.0.0.1","127.0.0.1","TCP","44","54674  >  53530 [ACK] Seq=6050 Ack=25603 Win=39680 Len=0"
"321","81.946986","127.0.0.1","127.0.0.1","OpcUa","142","UA Secure Conversation Message: PublishRequest"
"322","81.947079","127.0.0.1","127.0.0.1","TCP","44","53530  >  54674 [ACK] Seq=25603 Ack=6148 Win=59136 Len=0"
"323","82.024788","127.0.0.1","127.0.0.1","OpcUa","208","UA Secure Conversation Message: ReadRequest"
"324","82.024887","127.0.0.1","127.0.0.1","TCP","44","53530  >  54674 [ACK] Seq=25603 Ack=6312 Win=59136 Len=0"
"325","82.026746","127.0.0.1","127.0.0.1","OpcUa","143","UA Secure Conversation Message: ReadResponse"
"326","82.026875","127.0.0.1","127.0.0.1","TCP","44","54674  >  53530 [ACK] Seq=6312 Ack=25702 Win=39680 Len=0"
"327","84.357957","127.0.0.1","127.0.0.1","OpcUa","197","UA Secure Conversation Message: BrowseRequest"
"328","84.358034","127.0.0.1","127.0.0.1","TCP","44","53530  >  54674 [ACK] Seq=25702 Ack=6465 Win=58880 Len=0"
"329","84.360556","127.0.0.1","127.0.0.1","OpcUa","488","UA Secure Conversation Message: BrowseResponse"
"330","84.360657","127.0.0.1","127.0.0.1","TCP","44","54674  >  53530 [ACK] Seq=6465 Ack=26146 Win=39168 Len=0"
"331","85.976107","127.0.0.1","127.0.0.1","OpcUa","192","UA Secure Conversation Message: BrowseRequest"
"332","85.976188","127.0.0.1","127.0.0.1","TCP","44","53530  >  54674 [ACK] Seq=26146 Ack=6613 Win=58880 Len=0"
"333","85.979322","127.0.0.1","127.0.0.1","OpcUa","794","UA Secure Conversation Message: BrowseResponse"
"334","85.979428","127.0.0.1","127.0.0.1","TCP","44","54674  >  53530 [ACK] Seq=6613 Ack=26896 Win=38400 Len=0"
"335","86.923951","127.0.0.1","127.0.0.1","OpcUa","129","UA Secure Conversation Message: PublishResponse"
"336","86.924035","127.0.0.1","127.0.0.1","TCP","44","54674  >  53530 [ACK] Seq=6613 Ack=26981 Win=38400 Len=0"
"337","86.938041","127.0.0.1","127.0.0.1","OpcUa","142","UA Secure Conversation Message: PublishRequest"
"338","86.938144","127.0.0.1","127.0.0.1","TCP","44","53530  >  54674 [ACK] Seq=26981 Ack=6711 Win=58624 Len=0"
"339","87.030818","127.0.0.1","127.0.0.1","OpcUa","208","UA Secure Conversation Message: ReadRequest"
"340","87.030942","127.0.0.1","127.0.0.1","TCP","44","53530  >  54674 [ACK] Seq=26981 Ack=6875 Win=58624 Len=0"
"341","87.033674","127.0.0.1","127.0.0.1","OpcUa","143","UA Secure Conversation Message: ReadResponse"
"342","87.033767","127.0.0.1","127.0.0.1","TCP","44","54674  >  53530 [ACK] Seq=6875 Ack=27080 Win=38400 Len=0"
"343","87.703794","127.0.0.1","127.0.0.1","OpcUa","194","UA Secure Conversation Message: BrowseRequest"
"344","87.703874","127.0.0.1","127.0.0.1","TCP","44","53530  >  54674 [ACK] Seq=27080 Ack=7025 Win=58368 Len=0"
"345","87.705636","127.0.0.1","127.0.0.1","OpcUa","714","UA Secure Conversation Message: BrowseResponse"
"346","87.705726","127.0.0.1","127.0.0.1","TCP","44","54674  >  53530 [ACK] Seq=7025 Ack=27750 Win=37632 Len=0"
"347","87.706889","127.0.0.1","127.0.0.1","OpcUa","314","UA Secure Conversation Message: ReadRequest"
"348","87.706948","127.0.0.1","127.0.0.1","TCP","44","53530  >  54674 [ACK] Seq=27750 Ack=7295 Win=58112 Len=0"
"349","87.709636","127.0.0.1","127.0.0.1","OpcUa","200","UA Secure Conversation Message: ReadResponse"
"350","87.709704","127.0.0.1","127.0.0.1","TCP","44","54674  >  53530 [ACK] Seq=7295 Ack=27906 Win=37376 Len=0"
"351","87.710027","127.0.0.1","127.0.0.1","OpcUa","177","UA Secure Conversation Message: BrowseRequest"
"352","87.710072","127.0.0.1","127.0.0.1","TCP","44","53530  >  54674 [ACK] Seq=27906 Ack=7428 Win=57856 Len=0"
"353","87.711988","127.0.0.1","127.0.0.1","OpcUa","142","UA Secure Conversation Message: BrowseResponse"
"354","87.712056","127.0.0.1","127.0.0.1","TCP","44","54674  >  53530 [ACK] Seq=7428 Ack=28004 Win=37376 Len=0"
"355","87.712354","127.0.0.1","127.0.0.1","OpcUa","314","UA Secure Conversation Message: ReadRequest"
"356","87.712405","127.0.0.1","127.0.0.1","TCP","44","53530  >  54674 [ACK] Seq=28004 Ack=7698 Win=57600 Len=0"
"357","87.714751","127.0.0.1","127.0.0.1","OpcUa","197","UA Secure Conversation Message: ReadResponse"
"358","87.714840","127.0.0.1","127.0.0.1","TCP","44","54674  >  53530 [ACK] Seq=7698 Ack=28157 Win=37376 Len=0"
"359","87.715343","127.0.0.1","127.0.0.1","OpcUa","177","UA Secure Conversation Message: BrowseRequest"
"360","87.715432","127.0.0.1","127.0.0.1","TCP","44","53530  >  54674 [ACK] Seq=28157 Ack=7831 Win=57600 Len=0"
"361","87.717995","127.0.0.1","127.0.0.1","OpcUa","142","UA Secure Conversation Message: BrowseResponse"
"362","87.718107","127.0.0.1","127.0.0.1","TCP","44","54674  >  53530 [ACK] Seq=7831 Ack=28255 Win=37120 Len=0"
"363","87.718490","127.0.0.1","127.0.0.1","OpcUa","314","UA Secure Conversation Message: ReadRequest"
"364","87.718565","127.0.0.1","127.0.0.1","TCP","44","53530  >  54674 [ACK] Seq=28255 Ack=8101 Win=57344 Len=0"
"365","87.721140","127.0.0.1","127.0.0.1","OpcUa","188","UA Secure Conversation Message: ReadResponse"
"366","87.721231","127.0.0.1","127.0.0.1","TCP","44","54674  >  53530 [ACK] Seq=8101 Ack=28399 Win=37120 Len=0"
"367","87.721538","127.0.0.1","127.0.0.1","OpcUa","177","UA Secure Conversation Message: BrowseRequest"
"368","87.721579","127.0.0.1","127.0.0.1","TCP","44","53530  >  54674 [ACK] Seq=28399 Ack=8234 Win=57088 Len=0"
"369","87.723620","127.0.0.1","127.0.0.1","OpcUa","142","UA Secure Conversation Message: BrowseResponse"
"370","87.723702","127.0.0.1","127.0.0.1","TCP","44","54674  >  53530 [ACK] Seq=8234 Ack=28497 Win=36864 Len=0"
"371","90.070404","127.0.0.1","127.0.0.1","UDP","1464","54217  >  5093 Len=1432"
"372","90.125939","127.0.0.1","127.0.0.1","UDP","1464","5093  >  54217 Len=1432"
"373","90.130186","127.0.0.1","127.0.0.1","UDP","1464","54217  >  5093 Len=1432"
"374","90.130701","127.0.0.1","127.0.0.1","UDP","1464","5093  >  54217 Len=1432"
"375","90.132106","127.0.0.1","127.0.0.1","UDP","1464","54217  >  5093 Len=1432"
"376","90.132404","127.0.0.1","127.0.0.1","UDP","1464","5093  >  54217 Len=1432"
"377","90.133791","127.0.0.1","127.0.0.1","UDP","1464","54217  >  5093 Len=1432"
"378","90.134127","127.0.0.1","127.0.0.1","UDP","1464","5093  >  54217 Len=1432"
"379","91.926473","127.0.0.1","127.0.0.1","OpcUa","129","UA Secure Conversation Message: PublishResponse"
"380","91.926551","127.0.0.1","127.0.0.1","TCP","44","54674  >  53530 [ACK] Seq=8234 Ack=28582 Win=36864 Len=0"
"381","91.940757","127.0.0.1","127.0.0.1","OpcUa","142","UA Secure Conversation Message: PublishRequest"
"382","91.940862","127.0.0.1","127.0.0.1","TCP","44","53530  >  54674 [ACK] Seq=28582 Ack=8332 Win=57088 Len=0"
"383","92.034274","127.0.0.1","127.0.0.1","OpcUa","208","UA Secure Conversation Message: ReadRequest"
"384","92.034385","127.0.0.1","127.0.0.1","TCP","44","53530  >  54674 [ACK] Seq=28582 Ack=8496 Win=56832 Len=0"
"385","92.036925","127.0.0.1","127.0.0.1","OpcUa","143","UA Secure Conversation Message: ReadResponse"
"386","92.037097","127.0.0.1","127.0.0.1","TCP","44","54674  >  53530 [ACK] Seq=8496 Ack=28681 Win=36608 Len=0"
"387","93.087516","127.0.0.1","127.0.0.1","OpcUa","198","UA Secure Conversation Message: BrowseRequest"
