"No.","Time","Source","Destination","Protocol","Length","Info"
"1","0.000000","127.0.0.1","127.0.0.1","OpcUa","270","UA Secure Conversation Message: PublishResponse"
"2","0.000048","127.0.0.1","127.0.0.1","TCP","44","61053  >  53530 [ACK] Seq=1 Ack=227 Win=238 Len=0"
"3","0.014611","127.0.0.1","127.0.0.1","OpcUa","150","UA Secure Conversation Message: PublishRequest"
"4","0.014656","127.0.0.1","127.0.0.1","TCP","44","53530  >  61053 [ACK] Seq=227 Ack=107 Win=205 Len=0"
"5","1.001839","127.0.0.1","127.0.0.1","OpcUa","270","UA Secure Conversation Message: PublishResponse"
"6","1.001886","127.0.0.1","127.0.0.1","TCP","44","61053  >  53530 [ACK] Seq=107 Ack=453 Win=238 Len=0"
"7","1.015933","127.0.0.1","127.0.0.1","OpcUa","150","UA Secure Conversation Message: PublishRequest"
"8","1.015994","127.0.0.1","127.0.0.1","TCP","44","53530  >  61053 [ACK] Seq=453 Ack=213 Win=204 Len=0"
"9","1.173714","127.0.0.1","127.0.0.1","OpcUa","133","UA Secure Conversation Message: PublishResponse"
"10","1.173769","127.0.0.1","127.0.0.1","TCP","44","61053  >  53530 [ACK] Seq=213 Ack=542 Win=237 Len=0"
"11","1.187680","127.0.0.1","127.0.0.1","OpcUa","142","UA Secure Conversation Message: PublishRequest"
"12","1.187756","127.0.0.1","127.0.0.1","TCP","44","53530  >  61053 [ACK] Seq=542 Ack=311 Win=204 Len=0"
"13","1.894468","127.0.0.1","127.0.0.1","OpcUa","208","UA Secure Conversation Message: ReadRequest"
"14","1.894541","127.0.0.1","127.0.0.1","TCP","44","53530  >  61053 [ACK] Seq=542 Ack=475 Win=203 Len=0"
"15","1.896695","127.0.0.1","127.0.0.1","OpcUa","143","UA Secure Conversation Message: ReadResponse"
"16","1.896743","127.0.0.1","127.0.0.1","TCP","44","61053  >  53530 [ACK] Seq=475 Ack=641 Win=237 Len=0"
"17","2.004503","127.0.0.1","127.0.0.1","OpcUa","270","UA Secure Conversation Message: PublishResponse"
"18","2.004565","127.0.0.1","127.0.0.1","TCP","44","61053  >  53530 [ACK] Seq=475 Ack=867 Win=236 Len=0"
"19","2.018894","127.0.0.1","127.0.0.1","OpcUa","150","UA Secure Conversation Message: PublishRequest"
"20","2.018981","127.0.0.1","127.0.0.1","TCP","44","53530  >  61053 [ACK] Seq=867 Ack=581 Win=203 Len=0"
"21","3.003482","127.0.0.1","127.0.0.1","OpcUa","270","UA Secure Conversation Message: PublishResponse"
"22","3.003540","127.0.0.1","127.0.0.1","TCP","44","61053  >  53530 [ACK] Seq=581 Ack=1093 Win=235 Len=0"
"23","3.018328","127.0.0.1","127.0.0.1","OpcUa","150","UA Secure Conversation Message: PublishRequest"
"24","3.018418","127.0.0.1","127.0.0.1","TCP","44","53530  >  61053 [ACK] Seq=1093 Ack=687 Win=202 Len=0"
"26","3.993355","127.0.0.1","127.0.0.1","OpcUa","266","UA Secure Conversation Message: PublishResponse"
"27","3.993398","127.0.0.1","127.0.0.1","TCP","44","61053  >  53530 [ACK] Seq=687 Ack=1315 Win=234 Len=0"
"28","4.001996","127.0.0.1","127.0.0.1","OpcUa","150","UA Secure Conversation Message: PublishRequest"
"29","4.002064","127.0.0.1","127.0.0.1","TCP","44","53530  >  61053 [ACK] Seq=1315 Ack=793 Win=202 Len=0"
"31","5.005348","127.0.0.1","127.0.0.1","OpcUa","270","UA Secure Conversation Message: PublishResponse"
"32","5.005394","127.0.0.1","127.0.0.1","TCP","44","61053  >  53530 [ACK] Seq=793 Ack=1541 Win=233 Len=0"
"33","5.019213","127.0.0.1","127.0.0.1","OpcUa","150","UA Secure Conversation Message: PublishRequest"
"34","5.019277","127.0.0.1","127.0.0.1","TCP","44","53530  >  61053 [ACK] Seq=1541 Ack=899 Win=202 Len=0"
"36","6.001925","127.0.0.1","127.0.0.1","OpcUa","270","UA Secure Conversation Message: PublishResponse"
"37","6.001992","127.0.0.1","127.0.0.1","TCP","44","61053  >  53530 [ACK] Seq=899 Ack=1767 Win=232 Len=0"
"38","6.015661","127.0.0.1","127.0.0.1","OpcUa","150","UA Secure Conversation Message: PublishRequest"
"39","6.015730","127.0.0.1","127.0.0.1","TCP","44","53530  >  61053 [ACK] Seq=1767 Ack=1005 Win=201 Len=0"
"40","6.173960","127.0.0.1","127.0.0.1","OpcUa","133","UA Secure Conversation Message: PublishResponse"
"41","6.174038","127.0.0.1","127.0.0.1","TCP","44","61053  >  53530 [ACK] Seq=1005 Ack=1856 Win=232 Len=0"
"42","6.184831","127.0.0.1","127.0.0.1","OpcUa","142","UA Secure Conversation Message: PublishRequest"
"43","6.184909","127.0.0.1","127.0.0.1","TCP","44","53530  >  61053 [ACK] Seq=1856 Ack=1103 Win=201 Len=0"
"44","6.905493","127.0.0.1","127.0.0.1","OpcUa","208","UA Secure Conversation Message: ReadRequest"
"45","6.905553","127.0.0.1","127.0.0.1","TCP","44","53530  >  61053 [ACK] Seq=1856 Ack=1267 Win=200 Len=0"
"46","6.907443","127.0.0.1","127.0.0.1","OpcUa","143","UA Secure Conversation Message: ReadResponse"
"47","6.907485","127.0.0.1","127.0.0.1","TCP","44","61053  >  53530 [ACK] Seq=1267 Ack=1955 Win=232 Len=0"
"48","7.001713","127.0.0.1","127.0.0.1","OpcUa","270","UA Secure Conversation Message: PublishResponse"
"49","7.001779","127.0.0.1","127.0.0.1","TCP","44","61053  >  53530 [ACK] Seq=1267 Ack=2181 Win=231 Len=0"
"50","7.015778","127.0.0.1","127.0.0.1","OpcUa","150","UA Secure Conversation Message: PublishRequest"
"51","7.015865","127.0.0.1","127.0.0.1","TCP","44","53530  >  61053 [ACK] Seq=2181 Ack=1373 Win=200 Len=0"
"56","8.002133","127.0.0.1","127.0.0.1","OpcUa","270","UA Secure Conversation Message: PublishResponse"
"57","8.002186","127.0.0.1","127.0.0.1","TCP","44","61053  >  53530 [ACK] Seq=1373 Ack=2407 Win=230 Len=0"
"58","8.015968","127.0.0.1","127.0.0.1","OpcUa","150","UA Secure Conversation Message: PublishRequest"
"59","8.016052","127.0.0.1","127.0.0.1","TCP","44","53530  >  61053 [ACK] Seq=2407 Ack=1479 Win=199 Len=0"
"60","8.695691","127.0.0.1","127.0.0.1","OpcUa","160","UA Secure Conversation Message: WriteRequest"
"61","8.695734","127.0.0.1","127.0.0.1","TCP","44","53530  >  61053 [ACK] Seq=2407 Ack=1595 Win=199 Len=0"
"62","8.697383","127.0.0.1","127.0.0.1","OpcUa","108","UA Secure Conversation Message: WriteResponse"
"63","8.697437","127.0.0.1","127.0.0.1","TCP","44","61053  >  53530 [ACK] Seq=1595 Ack=2471 Win=230 Len=0"
"64","9.000274","127.0.0.1","127.0.0.1","OpcUa","236","UA Secure Conversation Message: PublishResponse"
"65","9.000341","127.0.0.1","127.0.0.1","TCP","44","61053  >  53530 [ACK] Seq=1595 Ack=2663 Win=229 Len=0"
"66","9.014066","127.0.0.1","127.0.0.1","OpcUa","150","UA Secure Conversation Message: PublishRequest"
"67","9.014160","127.0.0.1","127.0.0.1","TCP","44","53530  >  61053 [ACK] Seq=2663 Ack=1701 Win=199 Len=0"
"68","10.003292","127.0.0.1","127.0.0.1","OpcUa","270","UA Secure Conversation Message: PublishResponse"
"69","10.003361","127.0.0.1","127.0.0.1","TCP","44","61053  >  53530 [ACK] Seq=1701 Ack=2889 Win=228 Len=0"
"70","10.016979","127.0.0.1","127.0.0.1","OpcUa","150","UA Secure Conversation Message: PublishRequest"
"71","10.017032","127.0.0.1","127.0.0.1","TCP","44","53530  >  61053 [ACK] Seq=2889 Ack=1807 Win=198 Len=0"
"72","10.808563","127.0.0.1","127.0.0.1","OpcUa","160","UA Secure Conversation Message: WriteRequest"
"73","10.808605","127.0.0.1","127.0.0.1","TCP","44","53530  >  61053 [ACK] Seq=2889 Ack=1923 Win=198 Len=0"
"74","10.810207","127.0.0.1","127.0.0.1","OpcUa","108","UA Secure Conversation Message: WriteResponse"
"75","10.810259","127.0.0.1","127.0.0.1","TCP","44","61053  >  53530 [ACK] Seq=1923 Ack=2953 Win=228 Len=0"
"78","11.008335","127.0.0.1","127.0.0.1","OpcUa","270","UA Secure Conversation Message: PublishResponse"
"79","11.008401","127.0.0.1","127.0.0.1","TCP","44","61053  >  53530 [ACK] Seq=1923 Ack=3179 Win=227 Len=0"
"80","11.022622","127.0.0.1","127.0.0.1","OpcUa","150","UA Secure Conversation Message: PublishRequest"
"81","11.022679","127.0.0.1","127.0.0.1","TCP","44","53530  >  61053 [ACK] Seq=3179 Ack=2029 Win=197 Len=0"
"82","11.180212","127.0.0.1","127.0.0.1","OpcUa","133","UA Secure Conversation Message: PublishResponse"
"83","11.180286","127.0.0.1","127.0.0.1","TCP","44","61053  >  53530 [ACK] Seq=2029 Ack=3268 Win=227 Len=0"
"84","11.193910","127.0.0.1","127.0.0.1","OpcUa","142","UA Secure Conversation Message: PublishRequest"
"85","11.193973","127.0.0.1","127.0.0.1","TCP","44","53530  >  61053 [ACK] Seq=3268 Ack=2127 Win=197 Len=0"
"86","11.913926","127.0.0.1","127.0.0.1","OpcUa","208","UA Secure Conversation Message: ReadRequest"
"87","11.913995","127.0.0.1","127.0.0.1","TCP","44","53530  >  61053 [ACK] Seq=3268 Ack=2291 Win=196 Len=0"
"88","11.915963","127.0.0.1","127.0.0.1","OpcUa","143","UA Secure Conversation Message: ReadResponse"
"89","11.916004","127.0.0.1","127.0.0.1","TCP","44","61053  >  53530 [ACK] Seq=2291 Ack=3367 Win=226 Len=0"
"90","11.994014","127.0.0.1","127.0.0.1","OpcUa","270","UA Secure Conversation Message: PublishResponse"
"91","11.994087","127.0.0.1","127.0.0.1","TCP","44","61053  >  53530 [ACK] Seq=2291 Ack=3593 Win=225 Len=0"
"92","12.007585","127.0.0.1","127.0.0.1","OpcUa","150","UA Secure Conversation Message: PublishRequest"
"93","12.007675","127.0.0.1","127.0.0.1","TCP","44","53530  >  61053 [ACK] Seq=3593 Ack=2397 Win=196 Len=0"
"94","12.359704","127.0.0.1","127.0.0.1","OpcUa","160","UA Secure Conversation Message: WriteRequest"
"95","12.359756","127.0.0.1","127.0.0.1","TCP","44","53530  >  61053 [ACK] Seq=3593 Ack=2513 Win=195 Len=0"
"96","12.361362","127.0.0.1","127.0.0.1","OpcUa","108","UA Secure Conversation Message: WriteResponse"
"97","12.361407","127.0.0.1","127.0.0.1","TCP","44","61053  >  53530 [ACK] Seq=2513 Ack=3657 Win=225 Len=0"
"98","12.994139","127.0.0.1","127.0.0.1","OpcUa","270","UA Secure Conversation Message: PublishResponse"
"99","12.994209","127.0.0.1","127.0.0.1","TCP","44","61053  >  53530 [ACK] Seq=2513 Ack=3883 Win=224 Len=0"
"100","13.007991","127.0.0.1","127.0.0.1","OpcUa","150","UA Secure Conversation Message: PublishRequest"
"101","13.008072","127.0.0.1","127.0.0.1","TCP","44","53530  >  61053 [ACK] Seq=3883 Ack=2619 Win=195 Len=0"
"102","13.994043","127.0.0.1","127.0.0.1","OpcUa","266","UA Secure Conversation Message: PublishResponse"
"103","13.994105","127.0.0.1","127.0.0.1","TCP","44","61053  >  53530 [ACK] Seq=2619 Ack=4105 Win=223 Len=0"
"104","14.007982","127.0.0.1","127.0.0.1","OpcUa","150","UA Secure Conversation Message: PublishRequest"
"105","14.008105","127.0.0.1","127.0.0.1","TCP","44","53530  >  61053 [ACK] Seq=4105 Ack=2725 Win=195 Len=0"
"106","15.007045","127.0.0.1","127.0.0.1","OpcUa","270","UA Secure Conversation Message: PublishResponse"
"107","15.007117","127.0.0.1","127.0.0.1","TCP","44","61053  >  53530 [ACK] Seq=2725 Ack=4331 Win=222 Len=0"
"108","15.020951","127.0.0.1","127.0.0.1","OpcUa","150","UA Secure Conversation Message: PublishRequest"
"109","15.021031","127.0.0.1","127.0.0.1","TCP","44","53530  >  61053 [ACK] Seq=4331 Ack=2831 Win=194 Len=0"
"110","15.994550","127.0.0.1","127.0.0.1","OpcUa","270","UA Secure Conversation Message: PublishResponse"
"111","15.994617","127.0.0.1","127.0.0.1","TCP","44","61053  >  53530 [ACK] Seq=2831 Ack=4557 Win=222 Len=0"
"112","16.007983","127.0.0.1","127.0.0.1","OpcUa","150","UA Secure Conversation Message: PublishRequest"
"113","16.008054","127.0.0.1","127.0.0.1","TCP","44","53530  >  61053 [ACK] Seq=4557 Ack=2937 Win=194 Len=0"
"114","16.180300","127.0.0.1","127.0.0.1","OpcUa","133","UA Secure Conversation Message: PublishResponse"
"115","16.180367","127.0.0.1","127.0.0.1","TCP","44","61053  >  53530 [ACK] Seq=2937 Ack=4646 Win=221 Len=0"
"116","16.194611","127.0.0.1","127.0.0.1","OpcUa","142","UA Secure Conversation Message: PublishRequest"
"117","16.194685","127.0.0.1","127.0.0.1","TCP","44","53530  >  61053 [ACK] Seq=4646 Ack=3035 Win=193 Len=0"
"118","16.872847","127.0.0.1","127.0.0.1","OpcUa","164","UA Secure Conversation Message: WriteRequest"
"119","16.872900","127.0.0.1","127.0.0.1","TCP","44","53530  >  61053 [ACK] Seq=4646 Ack=3155 Win=193 Len=0"
"120","16.874266","127.0.0.1","127.0.0.1","OpcUa","108","UA Secure Conversation Message: WriteResponse"
"121","16.874316","127.0.0.1","127.0.0.1","TCP","44","61053  >  53530 [ACK] Seq=3155 Ack=4710 Win=221 Len=0"
"122","16.927275","127.0.0.1","127.0.0.1","OpcUa","208","UA Secure Conversation Message: ReadRequest"
"123","16.927364","127.0.0.1","127.0.0.1","TCP","44","53530  >  61053 [ACK] Seq=4710 Ack=3319 Win=192 Len=0"
"124","16.929036","127.0.0.1","127.0.0.1","OpcUa","143","UA Secure Conversation Message: ReadResponse"
"125","16.929115","127.0.0.1","127.0.0.1","TCP","44","61053  >  53530 [ACK] Seq=3319 Ack=4809 Win=221 Len=0"
"126","17.006938","127.0.0.1","127.0.0.1","OpcUa","270","UA Secure Conversation Message: PublishResponse"
"127","17.006976","127.0.0.1","127.0.0.1","TCP","44","61053  >  53530 [ACK] Seq=3319 Ack=5035 Win=220 Len=0"
"128","17.021893","127.0.0.1","127.0.0.1","OpcUa","150","UA Secure Conversation Message: PublishRequest"
"129","17.021979","127.0.0.1","127.0.0.1","TCP","44","53530  >  61053 [ACK] Seq=5035 Ack=3425 Win=192 Len=0"
"130","18.006837","127.0.0.1","127.0.0.1","OpcUa","270","UA Secure Conversation Message: PublishResponse"
"131","18.006906","127.0.0.1","127.0.0.1","TCP","44","61053  >  53530 [ACK] Seq=3425 Ack=5261 Win=219 Len=0"
"132","18.020818","127.0.0.1","127.0.0.1","OpcUa","150","UA Secure Conversation Message: PublishRequest"
"133","18.020908","127.0.0.1","127.0.0.1","TCP","44","53530  >  61053 [ACK] Seq=5261 Ack=3531 Win=191 Len=0"
"134","19.006776","127.0.0.1","127.0.0.1","OpcUa","266","UA Secure Conversation Message: PublishResponse"
"135","19.006835","127.0.0.1","127.0.0.1","TCP","44","61053  >  53530 [ACK] Seq=3531 Ack=5483 Win=218 Len=0"
"136","19.021371","127.0.0.1","127.0.0.1","OpcUa","150","UA Secure Conversation Message: PublishRequest"
"137","19.021452","127.0.0.1","127.0.0.1","TCP","44","53530  >  61053 [ACK] Seq=5483 Ack=3637 Win=191 Len=0"
"138","20.006700","127.0.0.1","127.0.0.1","OpcUa","270","UA Secure Conversation Message: PublishResponse"
"139","20.006764","127.0.0.1","127.0.0.1","TCP","44","61053  >  53530 [ACK] Seq=3637 Ack=5709 Win=217 Len=0"
"140","20.021327","127.0.0.1","127.0.0.1","OpcUa","150","UA Secure Conversation Message: PublishRequest"
"141","20.021394","127.0.0.1","127.0.0.1","TCP","44","53530  >  61053 [ACK] Seq=5709 Ack=3743 Win=191 Len=0"
"142","21.006640","127.0.0.1","127.0.0.1","OpcUa","270","UA Secure Conversation Message: PublishResponse"
"143","21.006683","127.0.0.1","127.0.0.1","TCP","44","61053  >  53530 [ACK] Seq=3743 Ack=5935 Win=216 Len=0"
"144","21.021824","127.0.0.1","127.0.0.1","OpcUa","150","UA Secure Conversation Message: PublishRequest"
"145","21.021905","127.0.0.1","127.0.0.1","TCP","44","53530  >  61053 [ACK] Seq=5935 Ack=3849 Win=190 Len=0"
"146","21.178716","127.0.0.1","127.0.0.1","OpcUa","133","UA Secure Conversation Message: PublishResponse"
"147","21.178759","127.0.0.1","127.0.0.1","TCP","44","61053  >  53530 [ACK] Seq=3849 Ack=6024 Win=216 Len=0"
"148","21.193340","127.0.0.1","127.0.0.1","OpcUa","142","UA Secure Conversation Message: PublishRequest"
"149","21.193427","127.0.0.1","127.0.0.1","TCP","44","53530  >  61053 [ACK] Seq=6024 Ack=3947 Win=190 Len=0"
"150","21.931360","127.0.0.1","127.0.0.1","OpcUa","208","UA Secure Conversation Message: ReadRequest"
"151","21.931626","127.0.0.1","127.0.0.1","TCP","44","53530  >  61053 [ACK] Seq=6024 Ack=4111 Win=189 Len=0"
"152","21.940677","127.0.0.1","127.0.0.1","OpcUa","143","UA Secure Conversation Message: ReadResponse"
"153","21.940882","127.0.0.1","127.0.0.1","TCP","44","61053  >  53530 [ACK] Seq=4111 Ack=6123 Win=215 Len=0"
"154","22.000313","127.0.0.1","127.0.0.1","OpcUa","270","UA Secure Conversation Message: PublishResponse"
"155","22.000535","127.0.0.1","127.0.0.1","TCP","44","61053  >  53530 [ACK] Seq=4111 Ack=6349 Win=215 Len=0"
"156","22.010097","127.0.0.1","127.0.0.1","OpcUa","150","UA Secure Conversation Message: PublishRequest"
"157","22.010345","127.0.0.1","127.0.0.1","TCP","44","53530  >  61053 [ACK] Seq=6349 Ack=4217 Win=189 Len=0"
"158","22.809741","127.0.0.1","127.0.0.1","OpcUa","164","UA Secure Conversation Message: WriteRequest"
"159","22.810002","127.0.0.1","127.0.0.1","TCP","44","53530  >  61053 [ACK] Seq=6349 Ack=4337 Win=188 Len=0"
"160","22.821545","127.0.0.1","127.0.0.1","OpcUa","108","UA Secure Conversation Message: WriteResponse"
"161","22.821814","127.0.0.1","127.0.0.1","TCP","44","61053  >  53530 [ACK] Seq=4337 Ack=6413 Win=214 Len=0"
"162","23.008614","127.0.0.1","127.0.0.1","OpcUa","270","UA Secure Conversation Message: PublishResponse"
"163","23.008849","127.0.0.1","127.0.0.1","TCP","44","61053  >  53530 [ACK] Seq=4337 Ack=6639 Win=213 Len=0"
"164","23.018558","127.0.0.1","127.0.0.1","OpcUa","150","UA Secure Conversation Message: PublishRequest"
"165","23.018823","127.0.0.1","127.0.0.1","TCP","44","53530  >  61053 [ACK] Seq=6639 Ack=4443 Win=188 Len=0"
"166","24.009931","127.0.0.1","127.0.0.1","OpcUa","236","UA Secure Conversation Message: PublishResponse"
"167","24.010189","127.0.0.1","127.0.0.1","TCP","44","61053  >  53530 [ACK] Seq=4443 Ack=6831 Win=213 Len=0"
"168","24.019941","127.0.0.1","127.0.0.1","OpcUa","150","UA Secure Conversation Message: PublishRequest"
"169","24.020167","127.0.0.1","127.0.0.1","TCP","44","53530  >  61053 [ACK] Seq=6831 Ack=4549 Win=187 Len=0"
"170","24.999008","127.0.0.1","127.0.0.1","OpcUa","270","UA Secure Conversation Message: PublishResponse"
"171","24.999077","127.0.0.1","127.0.0.1","TCP","44","61053  >  53530 [ACK] Seq=4549 Ack=7057 Win=212 Len=0"
"172","25.012843","127.0.0.1","127.0.0.1","OpcUa","150","UA Secure Conversation Message: PublishRequest"
"173","25.012935","127.0.0.1","127.0.0.1","TCP","44","53530  >  61053 [ACK] Seq=7057 Ack=4655 Win=187 Len=0"
"174","25.997416","127.0.0.1","127.0.0.1","OpcUa","270","UA Secure Conversation Message: PublishResponse"
"175","25.997476","127.0.0.1","127.0.0.1","TCP","44","61053  >  53530 [ACK] Seq=4655 Ack=7283 Win=211 Len=0"
"176","26.011448","127.0.0.1","127.0.0.1","OpcUa","150","UA Secure Conversation Message: PublishRequest"
"177","26.011532","127.0.0.1","127.0.0.1","TCP","44","53530  >  61053 [ACK] Seq=7283 Ack=4761 Win=187 Len=0"
"178","26.167949","127.0.0.1","127.0.0.1","OpcUa","133","UA Secure Conversation Message: PublishResponse"
"179","26.168030","127.0.0.1","127.0.0.1","TCP","44","61053  >  53530 [ACK] Seq=4761 Ack=7372 Win=211 Len=0"
"180","26.182276","127.0.0.1","127.0.0.1","OpcUa","142","UA Secure Conversation Message: PublishRequest"
"181","26.182354","127.0.0.1","127.0.0.1","TCP","44","53530  >  61053 [ACK] Seq=7372 Ack=4859 Win=186 Len=0"
"182","26.947707","127.0.0.1","127.0.0.1","OpcUa","208","UA Secure Conversation Message: ReadRequest"
"183","26.947779","127.0.0.1","127.0.0.1","TCP","44","53530  >  61053 [ACK] Seq=7372 Ack=5023 Win=186 Len=0"
"184","26.949766","127.0.0.1","127.0.0.1","OpcUa","143","UA Secure Conversation Message: ReadResponse"
"185","26.949807","127.0.0.1","127.0.0.1","TCP","44","61053  >  53530 [ACK] Seq=5023 Ack=7471 Win=210 Len=0"
"186","26.995383","127.0.0.1","127.0.0.1","OpcUa","270","UA Secure Conversation Message: PublishResponse"
"187","26.995429","127.0.0.1","127.0.0.1","TCP","44","61053  >  53530 [ACK] Seq=5023 Ack=7697 Win=209 Len=0"
"188","27.010295","127.0.0.1","127.0.0.1","OpcUa","150","UA Secure Conversation Message: PublishRequest"
"189","27.010392","127.0.0.1","127.0.0.1","TCP","44","53530  >  61053 [ACK] Seq=7697 Ack=5129 Win=185 Len=0"
"190","27.719537","127.0.0.1","127.0.0.1","OpcUa","164","UA Secure Conversation Message: WriteRequest"
"191","27.719579","127.0.0.1","127.0.0.1","TCP","44","53530  >  61053 [ACK] Seq=7697 Ack=5249 Win=185 Len=0"
"192","27.721150","127.0.0.1","127.0.0.1","OpcUa","108","UA Secure Conversation Message: WriteResponse"
"193","27.721196","127.0.0.1","127.0.0.1","TCP","44","61053  >  53530 [ACK] Seq=5249 Ack=7761 Win=209 Len=0"
"194","27.993979","127.0.0.1","127.0.0.1","OpcUa","270","UA Secure Conversation Message: PublishResponse"
"195","27.994039","127.0.0.1","127.0.0.1","TCP","44","61053  >  53530 [ACK] Seq=5249 Ack=7987 Win=208 Len=0"
"196","28.008714","127.0.0.1","127.0.0.1","OpcUa","150","UA Secure Conversation Message: PublishRequest"
"197","28.008796","127.0.0.1","127.0.0.1","TCP","44","53530  >  61053 [ACK] Seq=7987 Ack=5355 Win=184 Len=0"
"198","28.994481","127.0.0.1","127.0.0.1","OpcUa","266","UA Secure Conversation Message: PublishResponse"
"199","28.994538","127.0.0.1","127.0.0.1","TCP","44","61053  >  53530 [ACK] Seq=5355 Ack=8209 Win=207 Len=0"
"200","29.008866","127.0.0.1","127.0.0.1","OpcUa","150","UA Secure Conversation Message: PublishRequest"
"201","29.008949","127.0.0.1","127.0.0.1","TCP","44","53530  >  61053 [ACK] Seq=8209 Ack=5461 Win=184 Len=0"
"202","29.996553","127.0.0.1","127.0.0.1","OpcUa","270","UA Secure Conversation Message: PublishResponse"
"203","29.996607","127.0.0.1","127.0.0.1","TCP","44","61053  >  53530 [ACK] Seq=5461 Ack=8435 Win=206 Len=0"
"204","30.010774","127.0.0.1","127.0.0.1","OpcUa","150","UA Secure Conversation Message: PublishRequest"
"205","30.010847","127.0.0.1","127.0.0.1","TCP","44","53530  >  61053 [ACK] Seq=8435 Ack=5567 Win=183 Len=0"
"206","30.994290","127.0.0.1","127.0.0.1","OpcUa","270","UA Secure Conversation Message: PublishResponse"
"207","30.994347","127.0.0.1","127.0.0.1","TCP","44","61053  >  53530 [ACK] Seq=5567 Ack=8661 Win=206 Len=0"
"208","31.008821","127.0.0.1","127.0.0.1","OpcUa","150","UA Secure Conversation Message: PublishRequest"
"209","31.008888","127.0.0.1","127.0.0.1","TCP","44","53530  >  61053 [ACK] Seq=8661 Ack=5673 Win=183 Len=0"
"210","31.166584","127.0.0.1","127.0.0.1","OpcUa","133","UA Secure Conversation Message: PublishResponse"
"211","31.166673","127.0.0.1","127.0.0.1","TCP","44","61053  >  53530 [ACK] Seq=5673 Ack=8750 Win=205 Len=0"
"212","31.180940","127.0.0.1","127.0.0.1","OpcUa","142","UA Secure Conversation Message: PublishRequest"
"213","31.181030","127.0.0.1","127.0.0.1","TCP","44","53530  >  61053 [ACK] Seq=8750 Ack=5771 Win=183 Len=0"
"214","31.960251","127.0.0.1","127.0.0.1","OpcUa","208","UA Secure Conversation Message: ReadRequest"
"215","31.960336","127.0.0.1","127.0.0.1","TCP","44","53530  >  61053 [ACK] Seq=8750 Ack=5935 Win=182 Len=0"
"216","31.962564","127.0.0.1","127.0.0.1","OpcUa","143","UA Secure Conversation Message: ReadResponse"
"217","31.962622","127.0.0.1","127.0.0.1","TCP","44","61053  >  53530 [ACK] Seq=5935 Ack=8849 Win=205 Len=0"
"218","31.993588","127.0.0.1","127.0.0.1","OpcUa","270","UA Secure Conversation Message: PublishResponse"
"219","31.993651","127.0.0.1","127.0.0.1","TCP","44","61053  >  53530 [ACK] Seq=5935 Ack=9075 Win=204 Len=0"
"220","32.007802","127.0.0.1","127.0.0.1","OpcUa","150","UA Secure Conversation Message: PublishRequest"
"221","32.007891","127.0.0.1","127.0.0.1","TCP","44","53530  >  61053 [ACK] Seq=9075 Ack=6041 Win=182 Len=0"
"222","33.007117","127.0.0.1","127.0.0.1","OpcUa","270","UA Secure Conversation Message: PublishResponse"
"223","33.007159","127.0.0.1","127.0.0.1","TCP","44","61053  >  53530 [ACK] Seq=6041 Ack=9301 Win=203 Len=0"
"224","33.022227","127.0.0.1","127.0.0.1","OpcUa","150","UA Secure Conversation Message: PublishRequest"
"225","33.022331","127.0.0.1","127.0.0.1","TCP","44","53530  >  61053 [ACK] Seq=9301 Ack=6147 Win=181 Len=0"
"226","34.007258","127.0.0.1","127.0.0.1","OpcUa","266","UA Secure Conversation Message: PublishResponse"
"227","34.007330","127.0.0.1","127.0.0.1","TCP","44","61053  >  53530 [ACK] Seq=6147 Ack=9523 Win=202 Len=0"
"228","34.022073","127.0.0.1","127.0.0.1","OpcUa","150","UA Secure Conversation Message: PublishRequest"
"229","34.022150","127.0.0.1","127.0.0.1","TCP","44","53530  >  61053 [ACK] Seq=9523 Ack=6253 Win=181 Len=0"
"230","34.483670","127.0.0.1","127.0.0.1","OpcUa","164","UA Secure Conversation Message: WriteRequest"
"231","34.483712","127.0.0.1","127.0.0.1","TCP","44","53530  >  61053 [ACK] Seq=9523 Ack=6373 Win=180 Len=0"
"232","34.485318","127.0.0.1","127.0.0.1","OpcUa","108","UA Secure Conversation Message: WriteResponse"
"233","34.485366","127.0.0.1","127.0.0.1","TCP","44","61053  >  53530 [ACK] Seq=6373 Ack=9587 Win=202 Len=0"
"234","35.006873","127.0.0.1","127.0.0.1","OpcUa","270","UA Secure Conversation Message: PublishResponse"
"235","35.006944","127.0.0.1","127.0.0.1","TCP","44","61053  >  53530 [ACK] Seq=6373 Ack=9813 Win=201 Len=0"
"236","35.021367","127.0.0.1","127.0.0.1","OpcUa","150","UA Secure Conversation Message: PublishRequest"
"237","35.021479","127.0.0.1","127.0.0.1","TCP","44","53530  >  61053 [ACK] Seq=9813 Ack=6479 Win=180 Len=0"
"238","36.007105","127.0.0.1","127.0.0.1","OpcUa","270","UA Secure Conversation Message: PublishResponse"
"239","36.007186","127.0.0.1","127.0.0.1","TCP","44","61053  >  53530 [ACK] Seq=6479 Ack=10039 Win=200 Len=0"
"240","36.020926","127.0.0.1","127.0.0.1","OpcUa","150","UA Secure Conversation Message: PublishRequest"
"241","36.021001","127.0.0.1","127.0.0.1","TCP","44","53530  >  61053 [ACK] Seq=10039 Ack=6585 Win=179 Len=0"
"242","36.178054","127.0.0.1","127.0.0.1","OpcUa","133","UA Secure Conversation Message: PublishResponse"
"243","36.178119","127.0.0.1","127.0.0.1","TCP","44","61053  >  53530 [ACK] Seq=6585 Ack=10128 Win=200 Len=0"
"244","36.192394","127.0.0.1","127.0.0.1","OpcUa","142","UA Secure Conversation Message: PublishRequest"
"245","36.192474","127.0.0.1","127.0.0.1","TCP","44","53530  >  61053 [ACK] Seq=10128 Ack=6683 Win=179 Len=0"
"246","36.976013","127.0.0.1","127.0.0.1","OpcUa","208","UA Secure Conversation Message: ReadRequest"
"247","36.976086","127.0.0.1","127.0.0.1","TCP","44","53530  >  61053 [ACK] Seq=10128 Ack=6847 Win=178 Len=0"
"248","36.977925","127.0.0.1","127.0.0.1","OpcUa","143","UA Secure Conversation Message: ReadResponse"
"249","36.977988","127.0.0.1","127.0.0.1","TCP","44","61053  >  53530 [ACK] Seq=6847 Ack=10227 Win=199 Len=0"
"250","36.993252","127.0.0.1","127.0.0.1","OpcUa","270","UA Secure Conversation Message: PublishResponse"
"251","36.993321","127.0.0.1","127.0.0.1","TCP","44","61053  >  53530 [ACK] Seq=6847 Ack=10453 Win=199 Len=0"
"252","37.007197","127.0.0.1","127.0.0.1","OpcUa","150","UA Secure Conversation Message: PublishRequest"
"253","37.007265","127.0.0.1","127.0.0.1","TCP","44","53530  >  61053 [ACK] Seq=10453 Ack=6953 Win=178 Len=0"
"254","37.993242","127.0.0.1","127.0.0.1","OpcUa","270","UA Secure Conversation Message: PublishResponse"
"255","37.993302","127.0.0.1","127.0.0.1","TCP","44","61053  >  53530 [ACK] Seq=6953 Ack=10679 Win=198 Len=0"
"256","38.007350","127.0.0.1","127.0.0.1","OpcUa","150","UA Secure Conversation Message: PublishRequest"
"257","38.007525","127.0.0.1","127.0.0.1","TCP","44","53530  >  61053 [ACK] Seq=10679 Ack=7059 Win=178 Len=0"
"258","38.993522","127.0.0.1","127.0.0.1","OpcUa","236","UA Secure Conversation Message: PublishResponse"
"259","38.993567","127.0.0.1","127.0.0.1","TCP","44","61053  >  53530 [ACK] Seq=7059 Ack=10871 Win=197 Len=0"
"260","39.007598","127.0.0.1","127.0.0.1","OpcUa","150","UA Secure Conversation Message: PublishRequest"
"261","39.007668","127.0.0.1","127.0.0.1","TCP","44","53530  >  61053 [ACK] Seq=10871 Ack=7165 Win=177 Len=0"
"262","39.132995","127.0.0.1","127.0.0.1","OpcUa","164","UA Secure Conversation Message: WriteRequest"
"263","39.133040","127.0.0.1","127.0.0.1","TCP","44","53530  >  61053 [ACK] Seq=10871 Ack=7285 Win=177 Len=0"
"264","39.134857","127.0.0.1","127.0.0.1","OpcUa","108","UA Secure Conversation Message: WriteResponse"
"265","39.134905","127.0.0.1","127.0.0.1","TCP","44","61053  >  53530 [ACK] Seq=7285 Ack=10935 Win=197 Len=0"
"266","39.997056","127.0.0.1","127.0.0.1","OpcUa","270","UA Secure Conversation Message: PublishResponse"
"267","39.997117","127.0.0.1","127.0.0.1","TCP","44","61053  >  53530 [ACK] Seq=7285 Ack=11161 Win=196 Len=0"
"268","40.011090","127.0.0.1","127.0.0.1","OpcUa","150","UA Secure Conversation Message: PublishRequest"
"269","40.011172","127.0.0.1","127.0.0.1","TCP","44","53530  >  61053 [ACK] Seq=11161 Ack=7391 Win=176 Len=0"
"270","40.995130","127.0.0.1","127.0.0.1","OpcUa","270","UA Secure Conversation Message: PublishResponse"
"271","40.995187","127.0.0.1","127.0.0.1","TCP","44","61053  >  53530 [ACK] Seq=7391 Ack=11387 Win=195 Len=0"
"272","41.010207","127.0.0.1","127.0.0.1","OpcUa","150","UA Secure Conversation Message: PublishRequest"
"273","41.010260","127.0.0.1","127.0.0.1","TCP","44","53530  >  61053 [ACK] Seq=11387 Ack=7497 Win=176 Len=0"
"274","41.165738","127.0.0.1","127.0.0.1","OpcUa","133","UA Secure Conversation Message: PublishResponse"
"275","41.165787","127.0.0.1","127.0.0.1","TCP","44","61053  >  53530 [ACK] Seq=7497 Ack=11476 Win=195 Len=0"
"276","41.180415","127.0.0.1","127.0.0.1","OpcUa","142","UA Secure Conversation Message: PublishRequest"
"277","41.180516","127.0.0.1","127.0.0.1","TCP","44","53530  >  61053 [ACK] Seq=11476 Ack=7595 Win=175 Len=0"
"278","41.992430","127.0.0.1","127.0.0.1","OpcUa","208","UA Secure Conversation Message: ReadRequest"
"279","41.992510","127.0.0.1","127.0.0.1","TCP","44","53530  >  61053 [ACK] Seq=11476 Ack=7759 Win=175 Len=0"
"280","41.993459","127.0.0.1","127.0.0.1","OpcUa","270","UA Secure Conversation Message: PublishResponse"
"281","41.993538","127.0.0.1","127.0.0.1","TCP","44","61053  >  53530 [ACK] Seq=7759 Ack=11702 Win=194 Len=0"
"282","41.993937","127.0.0.1","127.0.0.1","OpcUa","143","UA Secure Conversation Message: ReadResponse"
"283","41.993979","127.0.0.1","127.0.0.1","TCP","44","61053  >  53530 [ACK] Seq=7759 Ack=11801 Win=193 Len=0"
"284","42.007893","127.0.0.1","127.0.0.1","OpcUa","150","UA Secure Conversation Message: PublishRequest"
"285","42.007952","127.0.0.1","127.0.0.1","TCP","44","53530  >  61053 [ACK] Seq=11801 Ack=7865 Win=174 Len=0"
"286","43.006545","127.0.0.1","127.0.0.1","OpcUa","270","UA Secure Conversation Message: PublishResponse"
"287","43.006595","127.0.0.1","127.0.0.1","TCP","44","61053  >  53530 [ACK] Seq=7865 Ack=12027 Win=192 Len=0"
"288","43.020846","127.0.0.1","127.0.0.1","OpcUa","150","UA Secure Conversation Message: PublishRequest"
"289","43.020909","127.0.0.1","127.0.0.1","TCP","44","53530  >  61053 [ACK] Seq=12027 Ack=7971 Win=174 Len=0"
"290","43.994375","127.0.0.1","127.0.0.1","OpcUa","266","UA Secure Conversation Message: PublishResponse"
"291","43.994467","127.0.0.1","127.0.0.1","TCP","44","61053  >  53530 [ACK] Seq=7971 Ack=12249 Win=192 Len=0"
"292","44.008425","127.0.0.1","127.0.0.1","OpcUa","150","UA Secure Conversation Message: PublishRequest"
"293","44.008532","127.0.0.1","127.0.0.1","TCP","44","53530  >  61053 [ACK] Seq=12249 Ack=8077 Win=174 Len=0"
"294","45.007457","127.0.0.1","127.0.0.1","OpcUa","270","UA Secure Conversation Message: PublishResponse"
"295","45.007546","127.0.0.1","127.0.0.1","TCP","44","61053  >  53530 [ACK] Seq=8077 Ack=12475 Win=191 Len=0"
"296","45.021468","127.0.0.1","127.0.0.1","OpcUa","150","UA Secure Conversation Message: PublishRequest"
"297","45.021548","127.0.0.1","127.0.0.1","TCP","44","53530  >  61053 [ACK] Seq=12475 Ack=8183 Win=173 Len=0"
"298","46.004085","127.0.0.1","127.0.0.1","OpcUa","270","UA Secure Conversation Message: PublishResponse"
"299","46.004130","127.0.0.1","127.0.0.1","TCP","44","61053  >  53530 [ACK] Seq=8183 Ack=12701 Win=190 Len=0"
"300","46.019341","127.0.0.1","127.0.0.1","OpcUa","150","UA Secure Conversation Message: PublishRequest"
"301","46.019388","127.0.0.1","127.0.0.1","TCP","44","53530  >  61053 [ACK] Seq=12701 Ack=8289 Win=173 Len=0"
"302","46.175326","127.0.0.1","127.0.0.1","OpcUa","133","UA Secure Conversation Message: PublishResponse"
"303","46.175369","127.0.0.1","127.0.0.1","TCP","44","61053  >  53530 [ACK] Seq=8289 Ack=12790 Win=189 Len=0"
"304","46.190751","127.0.0.1","127.0.0.1","OpcUa","142","UA Secure Conversation Message: PublishRequest"
"305","46.190836","127.0.0.1","127.0.0.1","TCP","44","53530  >  61053 [ACK] Seq=12790 Ack=8387 Win=172 Len=0"
"306","47.001288","127.0.0.1","127.0.0.1","OpcUa","208","UA Secure Conversation Message: ReadRequest"
"307","47.001368","127.0.0.1","127.0.0.1","TCP","44","53530  >  61053 [ACK] Seq=12790 Ack=8551 Win=172 Len=0"
"308","47.002752","127.0.0.1","127.0.0.1","OpcUa","270","UA Secure Conversation Message: PublishResponse"
"309","47.002797","127.0.0.1","127.0.0.1","TCP","44","61053  >  53530 [ACK] Seq=8551 Ack=13016 Win=189 Len=0"
"310","47.003021","127.0.0.1","127.0.0.1","OpcUa","143","UA Secure Conversation Message: ReadResponse"
"311","47.003094","127.0.0.1","127.0.0.1","TCP","44","61053  >  53530 [ACK] Seq=8551 Ack=13115 Win=188 Len=0"
"312","47.016246","127.0.0.1","127.0.0.1","OpcUa","150","UA Secure Conversation Message: PublishRequest"
"313","47.016351","127.0.0.1","127.0.0.1","TCP","44","53530  >  61053 [ACK] Seq=13115 Ack=8657 Win=171 Len=0"
"314","48.002017","127.0.0.1","127.0.0.1","OpcUa","270","UA Secure Conversation Message: PublishResponse"
"315","48.002078","127.0.0.1","127.0.0.1","TCP","44","61053  >  53530 [ACK] Seq=8657 Ack=13341 Win=187 Len=0"
"316","48.015572","127.0.0.1","127.0.0.1","OpcUa","150","UA Secure Conversation Message: PublishRequest"
"317","48.015663","127.0.0.1","127.0.0.1","TCP","44","53530  >  61053 [ACK] Seq=13341 Ack=8763 Win=171 Len=0"
"318","49.001530","127.0.0.1","127.0.0.1","OpcUa","266","UA Secure Conversation Message: PublishResponse"
"319","49.001602","127.0.0.1","127.0.0.1","TCP","44","61053  >  53530 [ACK] Seq=8763 Ack=13563 Win=186 Len=0"
"320","49.014662","127.0.0.1","127.0.0.1","OpcUa","150","UA Secure Conversation Message: PublishRequest"
"321","49.014778","127.0.0.1","127.0.0.1","TCP","44","53530  >  61053 [ACK] Seq=13563 Ack=8869 Win=171 Len=0"
"322","49.999069","127.0.0.1","127.0.0.1","OpcUa","270","UA Secure Conversation Message: PublishResponse"
"323","49.999135","127.0.0.1","127.0.0.1","TCP","44","61053  >  53530 [ACK] Seq=8869 Ack=13789 Win=185 Len=0"
"324","50.012772","127.0.0.1","127.0.0.1","OpcUa","150","UA Secure Conversation Message: PublishRequest"
"325","50.012881","127.0.0.1","127.0.0.1","TCP","44","53530  >  61053 [ACK] Seq=13789 Ack=8975 Win=170 Len=0"
"326","50.997338","127.0.0.1","127.0.0.1","OpcUa","270","UA Secure Conversation Message: PublishResponse"
"327","50.997404","127.0.0.1","127.0.0.1","TCP","44","61053  >  53530 [ACK] Seq=8975 Ack=14015 Win=185 Len=0"
"328","51.011556","127.0.0.1","127.0.0.1","OpcUa","150","UA Secure Conversation Message: PublishRequest"
"329","51.011641","127.0.0.1","127.0.0.1","TCP","44","53530  >  61053 [ACK] Seq=14015 Ack=9081 Win=170 Len=0"
"330","51.169455","127.0.0.1","127.0.0.1","OpcUa","133","UA Secure Conversation Message: PublishResponse"
"331","51.169515","127.0.0.1","127.0.0.1","TCP","44","61053  >  53530 [ACK] Seq=9081 Ack=14104 Win=184 Len=0"
"332","51.184197","127.0.0.1","127.0.0.1","OpcUa","142","UA Secure Conversation Message: PublishRequest"
"333","51.184284","127.0.0.1","127.0.0.1","TCP","44","53530  >  61053 [ACK] Seq=14104 Ack=9179 Win=169 Len=0"
"334","51.993824","127.0.0.1","127.0.0.1","OpcUa","270","UA Secure Conversation Message: PublishResponse"
"335","51.993887","127.0.0.1","127.0.0.1","TCP","44","61053  >  53530 [ACK] Seq=9179 Ack=14330 Win=183 Len=0"
"336","52.007940","127.0.0.1","127.0.0.1","OpcUa","150","UA Secure Conversation Message: PublishRequest"
"337","52.008042","127.0.0.1","127.0.0.1","TCP","44","53530  >  61053 [ACK] Seq=14330 Ack=9285 Win=169 Len=0"
"338","52.008131","127.0.0.1","127.0.0.1","OpcUa","208","UA Secure Conversation Message: ReadRequest"
"339","52.008157","127.0.0.1","127.0.0.1","TCP","44","53530  >  61053 [ACK] Seq=14330 Ack=9449 Win=168 Len=0"
"340","52.010398","127.0.0.1","127.0.0.1","OpcUa","143","UA Secure Conversation Message: ReadResponse"
"341","52.010446","127.0.0.1","127.0.0.1","TCP","44","61053  >  53530 [ACK] Seq=9449 Ack=14429 Win=183 Len=0"
"342","53.005616","127.0.0.1","127.0.0.1","OpcUa","270","UA Secure Conversation Message: PublishResponse"
