"No.","Time","Source","Destination","Protocol","Length","Info"
"1","0.000000","127.0.0.1","127.0.0.1","TCP","56","53270  >  53530 [SYN] Seq=0 Win=65535 Len=0 MSS=65495 WS=256 SACK_PERM"
"2","0.000078","127.0.0.1","127.0.0.1","TCP","56","53530  >  53270 [SYN, ACK] Seq=0 Ack=1 Win=65535 Len=0 MSS=65495 WS=256 SACK_PERM"
"3","0.000123","127.0.0.1","127.0.0.1","TCP","44","53270  >  53530 [ACK] Seq=1 Ack=1 Win=65280 Len=0"
"4","0.000391","127.0.0.1","127.0.0.1","OpcUa","128","Hello message"
"5","0.000422","127.0.0.1","127.0.0.1","TCP","44","53530  >  53270 [ACK] Seq=1 Ack=85 Win=65280 Len=0"
"6","0.003236","127.0.0.1","127.0.0.1","OpcUa","72","Acknowledge message"
"7","0.003281","127.0.0.1","127.0.0.1","TCP","44","53270  >  53530 [ACK] Seq=85 Ack=29 Win=65280 Len=0"
"8","0.003440","127.0.0.1","127.0.0.1","OpcUa","177","OpenSecureChannel message"
"9","0.003489","127.0.0.1","127.0.0.1","TCP","44","53530  >  53270 [ACK] Seq=29 Ack=218 Win=65280 Len=0"
"10","0.004850","127.0.0.1","127.0.0.1","OpcUa","179","OpenSecureChannel message"
"11","0.004899","127.0.0.1","127.0.0.1","TCP","44","53270  >  53530 [ACK] Seq=218 Ack=164 Win=65280 Len=0"
"12","0.005120","127.0.0.1","127.0.0.1","OpcUa","165","UA Secure Conversation Message: GetEndpointsRequest"
"13","0.005166","127.0.0.1","127.0.0.1","TCP","44","53530  >  53270 [ACK] Seq=164 Ack=339 Win=65024 Len=0"
"14","0.006650","127.0.0.1","127.0.0.1","OpcUa","20188","UA Secure Conversation Message: GetEndpointsResponse"
"15","0.006761","127.0.0.1","127.0.0.1","TCP","44","53270  >  53530 [ACK] Seq=339 Ack=20308 Win=45056 Len=0"
"16","0.007053","127.0.0.1","127.0.0.1","OpcUa","101","CloseSecureChannel message: CloseSecureChannelRequest"
"17","0.007089","127.0.0.1","127.0.0.1","TCP","44","53530  >  53270 [ACK] Seq=20308 Ack=396 Win=65024 Len=0"
"18","0.007120","127.0.0.1","127.0.0.1","TCP","44","53270  >  53530 [FIN, ACK] Seq=396 Ack=20308 Win=45056 Len=0"
"19","0.007139","127.0.0.1","127.0.0.1","TCP","44","53530  >  53270 [ACK] Seq=20308 Ack=397 Win=65024 Len=0"
"20","0.008135","127.0.0.1","127.0.0.1","TCP","44","53530  >  53270 [FIN, ACK] Seq=20308 Ack=397 Win=65024 Len=0"
"21","0.008196","127.0.0.1","127.0.0.1","TCP","44","53270  >  53530 [ACK] Seq=397 Ack=20309 Win=45056 Len=0"
"22","0.071812","127.0.0.1","127.0.0.1","TCP","56","53271  >  53530 [SYN] Seq=0 Win=65535 Len=0 MSS=65495 WS=256 SACK_PERM"
"23","0.071890","127.0.0.1","127.0.0.1","TCP","56","53530  >  53271 [SYN, ACK] Seq=0 Ack=1 Win=65535 Len=0 MSS=65495 WS=256 SACK_PERM"
"24","0.071926","127.0.0.1","127.0.0.1","TCP","44","53271  >  53530 [ACK] Seq=1 Ack=1 Win=65280 Len=0"
"25","0.072258","127.0.0.1","127.0.0.1","OpcUa","128","Hello message"
"26","0.072304","127.0.0.1","127.0.0.1","TCP","44","53530  >  53271 [ACK] Seq=1 Ack=85 Win=65280 Len=0"
"27","0.073206","127.0.0.1","127.0.0.1","OpcUa","72","Acknowledge message"
"28","0.073244","127.0.0.1","127.0.0.1","TCP","44","53271  >  53530 [ACK] Seq=85 Ack=29 Win=65280 Len=0"
"29","0.073326","127.0.0.1","127.0.0.1","OpcUa","177","OpenSecureChannel message"
"30","0.073350","127.0.0.1","127.0.0.1","TCP","44","53530  >  53271 [ACK] Seq=29 Ack=218 Win=65280 Len=0"
"31","0.073853","127.0.0.1","127.0.0.1","OpcUa","179","OpenSecureChannel message"
"32","0.073886","127.0.0.1","127.0.0.1","TCP","44","53271  >  53530 [ACK] Seq=218 Ack=164 Win=65280 Len=0"
"33","0.074156","127.0.0.1","127.0.0.1","OpcUa","423","UA Secure Conversation Message: CreateSessionRequest"
"34","0.074194","127.0.0.1","127.0.0.1","TCP","44","53530  >  53271 [ACK] Seq=164 Ack=597 Win=64768 Len=0"
"35","0.086646","127.0.0.1","127.0.0.1","OpcUa","21331","UA Secure Conversation Message: CreateSessionResponse"
"36","0.086801","127.0.0.1","127.0.0.1","TCP","44","53271  >  53530 [ACK] Seq=597 Ack=21451 Win=44032 Len=0"
"37","0.087768","127.0.0.1","127.0.0.1","OpcUa","193","UA Secure Conversation Message: ActivateSessionRequest"
"38","0.087812","127.0.0.1","127.0.0.1","TCP","44","53530  >  53271 [ACK] Seq=21451 Ack=746 Win=64768 Len=0"
"39","0.090544","127.0.0.1","127.0.0.1","OpcUa","140","UA Secure Conversation Message: ActivateSessionResponse"
"40","0.090598","127.0.0.1","127.0.0.1","TCP","44","53271  >  53530 [ACK] Seq=746 Ack=21547 Win=43776 Len=0"
"41","0.090772","127.0.0.1","127.0.0.1","OpcUa","190","UA Secure Conversation Message: ReadRequest"
"42","0.090812","127.0.0.1","127.0.0.1","TCP","44","53530  >  53271 [ACK] Seq=21547 Ack=892 Win=64512 Len=0"
"43","0.092314","127.0.0.1","127.0.0.1","OpcUa","116","UA Secure Conversation Message: ReadResponse"
"44","0.092371","127.0.0.1","127.0.0.1","TCP","44","53271  >  53530 [ACK] Seq=892 Ack=21619 Win=43776 Len=0"
"45","0.092406","127.0.0.1","127.0.0.1","OpcUa","496","UA Secure Conversation Message: ReadRequest"
"46","0.092428","127.0.0.1","127.0.0.1","TCP","44","53530  >  53271 [ACK] Seq=21619 Ack=1344 Win=64000 Len=0"
"47","0.094906","127.0.0.1","127.0.0.1","OpcUa","565","UA Secure Conversation Message: ReadResponse"
"48","0.094966","127.0.0.1","127.0.0.1","TCP","44","53271  >  53530 [ACK] Seq=1344 Ack=22140 Win=43264 Len=0"
"49","0.095468","127.0.0.1","127.0.0.1","OpcUa","172","UA Secure Conversation Message: ReadRequest"
"50","0.095521","127.0.0.1","127.0.0.1","TCP","44","53530  >  53271 [ACK] Seq=22140 Ack=1472 Win=64000 Len=0"
"51","0.097417","127.0.0.1","127.0.0.1","OpcUa","107","UA Secure Conversation Message: ReadResponse"
"52","0.097464","127.0.0.1","127.0.0.1","TCP","44","53271  >  53530 [ACK] Seq=1472 Ack=22203 Win=43264 Len=0"
"53","0.097677","127.0.0.1","127.0.0.1","OpcUa","160","UA Secure Conversation Message: CreateSubscriptionRequest"
"54","0.097713","127.0.0.1","127.0.0.1","TCP","44","53530  >  53271 [ACK] Seq=22203 Ack=1588 Win=63744 Len=0"
"55","0.102590","127.0.0.1","127.0.0.1","OpcUa","116","UA Secure Conversation Message: CreateSubscriptionResponse"
"56","0.102653","127.0.0.1","127.0.0.1","TCP","44","53271  >  53530 [ACK] Seq=1588 Ack=22275 Win=43008 Len=0"
"57","0.102897","127.0.0.1","127.0.0.1","OpcUa","320","UA Secure Conversation Message: CreateMonitoredItemsRequest"
"58","0.102931","127.0.0.1","127.0.0.1","TCP","44","53530  >  53271 [ACK] Seq=22275 Ack=1864 Win=63488 Len=0"
"59","0.105764","127.0.0.1","127.0.0.1","OpcUa","182","UA Secure Conversation Message: CreateMonitoredItemsResponse"
"60","0.105810","127.0.0.1","127.0.0.1","TCP","44","53271  >  53530 [ACK] Seq=1864 Ack=22413 Win=43008 Len=0"
"61","0.107176","127.0.0.1","127.0.0.1","OpcUa","177","UA Secure Conversation Message: BrowseRequest"
"62","0.107233","127.0.0.1","127.0.0.1","TCP","44","53530  >  53271 [ACK] Seq=22413 Ack=1997 Win=63488 Len=0"
"63","0.109608","127.0.0.1","127.0.0.1","OpcUa","240","UA Secure Conversation Message: BrowseResponse"
"64","0.109668","127.0.0.1","127.0.0.1","TCP","44","53271  >  53530 [ACK] Seq=1997 Ack=22609 Win=42752 Len=0"
"65","0.110159","127.0.0.1","127.0.0.1","OpcUa","314","UA Secure Conversation Message: ReadRequest"
"66","0.110209","127.0.0.1","127.0.0.1","TCP","44","53530  >  53271 [ACK] Seq=22609 Ack=2267 Win=63232 Len=0"
"67","0.112239","127.0.0.1","127.0.0.1","OpcUa","194","UA Secure Conversation Message: ReadResponse"
"68","0.112293","127.0.0.1","127.0.0.1","TCP","44","53271  >  53530 [ACK] Seq=2267 Ack=22759 Win=42752 Len=0"
"69","0.112463","127.0.0.1","127.0.0.1","OpcUa","177","UA Secure Conversation Message: BrowseRequest"
"70","0.112487","127.0.0.1","127.0.0.1","TCP","44","53530  >  53271 [ACK] Seq=22759 Ack=2400 Win=62976 Len=0"
"71","0.115236","127.0.0.1","127.0.0.1","OpcUa","142","UA Secure Conversation Message: BrowseResponse"
"72","0.115281","127.0.0.1","127.0.0.1","TCP","44","53271  >  53530 [ACK] Seq=2400 Ack=22857 Win=42496 Len=0"
"73","0.115497","127.0.0.1","127.0.0.1","OpcUa","314","UA Secure Conversation Message: ReadRequest"
"74","0.115540","127.0.0.1","127.0.0.1","TCP","44","53530  >  53271 [ACK] Seq=22857 Ack=2670 Win=62720 Len=0"
"75","0.118191","127.0.0.1","127.0.0.1","OpcUa","238","UA Secure Conversation Message: ReadResponse"
"76","0.118246","127.0.0.1","127.0.0.1","TCP","44","53271  >  53530 [ACK] Seq=2670 Ack=23051 Win=42240 Len=0"
"77","0.118562","127.0.0.1","127.0.0.1","OpcUa","177","UA Secure Conversation Message: BrowseRequest"
"78","0.118624","127.0.0.1","127.0.0.1","TCP","44","53530  >  53271 [ACK] Seq=23051 Ack=2803 Win=62720 Len=0"
"79","0.120836","127.0.0.1","127.0.0.1","OpcUa","142","UA Secure Conversation Message: BrowseResponse"
"80","0.120935","127.0.0.1","127.0.0.1","TCP","44","53271  >  53530 [ACK] Seq=2803 Ack=23149 Win=42240 Len=0"
"81","0.121360","127.0.0.1","127.0.0.1","OpcUa","314","UA Secure Conversation Message: ReadRequest"
"82","0.121421","127.0.0.1","127.0.0.1","TCP","44","53530  >  53271 [ACK] Seq=23149 Ack=3073 Win=62208 Len=0"
"83","0.123697","127.0.0.1","127.0.0.1","OpcUa","181","UA Secure Conversation Message: ReadResponse"
"84","0.123740","127.0.0.1","127.0.0.1","TCP","44","53271  >  53530 [ACK] Seq=3073 Ack=23286 Win=42240 Len=0"
"85","0.123940","127.0.0.1","127.0.0.1","OpcUa","177","UA Secure Conversation Message: BrowseRequest"
"86","0.123963","127.0.0.1","127.0.0.1","TCP","44","53530  >  53271 [ACK] Seq=23286 Ack=3206 Win=62208 Len=0"
"87","0.125250","127.0.0.1","127.0.0.1","OpcUa","116","UA Secure Conversation Message: BrowseResponse"
"88","0.125297","127.0.0.1","127.0.0.1","TCP","44","53271  >  53530 [ACK] Seq=3206 Ack=23358 Win=41984 Len=0"
"89","0.128237","127.0.0.1","127.0.0.1","OpcUa","177","UA Secure Conversation Message: BrowseRequest"
"90","0.128294","127.0.0.1","127.0.0.1","TCP","44","53530  >  53271 [ACK] Seq=23358 Ack=3339 Win=61952 Len=0"
"91","0.130589","127.0.0.1","127.0.0.1","OpcUa","463","UA Secure Conversation Message: BrowseResponse"
"92","0.130638","127.0.0.1","127.0.0.1","TCP","44","53271  >  53530 [ACK] Seq=3339 Ack=23777 Win=41728 Len=0"
"93","0.151584","127.0.0.1","127.0.0.1","OpcUa","334","UA Secure Conversation Message: ReadRequest"
"94","0.151637","127.0.0.1","127.0.0.1","TCP","44","53530  >  53271 [ACK] Seq=23777 Ack=3629 Win=61696 Len=0"
"95","0.153755","127.0.0.1","127.0.0.1","OpcUa","184","UA Secure Conversation Message: ReadResponse"
"96","0.153862","127.0.0.1","127.0.0.1","TCP","44","53271  >  53530 [ACK] Seq=3629 Ack=23917 Win=41472 Len=0"
"97","0.154067","127.0.0.1","127.0.0.1","OpcUa","179","UA Secure Conversation Message: BrowseRequest"
"98","0.154115","127.0.0.1","127.0.0.1","TCP","44","53530  >  53271 [ACK] Seq=23917 Ack=3764 Win=61696 Len=0"
"99","0.155156","127.0.0.1","127.0.0.1","OpcUa","142","UA Secure Conversation Message: BrowseResponse"
"100","0.155198","127.0.0.1","127.0.0.1","TCP","44","53271  >  53530 [ACK] Seq=3764 Ack=24015 Win=41472 Len=0"
"101","0.155384","127.0.0.1","127.0.0.1","OpcUa","314","UA Secure Conversation Message: ReadRequest"
"102","0.155402","127.0.0.1","127.0.0.1","TCP","44","53530  >  53271 [ACK] Seq=24015 Ack=4034 Win=61440 Len=0"
"103","0.157177","127.0.0.1","127.0.0.1","OpcUa","192","UA Secure Conversation Message: ReadResponse"
"104","0.157242","127.0.0.1","127.0.0.1","TCP","44","53271  >  53530 [ACK] Seq=4034 Ack=24163 Win=41216 Len=0"
"105","0.157384","127.0.0.1","127.0.0.1","OpcUa","177","UA Secure Conversation Message: BrowseRequest"
"106","0.157418","127.0.0.1","127.0.0.1","TCP","44","53530  >  53271 [ACK] Seq=24163 Ack=4167 Win=61184 Len=0"
"107","0.159557","127.0.0.1","127.0.0.1","OpcUa","116","UA Secure Conversation Message: BrowseResponse"
"108","0.159606","127.0.0.1","127.0.0.1","TCP","44","53271  >  53530 [ACK] Seq=4167 Ack=24235 Win=41216 Len=0"
"109","0.160069","127.0.0.1","127.0.0.1","OpcUa","334","UA Secure Conversation Message: ReadRequest"
"110","0.160118","127.0.0.1","127.0.0.1","TCP","44","53530  >  53271 [ACK] Seq=24235 Ack=4457 Win=60928 Len=0"
"111","0.161776","127.0.0.1","127.0.0.1","OpcUa","206","UA Secure Conversation Message: ReadResponse"
"112","0.161834","127.0.0.1","127.0.0.1","TCP","44","53271  >  53530 [ACK] Seq=4457 Ack=24397 Win=40960 Len=0"
"113","0.162028","127.0.0.1","127.0.0.1","OpcUa","179","UA Secure Conversation Message: BrowseRequest"
"114","0.162059","127.0.0.1","127.0.0.1","TCP","44","53530  >  53271 [ACK] Seq=24397 Ack=4592 Win=60928 Len=0"
"115","0.163736","127.0.0.1","127.0.0.1","OpcUa","142","UA Secure Conversation Message: BrowseResponse"
"116","0.163807","127.0.0.1","127.0.0.1","TCP","44","53271  >  53530 [ACK] Seq=4592 Ack=24495 Win=40960 Len=0"
"117","0.179508","127.0.0.1","127.0.0.1","OpcUa","142","UA Secure Conversation Message: PublishRequest"
"118","0.179588","127.0.0.1","127.0.0.1","TCP","44","53530  >  53271 [ACK] Seq=24495 Ack=4690 Win=60672 Len=0"
"119","0.179650","127.0.0.1","127.0.0.1","OpcUa","142","UA Secure Conversation Message: PublishRequest"
"120","0.179671","127.0.0.1","127.0.0.1","TCP","44","53530  >  53271 [ACK] Seq=24495 Ack=4788 Win=60672 Len=0"
"121","0.212639","127.0.0.1","127.0.0.1","OpcUa","129","UA Secure Conversation Message: PublishResponse"
"122","0.212688","127.0.0.1","127.0.0.1","TCP","44","53271  >  53530 [ACK] Seq=4788 Ack=24580 Win=40704 Len=0"
"123","0.226626","127.0.0.1","127.0.0.1","OpcUa","142","UA Secure Conversation Message: PublishRequest"
"124","0.226712","127.0.0.1","127.0.0.1","TCP","44","53530  >  53271 [ACK] Seq=24580 Ack=4886 Win=60416 Len=0"
"125","5.181312","127.0.0.1","127.0.0.1","OpcUa","208","UA Secure Conversation Message: ReadRequest"
"126","5.181421","127.0.0.1","127.0.0.1","TCP","44","53530  >  53271 [ACK] Seq=24580 Ack=5050 Win=60416 Len=0"
"127","5.183764","127.0.0.1","127.0.0.1","OpcUa","143","UA Secure Conversation Message: ReadResponse"
"128","5.183834","127.0.0.1","127.0.0.1","TCP","44","53271  >  53530 [ACK] Seq=5050 Ack=24679 Win=40704 Len=0"
"129","5.201138","127.0.0.1","127.0.0.1","OpcUa","129","UA Secure Conversation Message: PublishResponse"
"130","5.201216","127.0.0.1","127.0.0.1","TCP","44","53271  >  53530 [ACK] Seq=5050 Ack=24764 Win=40704 Len=0"
"131","5.212353","127.0.0.1","127.0.0.1","OpcUa","142","UA Secure Conversation Message: PublishRequest"
"132","5.212458","127.0.0.1","127.0.0.1","TCP","44","53530  >  53271 [ACK] Seq=24764 Ack=5148 Win=60160 Len=0"
"133","10.186498","127.0.0.1","127.0.0.1","OpcUa","208","UA Secure Conversation Message: ReadRequest"
"134","10.186572","127.0.0.1","127.0.0.1","TCP","44","53530  >  53271 [ACK] Seq=24764 Ack=5312 Win=60160 Len=0"
"135","10.189226","127.0.0.1","127.0.0.1","OpcUa","143","UA Secure Conversation Message: ReadResponse"
"136","10.189271","127.0.0.1","127.0.0.1","TCP","44","53271  >  53530 [ACK] Seq=5312 Ack=24863 Win=40448 Len=0"
"137","10.202498","127.0.0.1","127.0.0.1","OpcUa","129","UA Secure Conversation Message: PublishResponse"
"138","10.202539","127.0.0.1","127.0.0.1","TCP","44","53271  >  53530 [ACK] Seq=5312 Ack=24948 Win=40448 Len=0"
"139","10.217356","127.0.0.1","127.0.0.1","OpcUa","142","UA Secure Conversation Message: PublishRequest"
"140","10.217427","127.0.0.1","127.0.0.1","TCP","44","53530  >  53271 [ACK] Seq=24948 Ack=5410 Win=59904 Len=0"
"141","11.662648","127.0.0.1","127.0.0.1","OpcUa","197","UA Secure Conversation Message: BrowseRequest"
"142","11.662716","127.0.0.1","127.0.0.1","TCP","44","53530  >  53271 [ACK] Seq=24948 Ack=5563 Win=59904 Len=0"
"143","11.664321","127.0.0.1","127.0.0.1","OpcUa","442","UA Secure Conversation Message: BrowseResponse"
"144","11.664356","127.0.0.1","127.0.0.1","TCP","44","53271  >  53530 [ACK] Seq=5563 Ack=25346 Win=39936 Len=0"
"145","12.897755","127.0.0.1","127.0.0.1","OpcUa","197","UA Secure Conversation Message: BrowseRequest"
"146","12.897801","127.0.0.1","127.0.0.1","TCP","44","53530  >  53271 [ACK] Seq=25346 Ack=5716 Win=59648 Len=0"
"147","12.900539","127.0.0.1","127.0.0.1","OpcUa","246","UA Secure Conversation Message: BrowseResponse"
"148","12.900585","127.0.0.1","127.0.0.1","TCP","44","53271  >  53530 [ACK] Seq=5716 Ack=25548 Win=39936 Len=0"
"149","14.818592","127.0.0.1","127.0.0.1","OpcUa","496","UA Secure Conversation Message: ReadRequest"
"150","14.818664","127.0.0.1","127.0.0.1","TCP","44","53530  >  53271 [ACK] Seq=25548 Ack=6168 Win=59136 Len=0"
"151","14.818905","127.0.0.1","127.0.0.1","OpcUa","179","UA Secure Conversation Message: BrowseRequest"
"152","14.818996","127.0.0.1","127.0.0.1","TCP","44","53530  >  53271 [ACK] Seq=25548 Ack=6303 Win=59136 Len=0"
"153","14.820997","127.0.0.1","127.0.0.1","OpcUa","252","UA Secure Conversation Message: BrowseResponse"
"154","14.821053","127.0.0.1","127.0.0.1","TCP","44","53271  >  53530 [ACK] Seq=6303 Ack=25756 Win=39680 Len=0"
"155","14.821374","127.0.0.1","127.0.0.1","OpcUa","314","UA Secure Conversation Message: ReadRequest"
"156","14.821433","127.0.0.1","127.0.0.1","TCP","44","53530  >  53271 [ACK] Seq=25756 Ack=6573 Win=58880 Len=0"
"157","14.821953","127.0.0.1","127.0.0.1","OpcUa","391","UA Secure Conversation Message: ReadResponse"
"158","14.822003","127.0.0.1","127.0.0.1","TCP","44","53271  >  53530 [ACK] Seq=6573 Ack=26103 Win=39424 Len=0"
"159","14.823622","127.0.0.1","127.0.0.1","OpcUa","215","UA Secure Conversation Message: ReadResponse"
"160","14.823693","127.0.0.1","127.0.0.1","TCP","44","53271  >  53530 [ACK] Seq=6573 Ack=26274 Win=39168 Len=0"
"161","14.824217","127.0.0.1","127.0.0.1","OpcUa","334","UA Secure Conversation Message: ReadRequest"
"162","14.824314","127.0.0.1","127.0.0.1","TCP","44","53530  >  53271 [ACK] Seq=26274 Ack=6863 Win=58624 Len=0"
"163","14.827104","127.0.0.1","127.0.0.1","OpcUa","307","UA Secure Conversation Message: ReadResponse"
"164","14.827151","127.0.0.1","127.0.0.1","TCP","44","53271  >  53530 [ACK] Seq=6863 Ack=26537 Win=38912 Len=0"
"165","14.836580","127.0.0.1","127.0.0.1","OpcUa","314","UA Secure Conversation Message: ReadRequest"
"166","14.836624","127.0.0.1","127.0.0.1","TCP","44","53530  >  53271 [ACK] Seq=26537 Ack=7133 Win=58368 Len=0"
"167","14.838226","127.0.0.1","127.0.0.1","OpcUa","176","UA Secure Conversation Message: ReadResponse"
"168","14.838277","127.0.0.1","127.0.0.1","TCP","44","53271  >  53530 [ACK] Seq=7133 Ack=26669 Win=38656 Len=0"
"169","14.855100","127.0.0.1","127.0.0.1","OpcUa","334","UA Secure Conversation Message: ReadRequest"
"170","14.855148","127.0.0.1","127.0.0.1","TCP","44","53530  >  53271 [ACK] Seq=26669 Ack=7423 Win=58112 Len=0"
"171","14.858851","127.0.0.1","127.0.0.1","OpcUa","175","UA Secure Conversation Message: ReadResponse"
"172","14.858979","127.0.0.1","127.0.0.1","TCP","44","53271  >  53530 [ACK] Seq=7423 Ack=26800 Win=38656 Len=0"
"173","15.191837","127.0.0.1","127.0.0.1","OpcUa","208","UA Secure Conversation Message: ReadRequest"
"174","15.191967","127.0.0.1","127.0.0.1","TCP","44","53530  >  53271 [ACK] Seq=26800 Ack=7587 Win=57856 Len=0"
"175","15.193861","127.0.0.1","127.0.0.1","OpcUa","143","UA Secure Conversation Message: ReadResponse"
"176","15.193911","127.0.0.1","127.0.0.1","TCP","44","53271  >  53530 [ACK] Seq=7587 Ack=26899 Win=38400 Len=0"
"177","15.208481","127.0.0.1","127.0.0.1","OpcUa","129","UA Secure Conversation Message: PublishResponse"
"178","15.208568","127.0.0.1","127.0.0.1","TCP","44","53271  >  53530 [ACK] Seq=7587 Ack=26984 Win=38400 Len=0"
"179","15.223282","127.0.0.1","127.0.0.1","OpcUa","142","UA Secure Conversation Message: PublishRequest"
"180","15.223370","127.0.0.1","127.0.0.1","TCP","44","53530  >  53271 [ACK] Seq=26984 Ack=7685 Win=57600 Len=0"
"181","15.438344","127.0.0.1","127.0.0.1","OpcUa","160","UA Secure Conversation Message: CreateSubscriptionRequest"
"182","15.438383","127.0.0.1","127.0.0.1","TCP","44","53530  >  53271 [ACK] Seq=26984 Ack=7801 Win=57600 Len=0"
"183","15.443885","127.0.0.1","127.0.0.1","OpcUa","116","UA Secure Conversation Message: CreateSubscriptionResponse"
"184","15.443954","127.0.0.1","127.0.0.1","TCP","44","53271  >  53530 [ACK] Seq=7801 Ack=27056 Win=38400 Len=0"
"185","15.444300","127.0.0.1","127.0.0.1","OpcUa","192","UA Secure Conversation Message: CreateMonitoredItemsRequest"
"186","15.444364","127.0.0.1","127.0.0.1","TCP","44","53530  >  53271 [ACK] Seq=27056 Ack=7949 Win=57344 Len=0"
"187","15.447826","127.0.0.1","127.0.0.1","OpcUa","127","UA Secure Conversation Message: CreateMonitoredItemsResponse"
"188","15.447872","127.0.0.1","127.0.0.1","TCP","44","53271  >  53530 [ACK] Seq=7949 Ack=27139 Win=38144 Len=0"
"189","15.448228","127.0.0.1","127.0.0.1","OpcUa","176","UA Secure Conversation Message: TranslateBrowsePathsToNodeIdsRequest"
"190","15.448278","127.0.0.1","127.0.0.1","TCP","44","53530  >  53271 [ACK] Seq=27139 Ack=8081 Win=57344 Len=0"
"191","15.450925","127.0.0.1","127.0.0.1","OpcUa","112","UA Secure Conversation Message: TranslateBrowsePathsToNodeIdsResponse"
"192","15.450976","127.0.0.1","127.0.0.1","TCP","44","53271  >  53530 [ACK] Seq=8081 Ack=27207 Win=38144 Len=0"
"193","15.451233","127.0.0.1","127.0.0.1","OpcUa","174","UA Secure Conversation Message: TranslateBrowsePathsToNodeIdsRequest"
"194","15.451273","127.0.0.1","127.0.0.1","TCP","44","53530  >  53271 [ACK] Seq=27207 Ack=8211 Win=57088 Len=0"
"195","15.452389","127.0.0.1","127.0.0.1","OpcUa","112","UA Secure Conversation Message: TranslateBrowsePathsToNodeIdsResponse"
"196","15.452436","127.0.0.1","127.0.0.1","TCP","44","53271  >  53530 [ACK] Seq=8211 Ack=27275 Win=38144 Len=0"
"197","15.459572","127.0.0.1","127.0.0.1","OpcUa","142","UA Secure Conversation Message: PublishRequest"
"198","15.459620","127.0.0.1","127.0.0.1","TCP","44","53530  >  53271 [ACK] Seq=27275 Ack=8309 Win=57088 Len=0"
"199","15.942959","127.0.0.1","127.0.0.1","OpcUa","180","UA Secure Conversation Message: PublishResponse"
"200","15.943007","127.0.0.1","127.0.0.1","TCP","44","53271  >  53530 [ACK] Seq=8309 Ack=27411 Win=37888 Len=0"
"201","15.956085","127.0.0.1","127.0.0.1","OpcUa","150","UA Secure Conversation Message: PublishRequest"
"202","15.956167","127.0.0.1","127.0.0.1","TCP","44","53530  >  53271 [ACK] Seq=27411 Ack=8415 Win=57088 Len=0"
"203","16.430150","127.0.0.1","127.0.0.1","OpcUa","496","UA Secure Conversation Message: ReadRequest"
"204","16.430211","127.0.0.1","127.0.0.1","TCP","44","53530  >  53271 [ACK] Seq=27411 Ack=8867 Win=56576 Len=0"
"205","16.430323","127.0.0.1","127.0.0.1","OpcUa","179","UA Secure Conversation Message: BrowseRequest"
"206","16.430354","127.0.0.1","127.0.0.1","TCP","44","53530  >  53271 [ACK] Seq=27411 Ack=9002 Win=56320 Len=0"
"207","16.433396","127.0.0.1","127.0.0.1","OpcUa","252","UA Secure Conversation Message: BrowseResponse"
"208","16.433466","127.0.0.1","127.0.0.1","TCP","44","53271  >  53530 [ACK] Seq=9002 Ack=27619 Win=37888 Len=0"
"209","16.433655","127.0.0.1","127.0.0.1","OpcUa","385","UA Secure Conversation Message: ReadResponse"
"210","16.433702","127.0.0.1","127.0.0.1","TCP","44","53271  >  53530 [ACK] Seq=9002 Ack=27960 Win=37376 Len=0"
"211","16.444388","127.0.0.1","127.0.0.1","OpcUa","314","UA Secure Conversation Message: ReadRequest"
"212","16.444445","127.0.0.1","127.0.0.1","TCP","44","53530  >  53271 [ACK] Seq=27960 Ack=9272 Win=56064 Len=0"
"213","16.446328","127.0.0.1","127.0.0.1","OpcUa","174","UA Secure Conversation Message: ReadResponse"
"214","16.446374","127.0.0.1","127.0.0.1","TCP","44","53271  >  53530 [ACK] Seq=9272 Ack=28090 Win=37376 Len=0"
"215","16.460698","127.0.0.1","127.0.0.1","OpcUa","334","UA Secure Conversation Message: ReadRequest"
"216","16.460771","127.0.0.1","127.0.0.1","TCP","44","53530  >  53271 [ACK] Seq=28090 Ack=9562 Win=55808 Len=0"
"217","16.462662","127.0.0.1","127.0.0.1","OpcUa","173","UA Secure Conversation Message: ReadResponse"
"218","16.462711","127.0.0.1","127.0.0.1","TCP","44","53271  >  53530 [ACK] Seq=9562 Ack=28219 Win=37120 Len=0"
"219","16.993469","127.0.0.1","127.0.0.1","OpcUa","192","UA Secure Conversation Message: CreateMonitoredItemsRequest"
"220","16.993520","127.0.0.1","127.0.0.1","TCP","44","53530  >  53271 [ACK] Seq=28219 Ack=9710 Win=55808 Len=0"
"221","16.995589","127.0.0.1","127.0.0.1","OpcUa","127","UA Secure Conversation Message: CreateMonitoredItemsResponse"
"222","16.995630","127.0.0.1","127.0.0.1","TCP","44","53271  >  53530 [ACK] Seq=9710 Ack=28302 Win=37120 Len=0"
"223","16.995840","127.0.0.1","127.0.0.1","OpcUa","176","UA Secure Conversation Message: TranslateBrowsePathsToNodeIdsRequest"
"224","16.995864","127.0.0.1","127.0.0.1","TCP","44","53530  >  53271 [ACK] Seq=28302 Ack=9842 Win=55552 Len=0"
"225","16.996902","127.0.0.1","127.0.0.1","OpcUa","112","UA Secure Conversation Message: TranslateBrowsePathsToNodeIdsResponse"
"226","16.996941","127.0.0.1","127.0.0.1","TCP","44","53271  >  53530 [ACK] Seq=9842 Ack=28370 Win=37120 Len=0"
"227","16.997442","127.0.0.1","127.0.0.1","OpcUa","174","UA Secure Conversation Message: TranslateBrowsePathsToNodeIdsRequest"
"228","16.997486","127.0.0.1","127.0.0.1","TCP","44","53530  >  53271 [ACK] Seq=28370 Ack=9972 Win=55552 Len=0"
"229","16.998771","127.0.0.1","127.0.0.1","OpcUa","112","UA Secure Conversation Message: TranslateBrowsePathsToNodeIdsResponse"
"230","16.998816","127.0.0.1","127.0.0.1","TCP","44","53271  >  53530 [ACK] Seq=9972 Ack=28438 Win=36864 Len=0"
"231","17.456708","127.0.0.1","127.0.0.1","OpcUa","176","UA Secure Conversation Message: PublishResponse"
"232","17.456757","127.0.0.1","127.0.0.1","TCP","44","53271  >  53530 [ACK] Seq=9972 Ack=28570 Win=36864 Len=0"
"233","17.469669","127.0.0.1","127.0.0.1","OpcUa","150","UA Secure Conversation Message: PublishRequest"
"234","17.469747","127.0.0.1","127.0.0.1","TCP","44","53530  >  53271 [ACK] Seq=28570 Ack=10078 Win=55296 Len=0"
"235","17.850039","127.0.0.1","127.0.0.1","OpcUa","496","UA Secure Conversation Message: ReadRequest"
"236","17.850099","127.0.0.1","127.0.0.1","TCP","44","53530  >  53271 [ACK] Seq=28570 Ack=10530 Win=54784 Len=0"
"237","17.850241","127.0.0.1","127.0.0.1","OpcUa","179","UA Secure Conversation Message: BrowseRequest"
"238","17.850277","127.0.0.1","127.0.0.1","TCP","44","53530  >  53271 [ACK] Seq=28570 Ack=10665 Win=54784 Len=0"
"239","17.851675","127.0.0.1","127.0.0.1","OpcUa","387","UA Secure Conversation Message: ReadResponse"
"240","17.851722","127.0.0.1","127.0.0.1","TCP","44","53271  >  53530 [ACK] Seq=10665 Ack=28913 Win=36608 Len=0"
"241","17.853349","127.0.0.1","127.0.0.1","OpcUa","252","UA Secure Conversation Message: BrowseResponse"
"242","17.853441","127.0.0.1","127.0.0.1","TCP","44","53271  >  53530 [ACK] Seq=10665 Ack=29121 Win=36352 Len=0"
"243","17.873407","127.0.0.1","127.0.0.1","OpcUa","334","UA Secure Conversation Message: ReadRequest"
"244","17.873452","127.0.0.1","127.0.0.1","TCP","44","53530  >  53271 [ACK] Seq=29121 Ack=10955 Win=54528 Len=0"
"245","17.875171","127.0.0.1","127.0.0.1","OpcUa","171","UA Secure Conversation Message: ReadResponse"
"246","17.875223","127.0.0.1","127.0.0.1","TCP","44","53271  >  53530 [ACK] Seq=10955 Ack=29248 Win=36096 Len=0"
"247","18.337089","127.0.0.1","127.0.0.1","OpcUa","192","UA Secure Conversation Message: CreateMonitoredItemsRequest"
"248","18.337140","127.0.0.1","127.0.0.1","TCP","44","53530  >  53271 [ACK] Seq=29248 Ack=11103 Win=54272 Len=0"
"249","18.339649","127.0.0.1","127.0.0.1","OpcUa","127","UA Secure Conversation Message: CreateMonitoredItemsResponse"
"250","18.339684","127.0.0.1","127.0.0.1","TCP","44","53271  >  53530 [ACK] Seq=11103 Ack=29331 Win=36096 Len=0"
"251","18.339944","127.0.0.1","127.0.0.1","OpcUa","176","UA Secure Conversation Message: TranslateBrowsePathsToNodeIdsRequest"
"252","18.339967","127.0.0.1","127.0.0.1","TCP","44","53530  >  53271 [ACK] Seq=29331 Ack=11235 Win=54272 Len=0"
"253","18.341352","127.0.0.1","127.0.0.1","OpcUa","112","UA Secure Conversation Message: TranslateBrowsePathsToNodeIdsResponse"
"254","18.341385","127.0.0.1","127.0.0.1","TCP","44","53271  >  53530 [ACK] Seq=11235 Ack=29399 Win=36096 Len=0"
"255","18.341625","127.0.0.1","127.0.0.1","OpcUa","174","UA Secure Conversation Message: TranslateBrowsePathsToNodeIdsRequest"
"256","18.341647","127.0.0.1","127.0.0.1","TCP","44","53530  >  53271 [ACK] Seq=29399 Ack=11365 Win=54016 Len=0"
"257","18.342940","127.0.0.1","127.0.0.1","OpcUa","112","UA Secure Conversation Message: TranslateBrowsePathsToNodeIdsResponse"
"258","18.342987","127.0.0.1","127.0.0.1","TCP","44","53271  >  53530 [ACK] Seq=11365 Ack=29467 Win=35840 Len=0"
"259","18.451390","127.0.0.1","127.0.0.1","OpcUa","206","UA Secure Conversation Message: PublishResponse"
"260","18.451445","127.0.0.1","127.0.0.1","TCP","44","53271  >  53530 [ACK] Seq=11365 Ack=29629 Win=35840 Len=0"
"261","18.464791","127.0.0.1","127.0.0.1","OpcUa","150","UA Secure Conversation Message: PublishRequest"
"262","18.464865","127.0.0.1","127.0.0.1","TCP","44","53530  >  53271 [ACK] Seq=29629 Ack=11471 Win=54016 Len=0"
"263","18.983349","127.0.0.1","127.0.0.1","OpcUa","496","UA Secure Conversation Message: ReadRequest"
"264","18.983409","127.0.0.1","127.0.0.1","TCP","44","53530  >  53271 [ACK] Seq=29629 Ack=11923 Win=53504 Len=0"
"265","18.983503","127.0.0.1","127.0.0.1","OpcUa","179","UA Secure Conversation Message: BrowseRequest"
"266","18.983522","127.0.0.1","127.0.0.1","TCP","44","53530  >  53271 [ACK] Seq=29629 Ack=12058 Win=53248 Len=0"
"267","18.985842","127.0.0.1","127.0.0.1","OpcUa","391","UA Secure Conversation Message: ReadResponse"
"268","18.985915","127.0.0.1","127.0.0.1","TCP","44","53271  >  53530 [ACK] Seq=12058 Ack=29976 Win=35328 Len=0"
"269","18.986077","127.0.0.1","127.0.0.1","OpcUa","252","UA Secure Conversation Message: BrowseResponse"
"270","18.986117","127.0.0.1","127.0.0.1","TCP","44","53271  >  53530 [ACK] Seq=12058 Ack=30184 Win=35328 Len=0"
"271","19.008009","127.0.0.1","127.0.0.1","OpcUa","334","UA Secure Conversation Message: ReadRequest"
"272","19.008054","127.0.0.1","127.0.0.1","TCP","44","53530  >  53271 [ACK] Seq=30184 Ack=12348 Win=52992 Len=0"
"273","19.010993","127.0.0.1","127.0.0.1","OpcUa","175","UA Secure Conversation Message: ReadResponse"
"274","19.011039","127.0.0.1","127.0.0.1","TCP","44","53271  >  53530 [ACK] Seq=12348 Ack=30315 Win=35072 Len=0"
"275","19.388259","127.0.0.1","127.0.0.1","OpcUa","192","UA Secure Conversation Message: CreateMonitoredItemsRequest"
"276","19.388310","127.0.0.1","127.0.0.1","TCP","44","53530  >  53271 [ACK] Seq=30315 Ack=12496 Win=52992 Len=0"
"277","19.390376","127.0.0.1","127.0.0.1","OpcUa","127","UA Secure Conversation Message: CreateMonitoredItemsResponse"
"278","19.390428","127.0.0.1","127.0.0.1","TCP","44","53271  >  53530 [ACK] Seq=12496 Ack=30398 Win=35072 Len=0"
"279","19.391102","127.0.0.1","127.0.0.1","OpcUa","176","UA Secure Conversation Message: TranslateBrowsePathsToNodeIdsRequest"
"280","19.391148","127.0.0.1","127.0.0.1","TCP","44","53530  >  53271 [ACK] Seq=30398 Ack=12628 Win=52736 Len=0"
"281","19.392794","127.0.0.1","127.0.0.1","OpcUa","112","UA Secure Conversation Message: TranslateBrowsePathsToNodeIdsResponse"
"282","19.392839","127.0.0.1","127.0.0.1","TCP","44","53271  >  53530 [ACK] Seq=12628 Ack=30466 Win=34816 Len=0"
"283","19.393004","127.0.0.1","127.0.0.1","OpcUa","174","UA Secure Conversation Message: TranslateBrowsePathsToNodeIdsRequest"
"284","19.393030","127.0.0.1","127.0.0.1","TCP","44","53530  >  53271 [ACK] Seq=30466 Ack=12758 Win=52736 Len=0"
"285","19.394310","127.0.0.1","127.0.0.1","OpcUa","112","UA Secure Conversation Message: TranslateBrowsePathsToNodeIdsResponse"
"286","19.394364","127.0.0.1","127.0.0.1","TCP","44","53271  >  53530 [ACK] Seq=12758 Ack=30534 Win=34816 Len=0"
"287","19.448437","127.0.0.1","127.0.0.1","OpcUa","240","UA Secure Conversation Message: PublishResponse"
"288","19.448481","127.0.0.1","127.0.0.1","TCP","44","53271  >  53530 [ACK] Seq=12758 Ack=30730 Win=34560 Len=0"
"289","19.462316","127.0.0.1","127.0.0.1","OpcUa","150","UA Secure Conversation Message: PublishRequest"
"290","19.462366","127.0.0.1","127.0.0.1","TCP","44","53530  >  53271 [ACK] Seq=30730 Ack=12864 Win=52480 Len=0"
"291","20.000049","127.0.0.1","127.0.0.1","OpcUa","496","UA Secure Conversation Message: ReadRequest"
"292","20.000099","127.0.0.1","127.0.0.1","TCP","44","53530  >  53271 [ACK] Seq=30730 Ack=13316 Win=51968 Len=0"
"293","20.000252","127.0.0.1","127.0.0.1","OpcUa","179","UA Secure Conversation Message: BrowseRequest"
"294","20.000288","127.0.0.1","127.0.0.1","TCP","44","53530  >  53271 [ACK] Seq=30730 Ack=13451 Win=51968 Len=0"
"295","20.002356","127.0.0.1","127.0.0.1","OpcUa","252","UA Secure Conversation Message: BrowseResponse"
"296","20.002423","127.0.0.1","127.0.0.1","TCP","44","53271  >  53530 [ACK] Seq=13451 Ack=30938 Win=34560 Len=0"
"297","20.002545","127.0.0.1","127.0.0.1","OpcUa","391","UA Secure Conversation Message: ReadResponse"
"298","20.002581","127.0.0.1","127.0.0.1","TCP","44","53271  >  53530 [ACK] Seq=13451 Ack=31285 Win=34048 Len=0"
"299","20.046156","127.0.0.1","127.0.0.1","OpcUa","334","UA Secure Conversation Message: ReadRequest"
"300","20.046199","127.0.0.1","127.0.0.1","TCP","44","53530  >  53271 [ACK] Seq=31285 Ack=13741 Win=51712 Len=0"
"301","20.048830","127.0.0.1","127.0.0.1","OpcUa","175","UA Secure Conversation Message: ReadResponse"
"302","20.048869","127.0.0.1","127.0.0.1","TCP","44","53271  >  53530 [ACK] Seq=13741 Ack=31416 Win=34048 Len=0"
"303","20.195602","127.0.0.1","127.0.0.1","OpcUa","208","UA Secure Conversation Message: ReadRequest"
"304","20.195695","127.0.0.1","127.0.0.1","TCP","44","53530  >  53271 [ACK] Seq=31416 Ack=13905 Win=51456 Len=0"
"305","20.198338","127.0.0.1","127.0.0.1","OpcUa","143","UA Secure Conversation Message: ReadResponse"
"306","20.198413","127.0.0.1","127.0.0.1","TCP","44","53271  >  53530 [ACK] Seq=13905 Ack=31515 Win=33792 Len=0"
"307","20.212608","127.0.0.1","127.0.0.1","OpcUa","133","UA Secure Conversation Message: PublishResponse"
"308","20.212676","127.0.0.1","127.0.0.1","TCP","44","53271  >  53530 [ACK] Seq=13905 Ack=31604 Win=33792 Len=0"
"309","20.227030","127.0.0.1","127.0.0.1","OpcUa","142","UA Secure Conversation Message: PublishRequest"
"310","20.227108","127.0.0.1","127.0.0.1","TCP","44","53530  >  53271 [ACK] Seq=31604 Ack=14003 Win=51456 Len=0"
"311","20.381160","127.0.0.1","127.0.0.1","OpcUa","192","UA Secure Conversation Message: CreateMonitoredItemsRequest"
"312","20.381214","127.0.0.1","127.0.0.1","TCP","44","53530  >  53271 [ACK] Seq=31604 Ack=14151 Win=51200 Len=0"
"313","20.382705","127.0.0.1","127.0.0.1","OpcUa","127","UA Secure Conversation Message: CreateMonitoredItemsResponse"
"314","20.382754","127.0.0.1","127.0.0.1","TCP","44","53271  >  53530 [ACK] Seq=14151 Ack=31687 Win=33792 Len=0"
"315","20.382997","127.0.0.1","127.0.0.1","OpcUa","176","UA Secure Conversation Message: TranslateBrowsePathsToNodeIdsRequest"
"316","20.383044","127.0.0.1","127.0.0.1","TCP","44","53530  >  53271 [ACK] Seq=31687 Ack=14283 Win=51200 Len=0"
"317","20.384270","127.0.0.1","127.0.0.1","OpcUa","112","UA Secure Conversation Message: TranslateBrowsePathsToNodeIdsResponse"
"318","20.384334","127.0.0.1","127.0.0.1","TCP","44","53271  >  53530 [ACK] Seq=14283 Ack=31755 Win=33536 Len=0"
"319","20.384596","127.0.0.1","127.0.0.1","OpcUa","174","UA Secure Conversation Message: TranslateBrowsePathsToNodeIdsRequest"
"320","20.384639","127.0.0.1","127.0.0.1","TCP","44","53530  >  53271 [ACK] Seq=31755 Ack=14413 Win=50944 Len=0"
"321","20.387237","127.0.0.1","127.0.0.1","OpcUa","112","UA Secure Conversation Message: TranslateBrowsePathsToNodeIdsResponse"
"322","20.387331","127.0.0.1","127.0.0.1","TCP","44","53271  >  53530 [ACK] Seq=14413 Ack=31823 Win=33536 Len=0"
"323","20.448521","127.0.0.1","127.0.0.1","OpcUa","270","UA Secure Conversation Message: PublishResponse"
"324","20.448564","127.0.0.1","127.0.0.1","TCP","44","53271  >  53530 [ACK] Seq=14413 Ack=32049 Win=33280 Len=0"
"325","20.461624","127.0.0.1","127.0.0.1","OpcUa","150","UA Secure Conversation Message: PublishRequest"
"326","20.461682","127.0.0.1","127.0.0.1","TCP","44","53530  >  53271 [ACK] Seq=32049 Ack=14519 Win=50944 Len=0"
"327","21.048048","127.0.0.1","127.0.0.1","OpcUa","496","UA Secure Conversation Message: ReadRequest"
"328","21.048096","127.0.0.1","127.0.0.1","TCP","44","53530  >  53271 [ACK] Seq=32049 Ack=14971 Win=50432 Len=0"
"329","21.048242","127.0.0.1","127.0.0.1","OpcUa","179","UA Secure Conversation Message: BrowseRequest"
"330","21.048279","127.0.0.1","127.0.0.1","TCP","44","53530  >  53271 [ACK] Seq=32049 Ack=15106 Win=50176 Len=0"
"331","21.051084","127.0.0.1","127.0.0.1","OpcUa","252","UA Secure Conversation Message: BrowseResponse"
"332","21.051136","127.0.0.1","127.0.0.1","TCP","44","53271  >  53530 [ACK] Seq=15106 Ack=32257 Win=33024 Len=0"
"333","21.051254","127.0.0.1","127.0.0.1","OpcUa","387","UA Secure Conversation Message: ReadResponse"
"334","21.051275","127.0.0.1","127.0.0.1","TCP","44","53271  >  53530 [ACK] Seq=15106 Ack=32600 Win=32768 Len=0"
"335","21.077659","127.0.0.1","127.0.0.1","OpcUa","334","UA Secure Conversation Message: ReadRequest"
"336","21.077706","127.0.0.1","127.0.0.1","TCP","44","53530  >  53271 [ACK] Seq=32600 Ack=15396 Win=49920 Len=0"
"337","21.080490","127.0.0.1","127.0.0.1","OpcUa","171","UA Secure Conversation Message: ReadResponse"
"338","21.080542","127.0.0.1","127.0.0.1","TCP","44","53271  >  53530 [ACK] Seq=15396 Ack=32727 Win=32768 Len=0"
"339","21.383015","127.0.0.1","127.0.0.1","OpcUa","192","UA Secure Conversation Message: CreateMonitoredItemsRequest"
"340","21.383077","127.0.0.1","127.0.0.1","TCP","44","53530  >  53271 [ACK] Seq=32727 Ack=15544 Win=49920 Len=0"
"341","21.386163","127.0.0.1","127.0.0.1","OpcUa","127","UA Secure Conversation Message: CreateMonitoredItemsResponse"
"342","21.386267","127.0.0.1","127.0.0.1","TCP","44","53271  >  53530 [ACK] Seq=15544 Ack=32810 Win=65280 Len=0"
"343","21.386876","127.0.0.1","127.0.0.1","OpcUa","176","UA Secure Conversation Message: TranslateBrowsePathsToNodeIdsRequest"
"344","21.386956","127.0.0.1","127.0.0.1","TCP","44","53530  >  53271 [ACK] Seq=32810 Ack=15676 Win=49664 Len=0"
"345","21.389183","127.0.0.1","127.0.0.1","OpcUa","112","UA Secure Conversation Message: TranslateBrowsePathsToNodeIdsResponse"
"346","21.389237","127.0.0.1","127.0.0.1","TCP","44","53271  >  53530 [ACK] Seq=15676 Ack=32878 Win=65280 Len=0"
"347","21.389462","127.0.0.1","127.0.0.1","OpcUa","174","UA Secure Conversation Message: TranslateBrowsePathsToNodeIdsRequest"
"348","21.389508","127.0.0.1","127.0.0.1","TCP","44","53530  >  53271 [ACK] Seq=32878 Ack=15806 Win=49664 Len=0"
"349","21.390711","127.0.0.1","127.0.0.1","OpcUa","112","UA Secure Conversation Message: TranslateBrowsePathsToNodeIdsResponse"
"350","21.390762","127.0.0.1","127.0.0.1","TCP","44","53271  >  53530 [ACK] Seq=15806 Ack=32946 Win=65280 Len=0"
"351","21.446989","127.0.0.1","127.0.0.1","OpcUa","300","UA Secure Conversation Message: PublishResponse"
"352","21.447036","127.0.0.1","127.0.0.1","TCP","44","53271  >  53530 [ACK] Seq=15806 Ack=33202 Win=65024 Len=0"
"353","21.461209","127.0.0.1","127.0.0.1","OpcUa","150","UA Secure Conversation Message: PublishRequest"
"354","21.461274","127.0.0.1","127.0.0.1","TCP","44","53530  >  53271 [ACK] Seq=33202 Ack=15912 Win=49408 Len=0"
"355","22.316018","127.0.0.1","127.0.0.1","OpcUa","179","UA Secure Conversation Message: BrowseRequest"
"356","22.316063","127.0.0.1","127.0.0.1","TCP","44","53530  >  53271 [ACK] Seq=33202 Ack=16047 Win=49408 Len=0"
"357","22.316254","127.0.0.1","127.0.0.1","OpcUa","496","UA Secure Conversation Message: ReadRequest"
"358","22.316324","127.0.0.1","127.0.0.1","TCP","44","53530  >  53271 [ACK] Seq=33202 Ack=16499 Win=48896 Len=0"
"359","22.318358","127.0.0.1","127.0.0.1","OpcUa","252","UA Secure Conversation Message: BrowseResponse"
"360","22.318498","127.0.0.1","127.0.0.1","TCP","44","53271  >  53530 [ACK] Seq=16499 Ack=33410 Win=64768 Len=0"
"361","22.319693","127.0.0.1","127.0.0.1","OpcUa","391","UA Secure Conversation Message: ReadResponse"
