"No.","Time","Source","Destination","Protocol","Length","Info"
"1","0.000000","127.0.0.1","127.0.0.1","UDP","1464","54217  >  5093 Len=1432"
"2","0.052534","127.0.0.1","127.0.0.1","UDP","1464","5093  >  54217 Len=1432"
"3","0.056806","127.0.0.1","127.0.0.1","UDP","1464","54217  >  5093 Len=1432"
"4","0.057592","127.0.0.1","127.0.0.1","UDP","1464","5093  >  54217 Len=1432"
"5","0.059141","127.0.0.1","127.0.0.1","UDP","1464","54217  >  5093 Len=1432"
"6","0.059631","127.0.0.1","127.0.0.1","UDP","1464","5093  >  54217 Len=1432"
"7","0.061145","127.0.0.1","127.0.0.1","UDP","1464","54217  >  5093 Len=1432"
"8","0.061647","127.0.0.1","127.0.0.1","UDP","1464","5093  >  54217 Len=1432"
"9","1.634769","::1","::1","TLSv1.2","89","Application Data"
"10","1.634868","::1","::1","TCP","64","64964  >  8900 [ACK] Seq=1 Ack=26 Win=220 Len=0"
"11","1.636033","::1","::1","TLSv1.2","93","Application Data"
"12","1.636137","::1","::1","TCP","64","8900  >  64964 [ACK] Seq=26 Ack=30 Win=187 Len=0"
"13","15.011298","127.0.0.1","127.0.0.1","UDP","1464","54217  >  5093 Len=1432"
"14","15.062168","127.0.0.1","127.0.0.1","UDP","1464","5093  >  54217 Len=1432"
"15","15.067030","127.0.0.1","127.0.0.1","UDP","1464","54217  >  5093 Len=1432"
"16","15.067365","127.0.0.1","127.0.0.1","UDP","1464","5093  >  54217 Len=1432"
"17","15.068752","127.0.0.1","127.0.0.1","UDP","1464","54217  >  5093 Len=1432"
"18","15.069174","127.0.0.1","127.0.0.1","UDP","1464","5093  >  54217 Len=1432"
"19","15.070747","127.0.0.1","127.0.0.1","UDP","1464","54217  >  5093 Len=1432"
"20","15.071126","127.0.0.1","127.0.0.1","UDP","1464","5093  >  54217 Len=1432"
"21","26.638182","::1","::1","TLSv1.2","89","Application Data"
"22","26.638248","::1","::1","TCP","64","64964  >  8900 [ACK] Seq=30 Ack=51 Win=220 Len=0"
"23","26.639130","::1","::1","TLSv1.2","93","Application Data"
"24","26.639199","::1","::1","TCP","64","8900  >  64964 [ACK] Seq=51 Ack=59 Win=187 Len=0"
"25","30.016399","127.0.0.1","127.0.0.1","UDP","1464","54217  >  5093 Len=1432"
"26","30.056943","127.0.0.1","127.0.0.1","UDP","1464","5093  >  54217 Len=1432"
"27","30.061284","127.0.0.1","127.0.0.1","UDP","1464","54217  >  5093 Len=1432"
"28","30.061624","127.0.0.1","127.0.0.1","UDP","1464","5093  >  54217 Len=1432"
"29","30.063199","127.0.0.1","127.0.0.1","UDP","1464","54217  >  5093 Len=1432"
"30","30.063545","127.0.0.1","127.0.0.1","UDP","1464","5093  >  54217 Len=1432"
"31","30.064923","127.0.0.1","127.0.0.1","UDP","1464","54217  >  5093 Len=1432"
"32","30.065356","127.0.0.1","127.0.0.1","UDP","1464","5093  >  54217 Len=1432"
"33","45.022152","127.0.0.1","127.0.0.1","UDP","1464","54217  >  5093 Len=1432"
"34","45.065040","127.0.0.1","127.0.0.1","UDP","1464","5093  >  54217 Len=1432"
"35","45.069072","127.0.0.1","127.0.0.1","UDP","1464","54217  >  5093 Len=1432"
"36","45.069499","127.0.0.1","127.0.0.1","UDP","1464","5093  >  54217 Len=1432"
"37","45.070814","127.0.0.1","127.0.0.1","UDP","1464","54217  >  5093 Len=1432"
"38","45.071177","127.0.0.1","127.0.0.1","UDP","1464","5093  >  54217 Len=1432"
"39","45.072550","127.0.0.1","127.0.0.1","UDP","1464","54217  >  5093 Len=1432"
"40","45.072867","127.0.0.1","127.0.0.1","UDP","1464","5093  >  54217 Len=1432"
"41","51.643359","::1","::1","TLSv1.2","89","Application Data"
"42","51.643437","::1","::1","TCP","64","64964  >  8900 [ACK] Seq=59 Ack=76 Win=220 Len=0"
"43","51.644792","::1","::1","TLSv1.2","93","Application Data"
"44","51.644888","::1","::1","TCP","64","8900  >  64964 [ACK] Seq=76 Ack=88 Win=187 Len=0"
"45","60.035472","127.0.0.1","127.0.0.1","UDP","1464","54217  >  5093 Len=1432"
"46","60.083425","127.0.0.1","127.0.0.1","UDP","1464","5093  >  54217 Len=1432"
"47","60.087997","127.0.0.1","127.0.0.1","UDP","1464","54217  >  5093 Len=1432"
"48","60.088339","127.0.0.1","127.0.0.1","UDP","1464","5093  >  54217 Len=1432"
"49","60.089803","127.0.0.1","127.0.0.1","UDP","1464","54217  >  5093 Len=1432"
"50","60.090129","127.0.0.1","127.0.0.1","UDP","1464","5093  >  54217 Len=1432"
"51","60.091664","127.0.0.1","127.0.0.1","UDP","1464","54217  >  5093 Len=1432"
"52","60.092162","127.0.0.1","127.0.0.1","UDP","1464","5093  >  54217 Len=1432"
"53","62.481134","127.0.0.1","127.0.0.1","TCP","56","53540  >  53530 [SYN] Seq=0 Win=65535 Len=0 MSS=65495 WS=256 SACK_PERM"
"54","62.481399","127.0.0.1","127.0.0.1","TCP","56","53530  >  53540 [SYN, ACK] Seq=0 Ack=1 Win=65535 Len=0 MSS=65495 WS=256 SACK_PERM"
"55","62.481471","127.0.0.1","127.0.0.1","TCP","44","53540  >  53530 [ACK] Seq=1 Ack=1 Win=65280 Len=0"
"56","62.482058","127.0.0.1","127.0.0.1","OpcUa","128","Hello message"
"57","62.482094","127.0.0.1","127.0.0.1","TCP","44","53530  >  53540 [ACK] Seq=1 Ack=85 Win=65280 Len=0"
"58","62.578406","127.0.0.1","127.0.0.1","OpcUa","72","Acknowledge message"
"59","62.578480","127.0.0.1","127.0.0.1","TCP","44","53540  >  53530 [ACK] Seq=85 Ack=29 Win=65280 Len=0"
"60","62.578865","127.0.0.1","127.0.0.1","OpcUa","177","OpenSecureChannel message"
"61","62.578939","127.0.0.1","127.0.0.1","TCP","44","53530  >  53540 [ACK] Seq=29 Ack=218 Win=65280 Len=0"
"62","62.605187","127.0.0.1","127.0.0.1","OpcUa","179","OpenSecureChannel message"
"63","62.605275","127.0.0.1","127.0.0.1","TCP","44","53540  >  53530 [ACK] Seq=218 Ack=164 Win=65280 Len=0"
"64","62.605662","127.0.0.1","127.0.0.1","OpcUa","165","UA Secure Conversation Message: GetEndpointsRequest"
"65","62.605746","127.0.0.1","127.0.0.1","TCP","44","53530  >  53540 [ACK] Seq=164 Ack=339 Win=65024 Len=0"
"66","62.627705","127.0.0.1","127.0.0.1","OpcUa","20188","UA Secure Conversation Message: GetEndpointsResponse"
"67","62.627907","127.0.0.1","127.0.0.1","TCP","44","53540  >  53530 [ACK] Seq=339 Ack=20308 Win=45056 Len=0"
"68","62.628362","127.0.0.1","127.0.0.1","OpcUa","101","CloseSecureChannel message: CloseSecureChannelRequest"
"69","62.628420","127.0.0.1","127.0.0.1","TCP","44","53530  >  53540 [ACK] Seq=20308 Ack=396 Win=65024 Len=0"
"70","62.628465","127.0.0.1","127.0.0.1","TCP","44","53540  >  53530 [FIN, ACK] Seq=396 Ack=20308 Win=45056 Len=0"
"71","62.628492","127.0.0.1","127.0.0.1","TCP","44","53530  >  53540 [ACK] Seq=20308 Ack=397 Win=65024 Len=0"
"72","62.636907","127.0.0.1","127.0.0.1","TCP","44","53530  >  53540 [FIN, ACK] Seq=20308 Ack=397 Win=65024 Len=0"
"73","62.637026","127.0.0.1","127.0.0.1","TCP","44","53540  >  53530 [ACK] Seq=397 Ack=20309 Win=45056 Len=0"
"74","62.754703","127.0.0.1","127.0.0.1","TCP","56","53541  >  53530 [SYN] Seq=0 Win=65535 Len=0 MSS=65495 WS=256 SACK_PERM"
"75","62.754840","127.0.0.1","127.0.0.1","TCP","56","53530  >  53541 [SYN, ACK] Seq=0 Ack=1 Win=65535 Len=0 MSS=65495 WS=256 SACK_PERM"
"76","62.754913","127.0.0.1","127.0.0.1","TCP","44","53541  >  53530 [ACK] Seq=1 Ack=1 Win=65280 Len=0"
"77","62.755299","127.0.0.1","127.0.0.1","OpcUa","128","Hello message"
"78","62.755352","127.0.0.1","127.0.0.1","TCP","44","53530  >  53541 [ACK] Seq=1 Ack=85 Win=65280 Len=0"
"79","62.761892","127.0.0.1","127.0.0.1","OpcUa","72","Acknowledge message"
"80","62.761965","127.0.0.1","127.0.0.1","TCP","44","53541  >  53530 [ACK] Seq=85 Ack=29 Win=65280 Len=0"
"81","62.762260","127.0.0.1","127.0.0.1","OpcUa","177","OpenSecureChannel message"
"82","62.762342","127.0.0.1","127.0.0.1","TCP","44","53530  >  53541 [ACK] Seq=29 Ack=218 Win=65280 Len=0"
"83","62.765974","127.0.0.1","127.0.0.1","OpcUa","179","OpenSecureChannel message"
"84","62.766053","127.0.0.1","127.0.0.1","TCP","44","53541  >  53530 [ACK] Seq=218 Ack=164 Win=65280 Len=0"
"85","62.766740","127.0.0.1","127.0.0.1","OpcUa","423","UA Secure Conversation Message: CreateSessionRequest"
"86","62.766815","127.0.0.1","127.0.0.1","TCP","44","53530  >  53541 [ACK] Seq=164 Ack=597 Win=64768 Len=0"
"87","62.855462","127.0.0.1","127.0.0.1","OpcUa","21331","UA Secure Conversation Message: CreateSessionResponse"
"88","62.855721","127.0.0.1","127.0.0.1","TCP","44","53541  >  53530 [ACK] Seq=597 Ack=21451 Win=44032 Len=0"
"89","62.858467","127.0.0.1","127.0.0.1","OpcUa","193","UA Secure Conversation Message: ActivateSessionRequest"
"90","62.858560","127.0.0.1","127.0.0.1","TCP","44","53530  >  53541 [ACK] Seq=21451 Ack=746 Win=64768 Len=0"
"91","62.881424","127.0.0.1","127.0.0.1","OpcUa","140","UA Secure Conversation Message: ActivateSessionResponse"
"92","62.881515","127.0.0.1","127.0.0.1","TCP","44","53541  >  53530 [ACK] Seq=746 Ack=21547 Win=43776 Len=0"
"93","62.882048","127.0.0.1","127.0.0.1","OpcUa","190","UA Secure Conversation Message: ReadRequest"
"94","62.882129","127.0.0.1","127.0.0.1","TCP","44","53530  >  53541 [ACK] Seq=21547 Ack=892 Win=64512 Len=0"
"95","62.907379","127.0.0.1","127.0.0.1","OpcUa","116","UA Secure Conversation Message: ReadResponse"
"96","62.907468","127.0.0.1","127.0.0.1","TCP","44","53541  >  53530 [ACK] Seq=892 Ack=21619 Win=43776 Len=0"
"97","62.908056","127.0.0.1","127.0.0.1","OpcUa","496","UA Secure Conversation Message: ReadRequest"
"98","62.908129","127.0.0.1","127.0.0.1","TCP","44","53530  >  53541 [ACK] Seq=21619 Ack=1344 Win=64000 Len=0"
"99","62.924027","127.0.0.1","127.0.0.1","OpcUa","565","UA Secure Conversation Message: ReadResponse"
"100","62.924129","127.0.0.1","127.0.0.1","TCP","44","53541  >  53530 [ACK] Seq=1344 Ack=22140 Win=43264 Len=0"
"101","62.926288","127.0.0.1","127.0.0.1","OpcUa","172","UA Secure Conversation Message: ReadRequest"
"102","62.926481","127.0.0.1","127.0.0.1","TCP","44","53530  >  53541 [ACK] Seq=22140 Ack=1472 Win=64000 Len=0"
"103","62.939358","127.0.0.1","127.0.0.1","OpcUa","107","UA Secure Conversation Message: ReadResponse"
"104","62.939460","127.0.0.1","127.0.0.1","TCP","44","53541  >  53530 [ACK] Seq=1472 Ack=22203 Win=43264 Len=0"
"105","62.940057","127.0.0.1","127.0.0.1","OpcUa","160","UA Secure Conversation Message: CreateSubscriptionRequest"
"106","62.940146","127.0.0.1","127.0.0.1","TCP","44","53530  >  53541 [ACK] Seq=22203 Ack=1588 Win=63744 Len=0"
"107","63.022694","127.0.0.1","127.0.0.1","OpcUa","116","UA Secure Conversation Message: CreateSubscriptionResponse"
"108","63.022802","127.0.0.1","127.0.0.1","TCP","44","53541  >  53530 [ACK] Seq=1588 Ack=22275 Win=43008 Len=0"
"109","63.023128","127.0.0.1","127.0.0.1","OpcUa","320","UA Secure Conversation Message: CreateMonitoredItemsRequest"
"110","63.023184","127.0.0.1","127.0.0.1","TCP","44","53530  >  53541 [ACK] Seq=22275 Ack=1864 Win=63488 Len=0"
"111","63.126751","127.0.0.1","127.0.0.1","OpcUa","182","UA Secure Conversation Message: CreateMonitoredItemsResponse"
"112","63.126853","127.0.0.1","127.0.0.1","TCP","44","53541  >  53530 [ACK] Seq=1864 Ack=22413 Win=43008 Len=0"
"113","63.130356","127.0.0.1","127.0.0.1","OpcUa","177","UA Secure Conversation Message: BrowseRequest"
"114","63.130437","127.0.0.1","127.0.0.1","TCP","44","53530  >  53541 [ACK] Seq=22413 Ack=1997 Win=63488 Len=0"
"115","63.152153","127.0.0.1","127.0.0.1","OpcUa","240","UA Secure Conversation Message: BrowseResponse"
"116","63.152244","127.0.0.1","127.0.0.1","TCP","44","53541  >  53530 [ACK] Seq=1997 Ack=22609 Win=42752 Len=0"
"117","63.153402","127.0.0.1","127.0.0.1","OpcUa","314","UA Secure Conversation Message: ReadRequest"
"118","63.153484","127.0.0.1","127.0.0.1","TCP","44","53530  >  53541 [ACK] Seq=22609 Ack=2267 Win=63232 Len=0"
"119","63.169261","127.0.0.1","127.0.0.1","OpcUa","194","UA Secure Conversation Message: ReadResponse"
"120","63.169391","127.0.0.1","127.0.0.1","TCP","44","53541  >  53530 [ACK] Seq=2267 Ack=22759 Win=42752 Len=0"
"121","63.169757","127.0.0.1","127.0.0.1","OpcUa","177","UA Secure Conversation Message: BrowseRequest"
"122","63.169810","127.0.0.1","127.0.0.1","TCP","44","53530  >  53541 [ACK] Seq=22759 Ack=2400 Win=62976 Len=0"
"123","63.182820","127.0.0.1","127.0.0.1","OpcUa","142","UA Secure Conversation Message: BrowseResponse"
"124","63.182906","127.0.0.1","127.0.0.1","TCP","44","53541  >  53530 [ACK] Seq=2400 Ack=22857 Win=42496 Len=0"
"125","63.183373","127.0.0.1","127.0.0.1","OpcUa","314","UA Secure Conversation Message: ReadRequest"
"126","63.183468","127.0.0.1","127.0.0.1","TCP","44","53530  >  53541 [ACK] Seq=22857 Ack=2670 Win=62720 Len=0"
"127","63.196720","127.0.0.1","127.0.0.1","OpcUa","238","UA Secure Conversation Message: ReadResponse"
"128","63.196941","127.0.0.1","127.0.0.1","TCP","44","53541  >  53530 [ACK] Seq=2670 Ack=23051 Win=42240 Len=0"
"129","63.197396","127.0.0.1","127.0.0.1","OpcUa","177","UA Secure Conversation Message: BrowseRequest"
"130","63.197476","127.0.0.1","127.0.0.1","TCP","44","53530  >  53541 [ACK] Seq=23051 Ack=2803 Win=62720 Len=0"
"131","63.209545","127.0.0.1","127.0.0.1","OpcUa","142","UA Secure Conversation Message: BrowseResponse"
"132","63.209674","127.0.0.1","127.0.0.1","TCP","44","53541  >  53530 [ACK] Seq=2803 Ack=23149 Win=42240 Len=0"
"133","63.210174","127.0.0.1","127.0.0.1","OpcUa","314","UA Secure Conversation Message: ReadRequest"
"134","63.210236","127.0.0.1","127.0.0.1","TCP","44","53530  >  53541 [ACK] Seq=23149 Ack=3073 Win=62208 Len=0"
"135","63.222075","127.0.0.1","127.0.0.1","OpcUa","181","UA Secure Conversation Message: ReadResponse"
"136","63.222189","127.0.0.1","127.0.0.1","TCP","44","53541  >  53530 [ACK] Seq=3073 Ack=23286 Win=42240 Len=0"
"137","63.222796","127.0.0.1","127.0.0.1","OpcUa","177","UA Secure Conversation Message: BrowseRequest"
"138","63.222881","127.0.0.1","127.0.0.1","TCP","44","53530  >  53541 [ACK] Seq=23286 Ack=3206 Win=62208 Len=0"
"139","63.235029","127.0.0.1","127.0.0.1","OpcUa","116","UA Secure Conversation Message: BrowseResponse"
"140","63.235147","127.0.0.1","127.0.0.1","TCP","44","53541  >  53530 [ACK] Seq=3206 Ack=23358 Win=41984 Len=0"
"141","63.244827","127.0.0.1","127.0.0.1","OpcUa","177","UA Secure Conversation Message: BrowseRequest"
"142","63.244922","127.0.0.1","127.0.0.1","TCP","44","53530  >  53541 [ACK] Seq=23358 Ack=3339 Win=61952 Len=0"
"143","63.256195","127.0.0.1","127.0.0.1","OpcUa","463","UA Secure Conversation Message: BrowseResponse"
"144","63.256274","127.0.0.1","127.0.0.1","TCP","44","53541  >  53530 [ACK] Seq=3339 Ack=23777 Win=41728 Len=0"
"145","63.321993","127.0.0.1","127.0.0.1","OpcUa","334","UA Secure Conversation Message: ReadRequest"
"146","63.322053","127.0.0.1","127.0.0.1","TCP","44","53530  >  53541 [ACK] Seq=23777 Ack=3629 Win=61696 Len=0"
"147","63.331713","127.0.0.1","127.0.0.1","OpcUa","184","UA Secure Conversation Message: ReadResponse"
"148","63.331778","127.0.0.1","127.0.0.1","TCP","44","53541  >  53530 [ACK] Seq=3629 Ack=23917 Win=41472 Len=0"
"149","63.332101","127.0.0.1","127.0.0.1","OpcUa","179","UA Secure Conversation Message: BrowseRequest"
"150","63.332133","127.0.0.1","127.0.0.1","TCP","44","53530  >  53541 [ACK] Seq=23917 Ack=3764 Win=61696 Len=0"
"151","63.339646","127.0.0.1","127.0.0.1","OpcUa","142","UA Secure Conversation Message: BrowseResponse"
"152","63.339741","127.0.0.1","127.0.0.1","TCP","44","53541  >  53530 [ACK] Seq=3764 Ack=24015 Win=41472 Len=0"
"153","63.340104","127.0.0.1","127.0.0.1","OpcUa","314","UA Secure Conversation Message: ReadRequest"
"154","63.340160","127.0.0.1","127.0.0.1","TCP","44","53530  >  53541 [ACK] Seq=24015 Ack=4034 Win=61440 Len=0"
"155","63.347408","127.0.0.1","127.0.0.1","OpcUa","192","UA Secure Conversation Message: ReadResponse"
"156","63.347491","127.0.0.1","127.0.0.1","TCP","44","53541  >  53530 [ACK] Seq=4034 Ack=24163 Win=41216 Len=0"
"157","63.347800","127.0.0.1","127.0.0.1","OpcUa","177","UA Secure Conversation Message: BrowseRequest"
"158","63.347856","127.0.0.1","127.0.0.1","TCP","44","53530  >  53541 [ACK] Seq=24163 Ack=4167 Win=61184 Len=0"
"159","63.354694","127.0.0.1","127.0.0.1","OpcUa","116","UA Secure Conversation Message: BrowseResponse"
"160","63.354770","127.0.0.1","127.0.0.1","TCP","44","53541  >  53530 [ACK] Seq=4167 Ack=24235 Win=41216 Len=0"
"161","63.355363","127.0.0.1","127.0.0.1","OpcUa","334","UA Secure Conversation Message: ReadRequest"
"162","63.355435","127.0.0.1","127.0.0.1","TCP","44","53530  >  53541 [ACK] Seq=24235 Ack=4457 Win=60928 Len=0"
"163","63.362452","127.0.0.1","127.0.0.1","OpcUa","206","UA Secure Conversation Message: ReadResponse"
"164","63.362536","127.0.0.1","127.0.0.1","TCP","44","53541  >  53530 [ACK] Seq=4457 Ack=24397 Win=40960 Len=0"
"165","63.362851","127.0.0.1","127.0.0.1","OpcUa","179","UA Secure Conversation Message: BrowseRequest"
"166","63.362904","127.0.0.1","127.0.0.1","TCP","44","53530  >  53541 [ACK] Seq=24397 Ack=4592 Win=60928 Len=0"
"167","63.368673","127.0.0.1","127.0.0.1","OpcUa","142","UA Secure Conversation Message: BrowseResponse"
"168","63.368751","127.0.0.1","127.0.0.1","TCP","44","53541  >  53530 [ACK] Seq=4592 Ack=24495 Win=40960 Len=0"
"169","63.381170","127.0.0.1","127.0.0.1","OpcUa","160","UA Secure Conversation Message: CreateSubscriptionRequest"
"170","63.381228","127.0.0.1","127.0.0.1","TCP","44","53530  >  53541 [ACK] Seq=24495 Ack=4708 Win=60672 Len=0"
"171","63.399140","127.0.0.1","127.0.0.1","OpcUa","116","UA Secure Conversation Message: CreateSubscriptionResponse"
"172","63.399216","127.0.0.1","127.0.0.1","TCP","44","53541  >  53530 [ACK] Seq=4708 Ack=24567 Win=40960 Len=0"
"173","63.399651","127.0.0.1","127.0.0.1","OpcUa","1524","UA Secure Conversation Message: ReadRequest"
"174","63.399717","127.0.0.1","127.0.0.1","TCP","44","53530  >  53541 [ACK] Seq=24567 Ack=6188 Win=59136 Len=0"
"175","63.411309","127.0.0.1","127.0.0.1","OpcUa","528","UA Secure Conversation Message: ReadResponse"
"176","63.411387","127.0.0.1","127.0.0.1","TCP","44","53541  >  53530 [ACK] Seq=6188 Ack=25051 Win=40448 Len=0"
"177","63.411841","127.0.0.1","127.0.0.1","OpcUa","431","UA Secure Conversation Message: CreateMonitoredItemsRequest"
"178","63.411976","127.0.0.1","127.0.0.1","TCP","44","53530  >  53541 [ACK] Seq=25051 Ack=6575 Win=58880 Len=0"
"179","63.435241","127.0.0.1","127.0.0.1","OpcUa","242","UA Secure Conversation Message: CreateMonitoredItemsResponse"
"180","63.435414","127.0.0.1","127.0.0.1","TCP","44","53541  >  53530 [ACK] Seq=6575 Ack=25249 Win=40192 Len=0"
"181","63.435768","127.0.0.1","127.0.0.1","OpcUa","314","UA Secure Conversation Message: ReadRequest"
"182","63.435843","127.0.0.1","127.0.0.1","TCP","44","53530  >  53541 [ACK] Seq=25249 Ack=6845 Win=58624 Len=0"
"183","63.442352","127.0.0.1","127.0.0.1","OpcUa","184","UA Secure Conversation Message: ReadResponse"
"184","63.442426","127.0.0.1","127.0.0.1","TCP","44","53541  >  53530 [ACK] Seq=6845 Ack=25389 Win=39936 Len=0"
"185","63.442848","127.0.0.1","127.0.0.1","OpcUa","314","UA Secure Conversation Message: ReadRequest"
"186","63.442902","127.0.0.1","127.0.0.1","TCP","44","53530  >  53541 [ACK] Seq=25389 Ack=7115 Win=58368 Len=0"
"187","63.448521","127.0.0.1","127.0.0.1","OpcUa","174","UA Secure Conversation Message: ReadResponse"
"188","63.448598","127.0.0.1","127.0.0.1","TCP","44","53541  >  53530 [ACK] Seq=7115 Ack=25519 Win=39936 Len=0"
"189","63.449128","127.0.0.1","127.0.0.1","OpcUa","314","UA Secure Conversation Message: ReadRequest"
"190","63.449187","127.0.0.1","127.0.0.1","TCP","44","53530  >  53541 [ACK] Seq=25519 Ack=7385 Win=58112 Len=0"
"191","63.455795","127.0.0.1","127.0.0.1","OpcUa","176","UA Secure Conversation Message: ReadResponse"
"192","63.455865","127.0.0.1","127.0.0.1","TCP","44","53541  >  53530 [ACK] Seq=7385 Ack=25651 Win=39680 Len=0"
"193","63.456367","127.0.0.1","127.0.0.1","OpcUa","341","UA Secure Conversation Message: TranslateBrowsePathsToNodeIdsRequest"
"194","63.456429","127.0.0.1","127.0.0.1","TCP","44","53530  >  53541 [ACK] Seq=25651 Ack=7682 Win=57600 Len=0"
"195","63.470794","127.0.0.1","127.0.0.1","OpcUa","144","UA Secure Conversation Message: TranslateBrowsePathsToNodeIdsResponse"
"196","63.470877","127.0.0.1","127.0.0.1","TCP","44","53541  >  53530 [ACK] Seq=7682 Ack=25751 Win=39680 Len=0"
"197","63.471176","127.0.0.1","127.0.0.1","OpcUa","331","UA Secure Conversation Message: TranslateBrowsePathsToNodeIdsRequest"
"198","63.471220","127.0.0.1","127.0.0.1","TCP","44","53530  >  53541 [ACK] Seq=25751 Ack=7969 Win=57344 Len=0"
"199","63.478044","127.0.0.1","127.0.0.1","OpcUa","144","UA Secure Conversation Message: TranslateBrowsePathsToNodeIdsResponse"
"200","63.478152","127.0.0.1","127.0.0.1","TCP","44","53541  >  53530 [ACK] Seq=7969 Ack=25851 Win=39680 Len=0"
"201","63.500133","127.0.0.1","127.0.0.1","OpcUa","142","UA Secure Conversation Message: PublishRequest"
"202","63.500215","127.0.0.1","127.0.0.1","TCP","44","53530  >  53541 [ACK] Seq=25851 Ack=8067 Win=57344 Len=0"
"203","63.500273","127.0.0.1","127.0.0.1","OpcUa","142","UA Secure Conversation Message: PublishRequest"
"204","63.500290","127.0.0.1","127.0.0.1","TCP","44","53530  >  53541 [ACK] Seq=25851 Ack=8165 Win=57344 Len=0"
"205","63.500320","127.0.0.1","127.0.0.1","OpcUa","142","UA Secure Conversation Message: PublishRequest"
"206","63.500333","127.0.0.1","127.0.0.1","TCP","44","53530  >  53541 [ACK] Seq=25851 Ack=8263 Win=57088 Len=0"
"207","63.510618","127.0.0.1","127.0.0.1","OpcUa","129","UA Secure Conversation Message: PublishResponse"
"208","63.510704","127.0.0.1","127.0.0.1","TCP","44","53541  >  53530 [ACK] Seq=8263 Ack=25936 Win=39424 Len=0"
"209","63.515430","127.0.0.1","127.0.0.1","OpcUa","142","UA Secure Conversation Message: PublishRequest"
"210","63.515511","127.0.0.1","127.0.0.1","TCP","44","53530  >  53541 [ACK] Seq=25936 Ack=8361 Win=57088 Len=0"
"211","63.895718","127.0.0.1","127.0.0.1","OpcUa","289","UA Secure Conversation Message: PublishResponse"
"212","63.895794","127.0.0.1","127.0.0.1","TCP","44","53541  >  53530 [ACK] Seq=8361 Ack=26181 Win=39168 Len=0"
"213","63.906419","127.0.0.1","127.0.0.1","OpcUa","150","UA Secure Conversation Message: PublishRequest"
"214","63.906491","127.0.0.1","127.0.0.1","TCP","44","53530  >  53541 [ACK] Seq=26181 Ack=8467 Win=56832 Len=0"
"215","64.392589","127.0.0.1","127.0.0.1","OpcUa","206","UA Secure Conversation Message: PublishResponse"
"216","64.392673","127.0.0.1","127.0.0.1","TCP","44","53541  >  53530 [ACK] Seq=8467 Ack=26343 Win=39168 Len=0"
"217","64.405304","127.0.0.1","127.0.0.1","OpcUa","150","UA Secure Conversation Message: PublishRequest"
"218","64.405373","127.0.0.1","127.0.0.1","TCP","44","53530  >  53541 [ACK] Seq=26343 Ack=8573 Win=56832 Len=0"
"219","65.388536","127.0.0.1","127.0.0.1","OpcUa","206","UA Secure Conversation Message: PublishResponse"
"220","65.388627","127.0.0.1","127.0.0.1","TCP","44","53541  >  53530 [ACK] Seq=8573 Ack=26505 Win=38912 Len=0"
"221","65.401444","127.0.0.1","127.0.0.1","OpcUa","150","UA Secure Conversation Message: PublishRequest"
"222","65.401538","127.0.0.1","127.0.0.1","TCP","44","53530  >  53541 [ACK] Seq=26505 Ack=8679 Win=56832 Len=0"
"223","66.402601","127.0.0.1","127.0.0.1","OpcUa","210","UA Secure Conversation Message: PublishResponse"
"224","66.402697","127.0.0.1","127.0.0.1","TCP","44","53541  >  53530 [ACK] Seq=8679 Ack=26671 Win=38656 Len=0"
"225","66.415627","127.0.0.1","127.0.0.1","OpcUa","150","UA Secure Conversation Message: PublishRequest"
"226","66.415758","127.0.0.1","127.0.0.1","TCP","44","53530  >  53541 [ACK] Seq=26671 Ack=8785 Win=56576 Len=0"
"227","66.452171","127.0.0.1","127.0.0.1","OpcUa","192","UA Secure Conversation Message: BrowseRequest"
"228","66.452256","127.0.0.1","127.0.0.1","TCP","44","53530  >  53541 [ACK] Seq=26671 Ack=8933 Win=56576 Len=0"
"229","66.458262","127.0.0.1","127.0.0.1","OpcUa","794","UA Secure Conversation Message: BrowseResponse"
"230","66.458359","127.0.0.1","127.0.0.1","TCP","44","53541  >  53530 [ACK] Seq=8933 Ack=27421 Win=37888 Len=0"
"231","67.401350","127.0.0.1","127.0.0.1","OpcUa","210","UA Secure Conversation Message: PublishResponse"
"232","67.401426","127.0.0.1","127.0.0.1","TCP","44","53541  >  53530 [ACK] Seq=8933 Ack=27587 Win=37888 Len=0"
"233","67.413329","127.0.0.1","127.0.0.1","OpcUa","150","UA Secure Conversation Message: PublishRequest"
"234","67.413446","127.0.0.1","127.0.0.1","TCP","44","53530  >  53541 [ACK] Seq=27587 Ack=9039 Win=56320 Len=0"
"235","68.399918","127.0.0.1","127.0.0.1","OpcUa","210","UA Secure Conversation Message: PublishResponse"
"236","68.399992","127.0.0.1","127.0.0.1","TCP","44","53541  >  53530 [ACK] Seq=9039 Ack=27753 Win=37632 Len=0"
"237","68.413033","127.0.0.1","127.0.0.1","OpcUa","150","UA Secure Conversation Message: PublishRequest"
"238","68.413246","127.0.0.1","127.0.0.1","TCP","44","53530  >  53541 [ACK] Seq=27753 Ack=9145 Win=56320 Len=0"
"239","68.476215","127.0.0.1","127.0.0.1","OpcUa","133","UA Secure Conversation Message: PublishResponse"
"240","68.476278","127.0.0.1","127.0.0.1","TCP","44","53541  >  53530 [ACK] Seq=9145 Ack=27842 Win=37632 Len=0"
"241","68.490265","127.0.0.1","127.0.0.1","OpcUa","142","UA Secure Conversation Message: PublishRequest"
"242","68.490330","127.0.0.1","127.0.0.1","TCP","44","53530  >  53541 [ACK] Seq=27842 Ack=9243 Win=56064 Len=0"
"243","68.490388","127.0.0.1","127.0.0.1","OpcUa","208","UA Secure Conversation Message: ReadRequest"
"244","68.490416","127.0.0.1","127.0.0.1","TCP","44","53530  >  53541 [ACK] Seq=27842 Ack=9407 Win=56064 Len=0"
"245","68.495351","127.0.0.1","127.0.0.1","OpcUa","143","UA Secure Conversation Message: ReadResponse"
"246","68.495424","127.0.0.1","127.0.0.1","TCP","44","53541  >  53530 [ACK] Seq=9407 Ack=27941 Win=37376 Len=0"
"247","69.395379","127.0.0.1","127.0.0.1","OpcUa","210","UA Secure Conversation Message: PublishResponse"
"248","69.395472","127.0.0.1","127.0.0.1","TCP","44","53541  >  53530 [ACK] Seq=9407 Ack=28107 Win=37376 Len=0"
"249","69.408217","127.0.0.1","127.0.0.1","OpcUa","150","UA Secure Conversation Message: PublishRequest"
"250","69.408314","127.0.0.1","127.0.0.1","TCP","44","53530  >  53541 [ACK] Seq=28107 Ack=9513 Win=55808 Len=0"
"251","70.390513","127.0.0.1","127.0.0.1","OpcUa","210","UA Secure Conversation Message: PublishResponse"
"252","70.390583","127.0.0.1","127.0.0.1","TCP","44","53541  >  53530 [ACK] Seq=9513 Ack=28273 Win=37120 Len=0"
"253","70.402146","127.0.0.1","127.0.0.1","OpcUa","150","UA Secure Conversation Message: PublishRequest"
"254","70.402212","127.0.0.1","127.0.0.1","TCP","44","53530  >  53541 [ACK] Seq=28273 Ack=9619 Win=55808 Len=0"
"255","71.388512","127.0.0.1","127.0.0.1","OpcUa","206","UA Secure Conversation Message: PublishResponse"
"256","71.388593","127.0.0.1","127.0.0.1","TCP","44","53541  >  53530 [ACK] Seq=9619 Ack=28435 Win=36864 Len=0"
"257","71.400644","127.0.0.1","127.0.0.1","OpcUa","150","UA Secure Conversation Message: PublishRequest"
"258","71.400730","127.0.0.1","127.0.0.1","TCP","44","53530  >  53541 [ACK] Seq=28435 Ack=9725 Win=55808 Len=0"
"259","72.400869","127.0.0.1","127.0.0.1","OpcUa","210","UA Secure Conversation Message: PublishResponse"
"260","72.400955","127.0.0.1","127.0.0.1","TCP","44","53541  >  53530 [ACK] Seq=9725 Ack=28601 Win=36864 Len=0"
"261","72.414072","127.0.0.1","127.0.0.1","OpcUa","150","UA Secure Conversation Message: PublishRequest"
"262","72.414190","127.0.0.1","127.0.0.1","TCP","44","53530  >  53541 [ACK] Seq=28601 Ack=9831 Win=55552 Len=0"
"263","73.398115","127.0.0.1","127.0.0.1","OpcUa","210","UA Secure Conversation Message: PublishResponse"
"264","73.398192","127.0.0.1","127.0.0.1","TCP","44","53541  >  53530 [ACK] Seq=9831 Ack=28767 Win=36608 Len=0"
"265","73.411098","127.0.0.1","127.0.0.1","OpcUa","150","UA Secure Conversation Message: PublishRequest"
"266","73.411215","127.0.0.1","127.0.0.1","TCP","44","53530  >  53541 [ACK] Seq=28767 Ack=9937 Win=55552 Len=0"
"267","73.476319","127.0.0.1","127.0.0.1","OpcUa","133","UA Secure Conversation Message: PublishResponse"
"268","73.476416","127.0.0.1","127.0.0.1","TCP","44","53541  >  53530 [ACK] Seq=9937 Ack=28856 Win=36608 Len=0"
"269","73.488994","127.0.0.1","127.0.0.1","OpcUa","142","UA Secure Conversation Message: PublishRequest"
"270","73.489226","127.0.0.1","127.0.0.1","TCP","44","53530  >  53541 [ACK] Seq=28856 Ack=10035 Win=55296 Len=0"
"271","73.504418","127.0.0.1","127.0.0.1","OpcUa","208","UA Secure Conversation Message: ReadRequest"
"272","73.504510","127.0.0.1","127.0.0.1","TCP","44","53530  >  53541 [ACK] Seq=28856 Ack=10199 Win=55296 Len=0"
"273","73.509358","127.0.0.1","127.0.0.1","OpcUa","143","UA Secure Conversation Message: ReadResponse"
"274","73.509449","127.0.0.1","127.0.0.1","TCP","44","53541  >  53530 [ACK] Seq=10199 Ack=28955 Win=36352 Len=0"
"275","74.395078","127.0.0.1","127.0.0.1","OpcUa","210","UA Secure Conversation Message: PublishResponse"
"276","74.395149","127.0.0.1","127.0.0.1","TCP","44","53541  >  53530 [ACK] Seq=10199 Ack=29121 Win=36352 Len=0"
"277","74.408121","127.0.0.1","127.0.0.1","OpcUa","150","UA Secure Conversation Message: PublishRequest"
"278","74.408220","127.0.0.1","127.0.0.1","TCP","44","53530  >  53541 [ACK] Seq=29121 Ack=10305 Win=55040 Len=0"
"279","75.051122","127.0.0.1","127.0.0.1","UDP","1464","54217  >  5093 Len=1432"
"280","75.113487","127.0.0.1","127.0.0.1","UDP","1464","5093  >  54217 Len=1432"
"281","75.117367","127.0.0.1","127.0.0.1","UDP","1464","54217  >  5093 Len=1432"
"282","75.118321","127.0.0.1","127.0.0.1","UDP","1464","5093  >  54217 Len=1432"
"283","75.119290","127.0.0.1","127.0.0.1","UDP","1464","54217  >  5093 Len=1432"
"284","75.119588","127.0.0.1","127.0.0.1","UDP","1464","5093  >  54217 Len=1432"
"285","75.120845","127.0.0.1","127.0.0.1","UDP","1464","54217  >  5093 Len=1432"
"286","75.121107","127.0.0.1","127.0.0.1","UDP","1464","5093  >  54217 Len=1432"
"287","75.390217","127.0.0.1","127.0.0.1","OpcUa","210","UA Secure Conversation Message: PublishResponse"
"288","75.390404","127.0.0.1","127.0.0.1","TCP","44","53541  >  53530 [ACK] Seq=10305 Ack=29287 Win=36096 Len=0"
"289","75.403542","127.0.0.1","127.0.0.1","OpcUa","150","UA Secure Conversation Message: PublishRequest"
"290","75.403629","127.0.0.1","127.0.0.1","TCP","44","53530  >  53541 [ACK] Seq=29287 Ack=10411 Win=55040 Len=0"
"291","76.390658","127.0.0.1","127.0.0.1","OpcUa","206","UA Secure Conversation Message: PublishResponse"
"292","76.390751","127.0.0.1","127.0.0.1","TCP","44","53541  >  53530 [ACK] Seq=10411 Ack=29449 Win=35840 Len=0"
"293","76.403725","127.0.0.1","127.0.0.1","OpcUa","150","UA Secure Conversation Message: PublishRequest"
"294","76.403842","127.0.0.1","127.0.0.1","TCP","44","53530  >  53541 [ACK] Seq=29449 Ack=10517 Win=54784 Len=0"
"295","76.653763","::1","::1","TLSv1.2","89","Application Data"
"296","76.653987","::1","::1","TCP","64","64964  >  8900 [ACK] Seq=88 Ack=101 Win=220 Len=0"
"297","76.655194","::1","::1","TLSv1.2","93","Application Data"
"298","76.655274","::1","::1","TCP","64","8900  >  64964 [ACK] Seq=101 Ack=117 Win=187 Len=0"
"299","77.390752","127.0.0.1","127.0.0.1","OpcUa","210","UA Secure Conversation Message: PublishResponse"
"300","77.390848","127.0.0.1","127.0.0.1","TCP","44","53541  >  53530 [ACK] Seq=10517 Ack=29615 Win=35840 Len=0"
"301","77.403614","127.0.0.1","127.0.0.1","OpcUa","150","UA Secure Conversation Message: PublishRequest"
"302","77.403688","127.0.0.1","127.0.0.1","TCP","44","53530  >  53541 [ACK] Seq=29615 Ack=10623 Win=54784 Len=0"
"303","78.390575","127.0.0.1","127.0.0.1","OpcUa","210","UA Secure Conversation Message: PublishResponse"
"304","78.390730","127.0.0.1","127.0.0.1","TCP","44","53541  >  53530 [ACK] Seq=10623 Ack=29781 Win=35584 Len=0"
"305","78.402557","127.0.0.1","127.0.0.1","OpcUa","150","UA Secure Conversation Message: PublishRequest"
"306","78.402745","127.0.0.1","127.0.0.1","TCP","44","53530  >  53541 [ACK] Seq=29781 Ack=10729 Win=54784 Len=0"
"307","78.482167","127.0.0.1","127.0.0.1","OpcUa","133","UA Secure Conversation Message: PublishResponse"
"308","78.482255","127.0.0.1","127.0.0.1","TCP","44","53541  >  53530 [ACK] Seq=10729 Ack=29870 Win=35584 Len=0"
"309","78.495456","127.0.0.1","127.0.0.1","OpcUa","142","UA Secure Conversation Message: PublishRequest"
"310","78.495525","127.0.0.1","127.0.0.1","TCP","44","53530  >  53541 [ACK] Seq=29870 Ack=10827 Win=54528 Len=0"
"311","78.511393","127.0.0.1","127.0.0.1","OpcUa","208","UA Secure Conversation Message: ReadRequest"
"312","78.511507","127.0.0.1","127.0.0.1","TCP","44","53530  >  53541 [ACK] Seq=29870 Ack=10991 Win=54528 Len=0"
"313","78.517185","127.0.0.1","127.0.0.1","OpcUa","143","UA Secure Conversation Message: ReadResponse"
"314","78.517261","127.0.0.1","127.0.0.1","TCP","44","53541  >  53530 [ACK] Seq=10991 Ack=29969 Win=35328 Len=0"
"315","79.035981","127.0.0.1","127.0.0.1","OpcUa","314","UA Secure Conversation Message: ReadRequest"
"316","79.036069","127.0.0.1","127.0.0.1","TCP","44","53530  >  53541 [ACK] Seq=29969 Ack=11261 Win=54272 Len=0"
"317","79.036181","127.0.0.1","127.0.0.1","OpcUa","330","UA Secure Conversation Message: ReadRequest"
"318","79.036223","127.0.0.1","127.0.0.1","TCP","44","53530  >  53541 [ACK] Seq=29969 Ack=11547 Win=53760 Len=0"
"319","79.049330","127.0.0.1","127.0.0.1","OpcUa","213","UA Secure Conversation Message: ReadResponse"
"320","79.049421","127.0.0.1","127.0.0.1","TCP","44","53541  >  53530 [ACK] Seq=11547 Ack=30138 Win=35328 Len=0"
"321","79.049919","127.0.0.1","127.0.0.1","OpcUa","177","UA Secure Conversation Message: BrowseRequest"
"322","79.050045","127.0.0.1","127.0.0.1","OpcUa","302","UA Secure Conversation Message: ReadResponse"
"323","79.050110","127.0.0.1","127.0.0.1","TCP","44","53541  >  53530 [ACK] Seq=11680 Ack=30396 Win=35072 Len=0"
"324","79.058116","127.0.0.1","127.0.0.1","OpcUa","142","UA Secure Conversation Message: BrowseResponse"
"325","79.058231","127.0.0.1","127.0.0.1","TCP","44","53541  >  53530 [ACK] Seq=11680 Ack=30494 Win=34816 Len=0"
"326","79.058758","127.0.0.1","127.0.0.1","OpcUa","314","UA Secure Conversation Message: ReadRequest"
"327","79.058874","127.0.0.1","127.0.0.1","TCP","44","53530  >  53541 [ACK] Seq=30494 Ack=11950 Win=53504 Len=0"
"328","79.066402","127.0.0.1","127.0.0.1","OpcUa","184","UA Secure Conversation Message: ReadResponse"
"329","79.066496","127.0.0.1","127.0.0.1","TCP","44","53541  >  53530 [ACK] Seq=11950 Ack=30634 Win=34816 Len=0"
"330","79.067043","127.0.0.1","127.0.0.1","OpcUa","177","UA Secure Conversation Message: BrowseRequest"
"331","79.067140","127.0.0.1","127.0.0.1","TCP","44","53530  >  53541 [ACK] Seq=30634 Ack=12083 Win=53248 Len=0"
"332","79.073787","127.0.0.1","127.0.0.1","OpcUa","142","UA Secure Conversation Message: BrowseResponse"
"333","79.073886","127.0.0.1","127.0.0.1","TCP","44","53541  >  53530 [ACK] Seq=12083 Ack=30732 Win=34560 Len=0"
"334","79.074671","127.0.0.1","127.0.0.1","OpcUa","177","UA Secure Conversation Message: BrowseRequest"
"335","79.074778","127.0.0.1","127.0.0.1","TCP","44","53530  >  53541 [ACK] Seq=30732 Ack=12216 Win=53248 Len=0"
"336","79.075349","127.0.0.1","127.0.0.1","OpcUa","197","UA Secure Conversation Message: BrowseRequest"
"337","79.075412","127.0.0.1","127.0.0.1","TCP","44","53530  >  53541 [ACK] Seq=30732 Ack=12369 Win=52992 Len=0"
"338","79.081054","127.0.0.1","127.0.0.1","OpcUa","290","UA Secure Conversation Message: BrowseResponse"
"339","79.081157","127.0.0.1","127.0.0.1","TCP","44","53541  >  53530 [ACK] Seq=12369 Ack=30978 Win=34304 Len=0"
"340","79.081761","127.0.0.1","127.0.0.1","OpcUa","314","UA Secure Conversation Message: ReadRequest"
"341","79.081841","127.0.0.1","127.0.0.1","TCP","44","53530  >  53541 [ACK] Seq=30978 Ack=12639 Win=52736 Len=0"
"342","79.084218","127.0.0.1","127.0.0.1","OpcUa","442","UA Secure Conversation Message: BrowseResponse"
"343","79.084324","127.0.0.1","127.0.0.1","TCP","44","53541  >  53530 [ACK] Seq=12639 Ack=31376 Win=34048 Len=0"
"344","79.088509","127.0.0.1","127.0.0.1","OpcUa","215","UA Secure Conversation Message: ReadResponse"
"345","79.088619","127.0.0.1","127.0.0.1","TCP","44","53541  >  53530 [ACK] Seq=12639 Ack=31547 Win=33792 Len=0"
"346","79.398949","127.0.0.1","127.0.0.1","OpcUa","210","UA Secure Conversation Message: PublishResponse"
"347","79.399041","127.0.0.1","127.0.0.1","TCP","44","53541  >  53530 [ACK] Seq=12639 Ack=31713 Win=33792 Len=0"
"348","79.410517","127.0.0.1","127.0.0.1","OpcUa","150","UA Secure Conversation Message: PublishRequest"
"349","79.410598","127.0.0.1","127.0.0.1","TCP","44","53530  >  53541 [ACK] Seq=31713 Ack=12745 Win=52736 Len=0"
"350","80.401467","127.0.0.1","127.0.0.1","OpcUa","210","UA Secure Conversation Message: PublishResponse"
"351","80.401538","127.0.0.1","127.0.0.1","TCP","44","53541  >  53530 [ACK] Seq=12745 Ack=31879 Win=33536 Len=0"
"352","80.412621","127.0.0.1","127.0.0.1","OpcUa","150","UA Secure Conversation Message: PublishRequest"
"353","80.412717","127.0.0.1","127.0.0.1","TCP","44","53530  >  53541 [ACK] Seq=31879 Ack=12851 Win=52480 Len=0"
"354","80.519682","127.0.0.1","127.0.0.1","OpcUa","179","UA Secure Conversation Message: BrowseRequest"
"355","80.519772","127.0.0.1","127.0.0.1","TCP","44","53530  >  53541 [ACK] Seq=31879 Ack=12986 Win=52480 Len=0"
"356","80.519971","127.0.0.1","127.0.0.1","OpcUa","496","UA Secure Conversation Message: ReadRequest"
"357","80.520025","127.0.0.1","127.0.0.1","TCP","44","53530  >  53541 [ACK] Seq=31879 Ack=13438 Win=51968 Len=0"
"358","80.525031","127.0.0.1","127.0.0.1","OpcUa","252","UA Secure Conversation Message: BrowseResponse"
"359","80.525238","127.0.0.1","127.0.0.1","TCP","44","53541  >  53530 [ACK] Seq=13438 Ack=32087 Win=33280 Len=0"
"360","80.525659","127.0.0.1","127.0.0.1","OpcUa","334","UA Secure Conversation Message: ReadRequest"
"361","80.525735","127.0.0.1","127.0.0.1","TCP","44","53530  >  53541 [ACK] Seq=32087 Ack=13728 Win=51712 Len=0"
"362","80.526018","127.0.0.1","127.0.0.1","OpcUa","391","UA Secure Conversation Message: ReadResponse"
"363","80.526091","127.0.0.1","127.0.0.1","TCP","44","53541  >  53530 [ACK] Seq=13728 Ack=32434 Win=33024 Len=0"
"364","80.531197","127.0.0.1","127.0.0.1","OpcUa","307","UA Secure Conversation Message: ReadResponse"
"365","80.531286","127.0.0.1","127.0.0.1","TCP","44","53541  >  53530 [ACK] Seq=13728 Ack=32697 Win=32768 Len=0"
"366","80.688539","127.0.0.1","127.0.0.1","OpcUa","334","UA Secure Conversation Message: ReadRequest"
"367","80.688622","127.0.0.1","127.0.0.1","TCP","44","53530  >  53541 [ACK] Seq=32697 Ack=14018 Win=51456 Len=0"
"368","80.692974","127.0.0.1","127.0.0.1","OpcUa","175","UA Secure Conversation Message: ReadResponse"
"369","80.693058","127.0.0.1","127.0.0.1","TCP","44","53541  >  53530 [ACK] Seq=14018 Ack=32828 Win=65280 Len=0"
"370","81.280722","127.0.0.1","127.0.0.1","OpcUa","192","UA Secure Conversation Message: CreateMonitoredItemsRequest"
"371","81.280814","127.0.0.1","127.0.0.1","TCP","44","53530  >  53541 [ACK] Seq=32828 Ack=14166 Win=51200 Len=0"
"372","81.284811","127.0.0.1","127.0.0.1","OpcUa","127","UA Secure Conversation Message: CreateMonitoredItemsResponse"
"373","81.284905","127.0.0.1","127.0.0.1","TCP","44","53541  >  53530 [ACK] Seq=14166 Ack=32911 Win=65280 Len=0"
"374","81.285575","127.0.0.1","127.0.0.1","OpcUa","176","UA Secure Conversation Message: TranslateBrowsePathsToNodeIdsRequest"
"375","81.285671","127.0.0.1","127.0.0.1","TCP","44","53530  >  53541 [ACK] Seq=32911 Ack=14298 Win=51200 Len=0"
"376","81.290032","127.0.0.1","127.0.0.1","OpcUa","112","UA Secure Conversation Message: TranslateBrowsePathsToNodeIdsResponse"
"377","81.290126","127.0.0.1","127.0.0.1","TCP","44","53541  >  53530 [ACK] Seq=14298 Ack=32979 Win=65280 Len=0"
"378","81.290471","127.0.0.1","127.0.0.1","OpcUa","174","UA Secure Conversation Message: TranslateBrowsePathsToNodeIdsRequest"
"379","81.290522","127.0.0.1","127.0.0.1","TCP","44","53530  >  53541 [ACK] Seq=32979 Ack=14428 Win=50944 Len=0"
"380","81.294002","127.0.0.1","127.0.0.1","OpcUa","112","UA Secure Conversation Message: TranslateBrowsePathsToNodeIdsResponse"
