"No.","Time","Source","Destination","Protocol","Length","Info"
"1","0.000000","127.0.0.1","127.0.0.1","UDP","1464","54217  >  5093 Len=1432"
"2","0.046864","127.0.0.1","127.0.0.1","UDP","1464","5093  >  54217 Len=1432"
"3","0.050699","127.0.0.1","127.0.0.1","UDP","1464","54217  >  5093 Len=1432"
"4","0.051020","127.0.0.1","127.0.0.1","UDP","1464","5093  >  54217 Len=1432"
"5","0.052070","127.0.0.1","127.0.0.1","UDP","1464","54217  >  5093 Len=1432"
"6","0.052347","127.0.0.1","127.0.0.1","UDP","1464","5093  >  54217 Len=1432"
"7","0.053370","127.0.0.1","127.0.0.1","UDP","1464","54217  >  5093 Len=1432"
"8","0.053709","127.0.0.1","127.0.0.1","UDP","1464","5093  >  54217 Len=1432"
"9","11.564981","::1","::1","TLSv1.2","89","Application Data"
"10","11.565082","::1","::1","TCP","64","64964  >  8900 [ACK] Seq=1 Ack=26 Win=219 Len=0"
"11","11.566282","::1","::1","TLSv1.2","93","Application Data"
"12","11.566370","::1","::1","TCP","64","8900  >  64964 [ACK] Seq=26 Ack=30 Win=186 Len=0"
"13","15.011238","127.0.0.1","127.0.0.1","UDP","1464","54217  >  5093 Len=1432"
"14","15.058989","127.0.0.1","127.0.0.1","UDP","1464","5093  >  54217 Len=1432"
"15","15.063240","127.0.0.1","127.0.0.1","UDP","1464","54217  >  5093 Len=1432"
"16","15.063536","127.0.0.1","127.0.0.1","UDP","1464","5093  >  54217 Len=1432"
"17","15.065011","127.0.0.1","127.0.0.1","UDP","1464","54217  >  5093 Len=1432"
"18","15.065415","127.0.0.1","127.0.0.1","UDP","1464","5093  >  54217 Len=1432"
"19","15.066547","127.0.0.1","127.0.0.1","UDP","1464","54217  >  5093 Len=1432"
"20","15.066845","127.0.0.1","127.0.0.1","UDP","1464","5093  >  54217 Len=1432"
"21","30.015815","127.0.0.1","127.0.0.1","UDP","1464","54217  >  5093 Len=1432"
"22","30.066418","127.0.0.1","127.0.0.1","UDP","1464","5093  >  54217 Len=1432"
"23","30.071856","127.0.0.1","127.0.0.1","UDP","1464","54217  >  5093 Len=1432"
"24","30.072200","127.0.0.1","127.0.0.1","UDP","1464","5093  >  54217 Len=1432"
"25","30.073749","127.0.0.1","127.0.0.1","UDP","1464","54217  >  5093 Len=1432"
"26","30.074083","127.0.0.1","127.0.0.1","UDP","1464","5093  >  54217 Len=1432"
"27","30.075456","127.0.0.1","127.0.0.1","UDP","1464","54217  >  5093 Len=1432"
"28","30.075888","127.0.0.1","127.0.0.1","UDP","1464","5093  >  54217 Len=1432"
"29","36.581385","::1","::1","TLSv1.2","89","Application Data"
"30","36.581475","::1","::1","TCP","64","64964  >  8900 [ACK] Seq=30 Ack=51 Win=219 Len=0"
"31","36.582626","::1","::1","TLSv1.2","93","Application Data"
"32","36.582721","::1","::1","TCP","64","8900  >  64964 [ACK] Seq=51 Ack=59 Win=186 Len=0"
"33","43.702638","127.0.0.1","127.0.0.1","TCP","56","49365  >  53530 [SYN] Seq=0 Win=65535 Len=0 MSS=65495 WS=256 SACK_PERM"
"34","43.702800","127.0.0.1","127.0.0.1","TCP","56","53530  >  49365 [SYN, ACK] Seq=0 Ack=1 Win=65535 Len=0 MSS=65495 WS=256 SACK_PERM"
"35","43.702891","127.0.0.1","127.0.0.1","TCP","44","49365  >  53530 [ACK] Seq=1 Ack=1 Win=65280 Len=0"
"36","43.703336","127.0.0.1","127.0.0.1","OpcUa","128","Hello message"
"37","43.703374","127.0.0.1","127.0.0.1","TCP","44","53530  >  49365 [ACK] Seq=1 Ack=85 Win=65280 Len=0"
"38","43.709568","127.0.0.1","127.0.0.1","OpcUa","72","Acknowledge message"
"39","43.709668","127.0.0.1","127.0.0.1","TCP","44","49365  >  53530 [ACK] Seq=85 Ack=29 Win=65280 Len=0"
"40","43.709845","127.0.0.1","127.0.0.1","OpcUa","177","OpenSecureChannel message"
"41","43.709907","127.0.0.1","127.0.0.1","TCP","44","53530  >  49365 [ACK] Seq=29 Ack=218 Win=65280 Len=0"
"42","43.711443","127.0.0.1","127.0.0.1","OpcUa","179","OpenSecureChannel message"
"43","43.711528","127.0.0.1","127.0.0.1","TCP","44","49365  >  53530 [ACK] Seq=218 Ack=164 Win=65280 Len=0"
"44","43.711991","127.0.0.1","127.0.0.1","OpcUa","165","UA Secure Conversation Message: GetEndpointsRequest"
"45","43.712082","127.0.0.1","127.0.0.1","TCP","44","53530  >  49365 [ACK] Seq=164 Ack=339 Win=65024 Len=0"
"46","43.714784","127.0.0.1","127.0.0.1","OpcUa","20188","UA Secure Conversation Message: GetEndpointsResponse"
"47","43.714956","127.0.0.1","127.0.0.1","TCP","44","49365  >  53530 [ACK] Seq=339 Ack=20308 Win=45056 Len=0"
"48","43.715418","127.0.0.1","127.0.0.1","OpcUa","101","CloseSecureChannel message: CloseSecureChannelRequest"
"49","43.715489","127.0.0.1","127.0.0.1","TCP","44","53530  >  49365 [ACK] Seq=20308 Ack=396 Win=65024 Len=0"
"50","43.715546","127.0.0.1","127.0.0.1","TCP","44","49365  >  53530 [FIN, ACK] Seq=396 Ack=20308 Win=45056 Len=0"
"51","43.715576","127.0.0.1","127.0.0.1","TCP","44","53530  >  49365 [ACK] Seq=20308 Ack=397 Win=65024 Len=0"
"52","43.718412","127.0.0.1","127.0.0.1","TCP","44","53530  >  49365 [FIN, ACK] Seq=20308 Ack=397 Win=65024 Len=0"
"53","43.718522","127.0.0.1","127.0.0.1","TCP","44","49365  >  53530 [ACK] Seq=397 Ack=20309 Win=45056 Len=0"
"54","43.901463","127.0.0.1","127.0.0.1","TCP","56","49366  >  53530 [SYN] Seq=0 Win=65535 Len=0 MSS=65495 WS=256 SACK_PERM"
"55","43.901645","127.0.0.1","127.0.0.1","TCP","56","53530  >  49366 [SYN, ACK] Seq=0 Ack=1 Win=65535 Len=0 MSS=65495 WS=256 SACK_PERM"
"56","43.901815","127.0.0.1","127.0.0.1","TCP","44","49366  >  53530 [ACK] Seq=1 Ack=1 Win=65280 Len=0"
"57","43.902318","127.0.0.1","127.0.0.1","OpcUa","128","Hello message"
"58","43.902385","127.0.0.1","127.0.0.1","TCP","44","53530  >  49366 [ACK] Seq=1 Ack=85 Win=65280 Len=0"
"59","43.905286","127.0.0.1","127.0.0.1","OpcUa","72","Acknowledge message"
"60","43.905386","127.0.0.1","127.0.0.1","TCP","44","49366  >  53530 [ACK] Seq=85 Ack=29 Win=65280 Len=0"
"61","43.905560","127.0.0.1","127.0.0.1","OpcUa","177","OpenSecureChannel message"
"62","43.905698","127.0.0.1","127.0.0.1","TCP","44","53530  >  49366 [ACK] Seq=29 Ack=218 Win=65280 Len=0"
"63","43.907600","127.0.0.1","127.0.0.1","OpcUa","179","OpenSecureChannel message"
"64","43.907728","127.0.0.1","127.0.0.1","TCP","44","49366  >  53530 [ACK] Seq=218 Ack=164 Win=65280 Len=0"
"65","43.908080","127.0.0.1","127.0.0.1","OpcUa","423","UA Secure Conversation Message: CreateSessionRequest"
"66","43.908167","127.0.0.1","127.0.0.1","TCP","44","53530  >  49366 [ACK] Seq=164 Ack=597 Win=64768 Len=0"
"67","43.937563","127.0.0.1","127.0.0.1","OpcUa","21331","UA Secure Conversation Message: CreateSessionResponse"
"68","43.937728","127.0.0.1","127.0.0.1","TCP","44","49366  >  53530 [ACK] Seq=597 Ack=21451 Win=44032 Len=0"
"69","43.940355","127.0.0.1","127.0.0.1","OpcUa","193","UA Secure Conversation Message: ActivateSessionRequest"
"70","43.940437","127.0.0.1","127.0.0.1","TCP","44","53530  >  49366 [ACK] Seq=21451 Ack=746 Win=64768 Len=0"
"71","43.944678","127.0.0.1","127.0.0.1","OpcUa","140","UA Secure Conversation Message: ActivateSessionResponse"
"72","43.944783","127.0.0.1","127.0.0.1","TCP","44","49366  >  53530 [ACK] Seq=746 Ack=21547 Win=43776 Len=0"
"73","43.945110","127.0.0.1","127.0.0.1","OpcUa","190","UA Secure Conversation Message: ReadRequest"
"74","43.945170","127.0.0.1","127.0.0.1","TCP","44","53530  >  49366 [ACK] Seq=21547 Ack=892 Win=64512 Len=0"
"75","43.949049","127.0.0.1","127.0.0.1","OpcUa","116","UA Secure Conversation Message: ReadResponse"
"76","43.949174","127.0.0.1","127.0.0.1","TCP","44","49366  >  53530 [ACK] Seq=892 Ack=21619 Win=43776 Len=0"
"77","43.949665","127.0.0.1","127.0.0.1","OpcUa","496","UA Secure Conversation Message: ReadRequest"
"78","43.949761","127.0.0.1","127.0.0.1","TCP","44","53530  >  49366 [ACK] Seq=21619 Ack=1344 Win=64000 Len=0"
"79","43.955945","127.0.0.1","127.0.0.1","OpcUa","565","UA Secure Conversation Message: ReadResponse"
"80","43.956125","127.0.0.1","127.0.0.1","TCP","44","49366  >  53530 [ACK] Seq=1344 Ack=22140 Win=43264 Len=0"
"81","43.981831","127.0.0.1","127.0.0.1","OpcUa","172","UA Secure Conversation Message: ReadRequest"
"82","43.981920","127.0.0.1","127.0.0.1","TCP","44","53530  >  49366 [ACK] Seq=22140 Ack=1472 Win=64000 Len=0"
"83","43.985849","127.0.0.1","127.0.0.1","OpcUa","107","UA Secure Conversation Message: ReadResponse"
"84","43.985968","127.0.0.1","127.0.0.1","TCP","44","49366  >  53530 [ACK] Seq=1472 Ack=22203 Win=43264 Len=0"
"85","43.986283","127.0.0.1","127.0.0.1","OpcUa","160","UA Secure Conversation Message: CreateSubscriptionRequest"
"86","43.986336","127.0.0.1","127.0.0.1","TCP","44","53530  >  49366 [ACK] Seq=22203 Ack=1588 Win=63744 Len=0"
"87","43.997121","127.0.0.1","127.0.0.1","OpcUa","116","UA Secure Conversation Message: CreateSubscriptionResponse"
"88","43.997222","127.0.0.1","127.0.0.1","TCP","44","49366  >  53530 [ACK] Seq=1588 Ack=22275 Win=43008 Len=0"
"89","43.997590","127.0.0.1","127.0.0.1","OpcUa","320","UA Secure Conversation Message: CreateMonitoredItemsRequest"
"90","43.997646","127.0.0.1","127.0.0.1","TCP","44","53530  >  49366 [ACK] Seq=22275 Ack=1864 Win=63488 Len=0"
"91","44.002540","127.0.0.1","127.0.0.1","OpcUa","182","UA Secure Conversation Message: CreateMonitoredItemsResponse"
"92","44.002624","127.0.0.1","127.0.0.1","TCP","44","49366  >  53530 [ACK] Seq=1864 Ack=22413 Win=43008 Len=0"
"93","44.005809","127.0.0.1","127.0.0.1","OpcUa","177","UA Secure Conversation Message: BrowseRequest"
"94","44.005904","127.0.0.1","127.0.0.1","TCP","44","53530  >  49366 [ACK] Seq=22413 Ack=1997 Win=63488 Len=0"
"95","44.010483","127.0.0.1","127.0.0.1","OpcUa","240","UA Secure Conversation Message: BrowseResponse"
"96","44.010593","127.0.0.1","127.0.0.1","TCP","44","49366  >  53530 [ACK] Seq=1997 Ack=22609 Win=42752 Len=0"
"97","44.012141","127.0.0.1","127.0.0.1","OpcUa","314","UA Secure Conversation Message: ReadRequest"
"98","44.012212","127.0.0.1","127.0.0.1","TCP","44","53530  >  49366 [ACK] Seq=22609 Ack=2267 Win=63232 Len=0"
"99","44.015629","127.0.0.1","127.0.0.1","OpcUa","194","UA Secure Conversation Message: ReadResponse"
"100","44.015710","127.0.0.1","127.0.0.1","TCP","44","49366  >  53530 [ACK] Seq=2267 Ack=22759 Win=42752 Len=0"
"101","44.016133","127.0.0.1","127.0.0.1","OpcUa","177","UA Secure Conversation Message: BrowseRequest"
"102","44.016211","127.0.0.1","127.0.0.1","TCP","44","53530  >  49366 [ACK] Seq=22759 Ack=2400 Win=62976 Len=0"
"103","44.019676","127.0.0.1","127.0.0.1","OpcUa","142","UA Secure Conversation Message: BrowseResponse"
"104","44.019759","127.0.0.1","127.0.0.1","TCP","44","49366  >  53530 [ACK] Seq=2400 Ack=22857 Win=42496 Len=0"
"105","44.020118","127.0.0.1","127.0.0.1","OpcUa","314","UA Secure Conversation Message: ReadRequest"
"106","44.020165","127.0.0.1","127.0.0.1","TCP","44","53530  >  49366 [ACK] Seq=22857 Ack=2670 Win=62720 Len=0"
"107","44.024011","127.0.0.1","127.0.0.1","OpcUa","238","UA Secure Conversation Message: ReadResponse"
"108","44.024119","127.0.0.1","127.0.0.1","TCP","44","49366  >  53530 [ACK] Seq=2670 Ack=23051 Win=42240 Len=0"
"109","44.024591","127.0.0.1","127.0.0.1","OpcUa","177","UA Secure Conversation Message: BrowseRequest"
"110","44.024697","127.0.0.1","127.0.0.1","TCP","44","53530  >  49366 [ACK] Seq=23051 Ack=2803 Win=62720 Len=0"
"111","44.028730","127.0.0.1","127.0.0.1","OpcUa","142","UA Secure Conversation Message: BrowseResponse"
"112","44.028927","127.0.0.1","127.0.0.1","TCP","44","49366  >  53530 [ACK] Seq=2803 Ack=23149 Win=42240 Len=0"
"113","44.029336","127.0.0.1","127.0.0.1","OpcUa","314","UA Secure Conversation Message: ReadRequest"
"114","44.029401","127.0.0.1","127.0.0.1","TCP","44","53530  >  49366 [ACK] Seq=23149 Ack=3073 Win=62208 Len=0"
"115","44.033453","127.0.0.1","127.0.0.1","OpcUa","181","UA Secure Conversation Message: ReadResponse"
"116","44.033540","127.0.0.1","127.0.0.1","TCP","44","49366  >  53530 [ACK] Seq=3073 Ack=23286 Win=42240 Len=0"
"117","44.034041","127.0.0.1","127.0.0.1","OpcUa","177","UA Secure Conversation Message: BrowseRequest"
"118","44.034120","127.0.0.1","127.0.0.1","TCP","44","53530  >  49366 [ACK] Seq=23286 Ack=3206 Win=62208 Len=0"
"119","44.037646","127.0.0.1","127.0.0.1","OpcUa","116","UA Secure Conversation Message: BrowseResponse"
"120","44.037737","127.0.0.1","127.0.0.1","TCP","44","49366  >  53530 [ACK] Seq=3206 Ack=23358 Win=41984 Len=0"
"121","44.046935","127.0.0.1","127.0.0.1","OpcUa","177","UA Secure Conversation Message: BrowseRequest"
"122","44.047009","127.0.0.1","127.0.0.1","TCP","44","53530  >  49366 [ACK] Seq=23358 Ack=3339 Win=61952 Len=0"
"123","44.050743","127.0.0.1","127.0.0.1","OpcUa","463","UA Secure Conversation Message: BrowseResponse"
"124","44.050941","127.0.0.1","127.0.0.1","TCP","44","49366  >  53530 [ACK] Seq=3339 Ack=23777 Win=41728 Len=0"
"125","44.108962","127.0.0.1","127.0.0.1","OpcUa","334","UA Secure Conversation Message: ReadRequest"
"126","44.109052","127.0.0.1","127.0.0.1","TCP","44","53530  >  49366 [ACK] Seq=23777 Ack=3629 Win=61696 Len=0"
"127","44.113012","127.0.0.1","127.0.0.1","OpcUa","184","UA Secure Conversation Message: ReadResponse"
"128","44.113138","127.0.0.1","127.0.0.1","TCP","44","49366  >  53530 [ACK] Seq=3629 Ack=23917 Win=41472 Len=0"
"129","44.113656","127.0.0.1","127.0.0.1","OpcUa","179","UA Secure Conversation Message: BrowseRequest"
"130","44.113717","127.0.0.1","127.0.0.1","TCP","44","53530  >  49366 [ACK] Seq=23917 Ack=3764 Win=61696 Len=0"
"131","44.117611","127.0.0.1","127.0.0.1","OpcUa","142","UA Secure Conversation Message: BrowseResponse"
"132","44.117716","127.0.0.1","127.0.0.1","TCP","44","49366  >  53530 [ACK] Seq=3764 Ack=24015 Win=41472 Len=0"
"133","44.118123","127.0.0.1","127.0.0.1","OpcUa","314","UA Secure Conversation Message: ReadRequest"
"134","44.118182","127.0.0.1","127.0.0.1","TCP","44","53530  >  49366 [ACK] Seq=24015 Ack=4034 Win=61440 Len=0"
"135","44.123064","127.0.0.1","127.0.0.1","OpcUa","192","UA Secure Conversation Message: ReadResponse"
"136","44.123182","127.0.0.1","127.0.0.1","TCP","44","49366  >  53530 [ACK] Seq=4034 Ack=24163 Win=41216 Len=0"
"137","44.123703","127.0.0.1","127.0.0.1","OpcUa","177","UA Secure Conversation Message: BrowseRequest"
"138","44.123787","127.0.0.1","127.0.0.1","TCP","44","53530  >  49366 [ACK] Seq=24163 Ack=4167 Win=61184 Len=0"
"139","44.127957","127.0.0.1","127.0.0.1","OpcUa","116","UA Secure Conversation Message: BrowseResponse"
"140","44.128063","127.0.0.1","127.0.0.1","TCP","44","49366  >  53530 [ACK] Seq=4167 Ack=24235 Win=41216 Len=0"
"141","44.128883","127.0.0.1","127.0.0.1","OpcUa","334","UA Secure Conversation Message: ReadRequest"
"142","44.128976","127.0.0.1","127.0.0.1","TCP","44","53530  >  49366 [ACK] Seq=24235 Ack=4457 Win=60928 Len=0"
"143","44.132661","127.0.0.1","127.0.0.1","OpcUa","206","UA Secure Conversation Message: ReadResponse"
"144","44.132773","127.0.0.1","127.0.0.1","TCP","44","49366  >  53530 [ACK] Seq=4457 Ack=24397 Win=40960 Len=0"
"145","44.133258","127.0.0.1","127.0.0.1","OpcUa","179","UA Secure Conversation Message: BrowseRequest"
"146","44.133371","127.0.0.1","127.0.0.1","TCP","44","53530  >  49366 [ACK] Seq=24397 Ack=4592 Win=60928 Len=0"
"147","44.137206","127.0.0.1","127.0.0.1","OpcUa","142","UA Secure Conversation Message: BrowseResponse"
"148","44.137296","127.0.0.1","127.0.0.1","TCP","44","49366  >  53530 [ACK] Seq=4592 Ack=24495 Win=40960 Len=0"
"149","44.147040","127.0.0.1","127.0.0.1","OpcUa","160","UA Secure Conversation Message: CreateSubscriptionRequest"
"150","44.147118","127.0.0.1","127.0.0.1","TCP","44","53530  >  49366 [ACK] Seq=24495 Ack=4708 Win=60672 Len=0"
"151","44.157275","127.0.0.1","127.0.0.1","OpcUa","116","UA Secure Conversation Message: CreateSubscriptionResponse"
"152","44.157394","127.0.0.1","127.0.0.1","TCP","44","49366  >  53530 [ACK] Seq=4708 Ack=24567 Win=40960 Len=0"
"153","44.157940","127.0.0.1","127.0.0.1","OpcUa","954","UA Secure Conversation Message: ReadRequest"
"154","44.158029","127.0.0.1","127.0.0.1","TCP","44","53530  >  49366 [ACK] Seq=24567 Ack=5618 Win=59904 Len=0"
"155","44.162236","127.0.0.1","127.0.0.1","OpcUa","377","UA Secure Conversation Message: ReadResponse"
"156","44.162314","127.0.0.1","127.0.0.1","TCP","44","49366  >  53530 [ACK] Seq=5618 Ack=24900 Win=40448 Len=0"
"157","44.162594","127.0.0.1","127.0.0.1","OpcUa","326","UA Secure Conversation Message: CreateMonitoredItemsRequest"
"158","44.162634","127.0.0.1","127.0.0.1","TCP","44","53530  >  49366 [ACK] Seq=24900 Ack=5900 Win=59392 Len=0"
"159","44.168822","127.0.0.1","127.0.0.1","OpcUa","196","UA Secure Conversation Message: CreateMonitoredItemsResponse"
"160","44.168902","127.0.0.1","127.0.0.1","TCP","44","49366  >  53530 [ACK] Seq=5900 Ack=25052 Win=40448 Len=0"
"161","44.169326","127.0.0.1","127.0.0.1","OpcUa","314","UA Secure Conversation Message: ReadRequest"
"162","44.169379","127.0.0.1","127.0.0.1","TCP","44","53530  >  49366 [ACK] Seq=25052 Ack=6170 Win=59136 Len=0"
"163","44.172625","127.0.0.1","127.0.0.1","OpcUa","174","UA Secure Conversation Message: ReadResponse"
"164","44.172792","127.0.0.1","127.0.0.1","TCP","44","49366  >  53530 [ACK] Seq=6170 Ack=25182 Win=40192 Len=0"
"165","44.173206","127.0.0.1","127.0.0.1","OpcUa","314","UA Secure Conversation Message: ReadRequest"
"166","44.173262","127.0.0.1","127.0.0.1","TCP","44","53530  >  49366 [ACK] Seq=25182 Ack=6440 Win=58880 Len=0"
"167","44.176362","127.0.0.1","127.0.0.1","OpcUa","176","UA Secure Conversation Message: ReadResponse"
"168","44.176446","127.0.0.1","127.0.0.1","TCP","44","49366  >  53530 [ACK] Seq=6440 Ack=25314 Win=40192 Len=0"
"169","44.176797","127.0.0.1","127.0.0.1","OpcUa","286","UA Secure Conversation Message: TranslateBrowsePathsToNodeIdsRequest"
"170","44.176851","127.0.0.1","127.0.0.1","TCP","44","53530  >  49366 [ACK] Seq=25314 Ack=6682 Win=58624 Len=0"
"171","44.180053","127.0.0.1","127.0.0.1","OpcUa","136","UA Secure Conversation Message: TranslateBrowsePathsToNodeIdsResponse"
"172","44.180131","127.0.0.1","127.0.0.1","TCP","44","49366  >  53530 [ACK] Seq=6682 Ack=25406 Win=39936 Len=0"
"173","44.180386","127.0.0.1","127.0.0.1","OpcUa","278","UA Secure Conversation Message: TranslateBrowsePathsToNodeIdsRequest"
"174","44.180428","127.0.0.1","127.0.0.1","TCP","44","53530  >  49366 [ACK] Seq=25406 Ack=6916 Win=58368 Len=0"
"175","44.183741","127.0.0.1","127.0.0.1","OpcUa","136","UA Secure Conversation Message: TranslateBrowsePathsToNodeIdsResponse"
"176","44.183821","127.0.0.1","127.0.0.1","TCP","44","49366  >  53530 [ACK] Seq=6916 Ack=25498 Win=39936 Len=0"
"177","44.196747","127.0.0.1","127.0.0.1","OpcUa","142","UA Secure Conversation Message: PublishRequest"
"178","44.196843","127.0.0.1","127.0.0.1","TCP","44","53530  >  49366 [ACK] Seq=25498 Ack=7014 Win=58368 Len=0"
"179","44.196919","127.0.0.1","127.0.0.1","OpcUa","142","UA Secure Conversation Message: PublishRequest"
"180","44.196947","127.0.0.1","127.0.0.1","TCP","44","53530  >  49366 [ACK] Seq=25498 Ack=7112 Win=58368 Len=0"
"181","44.197003","127.0.0.1","127.0.0.1","OpcUa","142","UA Secure Conversation Message: PublishRequest"
"182","44.197027","127.0.0.1","127.0.0.1","TCP","44","53530  >  49366 [ACK] Seq=25498 Ack=7210 Win=58112 Len=0"
"183","44.201177","127.0.0.1","127.0.0.1","OpcUa","129","UA Secure Conversation Message: PublishResponse"
"184","44.201261","127.0.0.1","127.0.0.1","TCP","44","49366  >  53530 [ACK] Seq=7210 Ack=25583 Win=39936 Len=0"
"185","44.211852","127.0.0.1","127.0.0.1","OpcUa","142","UA Secure Conversation Message: PublishRequest"
"186","44.211924","127.0.0.1","127.0.0.1","TCP","44","53530  >  49366 [ACK] Seq=25583 Ack=7308 Win=58112 Len=0"
"187","44.664540","127.0.0.1","127.0.0.1","OpcUa","262","UA Secure Conversation Message: PublishResponse"
"188","44.664718","127.0.0.1","127.0.0.1","TCP","44","49366  >  53530 [ACK] Seq=7308 Ack=25801 Win=39680 Len=0"
"189","44.677332","127.0.0.1","127.0.0.1","OpcUa","150","UA Secure Conversation Message: PublishRequest"
"190","44.677441","127.0.0.1","127.0.0.1","TCP","44","53530  >  49366 [ACK] Seq=25801 Ack=7414 Win=58112 Len=0"
"191","45.025592","127.0.0.1","127.0.0.1","UDP","1464","54217  >  5093 Len=1432"
"192","45.065210","127.0.0.1","127.0.0.1","UDP","1464","5093  >  54217 Len=1432"
"193","45.069312","127.0.0.1","127.0.0.1","UDP","1464","54217  >  5093 Len=1432"
"194","45.069676","127.0.0.1","127.0.0.1","UDP","1464","5093  >  54217 Len=1432"
"195","45.070740","127.0.0.1","127.0.0.1","UDP","1464","54217  >  5093 Len=1432"
"196","45.071054","127.0.0.1","127.0.0.1","UDP","1464","5093  >  54217 Len=1432"
"197","45.071971","127.0.0.1","127.0.0.1","UDP","1464","54217  >  5093 Len=1432"
"198","45.072180","127.0.0.1","127.0.0.1","UDP","1464","5093  >  54217 Len=1432"
"199","45.165654","127.0.0.1","127.0.0.1","OpcUa","206","UA Secure Conversation Message: PublishResponse"
"200","45.165750","127.0.0.1","127.0.0.1","TCP","44","49366  >  53530 [ACK] Seq=7414 Ack=25963 Win=39424 Len=0"
"201","45.179250","127.0.0.1","127.0.0.1","OpcUa","150","UA Secure Conversation Message: PublishRequest"
"202","45.179441","127.0.0.1","127.0.0.1","TCP","44","53530  >  49366 [ACK] Seq=25963 Ack=7520 Win=57856 Len=0"
"203","46.160724","127.0.0.1","127.0.0.1","OpcUa","206","UA Secure Conversation Message: PublishResponse"
"204","46.160800","127.0.0.1","127.0.0.1","TCP","44","49366  >  53530 [ACK] Seq=7520 Ack=26125 Win=39168 Len=0"
"205","46.174906","127.0.0.1","127.0.0.1","OpcUa","150","UA Secure Conversation Message: PublishRequest"
"206","46.174973","127.0.0.1","127.0.0.1","TCP","44","53530  >  49366 [ACK] Seq=26125 Ack=7626 Win=57856 Len=0"
"207","47.160035","127.0.0.1","127.0.0.1","OpcUa","210","UA Secure Conversation Message: PublishResponse"
"208","47.160116","127.0.0.1","127.0.0.1","TCP","44","49366  >  53530 [ACK] Seq=7626 Ack=26291 Win=39168 Len=0"
"209","47.173578","127.0.0.1","127.0.0.1","OpcUa","150","UA Secure Conversation Message: PublishRequest"
"210","47.173690","127.0.0.1","127.0.0.1","TCP","44","53530  >  49366 [ACK] Seq=26291 Ack=7732 Win=57600 Len=0"
"211","48.152193","127.0.0.1","127.0.0.1","OpcUa","210","UA Secure Conversation Message: PublishResponse"
"212","48.152274","127.0.0.1","127.0.0.1","TCP","44","49366  >  53530 [ACK] Seq=7732 Ack=26457 Win=38912 Len=0"
"213","48.160767","127.0.0.1","127.0.0.1","OpcUa","150","UA Secure Conversation Message: PublishRequest"
"214","48.160906","127.0.0.1","127.0.0.1","TCP","44","53530  >  49366 [ACK] Seq=26457 Ack=7838 Win=57600 Len=0"
"215","49.152383","127.0.0.1","127.0.0.1","OpcUa","210","UA Secure Conversation Message: PublishResponse"
"216","49.152486","127.0.0.1","127.0.0.1","TCP","44","49366  >  53530 [ACK] Seq=7838 Ack=26623 Win=38912 Len=0"
"217","49.159433","127.0.0.1","127.0.0.1","OpcUa","150","UA Secure Conversation Message: PublishRequest"
"218","49.159534","127.0.0.1","127.0.0.1","TCP","44","53530  >  49366 [ACK] Seq=26623 Ack=7944 Win=57344 Len=0"
"219","49.191059","127.0.0.1","127.0.0.1","OpcUa","133","UA Secure Conversation Message: PublishResponse"
"220","49.191154","127.0.0.1","127.0.0.1","TCP","44","49366  >  53530 [ACK] Seq=7944 Ack=26712 Win=38656 Len=0"
"221","49.191552","127.0.0.1","127.0.0.1","OpcUa","208","UA Secure Conversation Message: ReadRequest"
"222","49.191625","127.0.0.1","127.0.0.1","TCP","44","53530  >  49366 [ACK] Seq=26712 Ack=8108 Win=57344 Len=0"
"223","49.195381","127.0.0.1","127.0.0.1","OpcUa","143","UA Secure Conversation Message: ReadResponse"
"224","49.195464","127.0.0.1","127.0.0.1","TCP","44","49366  >  53530 [ACK] Seq=8108 Ack=26811 Win=38656 Len=0"
"225","49.207085","127.0.0.1","127.0.0.1","OpcUa","142","UA Secure Conversation Message: PublishRequest"
"226","49.207200","127.0.0.1","127.0.0.1","TCP","44","53530  >  49366 [ACK] Seq=26811 Ack=8206 Win=57088 Len=0"
"227","50.155012","127.0.0.1","127.0.0.1","OpcUa","210","UA Secure Conversation Message: PublishResponse"
"228","50.155109","127.0.0.1","127.0.0.1","TCP","44","49366  >  53530 [ACK] Seq=8206 Ack=26977 Win=38400 Len=0"
"229","50.160021","127.0.0.1","127.0.0.1","OpcUa","150","UA Secure Conversation Message: PublishRequest"
"230","50.160102","127.0.0.1","127.0.0.1","TCP","44","53530  >  49366 [ACK] Seq=26977 Ack=8312 Win=57088 Len=0"
"231","51.153444","127.0.0.1","127.0.0.1","OpcUa","210","UA Secure Conversation Message: PublishResponse"
"232","51.153640","127.0.0.1","127.0.0.1","TCP","44","49366  >  53530 [ACK] Seq=8312 Ack=27143 Win=38144 Len=0"
"233","51.169552","127.0.0.1","127.0.0.1","OpcUa","150","UA Secure Conversation Message: PublishRequest"
"234","51.169636","127.0.0.1","127.0.0.1","TCP","44","53530  >  49366 [ACK] Seq=27143 Ack=8418 Win=57088 Len=0"
"235","52.156943","127.0.0.1","127.0.0.1","OpcUa","206","UA Secure Conversation Message: PublishResponse"
"236","52.157081","127.0.0.1","127.0.0.1","TCP","44","49366  >  53530 [ACK] Seq=8418 Ack=27305 Win=38144 Len=0"
"237","52.169165","127.0.0.1","127.0.0.1","OpcUa","150","UA Secure Conversation Message: PublishRequest"
"238","52.169252","127.0.0.1","127.0.0.1","TCP","44","53530  >  49366 [ACK] Seq=27305 Ack=8524 Win=56832 Len=0"
"239","53.167788","127.0.0.1","127.0.0.1","OpcUa","210","UA Secure Conversation Message: PublishResponse"
"240","53.167856","127.0.0.1","127.0.0.1","TCP","44","49366  >  53530 [ACK] Seq=8524 Ack=27471 Win=37888 Len=0"
"241","53.181207","127.0.0.1","127.0.0.1","OpcUa","150","UA Secure Conversation Message: PublishRequest"
"242","53.181338","127.0.0.1","127.0.0.1","TCP","44","53530  >  49366 [ACK] Seq=27471 Ack=8630 Win=56832 Len=0"
"243","54.164620","127.0.0.1","127.0.0.1","OpcUa","210","UA Secure Conversation Message: PublishResponse"
"244","54.164688","127.0.0.1","127.0.0.1","TCP","44","49366  >  53530 [ACK] Seq=8630 Ack=27637 Win=37888 Len=0"
"245","54.178536","127.0.0.1","127.0.0.1","OpcUa","150","UA Secure Conversation Message: PublishRequest"
"246","54.178609","127.0.0.1","127.0.0.1","TCP","44","53530  >  49366 [ACK] Seq=27637 Ack=8736 Win=56576 Len=0"
"247","54.195284","127.0.0.1","127.0.0.1","OpcUa","133","UA Secure Conversation Message: PublishResponse"
"248","54.195360","127.0.0.1","127.0.0.1","TCP","44","49366  >  53530 [ACK] Seq=8736 Ack=27726 Win=37632 Len=0"
"249","54.209528","127.0.0.1","127.0.0.1","OpcUa","142","UA Secure Conversation Message: PublishRequest"
"250","54.209610","127.0.0.1","127.0.0.1","TCP","44","53530  >  49366 [ACK] Seq=27726 Ack=8834 Win=56576 Len=0"
"251","54.209785","127.0.0.1","127.0.0.1","OpcUa","208","UA Secure Conversation Message: ReadRequest"
"252","54.209826","127.0.0.1","127.0.0.1","TCP","44","53530  >  49366 [ACK] Seq=27726 Ack=8998 Win=56320 Len=0"
"253","54.216271","127.0.0.1","127.0.0.1","OpcUa","143","UA Secure Conversation Message: ReadResponse"
"254","54.216349","127.0.0.1","127.0.0.1","TCP","44","49366  >  53530 [ACK] Seq=8998 Ack=27825 Win=37632 Len=0"
"255","55.153095","127.0.0.1","127.0.0.1","OpcUa","210","UA Secure Conversation Message: PublishResponse"
"256","55.153165","127.0.0.1","127.0.0.1","TCP","44","49366  >  53530 [ACK] Seq=8998 Ack=27991 Win=37376 Len=0"
"257","55.167051","127.0.0.1","127.0.0.1","OpcUa","150","UA Secure Conversation Message: PublishRequest"
"258","55.167119","127.0.0.1","127.0.0.1","TCP","44","53530  >  49366 [ACK] Seq=27991 Ack=9104 Win=56320 Len=0"
"259","55.890004","127.0.0.1","127.0.0.1","TCP","56","53083  >  4840 [SYN] Seq=0 Win=65535 Len=0 MSS=65495 WS=256 SACK_PERM"
"260","55.890133","127.0.0.1","127.0.0.1","TCP","56","4840  >  53083 [SYN, ACK] Seq=0 Ack=1 Win=65535 Len=0 MSS=65495 WS=2 SACK_PERM"
"261","55.890195","127.0.0.1","127.0.0.1","TCP","44","53083  >  4840 [ACK] Seq=1 Ack=1 Win=65280 Len=0"
"262","55.890713","127.0.0.1","127.0.0.1","OpcUa","100","Hello message"
"263","55.890791","127.0.0.1","127.0.0.1","TCP","44","4840  >  53083 [ACK] Seq=1 Ack=57 Win=65480 Len=0"
"264","55.890999","127.0.0.1","127.0.0.1","OpcUa","72","Acknowledge message"
"265","55.891048","127.0.0.1","127.0.0.1","TCP","44","53083  >  4840 [ACK] Seq=57 Ack=29 Win=65280 Len=0"
"266","55.891259","127.0.0.1","127.0.0.1","OpcUa","177","OpenSecureChannel message"
"267","55.891299","127.0.0.1","127.0.0.1","TCP","44","4840  >  53083 [ACK] Seq=29 Ack=190 Win=65346 Len=0"
"268","55.891512","127.0.0.1","127.0.0.1","OpcUa","179","OpenSecureChannel message"
"269","55.891550","127.0.0.1","127.0.0.1","TCP","44","53083  >  4840 [ACK] Seq=190 Ack=164 Win=65280 Len=0"
"270","55.891817","127.0.0.1","127.0.0.1","OpcUa","137","UA Secure Conversation Message: FindServersRequest"
"271","55.891855","127.0.0.1","127.0.0.1","TCP","44","4840  >  53083 [ACK] Seq=164 Ack=283 Win=65254 Len=0"
"272","55.892980","127.0.0.1","127.0.0.1","OpcUa","278","UA Secure Conversation Message: FindServersResponse"
"273","55.893046","127.0.0.1","127.0.0.1","TCP","44","53083  >  4840 [ACK] Seq=283 Ack=398 Win=65024 Len=0"
"274","55.893294","127.0.0.1","127.0.0.1","OpcUa","101","CloseSecureChannel message: CloseSecureChannelRequest"
"275","55.893331","127.0.0.1","127.0.0.1","TCP","44","4840  >  53083 [ACK] Seq=398 Ack=340 Win=65196 Len=0"
"276","55.893367","127.0.0.1","127.0.0.1","TCP","44","53083  >  4840 [FIN, ACK] Seq=340 Ack=398 Win=65024 Len=0"
"277","55.893386","127.0.0.1","127.0.0.1","TCP","44","4840  >  53083 [ACK] Seq=398 Ack=341 Win=65196 Len=0"
"278","55.893548","127.0.0.1","127.0.0.1","TCP","44","4840  >  53083 [FIN, ACK] Seq=398 Ack=341 Win=65196 Len=0"
"279","55.893619","127.0.0.1","127.0.0.1","TCP","44","53083  >  4840 [ACK] Seq=341 Ack=399 Win=65024 Len=0"
"280","56.161063","127.0.0.1","127.0.0.1","OpcUa","210","UA Secure Conversation Message: PublishResponse"
"281","56.161139","127.0.0.1","127.0.0.1","TCP","44","49366  >  53530 [ACK] Seq=9104 Ack=28157 Win=37376 Len=0"
"282","56.173608","127.0.0.1","127.0.0.1","OpcUa","150","UA Secure Conversation Message: PublishRequest"
"283","56.173697","127.0.0.1","127.0.0.1","TCP","44","53530  >  49366 [ACK] Seq=28157 Ack=9210 Win=56320 Len=0"
"284","57.160957","127.0.0.1","127.0.0.1","OpcUa","206","UA Secure Conversation Message: PublishResponse"
"285","57.161034","127.0.0.1","127.0.0.1","TCP","44","49366  >  53530 [ACK] Seq=9210 Ack=28319 Win=37120 Len=0"
"286","57.168080","127.0.0.1","127.0.0.1","OpcUa","150","UA Secure Conversation Message: PublishRequest"
"287","57.168184","127.0.0.1","127.0.0.1","TCP","44","53530  >  49366 [ACK] Seq=28319 Ack=9316 Win=56064 Len=0"
"288","58.159150","127.0.0.1","127.0.0.1","OpcUa","210","UA Secure Conversation Message: PublishResponse"
"289","58.159218","127.0.0.1","127.0.0.1","TCP","44","49366  >  53530 [ACK] Seq=9316 Ack=28485 Win=36864 Len=0"
"290","58.172730","127.0.0.1","127.0.0.1","OpcUa","150","UA Secure Conversation Message: PublishRequest"
"291","58.172798","127.0.0.1","127.0.0.1","TCP","44","53530  >  49366 [ACK] Seq=28485 Ack=9422 Win=56064 Len=0"
"292","59.153370","127.0.0.1","127.0.0.1","OpcUa","210","UA Secure Conversation Message: PublishResponse"
"293","59.153435","127.0.0.1","127.0.0.1","TCP","44","49366  >  53530 [ACK] Seq=9422 Ack=28651 Win=36864 Len=0"
"294","59.165281","127.0.0.1","127.0.0.1","OpcUa","150","UA Secure Conversation Message: PublishRequest"
"295","59.165364","127.0.0.1","127.0.0.1","TCP","44","53530  >  49366 [ACK] Seq=28651 Ack=9528 Win=55808 Len=0"
"296","59.198934","127.0.0.1","127.0.0.1","OpcUa","133","UA Secure Conversation Message: PublishResponse"
"297","59.199067","127.0.0.1","127.0.0.1","TCP","44","49366  >  53530 [ACK] Seq=9528 Ack=28740 Win=36608 Len=0"
"298","59.212796","127.0.0.1","127.0.0.1","OpcUa","142","UA Secure Conversation Message: PublishRequest"
"299","59.212865","127.0.0.1","127.0.0.1","TCP","44","53530  >  49366 [ACK] Seq=28740 Ack=9626 Win=55808 Len=0"
"300","59.228441","127.0.0.1","127.0.0.1","OpcUa","208","UA Secure Conversation Message: ReadRequest"
"301","59.228518","127.0.0.1","127.0.0.1","TCP","44","53530  >  49366 [ACK] Seq=28740 Ack=9790 Win=55552 Len=0"
"302","59.233292","127.0.0.1","127.0.0.1","OpcUa","143","UA Secure Conversation Message: ReadResponse"
"303","59.233372","127.0.0.1","127.0.0.1","TCP","44","49366  >  53530 [ACK] Seq=9790 Ack=28839 Win=36608 Len=0"
"304","60.042360","127.0.0.1","127.0.0.1","UDP","1464","54217  >  5093 Len=1432"
"305","60.094495","127.0.0.1","127.0.0.1","UDP","1464","5093  >  54217 Len=1432"
"306","60.099376","127.0.0.1","127.0.0.1","UDP","1464","54217  >  5093 Len=1432"
"307","60.099718","127.0.0.1","127.0.0.1","UDP","1464","5093  >  54217 Len=1432"
"308","60.101306","127.0.0.1","127.0.0.1","UDP","1464","54217  >  5093 Len=1432"
"309","60.101613","127.0.0.1","127.0.0.1","UDP","1464","5093  >  54217 Len=1432"
"310","60.102894","127.0.0.1","127.0.0.1","UDP","1464","54217  >  5093 Len=1432"
"311","60.103211","127.0.0.1","127.0.0.1","UDP","1464","5093  >  54217 Len=1432"
"312","60.164848","127.0.0.1","127.0.0.1","OpcUa","210","UA Secure Conversation Message: PublishResponse"
"313","60.164942","127.0.0.1","127.0.0.1","TCP","44","49366  >  53530 [ACK] Seq=9790 Ack=29005 Win=36352 Len=0"
"314","60.177255","127.0.0.1","127.0.0.1","OpcUa","150","UA Secure Conversation Message: PublishRequest"
"315","60.177366","127.0.0.1","127.0.0.1","TCP","44","53530  >  49366 [ACK] Seq=29005 Ack=9896 Win=55552 Len=0"
"316","61.164445","127.0.0.1","127.0.0.1","OpcUa","210","UA Secure Conversation Message: PublishResponse"
"317","61.164547","127.0.0.1","127.0.0.1","TCP","44","49366  >  53530 [ACK] Seq=9896 Ack=29171 Win=36352 Len=0"
"318","61.177318","127.0.0.1","127.0.0.1","OpcUa","150","UA Secure Conversation Message: PublishRequest"
"319","61.177426","127.0.0.1","127.0.0.1","TCP","44","53530  >  49366 [ACK] Seq=29171 Ack=10002 Win=55296 Len=0"
"320","61.589404","::1","::1","TLSv1.2","89","Application Data"
"321","61.589485","::1","::1","TCP","64","64964  >  8900 [ACK] Seq=59 Ack=76 Win=219 Len=0"
"322","61.590394","::1","::1","TLSv1.2","93","Application Data"
"323","61.590474","::1","::1","TCP","64","8900  >  64964 [ACK] Seq=76 Ack=88 Win=186 Len=0"
"324","61.630418","127.0.0.1","127.0.0.1","TCP","56","53084  >  4840 [SYN] Seq=0 Win=65535 Len=0 MSS=65495 WS=256 SACK_PERM"
"325","61.630535","127.0.0.1","127.0.0.1","TCP","56","4840  >  53084 [SYN, ACK] Seq=0 Ack=1 Win=65535 Len=0 MSS=65495 WS=2 SACK_PERM"
"326","61.630671","127.0.0.1","127.0.0.1","TCP","44","53084  >  4840 [ACK] Seq=1 Ack=1 Win=65280 Len=0"
"327","61.631165","127.0.0.1","127.0.0.1","OpcUa","100","Hello message"
"328","61.631250","127.0.0.1","127.0.0.1","TCP","44","4840  >  53084 [ACK] Seq=1 Ack=57 Win=65480 Len=0"
"329","61.631410","127.0.0.1","127.0.0.1","OpcUa","72","Acknowledge message"
"330","61.631451","127.0.0.1","127.0.0.1","TCP","44","53084  >  4840 [ACK] Seq=57 Ack=29 Win=65280 Len=0"
"331","61.631620","127.0.0.1","127.0.0.1","OpcUa","177","OpenSecureChannel message"
"332","61.631665","127.0.0.1","127.0.0.1","TCP","44","4840  >  53084 [ACK] Seq=29 Ack=190 Win=65346 Len=0"
"333","61.631826","127.0.0.1","127.0.0.1","OpcUa","179","OpenSecureChannel message"
"334","61.631865","127.0.0.1","127.0.0.1","TCP","44","53084  >  4840 [ACK] Seq=190 Ack=164 Win=65280 Len=0"
"335","61.632139","127.0.0.1","127.0.0.1","OpcUa","137","UA Secure Conversation Message: FindServersRequest"
"336","61.632182","127.0.0.1","127.0.0.1","TCP","44","4840  >  53084 [ACK] Seq=164 Ack=283 Win=65254 Len=0"
"337","61.633427","127.0.0.1","127.0.0.1","OpcUa","278","UA Secure Conversation Message: FindServersResponse"
"338","61.633496","127.0.0.1","127.0.0.1","TCP","44","53084  >  4840 [ACK] Seq=283 Ack=398 Win=65024 Len=0"
"339","61.633783","127.0.0.1","127.0.0.1","OpcUa","101","CloseSecureChannel message: CloseSecureChannelRequest"
"340","61.633813","127.0.0.1","127.0.0.1","TCP","44","4840  >  53084 [ACK] Seq=398 Ack=340 Win=65196 Len=0"
"341","61.633843","127.0.0.1","127.0.0.1","TCP","44","53084  >  4840 [FIN, ACK] Seq=340 Ack=398 Win=65024 Len=0"
"342","61.633864","127.0.0.1","127.0.0.1","TCP","44","4840  >  53084 [ACK] Seq=398 Ack=341 Win=65196 Len=0"
"343","61.634077","127.0.0.1","127.0.0.1","TCP","44","4840  >  53084 [FIN, ACK] Seq=398 Ack=341 Win=65196 Len=0"
"344","61.634161","127.0.0.1","127.0.0.1","TCP","44","53084  >  4840 [ACK] Seq=341 Ack=399 Win=65024 Len=0"
"345","62.165451","127.0.0.1","127.0.0.1","OpcUa","206","UA Secure Conversation Message: PublishResponse"
"346","62.165533","127.0.0.1","127.0.0.1","TCP","44","49366  >  53530 [ACK] Seq=10002 Ack=29333 Win=36096 Len=0"
"347","62.178745","127.0.0.1","127.0.0.1","OpcUa","150","UA Secure Conversation Message: PublishRequest"
"348","62.178834","127.0.0.1","127.0.0.1","TCP","44","53530  >  49366 [ACK] Seq=29333 Ack=10108 Win=55296 Len=0"
"349","63.161535","127.0.0.1","127.0.0.1","OpcUa","210","UA Secure Conversation Message: PublishResponse"
"350","63.161631","127.0.0.1","127.0.0.1","TCP","44","49366  >  53530 [ACK] Seq=10108 Ack=29499 Win=35840 Len=0"
"351","63.175400","127.0.0.1","127.0.0.1","OpcUa","150","UA Secure Conversation Message: PublishRequest"
"352","63.175509","127.0.0.1","127.0.0.1","TCP","44","53530  >  49366 [ACK] Seq=29499 Ack=10214 Win=55296 Len=0"
"353","63.230293","127.0.0.1","127.0.0.1","TCP","56","53085  >  53530 [SYN] Seq=0 Win=65535 Len=0 MSS=65495 WS=256 SACK_PERM"
"354","63.230445","127.0.0.1","127.0.0.1","TCP","56","53530  >  53085 [SYN, ACK] Seq=0 Ack=1 Win=65535 Len=0 MSS=65495 WS=256 SACK_PERM"
"355","63.230518","127.0.0.1","127.0.0.1","TCP","44","53085  >  53530 [ACK] Seq=1 Ack=1 Win=65280 Len=0"
"356","63.230927","127.0.0.1","127.0.0.1","OpcUa","124","Hello message"
"357","63.230977","127.0.0.1","127.0.0.1","TCP","44","53530  >  53085 [ACK] Seq=1 Ack=81 Win=65280 Len=0"
"358","63.234878","127.0.0.1","127.0.0.1","OpcUa","72","Acknowledge message"
"359","63.234960","127.0.0.1","127.0.0.1","TCP","44","53085  >  53530 [ACK] Seq=81 Ack=29 Win=65280 Len=0"
"360","63.235161","127.0.0.1","127.0.0.1","OpcUa","177","OpenSecureChannel message"
"361","63.235275","127.0.0.1","127.0.0.1","TCP","44","53530  >  53085 [ACK] Seq=29 Ack=214 Win=65280 Len=0"
"362","63.236327","127.0.0.1","127.0.0.1","OpcUa","179","OpenSecureChannel message"
"363","63.236403","127.0.0.1","127.0.0.1","TCP","44","53085  >  53530 [ACK] Seq=214 Ack=164 Win=65280 Len=0"
"364","63.237090","127.0.0.1","127.0.0.1","OpcUa","161","UA Secure Conversation Message: FindServersRequest"
"365","63.237169","127.0.0.1","127.0.0.1","TCP","44","53530  >  53085 [ACK] Seq=164 Ack=331 Win=65024 Len=0"
"366","63.239939","127.0.0.1","127.0.0.1","OpcUa","295","UA Secure Conversation Message: FindServersResponse"
"367","63.240041","127.0.0.1","127.0.0.1","TCP","44","53085  >  53530 [ACK] Seq=331 Ack=415 Win=65024 Len=0"
"368","63.240379","127.0.0.1","127.0.0.1","OpcUa","101","CloseSecureChannel message: CloseSecureChannelRequest"
"369","63.240447","127.0.0.1","127.0.0.1","TCP","44","53530  >  53085 [ACK] Seq=415 Ack=388 Win=65024 Len=0"
"370","63.240536","127.0.0.1","127.0.0.1","TCP","44","53085  >  53530 [FIN, ACK] Seq=388 Ack=415 Win=65024 Len=0"
"371","63.240560","127.0.0.1","127.0.0.1","TCP","44","53530  >  53085 [ACK] Seq=415 Ack=389 Win=65024 Len=0"
"372","63.243145","127.0.0.1","127.0.0.1","TCP","44","53530  >  53085 [FIN, ACK] Seq=415 Ack=389 Win=65024 Len=0"
"373","63.243282","127.0.0.1","127.0.0.1","TCP","44","53085  >  53530 [ACK] Seq=389 Ack=416 Win=65024 Len=0"
"374","64.160465","127.0.0.1","127.0.0.1","OpcUa","210","UA Secure Conversation Message: PublishResponse"
"375","64.160555","127.0.0.1","127.0.0.1","TCP","44","49366  >  53530 [ACK] Seq=10214 Ack=29665 Win=35840 Len=0"
"376","64.174016","127.0.0.1","127.0.0.1","OpcUa","150","UA Secure Conversation Message: PublishRequest"
"377","64.174105","127.0.0.1","127.0.0.1","TCP","44","53530  >  49366 [ACK] Seq=29665 Ack=10320 Win=55040 Len=0"
"378","64.191504","127.0.0.1","127.0.0.1","OpcUa","133","UA Secure Conversation Message: PublishResponse"
"379","64.191601","127.0.0.1","127.0.0.1","TCP","44","49366  >  53530 [ACK] Seq=10320 Ack=29754 Win=35584 Len=0"
"380","64.205491","127.0.0.1","127.0.0.1","OpcUa","142","UA Secure Conversation Message: PublishRequest"
