"No.","Time","Source","Destination","Protocol","Length","Info"
"1","0.000000","127.0.0.1","127.0.0.1","UDP","1464","54217  >  5093 Len=1432"
"2","0.036145","127.0.0.1","127.0.0.1","UDP","1464","5093  >  54217 Len=1432"
"3","0.039908","127.0.0.1","127.0.0.1","UDP","1464","54217  >  5093 Len=1432"
"4","0.040251","127.0.0.1","127.0.0.1","UDP","1464","5093  >  54217 Len=1432"
"5","0.041312","127.0.0.1","127.0.0.1","UDP","1464","54217  >  5093 Len=1432"
"6","0.041575","127.0.0.1","127.0.0.1","UDP","1464","5093  >  54217 Len=1432"
"7","0.042378","127.0.0.1","127.0.0.1","UDP","1464","54217  >  5093 Len=1432"
"8","0.042628","127.0.0.1","127.0.0.1","UDP","1464","5093  >  54217 Len=1432"
"9","11.505569","::1","::1","TLSv1.2","89","Application Data"
"10","11.505691","::1","::1","TCP","64","64964  >  8900 [ACK] Seq=1 Ack=26 Win=218 Len=0"
"11","11.509299","::1","::1","TLSv1.2","93","Application Data"
"12","11.509387","::1","::1","TCP","64","8900  >  64964 [ACK] Seq=26 Ack=30 Win=185 Len=0"
"13","15.011799","127.0.0.1","127.0.0.1","UDP","1464","54217  >  5093 Len=1432"
"14","15.062270","127.0.0.1","127.0.0.1","UDP","1464","5093  >  54217 Len=1432"
"15","15.066776","127.0.0.1","127.0.0.1","UDP","1464","54217  >  5093 Len=1432"
"16","15.067163","127.0.0.1","127.0.0.1","UDP","1464","5093  >  54217 Len=1432"
"17","15.068803","127.0.0.1","127.0.0.1","UDP","1464","54217  >  5093 Len=1432"
"18","15.070199","127.0.0.1","127.0.0.1","UDP","1464","5093  >  54217 Len=1432"
"19","15.072046","127.0.0.1","127.0.0.1","UDP","1464","54217  >  5093 Len=1432"
"20","15.072442","127.0.0.1","127.0.0.1","UDP","1464","5093  >  54217 Len=1432"
"21","30.018412","127.0.0.1","127.0.0.1","UDP","1464","54217  >  5093 Len=1432"
"22","30.064000","127.0.0.1","127.0.0.1","UDP","1464","5093  >  54217 Len=1432"
"23","30.067685","127.0.0.1","127.0.0.1","UDP","1464","54217  >  5093 Len=1432"
"24","30.068059","127.0.0.1","127.0.0.1","UDP","1464","5093  >  54217 Len=1432"
"25","30.068966","127.0.0.1","127.0.0.1","UDP","1464","54217  >  5093 Len=1432"
"26","30.069202","127.0.0.1","127.0.0.1","UDP","1464","5093  >  54217 Len=1432"
"27","30.070150","127.0.0.1","127.0.0.1","UDP","1464","54217  >  5093 Len=1432"
"28","30.070442","127.0.0.1","127.0.0.1","UDP","1464","5093  >  54217 Len=1432"
"29","36.019039","127.0.0.1","127.0.0.1","TCP","56","59595  >  59594 [SYN] Seq=0 Win=65535 Len=0 MSS=65495 WS=256 SACK_PERM"
"30","36.019236","127.0.0.1","127.0.0.1","TCP","56","59594  >  59595 [SYN, ACK] Seq=0 Ack=1 Win=65535 Len=0 MSS=65495 WS=256 SACK_PERM"
"31","36.019320","127.0.0.1","127.0.0.1","TCP","44","59595  >  59594 [ACK] Seq=1 Ack=1 Win=65280 Len=0"
"32","36.116709","127.0.0.1","127.0.0.1","TCP","45","59595  >  59594 [PSH, ACK] Seq=1 Ack=1 Win=65280 Len=1"
"33","36.116789","127.0.0.1","127.0.0.1","TCP","44","59594  >  59595 [ACK] Seq=1 Ack=2 Win=65280 Len=0"
"34","36.117637","::1","::1","TCP","76","59596  >  53530 [SYN] Seq=0 Win=65535 Len=0 MSS=65475 WS=256 SACK_PERM"
"35","36.117804","::1","::1","TCP","76","53530  >  59596 [SYN, ACK] Seq=0 Ack=1 Win=65535 Len=0 MSS=65475 WS=256 SACK_PERM"
"36","36.117885","::1","::1","TCP","64","59596  >  53530 [ACK] Seq=1 Ack=1 Win=65280 Len=0"
"37","36.119031","::1","::1","OpcUa","144","Hello message"
"38","36.119073","::1","::1","TCP","64","53530  >  59596 [ACK] Seq=1 Ack=81 Win=65280 Len=0"
"39","36.122651","::1","::1","OpcUa","92","Acknowledge message"
"40","36.122735","::1","::1","TCP","64","59596  >  53530 [ACK] Seq=81 Ack=29 Win=65280 Len=0"
"41","36.124638","::1","::1","OpcUa","196","OpenSecureChannel message"
"42","36.124736","::1","::1","TCP","64","53530  >  59596 [ACK] Seq=29 Ack=213 Win=65280 Len=0"
"43","36.125669","::1","::1","OpcUa","199","OpenSecureChannel message"
"44","36.125761","::1","::1","TCP","64","59596  >  53530 [ACK] Seq=213 Ack=164 Win=65280 Len=0"
"45","36.128204","::1","::1","OpcUa","424","UA Secure Conversation Message: CreateSessionRequest"
"46","36.128265","::1","::1","TCP","64","53530  >  59596 [ACK] Seq=164 Ack=573 Win=64768 Len=0"
"47","36.139512","::1","::1","OpcUa","21351","UA Secure Conversation Message: CreateSessionResponse"
"48","36.139681","::1","::1","TCP","64","59596  >  53530 [ACK] Seq=573 Ack=21451 Win=44032 Len=0"
"49","36.144745","::1","::1","OpcUa","252","UA Secure Conversation Message: ActivateSessionRequest"
"50","36.144820","::1","::1","TCP","64","53530  >  59596 [ACK] Seq=21451 Ack=761 Win=64768 Len=0"
"51","36.147346","::1","::1","OpcUa","160","UA Secure Conversation Message: ActivateSessionResponse"
"52","36.147430","::1","::1","TCP","64","59596  >  53530 [ACK] Seq=761 Ack=21547 Win=43776 Len=0"
"53","36.149609","::1","::1","OpcUa","195","UA Secure Conversation Message: ReadRequest"
"54","36.149677","::1","::1","TCP","64","53530  >  59596 [ACK] Seq=21547 Ack=892 Win=64512 Len=0"
"55","36.151345","::1","::1","OpcUa","138","UA Secure Conversation Message: ReadResponse"
"56","36.151413","::1","::1","TCP","64","59596  >  53530 [ACK] Seq=892 Ack=21621 Win=43776 Len=0"
"57","36.155575","::1","::1","OpcUa","159","UA Secure Conversation Message: CloseSessionRequest"
"58","36.155721","::1","::1","TCP","64","53530  >  59596 [ACK] Seq=21621 Ack=987 Win=64512 Len=0"
"59","36.162185","::1","::1","OpcUa","116","UA Secure Conversation Message: CloseSessionResponse"
"60","36.162264","::1","::1","TCP","64","59596  >  53530 [ACK] Seq=987 Ack=21673 Win=43776 Len=0"
"61","36.163392","::1","::1","OpcUa","158","CloseSecureChannel message: CloseSecureChannelRequest"
"62","36.163473","::1","::1","TCP","64","53530  >  59596 [ACK] Seq=21673 Ack=1081 Win=64256 Len=0"
"63","36.165403","::1","::1","TCP","64","59596  >  53530 [FIN, ACK] Seq=1081 Ack=21673 Win=43776 Len=0"
"64","36.165479","::1","::1","TCP","64","53530  >  59596 [ACK] Seq=21673 Ack=1082 Win=64256 Len=0"
"65","36.165565","::1","::1","TCP","64","53530  >  59596 [FIN, ACK] Seq=21673 Ack=1082 Win=64256 Len=0"
"66","36.165632","::1","::1","TCP","64","59596  >  53530 [ACK] Seq=1082 Ack=21674 Win=43776 Len=0"
"67","36.167828","127.0.0.1","127.0.0.1","TCP","45","59595  >  59594 [PSH, ACK] Seq=2 Ack=1 Win=65280 Len=1"
"68","36.167895","127.0.0.1","127.0.0.1","TCP","44","59594  >  59595 [ACK] Seq=1 Ack=3 Win=65280 Len=0"
"69","36.168398","127.0.0.1","127.0.0.1","TCP","44","59594  >  59595 [FIN, ACK] Seq=1 Ack=3 Win=65280 Len=0"
"70","36.168528","127.0.0.1","127.0.0.1","TCP","44","59595  >  59594 [ACK] Seq=3 Ack=2 Win=65280 Len=0"
"71","36.168629","127.0.0.1","127.0.0.1","TCP","44","59595  >  59594 [FIN, ACK] Seq=3 Ack=2 Win=65280 Len=0"
"72","36.168666","127.0.0.1","127.0.0.1","TCP","44","59594  >  59595 [ACK] Seq=2 Ack=4 Win=65280 Len=0"
"73","36.516860","::1","::1","TLSv1.2","89","Application Data"
"74","36.516948","::1","::1","TCP","64","64964  >  8900 [ACK] Seq=30 Ack=51 Win=218 Len=0"
"75","36.517700","::1","::1","TLSv1.2","93","Application Data"
"76","36.517755","::1","::1","TCP","64","8900  >  64964 [ACK] Seq=51 Ack=59 Win=185 Len=0"
"77","45.019833","127.0.0.1","127.0.0.1","UDP","1464","54217  >  5093 Len=1432"
"78","45.063265","127.0.0.1","127.0.0.1","UDP","1464","5093  >  54217 Len=1432"
"79","45.067052","127.0.0.1","127.0.0.1","UDP","1464","54217  >  5093 Len=1432"
"80","45.067412","127.0.0.1","127.0.0.1","UDP","1464","5093  >  54217 Len=1432"
"81","45.068476","127.0.0.1","127.0.0.1","UDP","1464","54217  >  5093 Len=1432"
"82","45.068837","127.0.0.1","127.0.0.1","UDP","1464","5093  >  54217 Len=1432"
"83","45.070056","127.0.0.1","127.0.0.1","UDP","1464","54217  >  5093 Len=1432"
"84","45.070362","127.0.0.1","127.0.0.1","UDP","1464","5093  >  54217 Len=1432"
