"No.","Time","Source","Destination","Protocol","Length","Info"
"1","0.000000000","::1","::1","TLSv1.2","89","Application Data"
"2","0.000078600","::1","::1","TCP","64","64964  >  8900 [ACK] Seq=1 Ack=26 Win=215 Len=0"
"3","0.001031600","::1","::1","TLSv1.2","93","Application Data"
"4","0.001101600","::1","::1","TCP","64","8900  >  64964 [ACK] Seq=26 Ack=30 Win=182 Len=0"
"5","8.537238100","127.0.0.1","127.0.0.1","UDP","1464","54217  >  5093 Len=1432"
"6","8.592610400","127.0.0.1","127.0.0.1","UDP","1464","5093  >  54217 Len=1432"
"7","8.597416400","127.0.0.1","127.0.0.1","UDP","1464","54217  >  5093 Len=1432"
"8","8.597904500","127.0.0.1","127.0.0.1","UDP","1464","5093  >  54217 Len=1432"
"9","8.599428400","127.0.0.1","127.0.0.1","UDP","1464","54217  >  5093 Len=1432"
"10","8.599746300","127.0.0.1","127.0.0.1","UDP","1464","5093  >  54217 Len=1432"
"11","8.601222700","127.0.0.1","127.0.0.1","UDP","1464","54217  >  5093 Len=1432"
"12","8.601567100","127.0.0.1","127.0.0.1","UDP","1464","5093  >  54217 Len=1432"
"13","23.551988600","127.0.0.1","127.0.0.1","UDP","1464","54217  >  5093 Len=1432"
"14","23.604248900","127.0.0.1","127.0.0.1","UDP","1464","5093  >  54217 Len=1432"
"15","23.608655900","127.0.0.1","127.0.0.1","UDP","1464","54217  >  5093 Len=1432"
"16","23.609001700","127.0.0.1","127.0.0.1","UDP","1464","5093  >  54217 Len=1432"
"17","23.610966000","127.0.0.1","127.0.0.1","UDP","1464","54217  >  5093 Len=1432"
"18","23.611338900","127.0.0.1","127.0.0.1","UDP","1464","5093  >  54217 Len=1432"
"19","23.612875000","127.0.0.1","127.0.0.1","UDP","1464","54217  >  5093 Len=1432"
"20","23.613221200","127.0.0.1","127.0.0.1","UDP","1464","5093  >  54217 Len=1432"
"21","24.507541700","127.0.0.1","127.0.0.1","TCP","56","61905  >  4840 [SYN] Seq=0 Win=65535 Len=0 MSS=65495 WS=256 SACK_PERM"
"22","24.507716900","127.0.0.1","127.0.0.1","TCP","56","4840  >  61905 [SYN, ACK] Seq=0 Ack=1 Win=65535 Len=0 MSS=65495 WS=2 SACK_PERM"
"23","24.507811000","127.0.0.1","127.0.0.1","TCP","44","61905  >  4840 [ACK] Seq=1 Ack=1 Win=65280 Len=0"
"24","24.508439900","127.0.0.1","127.0.0.1","OpcUa","100","Hello message"
"25","24.508510500","127.0.0.1","127.0.0.1","TCP","44","4840  >  61905 [ACK] Seq=1 Ack=57 Win=65480 Len=0"
"26","24.508739500","127.0.0.1","127.0.0.1","OpcUa","72","Acknowledge message"
"27","24.508805400","127.0.0.1","127.0.0.1","TCP","44","61905  >  4840 [ACK] Seq=57 Ack=29 Win=65280 Len=0"
"28","24.509171100","127.0.0.1","127.0.0.1","OpcUa","177","OpenSecureChannel message"
"29","24.509265500","127.0.0.1","127.0.0.1","TCP","44","4840  >  61905 [ACK] Seq=29 Ack=190 Win=65346 Len=0"
"30","24.509491700","127.0.0.1","127.0.0.1","OpcUa","179","OpenSecureChannel message"
"31","24.509542900","127.0.0.1","127.0.0.1","TCP","44","61905  >  4840 [ACK] Seq=190 Ack=164 Win=65280 Len=0"
"32","24.509852700","127.0.0.1","127.0.0.1","OpcUa","137","UA Secure Conversation Message: FindServersRequest"
"33","24.509909800","127.0.0.1","127.0.0.1","TCP","44","4840  >  61905 [ACK] Seq=164 Ack=283 Win=65254 Len=0"
"34","24.511666500","127.0.0.1","127.0.0.1","OpcUa","278","UA Secure Conversation Message: FindServersResponse"
"35","24.511744200","127.0.0.1","127.0.0.1","TCP","44","61905  >  4840 [ACK] Seq=283 Ack=398 Win=65024 Len=0"
"36","24.512057200","127.0.0.1","127.0.0.1","OpcUa","101","CloseSecureChannel message: CloseSecureChannelRequest"
"37","24.512121000","127.0.0.1","127.0.0.1","TCP","44","4840  >  61905 [ACK] Seq=398 Ack=340 Win=65196 Len=0"
"38","24.512184900","127.0.0.1","127.0.0.1","TCP","44","61905  >  4840 [FIN, ACK] Seq=340 Ack=398 Win=65024 Len=0"
"39","24.512212000","127.0.0.1","127.0.0.1","TCP","44","4840  >  61905 [ACK] Seq=398 Ack=341 Win=65196 Len=0"
"40","24.512345700","127.0.0.1","127.0.0.1","TCP","44","4840  >  61905 [FIN, ACK] Seq=398 Ack=341 Win=65196 Len=0"
"41","24.512504600","127.0.0.1","127.0.0.1","TCP","44","61905  >  4840 [ACK] Seq=341 Ack=399 Win=65024 Len=0"
"42","25.012497400","::1","::1","TLSv1.2","89","Application Data"
"43","25.012663200","::1","::1","TCP","64","64964  >  8900 [ACK] Seq=30 Ack=51 Win=215 Len=0"
"44","25.013400600","::1","::1","TLSv1.2","93","Application Data"
"45","25.013478000","::1","::1","TCP","64","8900  >  64964 [ACK] Seq=51 Ack=59 Win=182 Len=0"
"46","38.563875100","127.0.0.1","127.0.0.1","UDP","1464","54217  >  5093 Len=1432"
"47","38.609968500","127.0.0.1","127.0.0.1","UDP","1464","5093  >  54217 Len=1432"
"48","38.614404700","127.0.0.1","127.0.0.1","UDP","1464","54217  >  5093 Len=1432"
"49","38.614809200","127.0.0.1","127.0.0.1","UDP","1464","5093  >  54217 Len=1432"
"50","38.615969300","127.0.0.1","127.0.0.1","UDP","1464","54217  >  5093 Len=1432"
"51","38.616323100","127.0.0.1","127.0.0.1","UDP","1464","5093  >  54217 Len=1432"
"52","38.617253700","127.0.0.1","127.0.0.1","UDP","1464","54217  >  5093 Len=1432"
"53","38.617542300","127.0.0.1","127.0.0.1","UDP","1464","5093  >  54217 Len=1432"
"54","50.022955500","::1","::1","TLSv1.2","89","Application Data"
"55","50.023050300","::1","::1","TCP","64","64964  >  8900 [ACK] Seq=59 Ack=76 Win=215 Len=0"
"56","50.024188700","::1","::1","TLSv1.2","93","Application Data"
"57","50.024283400","::1","::1","TCP","64","8900  >  64964 [ACK] Seq=76 Ack=88 Win=182 Len=0"
"58","50.277385400","127.0.0.1","127.0.0.1","TCP","56","61445  >  4840 [SYN] Seq=0 Win=65535 Len=0 MSS=65495 WS=256 SACK_PERM"
"59","50.277527700","127.0.0.1","127.0.0.1","TCP","56","4840  >  61445 [SYN, ACK] Seq=0 Ack=1 Win=65535 Len=0 MSS=65495 WS=2 SACK_PERM"
"60","50.277612300","127.0.0.1","127.0.0.1","TCP","44","61445  >  4840 [ACK] Seq=1 Ack=1 Win=65280 Len=0"
"61","50.278276500","127.0.0.1","127.0.0.1","OpcUa","100","Hello message"
"62","50.278351800","127.0.0.1","127.0.0.1","TCP","44","4840  >  61445 [ACK] Seq=1 Ack=57 Win=65480 Len=0"
"63","50.278505500","127.0.0.1","127.0.0.1","OpcUa","72","Acknowledge message"
"64","50.278626400","127.0.0.1","127.0.0.1","TCP","44","61445  >  4840 [ACK] Seq=57 Ack=29 Win=65280 Len=0"
"65","50.278683600","127.0.0.1","127.0.0.1","OpcUa","177","OpenSecureChannel message"
"66","50.278703000","127.0.0.1","127.0.0.1","TCP","44","4840  >  61445 [ACK] Seq=29 Ack=190 Win=65346 Len=0"
"67","50.278818900","127.0.0.1","127.0.0.1","OpcUa","179","OpenSecureChannel message"
"68","50.278852200","127.0.0.1","127.0.0.1","TCP","44","61445  >  4840 [ACK] Seq=190 Ack=164 Win=65280 Len=0"
"69","50.279144200","127.0.0.1","127.0.0.1","OpcUa","137","UA Secure Conversation Message: FindServersRequest"
"70","50.279177300","127.0.0.1","127.0.0.1","TCP","44","4840  >  61445 [ACK] Seq=164 Ack=283 Win=65254 Len=0"
"71","50.280290600","127.0.0.1","127.0.0.1","OpcUa","278","UA Secure Conversation Message: FindServersResponse"
"72","50.280342200","127.0.0.1","127.0.0.1","TCP","44","61445  >  4840 [ACK] Seq=283 Ack=398 Win=65024 Len=0"
"73","50.280523000","127.0.0.1","127.0.0.1","OpcUa","101","CloseSecureChannel message: CloseSecureChannelRequest"
"74","50.280550800","127.0.0.1","127.0.0.1","TCP","44","4840  >  61445 [ACK] Seq=398 Ack=340 Win=65196 Len=0"
"75","50.280581200","127.0.0.1","127.0.0.1","TCP","44","61445  >  4840 [FIN, ACK] Seq=340 Ack=398 Win=65024 Len=0"
"76","50.280607300","127.0.0.1","127.0.0.1","TCP","44","4840  >  61445 [ACK] Seq=398 Ack=341 Win=65196 Len=0"
"77","50.280707200","127.0.0.1","127.0.0.1","TCP","44","4840  >  61445 [FIN, ACK] Seq=398 Ack=341 Win=65196 Len=0"
"78","50.280752900","127.0.0.1","127.0.0.1","TCP","44","61445  >  4840 [ACK] Seq=341 Ack=399 Win=65024 Len=0"
"79","52.215047800","127.0.0.1","127.0.0.1","TCP","56","61446  >  53530 [SYN] Seq=0 Win=65535 Len=0 MSS=65495 WS=256 SACK_PERM"
"80","52.215214900","127.0.0.1","127.0.0.1","TCP","56","53530  >  61446 [SYN, ACK] Seq=0 Ack=1 Win=65535 Len=0 MSS=65495 WS=256 SACK_PERM"
"81","52.215313800","127.0.0.1","127.0.0.1","TCP","44","61446  >  53530 [ACK] Seq=1 Ack=1 Win=65280 Len=0"
"82","52.215914100","127.0.0.1","127.0.0.1","OpcUa","124","Hello message"
"83","52.215998400","127.0.0.1","127.0.0.1","TCP","44","53530  >  61446 [ACK] Seq=1 Ack=81 Win=65280 Len=0"
"84","52.317845200","127.0.0.1","127.0.0.1","OpcUa","72","Acknowledge message"
"85","52.317920400","127.0.0.1","127.0.0.1","TCP","44","61446  >  53530 [ACK] Seq=81 Ack=29 Win=65280 Len=0"
"86","52.318178000","127.0.0.1","127.0.0.1","OpcUa","177","OpenSecureChannel message"
"87","52.318250200","127.0.0.1","127.0.0.1","TCP","44","53530  >  61446 [ACK] Seq=29 Ack=214 Win=65280 Len=0"
"88","52.394021400","127.0.0.1","127.0.0.1","OpcUa","179","OpenSecureChannel message"
"89","52.394120200","127.0.0.1","127.0.0.1","TCP","44","61446  >  53530 [ACK] Seq=214 Ack=164 Win=65280 Len=0"
"90","52.394517800","127.0.0.1","127.0.0.1","OpcUa","161","UA Secure Conversation Message: FindServersRequest"
"91","52.394585500","127.0.0.1","127.0.0.1","TCP","44","53530  >  61446 [ACK] Seq=164 Ack=331 Win=65024 Len=0"
"92","52.411525700","127.0.0.1","127.0.0.1","OpcUa","295","UA Secure Conversation Message: FindServersResponse"
"93","52.411610600","127.0.0.1","127.0.0.1","TCP","44","61446  >  53530 [ACK] Seq=331 Ack=415 Win=65024 Len=0"
"94","52.412055100","127.0.0.1","127.0.0.1","OpcUa","101","CloseSecureChannel message: CloseSecureChannelRequest"
"95","52.412143300","127.0.0.1","127.0.0.1","TCP","44","53530  >  61446 [ACK] Seq=415 Ack=388 Win=65024 Len=0"
"96","52.412196200","127.0.0.1","127.0.0.1","TCP","44","61446  >  53530 [FIN, ACK] Seq=388 Ack=415 Win=65024 Len=0"
"97","52.412226600","127.0.0.1","127.0.0.1","TCP","44","53530  >  61446 [ACK] Seq=415 Ack=389 Win=65024 Len=0"
"98","52.419472200","127.0.0.1","127.0.0.1","TCP","44","53530  >  61446 [FIN, ACK] Seq=415 Ack=389 Win=65024 Len=0"
"99","52.419612200","127.0.0.1","127.0.0.1","TCP","44","61446  >  53530 [ACK] Seq=389 Ack=416 Win=65024 Len=0"
"100","53.111271300","127.0.0.1","127.0.0.1","TCP","56","61447  >  53530 [SYN] Seq=0 Win=65535 Len=0 MSS=65495 WS=256 SACK_PERM"
"101","53.111447200","127.0.0.1","127.0.0.1","TCP","56","53530  >  61447 [SYN, ACK] Seq=0 Ack=1 Win=65535 Len=0 MSS=65495 WS=256 SACK_PERM"
"102","53.111567600","127.0.0.1","127.0.0.1","TCP","44","61447  >  53530 [ACK] Seq=1 Ack=1 Win=65280 Len=0"
"103","53.112181300","127.0.0.1","127.0.0.1","OpcUa","128","Hello message"
"104","53.112246400","127.0.0.1","127.0.0.1","TCP","44","53530  >  61447 [ACK] Seq=1 Ack=85 Win=65280 Len=0"
"105","53.120307700","127.0.0.1","127.0.0.1","OpcUa","72","Acknowledge message"
"106","53.120484300","127.0.0.1","127.0.0.1","TCP","44","61447  >  53530 [ACK] Seq=85 Ack=29 Win=65280 Len=0"
"107","53.120568900","127.0.0.1","127.0.0.1","OpcUa","177","OpenSecureChannel message"
"108","53.120620900","127.0.0.1","127.0.0.1","TCP","44","53530  >  61447 [ACK] Seq=29 Ack=218 Win=65280 Len=0"
"109","53.125192300","127.0.0.1","127.0.0.1","OpcUa","179","OpenSecureChannel message"
"110","53.125371200","127.0.0.1","127.0.0.1","TCP","44","61447  >  53530 [ACK] Seq=218 Ack=164 Win=65280 Len=0"
"111","53.125791000","127.0.0.1","127.0.0.1","OpcUa","165","UA Secure Conversation Message: GetEndpointsRequest"
"112","53.125857700","127.0.0.1","127.0.0.1","TCP","44","53530  >  61447 [ACK] Seq=164 Ack=339 Win=65024 Len=0"
"113","53.137341700","127.0.0.1","127.0.0.1","OpcUa","20188","UA Secure Conversation Message: GetEndpointsResponse"
"114","53.137507400","127.0.0.1","127.0.0.1","TCP","44","61447  >  53530 [ACK] Seq=339 Ack=20308 Win=45056 Len=0"
"115","53.138025600","127.0.0.1","127.0.0.1","OpcUa","101","CloseSecureChannel message: CloseSecureChannelRequest"
"116","53.138090700","127.0.0.1","127.0.0.1","TCP","44","53530  >  61447 [ACK] Seq=20308 Ack=396 Win=65024 Len=0"
"117","53.138143900","127.0.0.1","127.0.0.1","TCP","44","61447  >  53530 [FIN, ACK] Seq=396 Ack=20308 Win=45056 Len=0"
"118","53.138188500","127.0.0.1","127.0.0.1","TCP","44","53530  >  61447 [ACK] Seq=20308 Ack=397 Win=65024 Len=0"
"119","53.143875600","127.0.0.1","127.0.0.1","TCP","44","53530  >  61447 [FIN, ACK] Seq=20308 Ack=397 Win=65024 Len=0"
"120","53.144086400","127.0.0.1","127.0.0.1","TCP","44","61447  >  53530 [ACK] Seq=397 Ack=20309 Win=45056 Len=0"
"121","53.575921700","127.0.0.1","127.0.0.1","UDP","1464","54217  >  5093 Len=1432"
"122","53.620603800","127.0.0.1","127.0.0.1","UDP","1464","5093  >  54217 Len=1432"
"123","53.624435400","127.0.0.1","127.0.0.1","UDP","1464","54217  >  5093 Len=1432"
"124","53.624901200","127.0.0.1","127.0.0.1","UDP","1464","5093  >  54217 Len=1432"
"125","53.626826900","127.0.0.1","127.0.0.1","UDP","1464","54217  >  5093 Len=1432"
"126","53.627197700","127.0.0.1","127.0.0.1","UDP","1464","5093  >  54217 Len=1432"
"127","53.628486300","127.0.0.1","127.0.0.1","UDP","1464","54217  >  5093 Len=1432"
"128","53.628805300","127.0.0.1","127.0.0.1","UDP","1464","5093  >  54217 Len=1432"
"129","59.691256700","127.0.0.1","127.0.0.1","TCP","56","61448  >  53530 [SYN] Seq=0 Win=65535 Len=0 MSS=65495 WS=256 SACK_PERM"
"130","59.691524800","127.0.0.1","127.0.0.1","TCP","56","53530  >  61448 [SYN, ACK] Seq=0 Ack=1 Win=65535 Len=0 MSS=65495 WS=256 SACK_PERM"
"131","59.691634700","127.0.0.1","127.0.0.1","TCP","44","61448  >  53530 [ACK] Seq=1 Ack=1 Win=65280 Len=0"
"132","59.692303500","127.0.0.1","127.0.0.1","OpcUa","128","Hello message"
"133","59.692391100","127.0.0.1","127.0.0.1","TCP","44","53530  >  61448 [ACK] Seq=1 Ack=85 Win=65280 Len=0"
"134","59.701559300","127.0.0.1","127.0.0.1","OpcUa","72","Acknowledge message"
"135","59.701689000","127.0.0.1","127.0.0.1","TCP","44","61448  >  53530 [ACK] Seq=85 Ack=29 Win=65280 Len=0"
"136","59.701884500","127.0.0.1","127.0.0.1","OpcUa","177","OpenSecureChannel message"
"137","59.701942100","127.0.0.1","127.0.0.1","TCP","44","53530  >  61448 [ACK] Seq=29 Ack=218 Win=65280 Len=0"
"138","59.707451100","127.0.0.1","127.0.0.1","OpcUa","179","OpenSecureChannel message"
"139","59.707546000","127.0.0.1","127.0.0.1","TCP","44","61448  >  53530 [ACK] Seq=218 Ack=164 Win=65280 Len=0"
"140","59.707881700","127.0.0.1","127.0.0.1","OpcUa","165","UA Secure Conversation Message: GetEndpointsRequest"
"141","59.707956600","127.0.0.1","127.0.0.1","TCP","44","53530  >  61448 [ACK] Seq=164 Ack=339 Win=65024 Len=0"
"142","59.716138000","127.0.0.1","127.0.0.1","OpcUa","20188","UA Secure Conversation Message: GetEndpointsResponse"
"143","59.716440100","127.0.0.1","127.0.0.1","TCP","44","61448  >  53530 [ACK] Seq=339 Ack=20308 Win=45056 Len=0"
"144","59.716867800","127.0.0.1","127.0.0.1","OpcUa","101","CloseSecureChannel message: CloseSecureChannelRequest"
"145","59.717046500","127.0.0.1","127.0.0.1","TCP","44","53530  >  61448 [ACK] Seq=20308 Ack=396 Win=65024 Len=0"
"146","59.717174300","127.0.0.1","127.0.0.1","TCP","44","61448  >  53530 [FIN, ACK] Seq=396 Ack=20308 Win=45056 Len=0"
"147","59.717210400","127.0.0.1","127.0.0.1","TCP","44","53530  >  61448 [ACK] Seq=20308 Ack=397 Win=65024 Len=0"
"148","59.720277900","127.0.0.1","127.0.0.1","TCP","44","53530  >  61448 [FIN, ACK] Seq=20308 Ack=397 Win=65024 Len=0"
"149","59.720380800","127.0.0.1","127.0.0.1","TCP","44","61448  >  53530 [ACK] Seq=397 Ack=20309 Win=45056 Len=0"
"150","59.902018800","127.0.0.1","127.0.0.1","TCP","56","61449  >  53530 [SYN] Seq=0 Win=65535 Len=0 MSS=65495 WS=256 SACK_PERM"
"151","59.902181500","127.0.0.1","127.0.0.1","TCP","56","53530  >  61449 [SYN, ACK] Seq=0 Ack=1 Win=65535 Len=0 MSS=65495 WS=256 SACK_PERM"
"152","59.902273400","127.0.0.1","127.0.0.1","TCP","44","61449  >  53530 [ACK] Seq=1 Ack=1 Win=65280 Len=0"
"153","59.902772800","127.0.0.1","127.0.0.1","OpcUa","128","Hello message"
"154","59.902835500","127.0.0.1","127.0.0.1","TCP","44","53530  >  61449 [ACK] Seq=1 Ack=85 Win=65280 Len=0"
"155","59.909590400","127.0.0.1","127.0.0.1","OpcUa","72","Acknowledge message"
"156","59.909741200","127.0.0.1","127.0.0.1","TCP","44","61449  >  53530 [ACK] Seq=85 Ack=29 Win=65280 Len=0"
"157","59.909977600","127.0.0.1","127.0.0.1","OpcUa","177","OpenSecureChannel message"
"158","59.910058900","127.0.0.1","127.0.0.1","TCP","44","53530  >  61449 [ACK] Seq=29 Ack=218 Win=65280 Len=0"
"159","59.913290600","127.0.0.1","127.0.0.1","OpcUa","179","OpenSecureChannel message"
"160","59.913362700","127.0.0.1","127.0.0.1","TCP","44","61449  >  53530 [ACK] Seq=218 Ack=164 Win=65280 Len=0"
"161","59.913919600","127.0.0.1","127.0.0.1","OpcUa","386","UA Secure Conversation Message: CreateSessionRequest"
"162","59.914027500","127.0.0.1","127.0.0.1","TCP","44","53530  >  61449 [ACK] Seq=164 Ack=560 Win=64768 Len=0"
"163","60.011109700","127.0.0.1","127.0.0.1","OpcUa","21331","UA Secure Conversation Message: CreateSessionResponse"
"164","60.011276600","127.0.0.1","127.0.0.1","TCP","44","61449  >  53530 [ACK] Seq=560 Ack=21451 Win=44032 Len=0"
"165","60.012969200","127.0.0.1","127.0.0.1","OpcUa","193","UA Secure Conversation Message: ActivateSessionRequest"
"166","60.013109500","127.0.0.1","127.0.0.1","TCP","44","53530  >  61449 [ACK] Seq=21451 Ack=709 Win=64768 Len=0"
"167","60.033689700","127.0.0.1","127.0.0.1","OpcUa","140","UA Secure Conversation Message: ActivateSessionResponse"
"168","60.033793400","127.0.0.1","127.0.0.1","TCP","44","61449  >  53530 [ACK] Seq=709 Ack=21547 Win=43776 Len=0"
"169","60.034291500","127.0.0.1","127.0.0.1","OpcUa","190","UA Secure Conversation Message: ReadRequest"
"170","60.034389600","127.0.0.1","127.0.0.1","TCP","44","53530  >  61449 [ACK] Seq=21547 Ack=855 Win=64512 Len=0"
"171","60.063939400","127.0.0.1","127.0.0.1","OpcUa","116","UA Secure Conversation Message: ReadResponse"
"172","60.064043100","127.0.0.1","127.0.0.1","TCP","44","61449  >  53530 [ACK] Seq=855 Ack=21619 Win=43776 Len=0"
"173","60.064565100","127.0.0.1","127.0.0.1","OpcUa","496","UA Secure Conversation Message: ReadRequest"
"174","60.064666800","127.0.0.1","127.0.0.1","TCP","44","53530  >  61449 [ACK] Seq=21619 Ack=1307 Win=64000 Len=0"
"175","60.081299800","127.0.0.1","127.0.0.1","OpcUa","565","UA Secure Conversation Message: ReadResponse"
"176","60.081404100","127.0.0.1","127.0.0.1","TCP","44","61449  >  53530 [ACK] Seq=1307 Ack=22140 Win=43264 Len=0"
"177","60.082546400","127.0.0.1","127.0.0.1","OpcUa","172","UA Secure Conversation Message: ReadRequest"
"178","60.082622100","127.0.0.1","127.0.0.1","TCP","44","53530  >  61449 [ACK] Seq=22140 Ack=1435 Win=64000 Len=0"
"179","60.098433500","127.0.0.1","127.0.0.1","OpcUa","107","UA Secure Conversation Message: ReadResponse"
"180","60.098533800","127.0.0.1","127.0.0.1","TCP","44","61449  >  53530 [ACK] Seq=1435 Ack=22203 Win=43264 Len=0"
"181","60.098944000","127.0.0.1","127.0.0.1","OpcUa","160","UA Secure Conversation Message: CreateSubscriptionRequest"
"182","60.098989600","127.0.0.1","127.0.0.1","TCP","44","53530  >  61449 [ACK] Seq=22203 Ack=1551 Win=63744 Len=0"
"183","60.176386000","127.0.0.1","127.0.0.1","OpcUa","116","UA Secure Conversation Message: CreateSubscriptionResponse"
"184","60.176480000","127.0.0.1","127.0.0.1","TCP","44","61449  >  53530 [ACK] Seq=1551 Ack=22275 Win=43008 Len=0"
"185","60.177019100","127.0.0.1","127.0.0.1","OpcUa","320","UA Secure Conversation Message: CreateMonitoredItemsRequest"
"186","60.177107900","127.0.0.1","127.0.0.1","TCP","44","53530  >  61449 [ACK] Seq=22275 Ack=1827 Win=63488 Len=0"
"187","60.247656200","127.0.0.1","127.0.0.1","OpcUa","182","UA Secure Conversation Message: CreateMonitoredItemsResponse"
"188","60.247748400","127.0.0.1","127.0.0.1","TCP","44","61449  >  53530 [ACK] Seq=1827 Ack=22413 Win=43008 Len=0"
"189","60.264671000","127.0.0.1","127.0.0.1","OpcUa","177","UA Secure Conversation Message: BrowseRequest"
"190","60.264743900","127.0.0.1","127.0.0.1","TCP","44","53530  >  61449 [ACK] Seq=22413 Ack=1960 Win=63488 Len=0"
"191","60.287665600","127.0.0.1","127.0.0.1","OpcUa","240","UA Secure Conversation Message: BrowseResponse"
"192","60.287755300","127.0.0.1","127.0.0.1","TCP","44","61449  >  53530 [ACK] Seq=1960 Ack=22609 Win=42752 Len=0"
"193","60.288916400","127.0.0.1","127.0.0.1","OpcUa","314","UA Secure Conversation Message: ReadRequest"
"194","60.288972600","127.0.0.1","127.0.0.1","TCP","44","53530  >  61449 [ACK] Seq=22609 Ack=2230 Win=63232 Len=0"
"195","60.303621900","127.0.0.1","127.0.0.1","OpcUa","194","UA Secure Conversation Message: ReadResponse"
"196","60.303819400","127.0.0.1","127.0.0.1","TCP","44","61449  >  53530 [ACK] Seq=2230 Ack=22759 Win=42752 Len=0"
"197","60.304326400","127.0.0.1","127.0.0.1","OpcUa","177","UA Secure Conversation Message: BrowseRequest"
"198","60.304400200","127.0.0.1","127.0.0.1","TCP","44","53530  >  61449 [ACK] Seq=22759 Ack=2363 Win=62976 Len=0"
"199","60.314519300","127.0.0.1","127.0.0.1","OpcUa","142","UA Secure Conversation Message: BrowseResponse"
"200","60.314634700","127.0.0.1","127.0.0.1","TCP","44","61449  >  53530 [ACK] Seq=2363 Ack=22857 Win=42496 Len=0"
"201","60.315078400","127.0.0.1","127.0.0.1","OpcUa","314","UA Secure Conversation Message: ReadRequest"
"202","60.315155300","127.0.0.1","127.0.0.1","TCP","44","53530  >  61449 [ACK] Seq=22857 Ack=2633 Win=62720 Len=0"
"203","60.323826600","127.0.0.1","127.0.0.1","OpcUa","238","UA Secure Conversation Message: ReadResponse"
"204","60.323917600","127.0.0.1","127.0.0.1","TCP","44","61449  >  53530 [ACK] Seq=2633 Ack=23051 Win=42240 Len=0"
"205","60.324254500","127.0.0.1","127.0.0.1","OpcUa","177","UA Secure Conversation Message: BrowseRequest"
"206","60.324300800","127.0.0.1","127.0.0.1","TCP","44","53530  >  61449 [ACK] Seq=23051 Ack=2766 Win=62720 Len=0"
"207","60.330973200","127.0.0.1","127.0.0.1","OpcUa","142","UA Secure Conversation Message: BrowseResponse"
"208","60.331063000","127.0.0.1","127.0.0.1","TCP","44","61449  >  53530 [ACK] Seq=2766 Ack=23149 Win=42240 Len=0"
"209","60.331454600","127.0.0.1","127.0.0.1","OpcUa","314","UA Secure Conversation Message: ReadRequest"
"210","60.331518900","127.0.0.1","127.0.0.1","TCP","44","53530  >  61449 [ACK] Seq=23149 Ack=3036 Win=62464 Len=0"
"211","60.340506800","127.0.0.1","127.0.0.1","OpcUa","181","UA Secure Conversation Message: ReadResponse"
"212","60.340698800","127.0.0.1","127.0.0.1","TCP","44","61449  >  53530 [ACK] Seq=3036 Ack=23286 Win=42240 Len=0"
"213","60.340984100","127.0.0.1","127.0.0.1","OpcUa","177","UA Secure Conversation Message: BrowseRequest"
"214","60.341043800","127.0.0.1","127.0.0.1","TCP","44","53530  >  61449 [ACK] Seq=23286 Ack=3169 Win=62208 Len=0"
"215","60.346593000","127.0.0.1","127.0.0.1","OpcUa","116","UA Secure Conversation Message: BrowseResponse"
"216","60.346693100","127.0.0.1","127.0.0.1","TCP","44","61449  >  53530 [ACK] Seq=3169 Ack=23358 Win=41984 Len=0"
"217","60.358612900","127.0.0.1","127.0.0.1","OpcUa","177","UA Secure Conversation Message: BrowseRequest"
"218","60.358710200","127.0.0.1","127.0.0.1","TCP","44","53530  >  61449 [ACK] Seq=23358 Ack=3302 Win=62208 Len=0"
"219","60.366397000","127.0.0.1","127.0.0.1","OpcUa","463","UA Secure Conversation Message: BrowseResponse"
"220","60.366494900","127.0.0.1","127.0.0.1","TCP","44","61449  >  53530 [ACK] Seq=3302 Ack=23777 Win=41728 Len=0"
"221","60.452936100","127.0.0.1","127.0.0.1","OpcUa","334","UA Secure Conversation Message: ReadRequest"
"222","60.453027100","127.0.0.1","127.0.0.1","TCP","44","53530  >  61449 [ACK] Seq=23777 Ack=3592 Win=61696 Len=0"
"223","60.459634600","127.0.0.1","127.0.0.1","OpcUa","184","UA Secure Conversation Message: ReadResponse"
"224","60.459844100","127.0.0.1","127.0.0.1","TCP","44","61449  >  53530 [ACK] Seq=3592 Ack=23917 Win=41472 Len=0"
"225","60.460282000","127.0.0.1","127.0.0.1","OpcUa","179","UA Secure Conversation Message: BrowseRequest"
"226","60.460352800","127.0.0.1","127.0.0.1","TCP","44","53530  >  61449 [ACK] Seq=23917 Ack=3727 Win=61696 Len=0"
"227","60.466711300","127.0.0.1","127.0.0.1","OpcUa","142","UA Secure Conversation Message: BrowseResponse"
"228","60.466808400","127.0.0.1","127.0.0.1","TCP","44","61449  >  53530 [ACK] Seq=3727 Ack=24015 Win=41472 Len=0"
"229","60.467349800","127.0.0.1","127.0.0.1","OpcUa","314","UA Secure Conversation Message: ReadRequest"
"230","60.467564600","127.0.0.1","127.0.0.1","TCP","44","53530  >  61449 [ACK] Seq=24015 Ack=3997 Win=61440 Len=0"
"231","60.474703400","127.0.0.1","127.0.0.1","OpcUa","192","UA Secure Conversation Message: ReadResponse"
"232","60.474816500","127.0.0.1","127.0.0.1","TCP","44","61449  >  53530 [ACK] Seq=3997 Ack=24163 Win=41216 Len=0"
"233","60.475276000","127.0.0.1","127.0.0.1","OpcUa","177","UA Secure Conversation Message: BrowseRequest"
"234","60.475374300","127.0.0.1","127.0.0.1","TCP","44","53530  >  61449 [ACK] Seq=24163 Ack=4130 Win=61184 Len=0"
"235","60.481943800","127.0.0.1","127.0.0.1","OpcUa","116","UA Secure Conversation Message: BrowseResponse"
"236","60.482028600","127.0.0.1","127.0.0.1","TCP","44","61449  >  53530 [ACK] Seq=4130 Ack=24235 Win=41216 Len=0"
"237","60.482875400","127.0.0.1","127.0.0.1","OpcUa","334","UA Secure Conversation Message: ReadRequest"
"238","60.482968000","127.0.0.1","127.0.0.1","TCP","44","53530  >  61449 [ACK] Seq=24235 Ack=4420 Win=60928 Len=0"
"239","60.489003200","127.0.0.1","127.0.0.1","OpcUa","206","UA Secure Conversation Message: ReadResponse"
"240","60.489113000","127.0.0.1","127.0.0.1","TCP","44","61449  >  53530 [ACK] Seq=4420 Ack=24397 Win=40960 Len=0"
"241","60.489507400","127.0.0.1","127.0.0.1","OpcUa","179","UA Secure Conversation Message: BrowseRequest"
"242","60.489552400","127.0.0.1","127.0.0.1","TCP","44","53530  >  61449 [ACK] Seq=24397 Ack=4555 Win=60928 Len=0"
"243","60.496186300","127.0.0.1","127.0.0.1","OpcUa","142","UA Secure Conversation Message: BrowseResponse"
"244","60.496283200","127.0.0.1","127.0.0.1","TCP","44","61449  >  53530 [ACK] Seq=4555 Ack=24495 Win=40960 Len=0"
"245","60.521238600","127.0.0.1","127.0.0.1","OpcUa","142","UA Secure Conversation Message: PublishRequest"
"246","60.521353600","127.0.0.1","127.0.0.1","TCP","44","53530  >  61449 [ACK] Seq=24495 Ack=4653 Win=60672 Len=0"
"247","60.521459700","127.0.0.1","127.0.0.1","OpcUa","142","UA Secure Conversation Message: PublishRequest"
"248","60.521489900","127.0.0.1","127.0.0.1","TCP","44","53530  >  61449 [ACK] Seq=24495 Ack=4751 Win=60672 Len=0"
"249","60.535043500","127.0.0.1","127.0.0.1","OpcUa","129","UA Secure Conversation Message: PublishResponse"
"250","60.535168600","127.0.0.1","127.0.0.1","TCP","44","61449  >  53530 [ACK] Seq=4751 Ack=24580 Win=40704 Len=0"
"251","60.536508600","127.0.0.1","127.0.0.1","OpcUa","142","UA Secure Conversation Message: PublishRequest"
"252","60.536603800","127.0.0.1","127.0.0.1","TCP","44","53530  >  61449 [ACK] Seq=24580 Ack=4849 Win=60672 Len=0"
"253","65.433161100","127.0.0.1","127.0.0.1","OpcUa","129","UA Secure Conversation Message: PublishResponse"
"254","65.433258500","127.0.0.1","127.0.0.1","TCP","44","61449  >  53530 [ACK] Seq=4849 Ack=24665 Win=40704 Len=0"
"255","65.445594500","127.0.0.1","127.0.0.1","OpcUa","142","UA Secure Conversation Message: PublishRequest"
"256","65.445696100","127.0.0.1","127.0.0.1","TCP","44","53530  >  61449 [ACK] Seq=24665 Ack=4947 Win=60416 Len=0"
"257","65.507974100","127.0.0.1","127.0.0.1","OpcUa","208","UA Secure Conversation Message: ReadRequest"
"258","65.508060400","127.0.0.1","127.0.0.1","TCP","44","53530  >  61449 [ACK] Seq=24665 Ack=5111 Win=60416 Len=0"
"259","65.512222000","127.0.0.1","127.0.0.1","OpcUa","143","UA Secure Conversation Message: ReadResponse"
"260","65.512311100","127.0.0.1","127.0.0.1","TCP","44","61449  >  53530 [ACK] Seq=5111 Ack=24764 Win=40704 Len=0"
"261","68.584384200","127.0.0.1","127.0.0.1","UDP","1464","54217  >  5093 Len=1432"
"262","68.612823000","127.0.0.1","127.0.0.1","UDP","1464","5093  >  54217 Len=1432"
"263","68.616947000","127.0.0.1","127.0.0.1","UDP","1464","54217  >  5093 Len=1432"
"264","68.617379000","127.0.0.1","127.0.0.1","UDP","1464","5093  >  54217 Len=1432"
"265","68.618815900","127.0.0.1","127.0.0.1","UDP","1464","54217  >  5093 Len=1432"
"266","68.619099800","127.0.0.1","127.0.0.1","UDP","1464","5093  >  54217 Len=1432"
"267","68.620217900","127.0.0.1","127.0.0.1","UDP","1464","54217  >  5093 Len=1432"
"268","68.620499100","127.0.0.1","127.0.0.1","UDP","1464","5093  >  54217 Len=1432"
"269","70.434347900","127.0.0.1","127.0.0.1","OpcUa","129","UA Secure Conversation Message: PublishResponse"
"270","70.434455000","127.0.0.1","127.0.0.1","TCP","44","61449  >  53530 [ACK] Seq=5111 Ack=24849 Win=40448 Len=0"
"271","70.447483000","127.0.0.1","127.0.0.1","OpcUa","142","UA Secure Conversation Message: PublishRequest"
"272","70.447579200","127.0.0.1","127.0.0.1","TCP","44","53530  >  61449 [ACK] Seq=24849 Ack=5209 Win=60160 Len=0"
"273","70.523849300","127.0.0.1","127.0.0.1","OpcUa","208","UA Secure Conversation Message: ReadRequest"
"274","70.523933000","127.0.0.1","127.0.0.1","TCP","44","53530  >  61449 [ACK] Seq=24849 Ack=5373 Win=60160 Len=0"
"275","70.528642600","127.0.0.1","127.0.0.1","OpcUa","143","UA Secure Conversation Message: ReadResponse"
"276","70.528737900","127.0.0.1","127.0.0.1","TCP","44","61449  >  53530 [ACK] Seq=5373 Ack=24948 Win=40448 Len=0"
"277","75.025839200","::1","::1","TLSv1.2","89","Application Data"
"278","75.025911500","::1","::1","TCP","64","64964  >  8900 [ACK] Seq=88 Ack=101 Win=215 Len=0"
"279","75.027069600","::1","::1","TLSv1.2","93","Application Data"
"280","75.027214600","::1","::1","TCP","64","8900  >  64964 [ACK] Seq=101 Ack=117 Win=181 Len=0"
"281","75.431913700","127.0.0.1","127.0.0.1","OpcUa","129","UA Secure Conversation Message: PublishResponse"
"282","75.432029000","127.0.0.1","127.0.0.1","TCP","44","61449  >  53530 [ACK] Seq=5373 Ack=25033 Win=40448 Len=0"
"283","75.444665600","127.0.0.1","127.0.0.1","OpcUa","142","UA Secure Conversation Message: PublishRequest"
"284","75.444791400","127.0.0.1","127.0.0.1","TCP","44","53530  >  61449 [ACK] Seq=25033 Ack=5471 Win=59904 Len=0"
"285","75.537477400","127.0.0.1","127.0.0.1","OpcUa","208","UA Secure Conversation Message: ReadRequest"
"286","75.537601800","127.0.0.1","127.0.0.1","TCP","44","53530  >  61449 [ACK] Seq=25033 Ack=5635 Win=59648 Len=0"
"287","75.541731000","127.0.0.1","127.0.0.1","OpcUa","143","UA Secure Conversation Message: ReadResponse"
"288","75.541841500","127.0.0.1","127.0.0.1","TCP","44","61449  >  53530 [ACK] Seq=5635 Ack=25132 Win=40192 Len=0"
"289","76.595615100","127.0.0.1","127.0.0.1","OpcUa","197","UA Secure Conversation Message: BrowseRequest"
"290","76.595680000","127.0.0.1","127.0.0.1","TCP","44","53530  >  61449 [ACK] Seq=25132 Ack=5788 Win=59648 Len=0"
"291","76.600418500","127.0.0.1","127.0.0.1","OpcUa","442","UA Secure Conversation Message: BrowseResponse"
"292","76.600497000","127.0.0.1","127.0.0.1","TCP","44","61449  >  53530 [ACK] Seq=5788 Ack=25530 Win=39936 Len=0"
"293","78.390791800","127.0.0.1","127.0.0.1","OpcUa","496","UA Secure Conversation Message: ReadRequest"
"294","78.390877700","127.0.0.1","127.0.0.1","TCP","44","53530  >  61449 [ACK] Seq=25530 Ack=6240 Win=59136 Len=0"
"295","78.391091200","127.0.0.1","127.0.0.1","OpcUa","179","UA Secure Conversation Message: BrowseRequest"
"296","78.391127200","127.0.0.1","127.0.0.1","TCP","44","53530  >  61449 [ACK] Seq=25530 Ack=6375 Win=59136 Len=0"
"297","78.397285400","127.0.0.1","127.0.0.1","OpcUa","252","UA Secure Conversation Message: BrowseResponse"
"298","78.397378900","127.0.0.1","127.0.0.1","TCP","44","61449  >  53530 [ACK] Seq=6375 Ack=25738 Win=39680 Len=0"
"299","78.397802900","127.0.0.1","127.0.0.1","OpcUa","314","UA Secure Conversation Message: ReadRequest"
"300","78.397862600","127.0.0.1","127.0.0.1","TCP","44","53530  >  61449 [ACK] Seq=25738 Ack=6645 Win=58880 Len=0"
"301","78.399725700","127.0.0.1","127.0.0.1","OpcUa","391","UA Secure Conversation Message: ReadResponse"
"302","78.399809500","127.0.0.1","127.0.0.1","TCP","44","61449  >  53530 [ACK] Seq=6645 Ack=26085 Win=39424 Len=0"
"303","78.407939700","127.0.0.1","127.0.0.1","OpcUa","215","UA Secure Conversation Message: ReadResponse"
"304","78.408037400","127.0.0.1","127.0.0.1","TCP","44","61449  >  53530 [ACK] Seq=6645 Ack=26256 Win=39168 Len=0"
"305","78.408585500","127.0.0.1","127.0.0.1","OpcUa","334","UA Secure Conversation Message: ReadRequest"
"306","78.408673800","127.0.0.1","127.0.0.1","TCP","44","53530  >  61449 [ACK] Seq=26256 Ack=6935 Win=58368 Len=0"
"307","78.414160900","127.0.0.1","127.0.0.1","OpcUa","307","UA Secure Conversation Message: ReadResponse"
"308","78.414254400","127.0.0.1","127.0.0.1","TCP","44","61449  >  53530 [ACK] Seq=6935 Ack=26519 Win=38912 Len=0"
"309","78.438070000","127.0.0.1","127.0.0.1","OpcUa","314","UA Secure Conversation Message: ReadRequest"
"310","78.438172400","127.0.0.1","127.0.0.1","TCP","44","53530  >  61449 [ACK] Seq=26519 Ack=7205 Win=58112 Len=0"
"311","78.443827800","127.0.0.1","127.0.0.1","OpcUa","176","UA Secure Conversation Message: ReadResponse"
"312","78.443905300","127.0.0.1","127.0.0.1","TCP","44","61449  >  53530 [ACK] Seq=7205 Ack=26651 Win=38656 Len=0"
"313","78.538932400","127.0.0.1","127.0.0.1","OpcUa","334","UA Secure Conversation Message: ReadRequest"
"314","78.539022300","127.0.0.1","127.0.0.1","TCP","44","53530  >  61449 [ACK] Seq=26651 Ack=7495 Win=57856 Len=0"
"315","78.544035900","127.0.0.1","127.0.0.1","OpcUa","175","UA Secure Conversation Message: ReadResponse"
"316","78.544128300","127.0.0.1","127.0.0.1","TCP","44","61449  >  53530 [ACK] Seq=7495 Ack=26782 Win=38656 Len=0"
"317","78.971783500","127.0.0.1","127.0.0.1","OpcUa","160","UA Secure Conversation Message: CreateSubscriptionRequest"
"318","78.971856200","127.0.0.1","127.0.0.1","TCP","44","53530  >  61449 [ACK] Seq=26782 Ack=7611 Win=57856 Len=0"
"319","78.987174800","127.0.0.1","127.0.0.1","OpcUa","116","UA Secure Conversation Message: CreateSubscriptionResponse"
"320","78.987267700","127.0.0.1","127.0.0.1","TCP","44","61449  >  53530 [ACK] Seq=7611 Ack=26854 Win=38656 Len=0"
"321","78.987851800","127.0.0.1","127.0.0.1","OpcUa","192","UA Secure Conversation Message: CreateMonitoredItemsRequest"
"322","78.988046000","127.0.0.1","127.0.0.1","TCP","44","53530  >  61449 [ACK] Seq=26854 Ack=7759 Win=57600 Len=0"
"323","78.995859700","127.0.0.1","127.0.0.1","OpcUa","142","UA Secure Conversation Message: PublishRequest"
"324","78.995960100","127.0.0.1","127.0.0.1","TCP","44","53530  >  61449 [ACK] Seq=26854 Ack=7857 Win=57600 Len=0"
"325","78.998202300","127.0.0.1","127.0.0.1","OpcUa","127","UA Secure Conversation Message: CreateMonitoredItemsResponse"
"326","78.998406900","127.0.0.1","127.0.0.1","TCP","44","61449  >  53530 [ACK] Seq=7857 Ack=26937 Win=38400 Len=0"
"327","78.998918200","127.0.0.1","127.0.0.1","OpcUa","176","UA Secure Conversation Message: TranslateBrowsePathsToNodeIdsRequest"
"328","78.998992400","127.0.0.1","127.0.0.1","TCP","44","53530  >  61449 [ACK] Seq=26937 Ack=7989 Win=57344 Len=0"
"329","79.010185900","127.0.0.1","127.0.0.1","OpcUa","112","UA Secure Conversation Message: TranslateBrowsePathsToNodeIdsResponse"
"330","79.010268400","127.0.0.1","127.0.0.1","TCP","44","61449  >  53530 [ACK] Seq=7989 Ack=27005 Win=38400 Len=0"
"331","79.010701900","127.0.0.1","127.0.0.1","OpcUa","174","UA Secure Conversation Message: TranslateBrowsePathsToNodeIdsRequest"
"332","79.010743200","127.0.0.1","127.0.0.1","TCP","44","53530  >  61449 [ACK] Seq=27005 Ack=8119 Win=57344 Len=0"
"333","79.015623000","127.0.0.1","127.0.0.1","OpcUa","112","UA Secure Conversation Message: TranslateBrowsePathsToNodeIdsResponse"
"334","79.015722500","127.0.0.1","127.0.0.1","TCP","44","61449  >  53530 [ACK] Seq=8119 Ack=27073 Win=38400 Len=0"
"335","79.480637400","127.0.0.1","127.0.0.1","OpcUa","180","UA Secure Conversation Message: PublishResponse"
"336","79.480750600","127.0.0.1","127.0.0.1","TCP","44","61449  >  53530 [ACK] Seq=8119 Ack=27209 Win=38144 Len=0"
"337","79.490819100","127.0.0.1","127.0.0.1","OpcUa","150","UA Secure Conversation Message: PublishRequest"
"338","79.490934500","127.0.0.1","127.0.0.1","TCP","44","53530  >  61449 [ACK] Seq=27209 Ack=8225 Win=57088 Len=0"
"339","80.057792800","127.0.0.1","127.0.0.1","OpcUa","496","UA Secure Conversation Message: ReadRequest"
"340","80.057870600","127.0.0.1","127.0.0.1","TCP","44","53530  >  61449 [ACK] Seq=27209 Ack=8677 Win=56832 Len=0"
"341","80.058036400","127.0.0.1","127.0.0.1","OpcUa","179","UA Secure Conversation Message: BrowseRequest"
"342","80.058073500","127.0.0.1","127.0.0.1","TCP","44","53530  >  61449 [ACK] Seq=27209 Ack=8812 Win=56576 Len=0"
"343","80.062490700","127.0.0.1","127.0.0.1","OpcUa","252","UA Secure Conversation Message: BrowseResponse"
"344","80.062592100","127.0.0.1","127.0.0.1","TCP","44","61449  >  53530 [ACK] Seq=8812 Ack=27417 Win=37888 Len=0"
"345","80.063013300","127.0.0.1","127.0.0.1","OpcUa","387","UA Secure Conversation Message: ReadResponse"
"346","80.063101400","127.0.0.1","127.0.0.1","TCP","44","61449  >  53530 [ACK] Seq=8812 Ack=27760 Win=37632 Len=0"
"347","80.162420700","127.0.0.1","127.0.0.1","OpcUa","334","UA Secure Conversation Message: ReadRequest"
"348","80.162492600","127.0.0.1","127.0.0.1","TCP","44","53530  >  61449 [ACK] Seq=27760 Ack=9102 Win=56320 Len=0"
"349","80.166553300","127.0.0.1","127.0.0.1","OpcUa","171","UA Secure Conversation Message: ReadResponse"
"350","80.166639700","127.0.0.1","127.0.0.1","TCP","44","61449  >  53530 [ACK] Seq=9102 Ack=27887 Win=37632 Len=0"
"351","80.428265100","127.0.0.1","127.0.0.1","OpcUa","129","UA Secure Conversation Message: PublishResponse"
"352","80.428344000","127.0.0.1","127.0.0.1","TCP","44","61449  >  53530 [ACK] Seq=9102 Ack=27972 Win=37376 Len=0"
"353","80.441890400","127.0.0.1","127.0.0.1","OpcUa","142","UA Secure Conversation Message: PublishRequest"
"354","80.441957800","127.0.0.1","127.0.0.1","TCP","44","53530  >  61449 [ACK] Seq=27972 Ack=9200 Win=56320 Len=0"
"355","80.530276100","127.0.0.1","127.0.0.1","OpcUa","192","UA Secure Conversation Message: CreateMonitoredItemsRequest"
"356","80.530349400","127.0.0.1","127.0.0.1","TCP","44","53530  >  61449 [ACK] Seq=27972 Ack=9348 Win=56064 Len=0"
"357","80.534513500","127.0.0.1","127.0.0.1","OpcUa","127","UA Secure Conversation Message: CreateMonitoredItemsResponse"
"358","80.534615100","127.0.0.1","127.0.0.1","TCP","44","61449  >  53530 [ACK] Seq=9348 Ack=28055 Win=37376 Len=0"
"359","80.535370200","127.0.0.1","127.0.0.1","OpcUa","176","UA Secure Conversation Message: TranslateBrowsePathsToNodeIdsRequest"
"360","80.535489400","127.0.0.1","127.0.0.1","TCP","44","53530  >  61449 [ACK] Seq=28055 Ack=9480 Win=55808 Len=0"
"361","80.548409300","127.0.0.1","127.0.0.1","OpcUa","112","UA Secure Conversation Message: TranslateBrowsePathsToNodeIdsResponse"
"362","80.548508100","127.0.0.1","127.0.0.1","TCP","44","61449  >  53530 [ACK] Seq=9480 Ack=28123 Win=37376 Len=0"
"363","80.548856400","127.0.0.1","127.0.0.1","OpcUa","174","UA Secure Conversation Message: TranslateBrowsePathsToNodeIdsRequest"
"364","80.548923400","127.0.0.1","127.0.0.1","TCP","44","53530  >  61449 [ACK] Seq=28123 Ack=9610 Win=55808 Len=0"
"365","80.552249100","127.0.0.1","127.0.0.1","OpcUa","208","UA Secure Conversation Message: ReadRequest"
"366","80.552346800","127.0.0.1","127.0.0.1","TCP","44","53530  >  61449 [ACK] Seq=28123 Ack=9774 Win=55552 Len=0"
"367","80.554646900","127.0.0.1","127.0.0.1","OpcUa","112","UA Secure Conversation Message: TranslateBrowsePathsToNodeIdsResponse"
"368","80.554752400","127.0.0.1","127.0.0.1","TCP","44","61449  >  53530 [ACK] Seq=9774 Ack=28191 Win=37120 Len=0"
"369","80.556848600","127.0.0.1","127.0.0.1","OpcUa","143","UA Secure Conversation Message: ReadResponse"
"370","80.556944300","127.0.0.1","127.0.0.1","TCP","44","61449  >  53530 [ACK] Seq=9774 Ack=28290 Win=37120 Len=0"
"371","80.978139700","127.0.0.1","127.0.0.1","OpcUa","180","UA Secure Conversation Message: PublishResponse"
