"No.","Time","Source","Destination","Protocol","Length","Info"
"1","0.000000","127.0.0.1","127.0.0.1","UDP","1464","54217  >  5093 Len=1432"
"2","0.054336","127.0.0.1","127.0.0.1","UDP","1464","5093  >  54217 Len=1432"
"3","0.057733","127.0.0.1","127.0.0.1","UDP","1464","54217  >  5093 Len=1432"
"4","0.058052","127.0.0.1","127.0.0.1","UDP","1464","5093  >  54217 Len=1432"
"5","0.059523","127.0.0.1","127.0.0.1","UDP","1464","54217  >  5093 Len=1432"
"6","0.059900","127.0.0.1","127.0.0.1","UDP","1464","5093  >  54217 Len=1432"
"7","0.061501","127.0.0.1","127.0.0.1","UDP","1464","54217  >  5093 Len=1432"
"8","0.061836","127.0.0.1","127.0.0.1","UDP","1464","5093  >  54217 Len=1432"
"9","1.492612","::1","::1","TLSv1.2","89","Application Data"
"10","1.492689","::1","::1","TCP","64","64964  >  8900 [ACK] Seq=1 Ack=26 Win=218 Len=0"
"11","1.494257","::1","::1","TLSv1.2","93","Application Data"
"12","1.494334","::1","::1","TCP","64","8900  >  64964 [ACK] Seq=26 Ack=30 Win=184 Len=0"
"13","15.004503","127.0.0.1","127.0.0.1","UDP","1464","54217  >  5093 Len=1432"
"14","15.050663","127.0.0.1","127.0.0.1","UDP","1464","5093  >  54217 Len=1432"
"15","15.055124","127.0.0.1","127.0.0.1","UDP","1464","54217  >  5093 Len=1432"
"16","15.055444","127.0.0.1","127.0.0.1","UDP","1464","5093  >  54217 Len=1432"
"17","15.056904","127.0.0.1","127.0.0.1","UDP","1464","54217  >  5093 Len=1432"
"18","15.057291","127.0.0.1","127.0.0.1","UDP","1464","5093  >  54217 Len=1432"
"19","15.058458","127.0.0.1","127.0.0.1","UDP","1464","54217  >  5093 Len=1432"
"20","15.058782","127.0.0.1","127.0.0.1","UDP","1464","5093  >  54217 Len=1432"
"21","26.509160","::1","::1","TLSv1.2","89","Application Data"
"22","26.509234","::1","::1","TCP","64","64964  >  8900 [ACK] Seq=30 Ack=51 Win=217 Len=0"
"23","26.510336","::1","::1","TLSv1.2","93","Application Data"
"24","26.510422","::1","::1","TCP","64","8900  >  64964 [ACK] Seq=51 Ack=59 Win=184 Len=0"
"25","30.007919","127.0.0.1","127.0.0.1","UDP","1464","54217  >  5093 Len=1432"
"26","30.047960","127.0.0.1","127.0.0.1","UDP","1464","5093  >  54217 Len=1432"
"27","30.051575","127.0.0.1","127.0.0.1","UDP","1464","54217  >  5093 Len=1432"
"28","30.051926","127.0.0.1","127.0.0.1","UDP","1464","5093  >  54217 Len=1432"
"29","30.052739","127.0.0.1","127.0.0.1","UDP","1464","54217  >  5093 Len=1432"
"30","30.052992","127.0.0.1","127.0.0.1","UDP","1464","5093  >  54217 Len=1432"
"31","30.053787","127.0.0.1","127.0.0.1","UDP","1464","54217  >  5093 Len=1432"
"32","30.054000","127.0.0.1","127.0.0.1","UDP","1464","5093  >  54217 Len=1432"
"33","45.009493","127.0.0.1","127.0.0.1","UDP","1464","54217  >  5093 Len=1432"
"34","45.062702","127.0.0.1","127.0.0.1","UDP","1464","5093  >  54217 Len=1432"
"35","45.066216","127.0.0.1","127.0.0.1","UDP","1464","54217  >  5093 Len=1432"
"36","45.066774","127.0.0.1","127.0.0.1","UDP","1464","5093  >  54217 Len=1432"
"37","45.068075","127.0.0.1","127.0.0.1","UDP","1464","54217  >  5093 Len=1432"
"38","45.068458","127.0.0.1","127.0.0.1","UDP","1464","5093  >  54217 Len=1432"
"39","45.069557","127.0.0.1","127.0.0.1","UDP","1464","54217  >  5093 Len=1432"
"40","45.069920","127.0.0.1","127.0.0.1","UDP","1464","5093  >  54217 Len=1432"
"41","48.916272","127.0.0.1","127.0.0.1","TCP","56","49590  >  4840 [SYN] Seq=0 Win=65535 Len=0 MSS=65495 WS=256 SACK_PERM"
"42","48.916401","127.0.0.1","127.0.0.1","TCP","56","4840  >  49590 [SYN, ACK] Seq=0 Ack=1 Win=65535 Len=0 MSS=65495 WS=2 SACK_PERM"
"43","48.916479","127.0.0.1","127.0.0.1","TCP","44","49590  >  4840 [ACK] Seq=1 Ack=1 Win=65280 Len=0"
"44","48.916989","127.0.0.1","127.0.0.1","OpcUa","100","Hello message"
"45","48.917133","127.0.0.1","127.0.0.1","TCP","44","4840  >  49590 [ACK] Seq=1 Ack=57 Win=65480 Len=0"
"46","48.917303","127.0.0.1","127.0.0.1","OpcUa","72","Acknowledge message"
"47","48.917350","127.0.0.1","127.0.0.1","TCP","44","49590  >  4840 [ACK] Seq=57 Ack=29 Win=65280 Len=0"
"48","48.917693","127.0.0.1","127.0.0.1","OpcUa","177","OpenSecureChannel message"
"49","48.917753","127.0.0.1","127.0.0.1","TCP","44","4840  >  49590 [ACK] Seq=29 Ack=190 Win=65346 Len=0"
"50","48.917897","127.0.0.1","127.0.0.1","OpcUa","179","OpenSecureChannel message"
"51","48.917967","127.0.0.1","127.0.0.1","TCP","44","49590  >  4840 [ACK] Seq=190 Ack=164 Win=65280 Len=0"
"52","48.918255","127.0.0.1","127.0.0.1","OpcUa","137","UA Secure Conversation Message: FindServersRequest"
"53","48.918297","127.0.0.1","127.0.0.1","TCP","44","4840  >  49590 [ACK] Seq=164 Ack=283 Win=65254 Len=0"
"54","48.919434","127.0.0.1","127.0.0.1","OpcUa","278","UA Secure Conversation Message: FindServersResponse"
"55","48.919518","127.0.0.1","127.0.0.1","TCP","44","49590  >  4840 [ACK] Seq=283 Ack=398 Win=65024 Len=0"
"56","48.919836","127.0.0.1","127.0.0.1","OpcUa","101","CloseSecureChannel message: CloseSecureChannelRequest"
"57","48.919898","127.0.0.1","127.0.0.1","TCP","44","4840  >  49590 [ACK] Seq=398 Ack=340 Win=65196 Len=0"
"58","48.920008","127.0.0.1","127.0.0.1","TCP","44","49590  >  4840 [FIN, ACK] Seq=340 Ack=398 Win=65024 Len=0"
"59","48.920032","127.0.0.1","127.0.0.1","TCP","44","4840  >  49590 [ACK] Seq=398 Ack=341 Win=65196 Len=0"
"60","48.920120","127.0.0.1","127.0.0.1","TCP","44","4840  >  49590 [FIN, ACK] Seq=398 Ack=341 Win=65196 Len=0"
"61","48.920188","127.0.0.1","127.0.0.1","TCP","44","49590  >  4840 [ACK] Seq=341 Ack=399 Win=65024 Len=0"
"62","51.516743","::1","::1","TLSv1.2","89","Application Data"
"63","51.516821","::1","::1","TCP","64","64964  >  8900 [ACK] Seq=59 Ack=76 Win=217 Len=0"
"64","51.517949","::1","::1","TLSv1.2","93","Application Data"
"65","51.518028","::1","::1","TCP","64","8900  >  64964 [ACK] Seq=76 Ack=88 Win=184 Len=0"
"66","60.013600","127.0.0.1","127.0.0.1","UDP","1464","54217  >  5093 Len=1432"
"67","60.057381","127.0.0.1","127.0.0.1","UDP","1464","5093  >  54217 Len=1432"
"68","60.061674","127.0.0.1","127.0.0.1","UDP","1464","54217  >  5093 Len=1432"
"69","60.062262","127.0.0.1","127.0.0.1","UDP","1464","5093  >  54217 Len=1432"
"70","60.063679","127.0.0.1","127.0.0.1","UDP","1464","54217  >  5093 Len=1432"
"71","60.064099","127.0.0.1","127.0.0.1","UDP","1464","5093  >  54217 Len=1432"
"72","60.065621","127.0.0.1","127.0.0.1","UDP","1464","54217  >  5093 Len=1432"
"73","60.065936","127.0.0.1","127.0.0.1","UDP","1464","5093  >  54217 Len=1432"
"74","66.092473","127.0.0.1","127.0.0.1","TCP","56","50430  >  4840 [SYN] Seq=0 Win=65535 Len=0 MSS=65495 WS=256 SACK_PERM"
"75","66.092654","127.0.0.1","127.0.0.1","TCP","56","4840  >  50430 [SYN, ACK] Seq=0 Ack=1 Win=65535 Len=0 MSS=65495 WS=2 SACK_PERM"
"76","66.092782","127.0.0.1","127.0.0.1","TCP","44","50430  >  4840 [ACK] Seq=1 Ack=1 Win=65280 Len=0"
"77","66.093342","127.0.0.1","127.0.0.1","OpcUa","100","Hello message"
"78","66.093397","127.0.0.1","127.0.0.1","TCP","44","4840  >  50430 [ACK] Seq=1 Ack=57 Win=65480 Len=0"
"79","66.093660","127.0.0.1","127.0.0.1","OpcUa","72","Acknowledge message"
"80","66.093754","127.0.0.1","127.0.0.1","TCP","44","50430  >  4840 [ACK] Seq=57 Ack=29 Win=65280 Len=0"
"81","66.093955","127.0.0.1","127.0.0.1","OpcUa","177","OpenSecureChannel message"
"82","66.094011","127.0.0.1","127.0.0.1","TCP","44","4840  >  50430 [ACK] Seq=29 Ack=190 Win=65346 Len=0"
"83","66.094202","127.0.0.1","127.0.0.1","OpcUa","179","OpenSecureChannel message"
"84","66.094267","127.0.0.1","127.0.0.1","TCP","44","50430  >  4840 [ACK] Seq=190 Ack=164 Win=65280 Len=0"
"85","66.094551","127.0.0.1","127.0.0.1","OpcUa","137","UA Secure Conversation Message: FindServersRequest"
"86","66.094601","127.0.0.1","127.0.0.1","TCP","44","4840  >  50430 [ACK] Seq=164 Ack=283 Win=65254 Len=0"
"87","66.095755","127.0.0.1","127.0.0.1","OpcUa","278","UA Secure Conversation Message: FindServersResponse"
"88","66.095806","127.0.0.1","127.0.0.1","TCP","44","50430  >  4840 [ACK] Seq=283 Ack=398 Win=65024 Len=0"
"89","66.096061","127.0.0.1","127.0.0.1","OpcUa","101","CloseSecureChannel message: CloseSecureChannelRequest"
"90","66.096107","127.0.0.1","127.0.0.1","TCP","44","4840  >  50430 [ACK] Seq=398 Ack=340 Win=65196 Len=0"
"91","66.096142","127.0.0.1","127.0.0.1","TCP","44","50430  >  4840 [FIN, ACK] Seq=340 Ack=398 Win=65024 Len=0"
"92","66.096166","127.0.0.1","127.0.0.1","TCP","44","4840  >  50430 [ACK] Seq=398 Ack=341 Win=65196 Len=0"
"93","66.096403","127.0.0.1","127.0.0.1","TCP","44","4840  >  50430 [FIN, ACK] Seq=398 Ack=341 Win=65196 Len=0"
"94","66.096473","127.0.0.1","127.0.0.1","TCP","44","50430  >  4840 [ACK] Seq=341 Ack=399 Win=65024 Len=0"
"95","68.269820","127.0.0.1","127.0.0.1","TCP","56","50431  >  53530 [SYN] Seq=0 Win=65535 Len=0 MSS=65495 WS=256 SACK_PERM"
"96","68.270023","127.0.0.1","127.0.0.1","TCP","56","53530  >  50431 [SYN, ACK] Seq=0 Ack=1 Win=65535 Len=0 MSS=65495 WS=256 SACK_PERM"
"97","68.270126","127.0.0.1","127.0.0.1","TCP","44","50431  >  53530 [ACK] Seq=1 Ack=1 Win=65280 Len=0"
"98","68.271017","127.0.0.1","127.0.0.1","OpcUa","124","Hello message"
"99","68.271082","127.0.0.1","127.0.0.1","TCP","44","53530  >  50431 [ACK] Seq=1 Ack=81 Win=65280 Len=0"
"100","68.387551","127.0.0.1","127.0.0.1","OpcUa","72","Acknowledge message"
"101","68.387680","127.0.0.1","127.0.0.1","TCP","44","50431  >  53530 [ACK] Seq=81 Ack=29 Win=65280 Len=0"
"102","68.387878","127.0.0.1","127.0.0.1","OpcUa","177","OpenSecureChannel message"
"103","68.387948","127.0.0.1","127.0.0.1","TCP","44","53530  >  50431 [ACK] Seq=29 Ack=214 Win=65280 Len=0"
"104","68.428749","127.0.0.1","127.0.0.1","OpcUa","179","OpenSecureChannel message"
"105","68.428847","127.0.0.1","127.0.0.1","TCP","44","50431  >  53530 [ACK] Seq=214 Ack=164 Win=65280 Len=0"
"106","68.429355","127.0.0.1","127.0.0.1","OpcUa","161","UA Secure Conversation Message: FindServersRequest"
"107","68.429464","127.0.0.1","127.0.0.1","TCP","44","53530  >  50431 [ACK] Seq=164 Ack=331 Win=65024 Len=0"
"108","68.447044","127.0.0.1","127.0.0.1","OpcUa","295","UA Secure Conversation Message: FindServersResponse"
"109","68.447139","127.0.0.1","127.0.0.1","TCP","44","50431  >  53530 [ACK] Seq=331 Ack=415 Win=65024 Len=0"
"110","68.447429","127.0.0.1","127.0.0.1","OpcUa","101","CloseSecureChannel message: CloseSecureChannelRequest"
"111","68.447473","127.0.0.1","127.0.0.1","TCP","44","53530  >  50431 [ACK] Seq=415 Ack=388 Win=65024 Len=0"
"112","68.447517","127.0.0.1","127.0.0.1","TCP","44","50431  >  53530 [FIN, ACK] Seq=388 Ack=415 Win=65024 Len=0"
"113","68.447545","127.0.0.1","127.0.0.1","TCP","44","53530  >  50431 [ACK] Seq=415 Ack=389 Win=65024 Len=0"
"114","68.454969","127.0.0.1","127.0.0.1","TCP","44","53530  >  50431 [FIN, ACK] Seq=415 Ack=389 Win=65024 Len=0"
"115","68.455093","127.0.0.1","127.0.0.1","TCP","44","50431  >  53530 [ACK] Seq=389 Ack=416 Win=65024 Len=0"
"116","69.201704","127.0.0.1","127.0.0.1","TCP","56","50432  >  53530 [SYN] Seq=0 Win=65535 Len=0 MSS=65495 WS=256 SACK_PERM"
"117","69.201859","127.0.0.1","127.0.0.1","TCP","56","53530  >  50432 [SYN, ACK] Seq=0 Ack=1 Win=65535 Len=0 MSS=65495 WS=256 SACK_PERM"
"118","69.201956","127.0.0.1","127.0.0.1","TCP","44","50432  >  53530 [ACK] Seq=1 Ack=1 Win=65280 Len=0"
"119","69.202467","127.0.0.1","127.0.0.1","OpcUa","128","Hello message"
"120","69.202521","127.0.0.1","127.0.0.1","TCP","44","53530  >  50432 [ACK] Seq=1 Ack=85 Win=65280 Len=0"
"121","69.212463","127.0.0.1","127.0.0.1","OpcUa","72","Acknowledge message"
"122","69.212560","127.0.0.1","127.0.0.1","TCP","44","50432  >  53530 [ACK] Seq=85 Ack=29 Win=65280 Len=0"
"123","69.212691","127.0.0.1","127.0.0.1","OpcUa","177","OpenSecureChannel message"
"124","69.212752","127.0.0.1","127.0.0.1","TCP","44","53530  >  50432 [ACK] Seq=29 Ack=218 Win=65280 Len=0"
"125","69.216315","127.0.0.1","127.0.0.1","OpcUa","179","OpenSecureChannel message"
"126","69.216407","127.0.0.1","127.0.0.1","TCP","44","50432  >  53530 [ACK] Seq=218 Ack=164 Win=65280 Len=0"
"127","69.216884","127.0.0.1","127.0.0.1","OpcUa","165","UA Secure Conversation Message: GetEndpointsRequest"
"128","69.216949","127.0.0.1","127.0.0.1","TCP","44","53530  >  50432 [ACK] Seq=164 Ack=339 Win=65024 Len=0"
"129","69.234046","127.0.0.1","127.0.0.1","OpcUa","20188","UA Secure Conversation Message: GetEndpointsResponse"
"130","69.234214","127.0.0.1","127.0.0.1","TCP","44","50432  >  53530 [ACK] Seq=339 Ack=20308 Win=45056 Len=0"
"131","69.234647","127.0.0.1","127.0.0.1","OpcUa","101","CloseSecureChannel message: CloseSecureChannelRequest"
"132","69.234697","127.0.0.1","127.0.0.1","TCP","44","53530  >  50432 [ACK] Seq=20308 Ack=396 Win=65024 Len=0"
"133","69.234731","127.0.0.1","127.0.0.1","TCP","44","50432  >  53530 [FIN, ACK] Seq=396 Ack=20308 Win=45056 Len=0"
"134","69.234754","127.0.0.1","127.0.0.1","TCP","44","53530  >  50432 [ACK] Seq=20308 Ack=397 Win=65024 Len=0"
"135","69.238297","127.0.0.1","127.0.0.1","TCP","44","53530  >  50432 [FIN, ACK] Seq=20308 Ack=397 Win=65024 Len=0"
"136","69.238456","127.0.0.1","127.0.0.1","TCP","44","50432  >  53530 [ACK] Seq=397 Ack=20309 Win=45056 Len=0"
"137","75.015539","127.0.0.1","127.0.0.1","UDP","1464","54217  >  5093 Len=1432"
"138","75.062651","127.0.0.1","127.0.0.1","UDP","1464","5093  >  54217 Len=1432"
"139","75.066749","127.0.0.1","127.0.0.1","UDP","1464","54217  >  5093 Len=1432"
"140","75.067119","127.0.0.1","127.0.0.1","UDP","1464","5093  >  54217 Len=1432"
"141","75.068431","127.0.0.1","127.0.0.1","UDP","1464","54217  >  5093 Len=1432"
"142","75.068718","127.0.0.1","127.0.0.1","UDP","1464","5093  >  54217 Len=1432"
"143","75.069740","127.0.0.1","127.0.0.1","UDP","1464","54217  >  5093 Len=1432"
"144","75.070033","127.0.0.1","127.0.0.1","UDP","1464","5093  >  54217 Len=1432"
"145","76.522178","::1","::1","TLSv1.2","89","Application Data"
"146","76.522275","::1","::1","TCP","64","64964  >  8900 [ACK] Seq=88 Ack=101 Win=217 Len=0"
"147","76.524609","::1","::1","TLSv1.2","93","Application Data"
"148","76.524693","::1","::1","TCP","64","8900  >  64964 [ACK] Seq=101 Ack=117 Win=184 Len=0"
"149","77.821574","127.0.0.1","127.0.0.1","TCP","56","61037  >  53530 [SYN] Seq=0 Win=65535 Len=0 MSS=65495 WS=256 SACK_PERM"
"150","77.821751","127.0.0.1","127.0.0.1","TCP","56","53530  >  61037 [SYN, ACK] Seq=0 Ack=1 Win=65535 Len=0 MSS=65495 WS=256 SACK_PERM"
"151","77.821952","127.0.0.1","127.0.0.1","TCP","44","61037  >  53530 [ACK] Seq=1 Ack=1 Win=65280 Len=0"
"152","77.822686","127.0.0.1","127.0.0.1","OpcUa","128","Hello message"
"153","77.822798","127.0.0.1","127.0.0.1","TCP","44","53530  >  61037 [ACK] Seq=1 Ack=85 Win=65280 Len=0"
"154","77.831206","127.0.0.1","127.0.0.1","OpcUa","72","Acknowledge message"
"155","77.831292","127.0.0.1","127.0.0.1","TCP","44","61037  >  53530 [ACK] Seq=85 Ack=29 Win=65280 Len=0"
"156","77.831529","127.0.0.1","127.0.0.1","OpcUa","177","OpenSecureChannel message"
"157","77.831606","127.0.0.1","127.0.0.1","TCP","44","53530  >  61037 [ACK] Seq=29 Ack=218 Win=65280 Len=0"
"158","77.836064","127.0.0.1","127.0.0.1","OpcUa","179","OpenSecureChannel message"
"159","77.836155","127.0.0.1","127.0.0.1","TCP","44","61037  >  53530 [ACK] Seq=218 Ack=164 Win=65280 Len=0"
"160","77.836469","127.0.0.1","127.0.0.1","OpcUa","165","UA Secure Conversation Message: GetEndpointsRequest"
"161","77.836536","127.0.0.1","127.0.0.1","TCP","44","53530  >  61037 [ACK] Seq=164 Ack=339 Win=65024 Len=0"
"162","77.845617","127.0.0.1","127.0.0.1","OpcUa","20188","UA Secure Conversation Message: GetEndpointsResponse"
"163","77.845839","127.0.0.1","127.0.0.1","TCP","44","61037  >  53530 [ACK] Seq=339 Ack=20308 Win=45056 Len=0"
"164","77.846262","127.0.0.1","127.0.0.1","OpcUa","101","CloseSecureChannel message: CloseSecureChannelRequest"
"165","77.846329","127.0.0.1","127.0.0.1","TCP","44","53530  >  61037 [ACK] Seq=20308 Ack=396 Win=65024 Len=0"
"166","77.846460","127.0.0.1","127.0.0.1","TCP","44","61037  >  53530 [FIN, ACK] Seq=396 Ack=20308 Win=45056 Len=0"
"167","77.846493","127.0.0.1","127.0.0.1","TCP","44","53530  >  61037 [ACK] Seq=20308 Ack=397 Win=65024 Len=0"
"168","77.851058","127.0.0.1","127.0.0.1","TCP","44","53530  >  61037 [FIN, ACK] Seq=20308 Ack=397 Win=65024 Len=0"
"169","77.851170","127.0.0.1","127.0.0.1","TCP","44","61037  >  53530 [ACK] Seq=397 Ack=20309 Win=45056 Len=0"
"170","78.020299","127.0.0.1","127.0.0.1","TCP","56","61038  >  53530 [SYN] Seq=0 Win=65535 Len=0 MSS=65495 WS=256 SACK_PERM"
"171","78.020501","127.0.0.1","127.0.0.1","TCP","56","53530  >  61038 [SYN, ACK] Seq=0 Ack=1 Win=65535 Len=0 MSS=65495 WS=256 SACK_PERM"
"172","78.020574","127.0.0.1","127.0.0.1","TCP","44","61038  >  53530 [ACK] Seq=1 Ack=1 Win=65280 Len=0"
"173","78.021060","127.0.0.1","127.0.0.1","OpcUa","128","Hello message"
"174","78.021114","127.0.0.1","127.0.0.1","TCP","44","53530  >  61038 [ACK] Seq=1 Ack=85 Win=65280 Len=0"
"175","78.027512","127.0.0.1","127.0.0.1","OpcUa","72","Acknowledge message"
"176","78.027583","127.0.0.1","127.0.0.1","TCP","44","61038  >  53530 [ACK] Seq=85 Ack=29 Win=65280 Len=0"
"177","78.027860","127.0.0.1","127.0.0.1","OpcUa","177","OpenSecureChannel message"
"178","78.027968","127.0.0.1","127.0.0.1","TCP","44","53530  >  61038 [ACK] Seq=29 Ack=218 Win=65280 Len=0"
"179","78.031624","127.0.0.1","127.0.0.1","OpcUa","179","OpenSecureChannel message"
"180","78.031706","127.0.0.1","127.0.0.1","TCP","44","61038  >  53530 [ACK] Seq=218 Ack=164 Win=65280 Len=0"
"181","78.032139","127.0.0.1","127.0.0.1","OpcUa","386","UA Secure Conversation Message: CreateSessionRequest"
"182","78.032193","127.0.0.1","127.0.0.1","TCP","44","53530  >  61038 [ACK] Seq=164 Ack=560 Win=64768 Len=0"
"183","78.121227","127.0.0.1","127.0.0.1","OpcUa","21331","UA Secure Conversation Message: CreateSessionResponse"
"184","78.121411","127.0.0.1","127.0.0.1","TCP","44","61038  >  53530 [ACK] Seq=560 Ack=21451 Win=44032 Len=0"
"185","78.123569","127.0.0.1","127.0.0.1","OpcUa","193","UA Secure Conversation Message: ActivateSessionRequest"
"186","78.123664","127.0.0.1","127.0.0.1","TCP","44","53530  >  61038 [ACK] Seq=21451 Ack=709 Win=64768 Len=0"
"187","78.160964","127.0.0.1","127.0.0.1","OpcUa","140","UA Secure Conversation Message: ActivateSessionResponse"
"188","78.161086","127.0.0.1","127.0.0.1","TCP","44","61038  >  53530 [ACK] Seq=709 Ack=21547 Win=43776 Len=0"
"189","78.161875","127.0.0.1","127.0.0.1","OpcUa","190","UA Secure Conversation Message: ReadRequest"
"190","78.161998","127.0.0.1","127.0.0.1","TCP","44","53530  >  61038 [ACK] Seq=21547 Ack=855 Win=64512 Len=0"
"191","78.190895","127.0.0.1","127.0.0.1","OpcUa","116","UA Secure Conversation Message: ReadResponse"
"192","78.190990","127.0.0.1","127.0.0.1","TCP","44","61038  >  53530 [ACK] Seq=855 Ack=21619 Win=43776 Len=0"
"193","78.191443","127.0.0.1","127.0.0.1","OpcUa","496","UA Secure Conversation Message: ReadRequest"
"194","78.191538","127.0.0.1","127.0.0.1","TCP","44","53530  >  61038 [ACK] Seq=21619 Ack=1307 Win=64000 Len=0"
"195","78.205967","127.0.0.1","127.0.0.1","OpcUa","565","UA Secure Conversation Message: ReadResponse"
"196","78.206083","127.0.0.1","127.0.0.1","TCP","44","61038  >  53530 [ACK] Seq=1307 Ack=22140 Win=43264 Len=0"
"197","78.207079","127.0.0.1","127.0.0.1","OpcUa","172","UA Secure Conversation Message: ReadRequest"
"198","78.207155","127.0.0.1","127.0.0.1","TCP","44","53530  >  61038 [ACK] Seq=22140 Ack=1435 Win=64000 Len=0"
"199","78.218287","127.0.0.1","127.0.0.1","OpcUa","107","UA Secure Conversation Message: ReadResponse"
"200","78.218508","127.0.0.1","127.0.0.1","TCP","44","61038  >  53530 [ACK] Seq=1435 Ack=22203 Win=43264 Len=0"
"201","78.218980","127.0.0.1","127.0.0.1","OpcUa","160","UA Secure Conversation Message: CreateSubscriptionRequest"
"202","78.219081","127.0.0.1","127.0.0.1","TCP","44","53530  >  61038 [ACK] Seq=22203 Ack=1551 Win=63744 Len=0"
"203","78.283712","127.0.0.1","127.0.0.1","OpcUa","116","UA Secure Conversation Message: CreateSubscriptionResponse"
"204","78.283823","127.0.0.1","127.0.0.1","TCP","44","61038  >  53530 [ACK] Seq=1551 Ack=22275 Win=43008 Len=0"
"205","78.284336","127.0.0.1","127.0.0.1","OpcUa","320","UA Secure Conversation Message: CreateMonitoredItemsRequest"
"206","78.284420","127.0.0.1","127.0.0.1","TCP","44","53530  >  61038 [ACK] Seq=22275 Ack=1827 Win=63488 Len=0"
"207","78.369786","127.0.0.1","127.0.0.1","OpcUa","182","UA Secure Conversation Message: CreateMonitoredItemsResponse"
"208","78.369976","127.0.0.1","127.0.0.1","TCP","44","61038  >  53530 [ACK] Seq=1827 Ack=22413 Win=43008 Len=0"
"209","78.373956","127.0.0.1","127.0.0.1","OpcUa","177","UA Secure Conversation Message: BrowseRequest"
"210","78.374063","127.0.0.1","127.0.0.1","TCP","44","53530  >  61038 [ACK] Seq=22413 Ack=1960 Win=63488 Len=0"
"211","78.389713","127.0.0.1","127.0.0.1","OpcUa","240","UA Secure Conversation Message: BrowseResponse"
"212","78.389921","127.0.0.1","127.0.0.1","TCP","44","61038  >  53530 [ACK] Seq=1960 Ack=22609 Win=42752 Len=0"
"213","78.391240","127.0.0.1","127.0.0.1","OpcUa","314","UA Secure Conversation Message: ReadRequest"
"214","78.391329","127.0.0.1","127.0.0.1","TCP","44","53530  >  61038 [ACK] Seq=22609 Ack=2230 Win=63232 Len=0"
"215","78.406574","127.0.0.1","127.0.0.1","OpcUa","194","UA Secure Conversation Message: ReadResponse"
"216","78.406687","127.0.0.1","127.0.0.1","TCP","44","61038  >  53530 [ACK] Seq=2230 Ack=22759 Win=42752 Len=0"
"217","78.407307","127.0.0.1","127.0.0.1","OpcUa","177","UA Secure Conversation Message: BrowseRequest"
"218","78.407418","127.0.0.1","127.0.0.1","TCP","44","53530  >  61038 [ACK] Seq=22759 Ack=2363 Win=62976 Len=0"
"219","78.420197","127.0.0.1","127.0.0.1","OpcUa","142","UA Secure Conversation Message: BrowseResponse"
"220","78.420348","127.0.0.1","127.0.0.1","TCP","44","61038  >  53530 [ACK] Seq=2363 Ack=22857 Win=42496 Len=0"
"221","78.420674","127.0.0.1","127.0.0.1","OpcUa","314","UA Secure Conversation Message: ReadRequest"
"222","78.420724","127.0.0.1","127.0.0.1","TCP","44","53530  >  61038 [ACK] Seq=22857 Ack=2633 Win=62720 Len=0"
"223","78.428487","127.0.0.1","127.0.0.1","OpcUa","238","UA Secure Conversation Message: ReadResponse"
"224","78.428597","127.0.0.1","127.0.0.1","TCP","44","61038  >  53530 [ACK] Seq=2633 Ack=23051 Win=42240 Len=0"
"225","78.429154","127.0.0.1","127.0.0.1","OpcUa","177","UA Secure Conversation Message: BrowseRequest"
"226","78.429236","127.0.0.1","127.0.0.1","TCP","44","53530  >  61038 [ACK] Seq=23051 Ack=2766 Win=62720 Len=0"
"227","78.436774","127.0.0.1","127.0.0.1","OpcUa","142","UA Secure Conversation Message: BrowseResponse"
"228","78.436869","127.0.0.1","127.0.0.1","TCP","44","61038  >  53530 [ACK] Seq=2766 Ack=23149 Win=42240 Len=0"
"229","78.437408","127.0.0.1","127.0.0.1","OpcUa","314","UA Secure Conversation Message: ReadRequest"
"230","78.437507","127.0.0.1","127.0.0.1","TCP","44","53530  >  61038 [ACK] Seq=23149 Ack=3036 Win=62464 Len=0"
"231","78.445871","127.0.0.1","127.0.0.1","OpcUa","184","UA Secure Conversation Message: ReadResponse"
"232","78.445979","127.0.0.1","127.0.0.1","TCP","44","61038  >  53530 [ACK] Seq=3036 Ack=23289 Win=42240 Len=0"
"233","78.446456","127.0.0.1","127.0.0.1","OpcUa","177","UA Secure Conversation Message: BrowseRequest"
"234","78.446553","127.0.0.1","127.0.0.1","TCP","44","53530  >  61038 [ACK] Seq=23289 Ack=3169 Win=62208 Len=0"
"235","78.454155","127.0.0.1","127.0.0.1","OpcUa","116","UA Secure Conversation Message: BrowseResponse"
"236","78.454252","127.0.0.1","127.0.0.1","TCP","44","61038  >  53530 [ACK] Seq=3169 Ack=23361 Win=41984 Len=0"
"237","78.464690","127.0.0.1","127.0.0.1","OpcUa","177","UA Secure Conversation Message: BrowseRequest"
"238","78.464778","127.0.0.1","127.0.0.1","TCP","44","53530  >  61038 [ACK] Seq=23361 Ack=3302 Win=62208 Len=0"
"239","78.472564","127.0.0.1","127.0.0.1","OpcUa","463","UA Secure Conversation Message: BrowseResponse"
"240","78.472658","127.0.0.1","127.0.0.1","TCP","44","61038  >  53530 [ACK] Seq=3302 Ack=23780 Win=41728 Len=0"
"241","78.552908","127.0.0.1","127.0.0.1","OpcUa","334","UA Secure Conversation Message: ReadRequest"
"242","78.552997","127.0.0.1","127.0.0.1","TCP","44","53530  >  61038 [ACK] Seq=23780 Ack=3592 Win=61696 Len=0"
"243","78.559385","127.0.0.1","127.0.0.1","OpcUa","184","UA Secure Conversation Message: ReadResponse"
"244","78.559485","127.0.0.1","127.0.0.1","TCP","44","61038  >  53530 [ACK] Seq=3592 Ack=23920 Win=41472 Len=0"
"245","78.559842","127.0.0.1","127.0.0.1","OpcUa","179","UA Secure Conversation Message: BrowseRequest"
"246","78.559892","127.0.0.1","127.0.0.1","TCP","44","53530  >  61038 [ACK] Seq=23920 Ack=3727 Win=61696 Len=0"
"247","78.567414","127.0.0.1","127.0.0.1","OpcUa","142","UA Secure Conversation Message: BrowseResponse"
"248","78.567512","127.0.0.1","127.0.0.1","TCP","44","61038  >  53530 [ACK] Seq=3727 Ack=24018 Win=41472 Len=0"
"249","78.567930","127.0.0.1","127.0.0.1","OpcUa","314","UA Secure Conversation Message: ReadRequest"
"250","78.568010","127.0.0.1","127.0.0.1","TCP","44","53530  >  61038 [ACK] Seq=24018 Ack=3997 Win=61440 Len=0"
"251","78.574027","127.0.0.1","127.0.0.1","OpcUa","192","UA Secure Conversation Message: ReadResponse"
"252","78.574127","127.0.0.1","127.0.0.1","TCP","44","61038  >  53530 [ACK] Seq=3997 Ack=24166 Win=41216 Len=0"
"253","78.574614","127.0.0.1","127.0.0.1","OpcUa","177","UA Secure Conversation Message: BrowseRequest"
"254","78.574662","127.0.0.1","127.0.0.1","TCP","44","53530  >  61038 [ACK] Seq=24166 Ack=4130 Win=61184 Len=0"
"255","78.581161","127.0.0.1","127.0.0.1","OpcUa","116","UA Secure Conversation Message: BrowseResponse"
"256","78.581287","127.0.0.1","127.0.0.1","TCP","44","61038  >  53530 [ACK] Seq=4130 Ack=24238 Win=41216 Len=0"
"257","78.582150","127.0.0.1","127.0.0.1","OpcUa","334","UA Secure Conversation Message: ReadRequest"
"258","78.582239","127.0.0.1","127.0.0.1","TCP","44","53530  >  61038 [ACK] Seq=24238 Ack=4420 Win=60928 Len=0"
"259","78.588123","127.0.0.1","127.0.0.1","OpcUa","206","UA Secure Conversation Message: ReadResponse"
"260","78.588224","127.0.0.1","127.0.0.1","TCP","44","61038  >  53530 [ACK] Seq=4420 Ack=24400 Win=40960 Len=0"
"261","78.588690","127.0.0.1","127.0.0.1","OpcUa","179","UA Secure Conversation Message: BrowseRequest"
"262","78.588771","127.0.0.1","127.0.0.1","TCP","44","53530  >  61038 [ACK] Seq=24400 Ack=4555 Win=60928 Len=0"
"263","78.595646","127.0.0.1","127.0.0.1","OpcUa","142","UA Secure Conversation Message: BrowseResponse"
"264","78.595751","127.0.0.1","127.0.0.1","TCP","44","61038  >  53530 [ACK] Seq=4555 Ack=24498 Win=40960 Len=0"
"265","78.626360","127.0.0.1","127.0.0.1","OpcUa","142","UA Secure Conversation Message: PublishRequest"
"266","78.626453","127.0.0.1","127.0.0.1","TCP","44","53530  >  61038 [ACK] Seq=24498 Ack=4653 Win=60672 Len=0"
"267","78.626573","127.0.0.1","127.0.0.1","OpcUa","142","UA Secure Conversation Message: PublishRequest"
"268","78.626596","127.0.0.1","127.0.0.1","TCP","44","53530  >  61038 [ACK] Seq=24498 Ack=4751 Win=60672 Len=0"
"269","78.639537","127.0.0.1","127.0.0.1","OpcUa","129","UA Secure Conversation Message: PublishResponse"
"270","78.639615","127.0.0.1","127.0.0.1","TCP","44","61038  >  53530 [ACK] Seq=4751 Ack=24583 Win=40704 Len=0"
"271","78.641399","127.0.0.1","127.0.0.1","OpcUa","142","UA Secure Conversation Message: PublishRequest"
"272","78.641497","127.0.0.1","127.0.0.1","TCP","44","53530  >  61038 [ACK] Seq=24583 Ack=4849 Win=60672 Len=0"
"273","83.546930","127.0.0.1","127.0.0.1","OpcUa","129","UA Secure Conversation Message: PublishResponse"
"274","83.547010","127.0.0.1","127.0.0.1","TCP","44","61038  >  53530 [ACK] Seq=4849 Ack=24668 Win=40704 Len=0"
"275","83.559626","127.0.0.1","127.0.0.1","OpcUa","142","UA Secure Conversation Message: PublishRequest"
"276","83.559733","127.0.0.1","127.0.0.1","TCP","44","53530  >  61038 [ACK] Seq=24668 Ack=4947 Win=60416 Len=0"
"277","83.606950","127.0.0.1","127.0.0.1","OpcUa","208","UA Secure Conversation Message: ReadRequest"
"278","83.607028","127.0.0.1","127.0.0.1","TCP","44","53530  >  61038 [ACK] Seq=24668 Ack=5111 Win=60416 Len=0"
"279","83.612490","127.0.0.1","127.0.0.1","OpcUa","143","UA Secure Conversation Message: ReadResponse"
"280","83.612592","127.0.0.1","127.0.0.1","TCP","44","61038  >  53530 [ACK] Seq=5111 Ack=24767 Win=40704 Len=0"
"281","84.126668","127.0.0.1","127.0.0.1","OpcUa","197","UA Secure Conversation Message: BrowseRequest"
"282","84.126745","127.0.0.1","127.0.0.1","TCP","44","53530  >  61038 [ACK] Seq=24767 Ack=5264 Win=60160 Len=0"
"283","84.131592","127.0.0.1","127.0.0.1","OpcUa","246","UA Secure Conversation Message: BrowseResponse"
"284","84.131712","127.0.0.1","127.0.0.1","TCP","44","61038  >  53530 [ACK] Seq=5264 Ack=24969 Win=40448 Len=0"
"285","86.154277","127.0.0.1","127.0.0.1","OpcUa","197","UA Secure Conversation Message: BrowseRequest"
"286","86.154349","127.0.0.1","127.0.0.1","TCP","44","53530  >  61038 [ACK] Seq=24969 Ack=5417 Win=59904 Len=0"
"287","86.159754","127.0.0.1","127.0.0.1","OpcUa","442","UA Secure Conversation Message: BrowseResponse"
"288","86.159836","127.0.0.1","127.0.0.1","TCP","44","61038  >  53530 [ACK] Seq=5417 Ack=25367 Win=39936 Len=0"
"289","88.557572","127.0.0.1","127.0.0.1","OpcUa","129","UA Secure Conversation Message: PublishResponse"
"290","88.557667","127.0.0.1","127.0.0.1","TCP","44","61038  >  53530 [ACK] Seq=5417 Ack=25452 Win=39936 Len=0"
"291","88.570534","127.0.0.1","127.0.0.1","OpcUa","142","UA Secure Conversation Message: PublishRequest"
"292","88.570721","127.0.0.1","127.0.0.1","TCP","44","53530  >  61038 [ACK] Seq=25452 Ack=5515 Win=59904 Len=0"
"293","88.617378","127.0.0.1","127.0.0.1","OpcUa","208","UA Secure Conversation Message: ReadRequest"
"294","88.617475","127.0.0.1","127.0.0.1","TCP","44","53530  >  61038 [ACK] Seq=25452 Ack=5679 Win=59648 Len=0"
"295","88.624226","127.0.0.1","127.0.0.1","OpcUa","143","UA Secure Conversation Message: ReadResponse"
"296","88.624344","127.0.0.1","127.0.0.1","TCP","44","61038  >  53530 [ACK] Seq=5679 Ack=25551 Win=39936 Len=0"
"297","90.031173","127.0.0.1","127.0.0.1","UDP","1464","54217  >  5093 Len=1432"
"298","90.074629","127.0.0.1","127.0.0.1","UDP","1464","5093  >  54217 Len=1432"
"299","90.077945","127.0.0.1","127.0.0.1","UDP","1464","54217  >  5093 Len=1432"
"300","90.078375","127.0.0.1","127.0.0.1","UDP","1464","5093  >  54217 Len=1432"
"301","90.079808","127.0.0.1","127.0.0.1","UDP","1464","54217  >  5093 Len=1432"
"302","90.080080","127.0.0.1","127.0.0.1","UDP","1464","5093  >  54217 Len=1432"
"303","90.081394","127.0.0.1","127.0.0.1","UDP","1464","54217  >  5093 Len=1432"
"304","90.081668","127.0.0.1","127.0.0.1","UDP","1464","5093  >  54217 Len=1432"
"305","90.852840","127.0.0.1","127.0.0.1","OpcUa","496","UA Secure Conversation Message: ReadRequest"
"306","90.852940","127.0.0.1","127.0.0.1","TCP","44","53530  >  61038 [ACK] Seq=25551 Ack=6131 Win=59392 Len=0"
"307","90.853325","127.0.0.1","127.0.0.1","OpcUa","179","UA Secure Conversation Message: BrowseRequest"
"308","90.853371","127.0.0.1","127.0.0.1","TCP","44","53530  >  61038 [ACK] Seq=25551 Ack=6266 Win=59136 Len=0"
"309","90.859202","127.0.0.1","127.0.0.1","OpcUa","252","UA Secure Conversation Message: BrowseResponse"
"310","90.859411","127.0.0.1","127.0.0.1","TCP","44","61038  >  53530 [ACK] Seq=6266 Ack=25759 Win=39680 Len=0"
"311","90.859786","127.0.0.1","127.0.0.1","OpcUa","314","UA Secure Conversation Message: ReadRequest"
"312","90.859956","127.0.0.1","127.0.0.1","TCP","44","53530  >  61038 [ACK] Seq=25759 Ack=6536 Win=58880 Len=0"
"313","90.861132","127.0.0.1","127.0.0.1","OpcUa","385","UA Secure Conversation Message: ReadResponse"
"314","90.861228","127.0.0.1","127.0.0.1","TCP","44","61038  >  53530 [ACK] Seq=6536 Ack=26100 Win=39424 Len=0"
"315","90.865222","127.0.0.1","127.0.0.1","OpcUa","215","UA Secure Conversation Message: ReadResponse"
"316","90.865339","127.0.0.1","127.0.0.1","TCP","44","61038  >  53530 [ACK] Seq=6536 Ack=26271 Win=39168 Len=0"
"317","90.866095","127.0.0.1","127.0.0.1","OpcUa","334","UA Secure Conversation Message: ReadRequest"
"318","90.866169","127.0.0.1","127.0.0.1","TCP","44","53530  >  61038 [ACK] Seq=26271 Ack=6826 Win=58624 Len=0"
"319","90.871512","127.0.0.1","127.0.0.1","OpcUa","307","UA Secure Conversation Message: ReadResponse"
"320","90.871588","127.0.0.1","127.0.0.1","TCP","44","61038  >  53530 [ACK] Seq=6826 Ack=26534 Win=38912 Len=0"
"321","90.892042","127.0.0.1","127.0.0.1","OpcUa","314","UA Secure Conversation Message: ReadRequest"
"322","90.892127","127.0.0.1","127.0.0.1","TCP","44","53530  >  61038 [ACK] Seq=26534 Ack=7096 Win=58368 Len=0"
"323","90.897279","127.0.0.1","127.0.0.1","OpcUa","174","UA Secure Conversation Message: ReadResponse"
"324","90.897368","127.0.0.1","127.0.0.1","TCP","44","61038  >  53530 [ACK] Seq=7096 Ack=26664 Win=38656 Len=0"
"325","90.942881","127.0.0.1","127.0.0.1","OpcUa","334","UA Secure Conversation Message: ReadRequest"
"326","90.942957","127.0.0.1","127.0.0.1","TCP","44","53530  >  61038 [ACK] Seq=26664 Ack=7386 Win=58112 Len=0"
"327","90.949281","127.0.0.1","127.0.0.1","OpcUa","173","UA Secure Conversation Message: ReadResponse"
"328","90.949386","127.0.0.1","127.0.0.1","TCP","44","61038  >  53530 [ACK] Seq=7386 Ack=26793 Win=38656 Len=0"
"329","91.260720","127.0.0.1","127.0.0.1","OpcUa","160","UA Secure Conversation Message: CreateSubscriptionRequest"
"330","91.260792","127.0.0.1","127.0.0.1","TCP","44","53530  >  61038 [ACK] Seq=26793 Ack=7502 Win=57856 Len=0"
"331","91.273432","127.0.0.1","127.0.0.1","OpcUa","116","UA Secure Conversation Message: CreateSubscriptionResponse"
"332","91.273539","127.0.0.1","127.0.0.1","TCP","44","61038  >  53530 [ACK] Seq=7502 Ack=26865 Win=38656 Len=0"
"333","91.274297","127.0.0.1","127.0.0.1","OpcUa","192","UA Secure Conversation Message: CreateMonitoredItemsRequest"
"334","91.274368","127.0.0.1","127.0.0.1","TCP","44","53530  >  61038 [ACK] Seq=26865 Ack=7650 Win=57856 Len=0"
"335","91.284107","127.0.0.1","127.0.0.1","OpcUa","127","UA Secure Conversation Message: CreateMonitoredItemsResponse"
"336","91.284220","127.0.0.1","127.0.0.1","TCP","44","61038  >  53530 [ACK] Seq=7650 Ack=26948 Win=38400 Len=0"
"337","91.284863","127.0.0.1","127.0.0.1","OpcUa","176","UA Secure Conversation Message: TranslateBrowsePathsToNodeIdsRequest"
"338","91.284944","127.0.0.1","127.0.0.1","TCP","44","53530  >  61038 [ACK] Seq=26948 Ack=7782 Win=57600 Len=0"
"339","91.287108","127.0.0.1","127.0.0.1","OpcUa","142","UA Secure Conversation Message: PublishRequest"
"340","91.287209","127.0.0.1","127.0.0.1","TCP","44","53530  >  61038 [ACK] Seq=26948 Ack=7880 Win=57600 Len=0"
"341","91.297145","127.0.0.1","127.0.0.1","OpcUa","112","UA Secure Conversation Message: TranslateBrowsePathsToNodeIdsResponse"
"342","91.297250","127.0.0.1","127.0.0.1","TCP","44","61038  >  53530 [ACK] Seq=7880 Ack=27016 Win=38400 Len=0"
"343","91.297674","127.0.0.1","127.0.0.1","OpcUa","174","UA Secure Conversation Message: TranslateBrowsePathsToNodeIdsRequest"
"344","91.297772","127.0.0.1","127.0.0.1","TCP","44","53530  >  61038 [ACK] Seq=27016 Ack=8010 Win=57344 Len=0"
"345","91.302251","127.0.0.1","127.0.0.1","OpcUa","112","UA Secure Conversation Message: TranslateBrowsePathsToNodeIdsResponse"
"346","91.302378","127.0.0.1","127.0.0.1","TCP","44","61038  >  53530 [ACK] Seq=8010 Ack=27084 Win=38400 Len=0"
"347","91.774195","127.0.0.1","127.0.0.1","OpcUa","176","UA Secure Conversation Message: PublishResponse"
"348","91.774286","127.0.0.1","127.0.0.1","TCP","44","61038  >  53530 [ACK] Seq=8010 Ack=27216 Win=38144 Len=0"
"349","91.786993","127.0.0.1","127.0.0.1","OpcUa","150","UA Secure Conversation Message: PublishRequest"
"350","91.787101","127.0.0.1","127.0.0.1","TCP","44","53530  >  61038 [ACK] Seq=27216 Ack=8116 Win=57344 Len=0"
"351","92.544999","127.0.0.1","127.0.0.1","OpcUa","496","UA Secure Conversation Message: ReadRequest"
"352","92.545097","127.0.0.1","127.0.0.1","TCP","44","53530  >  61038 [ACK] Seq=27216 Ack=8568 Win=56832 Len=0"
"353","92.545274","127.0.0.1","127.0.0.1","OpcUa","179","UA Secure Conversation Message: BrowseRequest"
"354","92.545312","127.0.0.1","127.0.0.1","TCP","44","53530  >  61038 [ACK] Seq=27216 Ack=8703 Win=56832 Len=0"
"355","92.549428","127.0.0.1","127.0.0.1","OpcUa","252","UA Secure Conversation Message: BrowseResponse"
"356","92.549525","127.0.0.1","127.0.0.1","TCP","44","61038  >  53530 [ACK] Seq=8703 Ack=27424 Win=37888 Len=0"
"357","92.550626","127.0.0.1","127.0.0.1","OpcUa","387","UA Secure Conversation Message: ReadResponse"
"358","92.550712","127.0.0.1","127.0.0.1","TCP","44","61038  >  53530 [ACK] Seq=8703 Ack=27767 Win=37632 Len=0"
"359","92.577825","127.0.0.1","127.0.0.1","OpcUa","314","UA Secure Conversation Message: ReadRequest"
"360","92.577904","127.0.0.1","127.0.0.1","TCP","44","53530  >  61038 [ACK] Seq=27767 Ack=8973 Win=56320 Len=0"
"361","92.583525","127.0.0.1","127.0.0.1","OpcUa","176","UA Secure Conversation Message: ReadResponse"
"362","92.583696","127.0.0.1","127.0.0.1","TCP","44","61038  >  53530 [ACK] Seq=8973 Ack=27899 Win=37632 Len=0"
"363","92.661937","127.0.0.1","127.0.0.1","OpcUa","334","UA Secure Conversation Message: ReadRequest"
"364","92.662012","127.0.0.1","127.0.0.1","TCP","44","53530  >  61038 [ACK] Seq=27899 Ack=9263 Win=56064 Len=0"
"365","92.668017","127.0.0.1","127.0.0.1","OpcUa","171","UA Secure Conversation Message: ReadResponse"
"366","92.668126","127.0.0.1","127.0.0.1","TCP","44","61038  >  53530 [ACK] Seq=9263 Ack=28026 Win=37376 Len=0"
"367","92.777665","127.0.0.1","127.0.0.1","OpcUa","176","UA Secure Conversation Message: PublishResponse"
"368","92.777764","127.0.0.1","127.0.0.1","TCP","44","61038  >  53530 [ACK] Seq=9263 Ack=28158 Win=37376 Len=0"
"369","92.791227","127.0.0.1","127.0.0.1","OpcUa","150","UA Secure Conversation Message: PublishRequest"
"370","92.791318","127.0.0.1","127.0.0.1","TCP","44","53530  >  61038 [ACK] Seq=28158 Ack=9369 Win=56064 Len=0"
"371","93.005261","127.0.0.1","127.0.0.1","OpcUa","192","UA Secure Conversation Message: CreateMonitoredItemsRequest"
"372","93.005336","127.0.0.1","127.0.0.1","TCP","44","53530  >  61038 [ACK] Seq=28158 Ack=9517 Win=55808 Len=0"
"373","93.012239","127.0.0.1","127.0.0.1","OpcUa","127","UA Secure Conversation Message: CreateMonitoredItemsResponse"
"374","93.012339","127.0.0.1","127.0.0.1","TCP","44","61038  >  53530 [ACK] Seq=9517 Ack=28241 Win=37120 Len=0"
"375","93.012947","127.0.0.1","127.0.0.1","OpcUa","176","UA Secure Conversation Message: TranslateBrowsePathsToNodeIdsRequest"
"376","93.013044","127.0.0.1","127.0.0.1","TCP","44","53530  >  61038 [ACK] Seq=28241 Ack=9649 Win=55808 Len=0"
"377","93.019507","127.0.0.1","127.0.0.1","OpcUa","112","UA Secure Conversation Message: TranslateBrowsePathsToNodeIdsResponse"
"378","93.019611","127.0.0.1","127.0.0.1","TCP","44","61038  >  53530 [ACK] Seq=9649 Ack=28309 Win=37120 Len=0"
"379","93.020200","127.0.0.1","127.0.0.1","OpcUa","174","UA Secure Conversation Message: TranslateBrowsePathsToNodeIdsRequest"
"380","93.020271","127.0.0.1","127.0.0.1","TCP","44","53530  >  61038 [ACK] Seq=28309 Ack=9779 Win=55552 Len=0"
"381","93.025581","127.0.0.1","127.0.0.1","OpcUa","112","UA Secure Conversation Message: TranslateBrowsePathsToNodeIdsResponse"
"382","93.025718","127.0.0.1","127.0.0.1","TCP","44","61038  >  53530 [ACK] Seq=9779 Ack=28377 Win=37120 Len=0"
"383","93.272653","127.0.0.1","127.0.0.1","OpcUa","180","UA Secure Conversation Message: PublishResponse"
"384","93.272775","127.0.0.1","127.0.0.1","TCP","44","61038  >  53530 [ACK] Seq=9779 Ack=28513 Win=36864 Len=0"
"385","93.284996","127.0.0.1","127.0.0.1","OpcUa","150","UA Secure Conversation Message: PublishRequest"
